source,date,title,description
Bavarianfootballworks.com,2019-03-06T13:50:00Z,Bayern Munich “irritated” with the timing and manner of Joachim Low’s roster moves - Bavarian Football Works,Bayern Munich’s CEO and sporting director questioned the timing of the news that three of the club’s veteran players were cut from the German national team.
Lowkickmma.com,2019-03-06T13:39:00Z,Gruesome Details Surface Of Matt Hughes' Alleged Domestic Abuse - LowKick MMA,Harrowing details of Matt Hughes' alleged domestic violence against his wife Audra following his June 2017 automobile accident surfaced in court documents.
Sbnation.com,2019-03-06T13:03:00Z,"Jesús take the wheel: Pochettino issued two-match touchline ban, £10k fine for confrontation with Mike Dean - Cartilage Free Captain",The FA is super dumb.
Mmafighting.com,2019-03-06T13:00:00Z,Morning Report: Anthony Johnson willing to come out of retirement to fight Jon Jones - MMA Fighting,"Anthony Johnson is willing to come out of retirement for a fight with Jon Jones, but he has one stipulation."
Turnto10.com,2019-03-06T12:47:00Z,Petition asks Gillette to remove name from Patriots' stadium - Turn to 10,"More than 13,000 people have signed an online petition asking Gillette to remove its name from the stadium in Foxborough where the New England Patriots play. The petition on Care2 asks Procter and Gamble -- Gillette's parent company -- to end ties with the Pa…"
Espn.com,2019-03-06T12:25:37Z,Olney: Expect a monster year from Red Sox's Rafael Devers - ESPN,"The champs' 22-year-old third baseman, who rose to the occasion in October, could be among baseball's biggest breakout stars in 2019."
Bigblueview.com,2019-03-06T11:50:08Z,"Giants news, 3/6: Dave Gettleman being hammered for Landon Collins decision - Big Blue View",Let’s see what others are saying about the move
Triblive.com,2019-03-06T11:31:55Z,Tim Benz: Gushing over Jake Guentzel's OT goal and what it means for Penguins - Tribune-Review,"When it comes to praising the Sidney Crosby-Evgeni Malkin-era Penguins, as a fanbase — and media corps — we can get a little … What’s the word I’m looking for? Gushy? Effusive? Flowery? Fawning? Yeah. Any of those fit. Big picture, given the franchise’s accom…"
Al.com,2019-03-06T11:29:00Z,The difference between Auburn and Alabama basketball - AL.com,The final 90 seconds on Tuesday gave us everything that is different about these two basketball teams.
Freep.com,2019-03-06T11:05:00Z,Filip Zadina shows why Detroit Red Wings were so happy to draft him - Detroit Free Press,The Detroit Red Wings drafted Filip Zadina because of his ability to score. He showed off more than than in his 4th NHL game.
Planetf1.com,2019-03-06T09:24:42Z,Five drivers who could gatecrash the podium - PlanetF1,"Ferrari look the real deal when it comes to threatening the dominance of Mercedes, but what about the more unlikely 2019 challengers?"
Thestate.com,2019-03-06T08:46:00Z,It seems UNC has a different star each week. Boston College just the latest team to find out. - The State,The North Carolina Tar Heels defeated the Boston College Eagles 79-66 behind 17 and 20 from senior forward Luke Maye.
Espn.com,2019-03-06T06:26:29Z,Rocket climbers - Houston's journey up the West standings - ESPN,"Once 14th in the conference, the Rockets have regained their place among the West's most dangerous teams."
Ljworld.com,2019-03-06T05:55:00Z,Tale of the Tait | Jayhawks in no mood for excuses after somber end to incredible Big 12 title streak - Lawrence Journal-World,"Norman, Okla. — [The streak is over][1] and as the rest of the Big 12 Conference no doubt was doing a happy dance at the expense of 14-time defending champion Kansas following Tuesday’s loss at Oklahoma, one man’s name came up that had not been mentioned in a…"
Ksl.com,2019-03-06T05:08:45Z,Jazz Gaming take Ria with first pick of NBA2K draft - KSL.com,The Utah Jazz selected Spencer
Indystar.com,2019-03-06T05:04:00Z,Minnesota fan confronts Matt Haarms as Gopher students storm court after beating Purdue - Indianapolis Star,The Minnesota Gophers fan approached Matt Haarms as students stormed the court following a win over Purdue.
Sportschatplace.com,2019-03-06T04:31:48Z,"Phoenix Suns vs. New York Knicks - 3/6/19 NBA Pick, Odds, and Prediction - Sports Chat Place",The New York Knicks and the Phoenix Suns do battle at the Talking Stick Resort Arena on Wednesday night.
Latimes.com,2019-03-06T04:10:00Z,LeBron James’ playing time next topic of concern for injury-plagued Lakers - Los Angeles Times,"LeBron James played 42 minutes in the loss to the Clippers on Monday. With the team likely out of reach of the playoffs, his minutes could decrease."
247sports.com,2019-03-06T03:59:36Z,No. 5 Vols shut down Mississippi State on Senior Night - 247Sports,"Kyle Alexander grabbed the game's first rebound. Admiral Schofield scored the first points, then went on to hit his first four shots from the floor. It was Senior Night at"
Ussoccer.com,2019-03-06T03:56:44Z,WNT Closes Out 2019 SheBelieves Cup with 1-0 Victory Against Brazil - U.S. Soccer,"The U.S. Women’s National Team closed out the 2019 SheBelieves Cup and its fifth game of the year with a 1-0 win against Brazil in front of a Tampa-record crowd of 14,009 at Raymond James Stadium. The U.S. has five domestic matches remaining before the 2019 F…"
Boston.com,2019-03-06T03:41:29Z,"Bruins Krejci scores in OT, Bruins beat Hurricanes 4-3 - Boston.com",
Rivals.com,2019-03-06T02:27:41Z,A Grand Farewell: FSU rallies for OT win against Hokies on Senior Night - Rivals.com,FSU rallies from a 14-point halftime deficit to knock off Virginia Tech and clinch the No. 4 seed in ACC tourney.
Nola.com,2019-03-06T02:10:44Z,See photos: The 55th Bourbon Street Awards costume contest on Mardi Gras in New Orleans - NOLA.com,The Bourbon Street Awards in the New Orleans French Quarter on Mardi Gras day didn't disappoint.
Care2.com,2019-03-06T01:35:20Z,Why Have 20 Horses Died at this Famous California Racetrack? - Care2.com,"In just over two months, 20 horses have died at Santa Anita Park. Nineteen suffered catastrophic injuries and were euthanized, yet the track remains open."
Nydailynews.com,2019-03-06T00:45:00Z,Headaches await ESPN's Jessica Mendoza in Mets advisory role - New York Daily News,The Mets better hope Jessica Mendoza is a better adviser than she is an ESPN analyst.
Espn.com,2019-03-06T00:11:12Z,Why Real Madrid suffered their darkest night in UCL history - ESPN,"Real Madrid's shocking loss to Ajax in the Champions League was the result of arrogance and poor player form, writes Gab Marcotti."
Grandforksherald.com,2019-03-05T23:50:00Z,Three sentenced to prison in college basketball bribery scan... - Grand Forks Herald,"Three men received federal prison sentences Tuesday for their roles in a college basketball bribery scheme, ending the first of several trials brought on by the scandal.Former Adidas executive James Gatto received nine months in prison while former Adidas con…"
Yahoo.com,2019-03-05T21:59:00Z,Kyler Murray reportedly didn't impress some teams at combine - Yahoo Sports,NFL Network's Charley Casserly said many teams had some negative things to say about Kyler Murray after the combine.
Turfshowtimes.com,2019-03-05T21:58:08Z,LA Rams release ILB Mark Barron - Turf Show Times,The Rams have decided to part ways with their leading inside linebacker.
Wdrb.com,2019-03-05T18:38:00Z,BOZICH | Who's the NCAA Tournament favorite if Zion doesn't return? - WDRB,Duke has looked vulnerable in its last four games without Zion Williamson. Who's the NCAA Tournament favorite if Zion does not return?
Yardbarker.com,2019-03-05T18:15:18Z,The '(Free) agent of change' quiz - Yardbarker,"It may have taken a little over four months to seal the deal, but the Philadelphia Phillies finally got their man. On Thursday, the Phillies and superstar free-agent right fielder Bryce Harper agreed to terms on a record 13-year/$330 million contract (whi"
Youtube.com,2019-03-05T18:00:00Z,Top Broad & Vertical Jumps | 2019 NFL Scouting Combine Highlights - NFL,The best broad and vertical jumps from the top prospects at the 2019 NFL Scouting Combine. Subscribe to NFL: http://j.mp/1L0bVBu Check out our other channels...
Yardbarker.com,2019-03-05T17:59:21Z,Steve Clifford: Magic don't expect Markelle Fultz to play this season - Yardbarker,"When the Magic acquired Markelle Fultz from the Sixers at the trade deadline last month, reports indicated that the team would be patient with the former No. 1 pick, who was diagnosed with thoracic outlet syndrome and ruled out indefinitely in December. H"
Chicagobears.com,2019-03-05T17:29:11Z,Bears release veteran linebacker Sam Acho - ChicagoBears.com,"The Bears on Tuesday released outside linebacker Sam Acho. The eight-year NFL veteran spent the past four seasons with the Bears, appearing in 51 games with 25 starts."
Nevadasportsnet.com,2019-03-05T16:04:59Z,New video sheds a little more light on Jordan Caroline-Utah State situation - Nevada Sports Net,"In yesterday's Monday Mailbag, I broke down the post-game incident at Utah State to best of my knowledge after conversations with a handful of people. Then later Monday night, a new security video of the incident was released by Utah State to KSL, a televisio…"
Abc7.com,2019-03-05T08:09:15Z,LeBron's first season in Los Angeles has become a disaster - KABC-TV,The Lakers are on the verge of missing the playoffs in LeBron James' first season in Los Angeles.
Kvrr.com,2019-03-05T00:19:56Z,"President Trump Honors FCS Champion Bison, Coach Entz ""It's been a once in a lifetime trip"" - KVRR",WASHINGTON – North Dakota State football makes its historic trip to The White House. The team was honored by President Trump for its seventh national title in the last eight seasons and there were even a few surprises thrown in. The trip was tightly scheduled…
