post #,username,text,Anger,Fear,Joy,Sadness,Analytical,Confident,Tentative
478,MarlieeB,"b""You can fight this Wavey. I've gone to rock bottom more than once over the past year or so but I am here still fighting and fighting any bad thoughts.We are all here for you.xxx""",0.0,0.0,0.0,0.0,0.0,0.0,0.733641
479,Waverunner,"b""It's too late for me, nothing to go on for. Thank you for your kind words though.""",0.0,0.0,0.0,0.0,0.0,0.0,0.920133
480,Sparklypurplepaws,"b""It's not too late wave, whilst your heart is still beating, there is still hope x We are all here for you - keep talking x""",0.0,0.0,0.0,0.0,0.0,0.0,0.0
481,SarahD,b'Really care about you. Really want you to be safe. X',0.0,0.0,0.0,0.670872,0.988064,0.0,0.884138
482,Sparklypurplepaws,b'I really hope you are ok wave xxx',0.0,0.0,0.0,0.0,0.506763,0.0,0.88939
483,Anime-Alchemy,"b""This is soo true! Please wave don't give in. There is always hope even if you can't see it """,0.0,0.0,0.0,0.0,0.78409,0.838624,0.0
484,Sparklypurplepaws,"b'Please wave, let us know how you are feeling x'",0.0,0.0,0.0,0.0,0.735673,0.0,0.0
485,rubyrose,"b""Concerned about you. Really hope you're okay.""",0.0,0.509146,0.0,0.0,0.0,0.0,0.99631
486,*autumn*,b'Thinking of you xxxxx',0.0,0.0,0.0,0.0,0.920855,0.0,0.0
487,Sparklypurplepaws,"b'Hope your ok wave, you have a lot of support here xxx'",0.0,0.0,0.0,0.0,0.0,0.0,0.88939
488,Waverunner,b'Still alive. Not able to be here at the moment. Still in a bad place.',0.0,0.0,0.0,0.569648,0.0,0.0,0.0
489,Anime-Alchemy,b'Wave your part of the wolf pack remember ',0.0,0.0,0.0,0.556462,0.803567,0.0,0.0
490,*autumn*,"b""Glad you're still with us sweetheart x""",0.0,0.0,0.500474,0.0,0.0,0.0,0.0
491,AliceinWonderland,b'Sending love and strength ',0.0,0.0,0.767423,0.0,0.0,0.0,0.0
492,Waverunner,"b""Received the write up for my therapy assessment today. We had agreed that she would not send it to the con who did not keep our appointment and she did anyway. It also says she received the referral in Jan and I was told it was done last year. Don't know what to believe anymore!""",0.0,0.0,0.0,0.0,0.796313,0.0,0.593613
493,*autumn*,b'Keep strong waverunner xx',0.0,0.0,0.735795,0.0,0.0,0.0,0.0
494,*autumn*,b'xx  \xe2\x99\xa5\xe2\x99\xa5 xx \xe2\x99\xa5\xe2\x99\xa5  xx',0.0,0.0,0.0,0.0,0.0,0.0,0.0
495,Waverunner,"b""Wish I wasn't so wrapped up in myself. Have pushed others so far away that I may never find them again  I really hate myself""",0.587521,0.0,0.0,0.0,0.900364,0.0,0.631794
496,Anime-Alchemy,"b'Hello Wave, how are things going for you? '",0.0,0.0,0.0,0.0,0.0,0.0,0.0
497,Waverunner,b'Still struggling. Not a lot to say',0.0,0.0,0.0,0.670908,0.0,0.0,0.952443
498,Anime-Alchemy,b'Are you seeing the doctor or any mental health worker?',0.0,0.0,0.0,0.0,0.0,0.0,0.968123
499,Waverunner,b'Seeing the therapy assessor still and a psychologist in relation to my physical health. See my GP as and when. Want to walk away from it all though.',0.0,0.0,0.0,0.0,0.0,0.890603,0.0
500,Waverunner,b'Angry.',0.949302,0.0,0.0,0.0,0.0,0.0,0.0
501,Waverunner,b'Feeling very anxious and irritable today',0.0,0.775924,0.0,0.0,0.0,0.942582,0.0
502,SarahD,"b'Hello WaveI have been offline for a while. I know you are still struggling, and am sending my love to you. Hope you can manage to keep going until you can find a good way forward. Sarah xxx'",0.0,0.0,0.0,0.0,0.530164,0.0,0.733641
503,Waverunner,"b""[QUOTE=SarahD;1146713]Hello WaveI have been offline for a while. I know you are still struggling, and am sending my love to you. Hope you can manage to keep going until you can find a good way forward. You've been in my thoughts SarahD. Hope you are okay """,0.0,0.0,0.53307,0.0,0.697753,0.0,0.85591
504,Waverunner,"b""Raging. So angry I don't know what to do with myself""",0.924127,0.0,0.0,0.0,0.0,0.0,0.0
505,Caro5,b'Write it down on paper and then rip the paper up. Can you get any exercise or something to release the anger safely?',0.628827,0.0,0.0,0.0,0.901148,0.0,0.990508
506,Waverunner,"b""Still raging. This has been triggered, or actually made worse, by a decision someone senior made at work in relation to me. I may run into said person today which would not be wise given how I'm feeling because I would struggled to remain professional. Better off away from people now.""",0.509265,0.0,0.0,0.0,0.814653,0.0,0.84639
507,Waverunner,"b"" I can't do life anymore """,0.0,0.0,0.0,0.852076,0.0,0.0,0.0
508,UMPALUMPA,"b""some people on here may be on top of the world tonight, but things change with time waverunner. Ive felt the same and acted on it, but what I am trying to say to you is 'things do improve' thats not a myth or a random comment.take care waverunner please look after yourself. Xx""",0.0,0.0,0.0,0.0,0.0,0.0,0.971453
509,Waverunner,"b""Thanks Umpalumpa, things have been so hard for so long and I don't see any other way out. Have isolated myself and there is no way back""",0.0,0.0,0.0,0.0,0.0,0.0,0.827288
510,UMPALUMPA,"b'I hate to sound like a preacher Waverunner no one likes a know it all nuffin, I feel the same.I dont always feel as low as you do now though it changes over days and weeks, the trick is too dodge acting on the self harm and low negative thoughts.not easy I know for sure, I sent you a freinds request xxxx hope thats ok. '",0.0,0.0,0.0,0.0,0.503512,0.0,0.57715
511,Waverunner,"b""I'm getting worse. Too late on the SH and request already accepted """,0.0,0.0,0.0,0.741577,0.0,0.0,0.0
512,Caro5,"b""Sorry to hear that you couldn't avoid the SH but hope you can find the strength to not do it again. Hang on in there. I know things feel like they can only get worse but things can and will get better.""",0.0,0.0,0.0,0.524359,0.756719,0.0,0.706892
513,Waverunner,b'I am so tired of feeling this way. So angry and it is draining. Feel alone. Want out of life. I am tired of my pathetic self. Enough',0.690211,0.0,0.0,0.629442,0.0,0.0,0.586281
514,Waverunner,b'Guess I was right.',0.0,0.0,0.0,0.0,0.0,0.0,0.984352
515,SarahD,b'Hello waveOften think about you and hope you are holding on.Did you think anymore about trying some meds?Hope things are better at work.Love to youSarah xxx',0.0,0.0,0.0,0.0,0.560098,0.0,0.91961
516,SarahD,"b'Hi wave, how is it going? Hugs xxx'",0.0,0.0,0.0,0.0,0.0,0.0,0.0
517,AliceinWonderland,"b'Thinking of you wave, hope you are holding up OK  x'",0.0,0.0,0.0,0.0,0.653099,0.0,0.786991
518,maybe.shes.a.wildflower,"b""Good morning! Hope you're managing to cope still  thinking of you! X""",0.0,0.0,0.0,0.0,0.0,0.0,0.959646
519,Waverunner,"b""Don't think I can do life anymore""",0.0,0.0,0.0,0.863962,0.762356,0.0,0.0
520,dimitri1013,b'Waverunner you can and you will make it through. The low times are hard but I have faith in every single one of you on this forum. It is the nicest and most thoughtful community there is. Have you made any head way with your psychologist/psychiatrist on how you are feeling?',0.0,0.0,0.0,0.0,0.0,0.577118,0.0
521,lpdorch54,b'I know how hard it is to struggle with suicidal thoughts but if you have help planned it vwould be really good to make yourself want to be here to go to them. If the help works you might be lucky and you could be feeling completely different. Please wait and try the treatment it would be very sad if you did anything else',0.0,0.0,0.0,0.920108,0.861128,0.0,0.850202
522,MarlieeB,"b""Nice to see you back posting I'm sorry though that you are still struggling so, so much.Take carexxx""",0.0,0.0,0.0,0.629548,0.0,0.0,0.0
523,AliceinWonderland,"b""I wish I knew what to say that would help. You sound like you've totally had enough. You're not alone, reaching out shows you want help with being able to carry on, and that there is some tiny part of you that believes things could change and be different. I hope you can hold onto the possibility that getting help could improve things, many of us I imagine have been in a place where we've felt unhelpable, and that we are too defective and broken (I have), but then things have gradually become easier to deal with, and hope has started to grow again. You are valuable and your life matters. Please hold on and give it a chance to see if things can change """,0.0,0.0,0.594697,0.572801,0.0,0.0,0.938916
524,Waverunner,"b""Not sure why I am here. Dimitri and Ipdorch - my last psychologist appt was cancelled as the psychologist is unwell. No new appt as yet and not sure when this will be offered. I also have my last appt with the therapy assessor this week as she leaves at the end of the week. Then onto a waiting list for therapy.MarlieeBee - thanks although don't really feel that I'm back.Alice - thanks for taking the time to post, that is a help in itself especially as I feel so alone with things at the moment. Unfortunately, I see things getting worse given my support networks being up in the air. Also have succeeded in pushing the few friends I have away so not feeling optimistic or hopeful about the future. Just feels I'm done and should just accept that and do what needs to be done.""",0.0,0.0,0.0,0.6398,0.0,0.0,0.902213
525,amathus,"b""Hi Waverunner, could you get in touch your Psychologist's secretary /office to see if you can make an appointment? At least you would be less 'up in the air', about things.""",0.0,0.0,0.0,0.0,0.566171,0.0,0.890302
526,Waverunner,"b""Hi Amathus. It was her secretary who cancelled the appt (the week before my appt) and she said they be in touch to reschedule. I get the impression that they aren't sure when the psychologist will be back""",0.0,0.0,0.0,0.0,0.0,0.0,0.57044
527,amathus,"b""Oh dear that's not helpful to you then. The only other thing I can suggest is to think of a goal you would like to achieve perhaps each day, no matter how big or small and work towards that.Maybe go for a short walk and increase the distance each day for example. Having an objective for each day does help in my experience.""",0.0,0.0,0.0,0.0,0.917611,0.0,0.94289
528,Waverunner,"b""Falling apart! You wouldn't know it to look at me though.""",0.0,0.0,0.0,0.0,0.997923,0.0,0.0
529,Waverunner,b'Useless human being ',0.80968,0.0,0.0,0.0,0.0,0.0,0.0
530,MarlieeB,"b""No you aren't hun xxx""",0.0,0.0,0.0,0.0,0.0,0.0,0.0
531,AliceinWonderland,"b""You're not useless at all wave  I get it though, feeling that way, can't see anything redeeming about ourselves at all. Others can though Any news on when your psychologist will be back? I hope it's not going to be a lengthy absence. It's really difficult when a therapist is away, it can really throw things. When I've been in a really bad place, mine has suggested seeing my GP whilst she is away, just to check in with somebody (realising it can't be the same as a therapy session, but rather just someone to touch base with). I can't remember whether I did, I don't think I was all that keen on the idea. And I know it's different with an uplanned absence that hasn't been anticipated. But with my permission she had written to my GP anyway (she showed me the letter first to check I was happy with it), to say that I was having a particularly difficult time, and might need extra support anyway, especially on weeks when she was due to be away. Depends on the GP (and your relationship with them), but some will understand that people seeing a therapist or psychologist might need extra support when that person is unavailable. It's a valid reason for an appointment. Maybe if you feel it would be appropriate for you you could ask, and explain you just need extra support? I've never felt my recent GPs have really 'got' it with what I struggle with. Maybe I'm wrong, I don't know. I had one years ago who did, but then she was looking into stopping being a GP and training as a psychotherapist. You've been in my thoughts, sorry I haven't been able to reply for a few days. You are far from useless, I have a lot of respect for, and identification with, you  You do show strength in what you have been through. Please hold on, as you say your support networks are up in the air, but when they become more stable and trustable again, things will feel different. It may be that friends you have pushed away may still be waiting in the wings, unsure what would help or whether you'd like contact, but would be willing to still reach out to you if they knew what they could do, and that you would like them to. Sending hugs and wishing hopeful thoughts for you  xx""",0.0,0.0,0.0,0.603329,0.769999,0.0,0.914057
532,AliceinWonderland,b'Thinking of you  xx',0.0,0.0,0.596899,0.0,0.920855,0.0,0.0
533,Waverunner,b'Struggling so much',0.0,0.0,0.0,0.818247,0.0,0.0,0.0
534,Unique1,b'Sorry your struggling waverunner.Unique1 xx',0.0,0.669607,0.0,0.0,0.0,0.0,0.0
535,MarlieeB,b'xxx',0.0,0.0,0.0,0.0,0.0,0.0,0.0
536,AliceinWonderland,"b""Sending a huge hug, you're in my thoughts  xx""",0.0,0.0,0.58682,0.0,0.0,0.0,0.0
537,corneliuscrane,"b""hi waverunner,sorry to hear this,don't feel so lonely..we are here to chat with you""",0.0,0.0,0.0,0.550826,0.0,0.0,0.0
538,Waverunner,b'Still finding things very hard. So much self doubt',0.0,0.0,0.0,0.595338,0.0,0.0,0.0
539,Waverunner,"b""Finding it hard with no support at present and no sign of when I'll get any support. Don't know what to do anymore, so much swirling around in my head with nowhere to go.""",0.0,0.0,0.0,0.0,0.0,0.0,0.924421
540,AliceinWonderland,"b""Do you write a journal at all wave, or ever tried artwork to express what's going on in your head? Just a thought. I'm sorry there's no support and no news of when there will be. It's very hard to keep plodding on through the days, especially when so much is going round in your head. I hope there will be news about some support soon. x""",0.0,0.0,0.0,0.545845,0.0,0.0,0.877926
541,Waverunner,"b""No, don't write a journal. In the past, nothing I wrote was private so I don't ever write things down. Even writing on the forum was a big step for me. No trust.""",0.0,0.0,0.0,0.0,0.0,0.0,0.851458
542,Waverunner,"b""Can't stay. Sorry""",0.0,0.0,0.0,0.0,0.0,0.0,0.0
543,AliceinWonderland,"b""Sorry to hear that. I know what you mean about it being a big step to write on the forum, same here. Trust is such a difficult thing I know, and often for understandable reasons  I wish it wasn't so for you. I can only send a hug and hope that some peace will come to your mind """,0.0,0.0,0.0,0.0,0.771895,0.0,0.905456
544,Waverunner,"b""Don't know why I'm still here""",0.0,0.0,0.0,0.0,0.801827,0.0,0.0
545,Fairy Lucretia,"b'because you are special and important and the world would be lost without you ,thats why you are here xx'",0.0,0.0,0.804457,0.0,0.0,0.0,0.0
546,AliceinWonderland,"b""I agree with Lu, you're special and important, you have a role to play in this life, to give and to receive, to get to the better times you deserve  x""",0.0,0.0,0.755076,0.0,0.0,0.0,0.0
547,Strugglingwithlife,"b'I know that feeling... beg God to take my life away a lot... but if we can achieve some small moments of joy, some small moments of happiness in the future, then that has to be a reason to live. Massive hug xXx'",0.0,0.0,0.877926,0.0,0.747663,0.0,0.865388
548,MarlieeB,b'You are still here because there is something inside you that is keeping you here.Please take care of yourself.xxx',0.0,0.0,0.0,0.0,0.560098,0.0,0.0
549,AliceinWonderland,"b'Thinking of you wave, sending hugs, hope you are ok  x'",0.0,0.0,0.0,0.0,0.653099,0.0,0.786991
550,AliceinWonderland,"b""How's things going wave? """,0.0,0.0,0.0,0.0,0.0,0.0,0.0
551,Waverunner,b'Abandoned. Should have known better',0.0,0.0,0.0,0.0,0.970663,0.0,0.0
552,AliceinWonderland,b'Abandoned? Has something happened? ',0.0,0.582881,0.0,0.0,0.0,0.0,0.99856
553,Waverunner,"b""Nothing happened. Just realised I'm alone. Shouldn't have let anyone in or hoped things may be better because it always ends the same. Alone.""",0.0,0.0,0.0,0.517731,0.812664,0.0,0.994017
554,Stray,"b""Yes, we are all alone, it hurts. I'm sorry xx""",0.0,0.535293,0.0,0.640246,0.0,0.975399,0.0
555,Waverunner,"b""I don't want to be alone anymore. Don't want to feel what I'm feeling.""",0.0,0.0,0.0,0.605702,0.0,0.0,0.808202
556,AliceinWonderland,b' xx',0.0,0.0,0.576238,0.0,0.0,0.0,0.0
557,Waverunner,"b""Feeling angry and abandoned and I hate that I get my hopes up and end up disappointed. Maybe it's better to just go back into my hole and just exist until I don't anymore.""",0.772455,0.0,0.0,0.0,0.0,0.0,0.984651
558,Waverunner,b'Low and tearful',0.0,0.0,0.0,0.0,0.0,0.0,0.0
559,Fairy Lucretia,b'sending massive hugs and cuddles i hope you feel better soon xx',0.0,0.0,0.501056,0.0,0.0,0.0,0.88939
560,MarlieeB,b'xxx',0.0,0.0,0.0,0.0,0.0,0.0,0.0
561,Waverunner,"b""Still low, still emotional swinging between anger and despair. Don't know what to do. Just want it to end""",0.0,0.0,0.0,0.656546,0.596122,0.0,0.902459
562,Waverunner,b'Why do I feel so useless?',0.654377,0.0,0.0,0.0,0.0,0.0,0.75152
563,Waverunner,"b""Thanks for the hugs. Wish they were real. Not feeling any different. Seems the osychologist is back at work though, appointment next week. Still heard nothing about the therapy though (they said September). Not sure I can do it anymore though. Also have pip assessment next week at home (I didn't ask for a home visit but the letter said they would visit me at home). Don't think I'll still qualify for it though as although not great, have improved physically.""",0.0,0.0,0.685148,0.626579,0.596122,0.0,0.876449
564,AliceinWonderland,"b""Wish they could be real too  Sorry things are still so difficult and you're not feeling any different. I hope your psychologist being back will help, and that you hear something about therapy, it's so ridiculously unhelpful that they keep you waiting, and then perhaps don't let you know what's happening when they said they would. Perhaps when you hear something for definite you'll feel more able to handle it, all the uncertainty and waiting must make it harder to feel you'll be able to do it (if I've understood what you mean correctly). Would you still qualify for pip on mental health grounds if not on physical health grounds? That's tough that you have that to contend with as well at the moment, I hope it goes alright. Wishing you strength and hopeful thoughts today  """,0.0,0.0,0.0,0.649683,0.0,0.0,0.921283
565,Waverunner,"b""Unlikely I would qualify on mh grounds (won't admit to anyone how bad things are). Restless and low. Feel trapped.""",0.0,0.0,0.0,0.505214,0.0,0.0,0.983506
566,MarlieeB,b'xxx',0.0,0.0,0.0,0.0,0.0,0.0,0.0
567,Waverunner,"b""My mood has dipped significantly today. VERY low and tearful. Don't see a way out and not sure I should even go to my appointment next week. Don't think I can or should choose life anymore.""",0.0,0.0,0.0,0.711009,0.853327,0.0,0.882691
568,MarlieeB,b'Please go to your appointment next week. I know how frustrating these things can be and that it seems like you are going round in circles but I really hope good comes out of it.Please keep on choosing life Wavey.xxx',0.0,0.0,0.0,0.0,0.747663,0.0,0.930321
569,Waverunner,"b""Thank you for replying MarlieeB. I know how hard things are for you so appreciate it! My appointment is with the psychologist re physical health so don't think that much will come from it but I've had enough of doctors in general. They don't listen anyway. It's getting harder and harder to choose life. Sigh.""",0.0,0.0,0.0,0.557551,0.0,0.0,0.0
570,Waverunner,"b""Questioning myself today in every aspect of life. I'm not sure about anything anymore. I don't see myself making it through this battle. So so tired and nothing left.""",0.0,0.0,0.0,0.744667,0.0,0.0,0.920443
571,SarahD,b'Know how you feel Wave. Hope you can keep going.I hope you go to the psychologist this week. Sometimes people can surprise us. It may be useful.Thinking of you xxx',0.0,0.0,0.511815,0.0,0.566171,0.0,0.991298
572,MarlieeB,b'xxx',0.0,0.0,0.0,0.0,0.0,0.0,0.0
573,Waverunner,b'Still questioning myself. Just wish people could see I need some help and that I could take it. Doomed.',0.0,0.0,0.0,0.0,0.870325,0.0,0.99827
574,Fairy Lucretia,b'xxxxxxxxxx ',0.0,0.0,0.0,0.0,0.0,0.0,0.0
575,MarlieeB,"b'Sometimes we have to push and push and push until they get the message. It makes you feel so, so bad while doing it and you feel like giving up but sometimes you need to draw attention to yourself.Easier said than done, I really know.xxx'",0.0,0.0,0.0,0.764536,0.596122,0.0,0.849113
576,Waverunner,b'Given up. Done',0.0,0.0,0.0,0.0,0.0,0.0,0.0
577,Fairy Lucretia,b'whats wrong? xx how can we help? xx',0.0,0.611055,0.0,0.0,0.0,0.0,0.0
578,Waverunner,"b'Why does life have to be so hard? I feel so alone, wish there was someone to tell me it will be okay. Trapped'",0.0,0.0,0.0,0.782853,0.0,0.0,0.80186
579,Fairy Lucretia,b'it WILL be okay xx i promise ',0.0,0.0,0.554363,0.0,0.0,0.0,0.0
580,Waverunner,b'Thanks Fairy. Wish I could see it',0.0,0.0,0.0,0.0,0.0,0.0,0.991679
581,MarlieeB,b'xxx',0.0,0.0,0.0,0.0,0.0,0.0,0.0
582,Waverunner,"b""Restless, struggling. Don't want to be around people.""",0.0,0.0,0.0,0.0,0.0,0.0,0.983475
583,MarlieeB,"b""I'm sorry you are restless and struggling. It is hard especially when you are around people and you just want your own space.I hope you will be okay.xxx""",0.0,0.0,0.0,0.570658,0.0,0.0,0.976532
584,AliceinWonderland,b' xxSorry you are struggling so much x',0.0,0.0,0.0,0.818247,0.0,0.0,0.0
585,Waverunner,b'Nothing new to say. Self loathing. So tired. Wish someone cared',0.0,0.0,0.0,0.527866,0.0,0.0,0.972662
586,MarlieeB,"b""I know it's not the same as real life but I care and I'm positive that everyone else on this forum does as well.xxx""",0.0,0.0,0.630771,0.0,0.702145,0.758379,0.0
587,Snudge,"b""Sorry for you. But please try and not think that way. I'm new on this forum because I went searching for someone to speak too. You see that's the shitter about mental health. Its so very lonely. And please don't think i'm patronising you but things hopefully will perk up for you. Deep down we all have something good and worthwhile within. Here's hoping you discover yours soon. Be well. Thinking of you""",0.675408,0.702952,0.59321,0.755686,0.520772,0.0,0.859075
588,Waverunner,"b'Thank you Snudge.  to the forum, hope you find it useful!'",0.0,0.0,0.575377,0.0,0.653099,0.0,0.786991
589,SarahD,"b'Wave, I care too. Hope desperately things improve for you xxx'",0.0,0.0,0.0,0.0,0.0,0.0,0.972662
590,Waverunner,"b""Thank you SarahD and MarlieeB. I don't feel that anyone cares but I do appreciate your replies! Sent a letter today cancelling my appoint with the pdoc. I figure they will close me now as it's the 2nd appointment I've cancelled. They've never met me and didn't bother to do anything when told I was suicidal so no desire to engage with them at all. Cutting ties. No one will miss me.""",0.0,0.0,0.612917,0.678434,0.0,0.0,0.0
591,Waverunner,b'Wish it would end',0.0,0.0,0.0,0.518735,0.0,0.0,0.0
592,MarlieeB,b'I do wish the pain you are in ends soon Waveyxxx',0.0,0.0,0.0,0.788037,0.0,0.0,0.0
593,Waverunner,b'Feeling disconnected and finding it incredibly hard to be around people. Just want to run. It feels like something is going to give very soon.',0.0,0.0,0.0,0.539652,0.557345,0.0,0.978371
594,SarahD,"b'I do care about you Wave, and I know many on here do.I am sorry everything is so hard. Sending love xxx'",0.0,0.0,0.0,0.559173,0.0,0.0,0.664175
595,MarlieeB,b'xxx',0.0,0.0,0.0,0.0,0.0,0.0,0.0
596,AliceinWonderland,"b""I'm sorry you're in so much pain and turmoil wave, I hope there is something that eases it and gives you a break today. Much love, A. xx""",0.0,0.0,0.0,0.670746,0.0,0.0,0.948691
597,Waverunner,"b'Struggling so much. Without going into detail, have images in my head as to where this is headed. They are vivid and unfortunately scary and appealing at the same time. No one to ask for help'",0.0,0.0,0.0,0.0,0.694442,0.0,0.0
598,MarlieeB,b'xxx',0.0,0.0,0.0,0.0,0.0,0.0,0.0
599,Waverunner,b'Still feeling disconnected and isolated. Still haunted by images. Can I not just go. This hurts.',0.0,0.0,0.0,0.629828,0.0,0.0,0.936899
600,MarlieeB,b'I know how much it hurts hun but I do hope something will help you fight everything.xxx',0.0,0.613595,0.0,0.0,0.0,0.0,0.856622
601,Waverunner,"b'Too tired to fight. Just biding my time now but thank you for the thoughts, appreciated'",0.0,0.0,0.0,0.0,0.908592,0.0,0.936899
602,Waverunner,b'Angry. What do I do',0.952248,0.0,0.0,0.0,0.0,0.0,0.0
603,Waverunner,"b'Had a message left on my phone today by pdoc. He received my letter cancelling my appointment and wanted to ""touch base"" with me. Can\'t call back. Feeling very low and feel sick.'",0.0,0.0,0.0,0.595385,0.902438,0.709964,0.0
604,SarahD,"b'Sorry Wave, such a hard time. You really need to get some help. I know they are a-holes, but what alternative is there? Maybe it is worth a try. Xxx'",0.0,0.0,0.0,0.571675,0.720783,0.0,0.966403
605,MarlieeB,"b""I agree with Sarah and also some are stubborn and won't leave you alone till you see them.xxx""",0.0,0.0,0.0,0.0,0.0,0.0,0.0
606,Waverunner,"b""Can't. I don't see them being stubborn, didn't do anything when they were told I was suicidal so why bother now. They won't try that hard. I've never seen anyone in that team.""",0.0,0.0,0.0,0.75596,0.0,0.0,0.928648
607,Waverunner,"b""Struggling with my mood and thoughts. Really don't want to carry on anymore. Just don't know what I'm fighting for. I can't be here anymore.""",0.0,0.0,0.0,0.826212,0.89196,0.0,0.84639
608,MarlieeB,"b'I know you are struggling so, so much but please try your best to fight and if you feel like you are getting to the place where it is too much then please reach out.xxx'",0.0,0.0,0.0,0.0,0.0,0.0,0.0
609,AliceinWonderland,b'Thinking of you and sending hugs  How are you doing?',0.0,0.0,0.0,0.0,0.687768,0.0,0.0
610,MarlieeB,"b""Lots of 's for my Wavey.Also I finally tried Coke Life yesterday. It tastes to me so much like Normal Pepsi. (If you remember the convo from like a year ago lol)xxx""",0.0,0.0,0.723148,0.0,0.0,0.0,0.924421
