post #,username,text,Anger,Fear,Joy,Sadness,Analytical,Confident,Tentative
0,Waverunner,"b""I am feeling so very low. Can't accurately describe in words how bad I feel. It feels though that it is my fate to die. Soon. It feels inevitable now.""",0.0,0.0,0.0,0.76536,0.0,0.0,0.548498
1,Per Ardua Ad Astra,"b""I'm sorry you feel so bad at the moment, WaverunnerPlease stick around and stay with us, and don't go through matters alone. Post here.Sending you a hug """,0.0,0.0,0.0,0.746056,0.0,0.0,0.914329
2,adzesc,b'Hi WaverunnerSorry that you feel this way. Can i ask what kind of support are you getting? Is there anyone close to you that you can turn to. Also when you say that it your fate to die do you mean that you are feeling suicidal? sorry if thats a bit of a blunt question just trying to understand what you mean.',0.0,0.0,0.0,0.876205,0.871232,0.0,0.940913
3,blueflames,b'I know that feeling. Try and hold on as best you can because it probably wont last. Keep talking to us here and if the thoughts become worse then please got yourself to hospital xx',0.0,0.0,0.0,0.633383,0.913969,0.0,0.871674
4,maybe.shes.a.wildflower,b'So good to see you back!!  so sorry that its under such sad circumstances. Much love to you xx',0.0,0.0,0.706506,0.0,0.0,0.0,0.0
5,katya,"b""I'm so sorry you're feeling like this. I know it might seem inevitable - that's part of the nature of illness that is depression - but it's not inevitable. Things can start to look up (I know it's hard to see that right now). You're worth far more than you realise right now. Try not to focus on the future, because your illness will only allow you to see bleakness right now; try to focus on the moment instead, and try to fill your day with little moments that are as enjoyable as possible. Thinking of you. We're here for you.""",0.0,0.0,0.0,0.629553,0.0,0.0,0.889566
6,Waverunner,"b'Currently going through an assessment for psychotherapy and waiting to see what I will be offered. Also due to have a few sessions with a psychologist in relation to my physical health. Not really any support outside of that. And yes, I do feel suicidal.'",0.0,0.0,0.0,0.585942,0.829888,0.0,0.814556
7,MarlieeB,b'((((((((((Waverunner))))))))))',0.0,0.0,0.0,0.0,0.0,0.0,0.0
8,messymoo,"b""I'm sorry to see your struggling too I hope you can keep yourself safe. Thinking of you  xx""",0.0,0.0,0.0,0.0,0.870325,0.0,0.911392
9,braveone,"b""In a similar boat, as so many of seem to be. No magic answer im afraid. You're going through the hardest of times, but it won't last. It can't. You'll either start to see hope or do as you're suggesting and exit. Even though I dont know you and will never meet you, I hope the former is the case. You have worth as do we all. Somewhere, sometime you will cause someone to smile, and somewhere someone will make you smile. Just do your best to keep going until then""",0.0,0.660393,0.654602,0.514128,0.0,0.0,0.981036
10,rubyrose,"b'So sorry to hear it, Waverunner. I truly hope you keep holding on and keep yourself safe. '",0.0,0.0,0.0,0.0,0.0,0.0,0.0
11,SarahD,"b""When I am desperate and very suicidal, and there is no help (which usually there isn't), I try to persuade myself to put it off. I tell myself I can do it if I have to, but I can wait one day more.That bit of time can help sometimes.""",0.0,0.0,0.0,0.785476,0.0,0.0,0.0
12,*autumn*,"b'Hi waverunner, thinking of you xxx'",0.0,0.0,0.0,0.0,0.620279,0.0,0.0
13,Umbria,"b'Hope mate, please have hope, because when you feel so low and lost, there is someone out there who would be devastated if you chose to leave. Out of suffering have emerged the strongest souls; the most massive characters are seared with scars...when the daylight breaks through...and it will, you will so appreciate life and have more to give as you have been to the depths...stay strong bro.'",0.0,0.0,0.0,0.789138,0.0,0.0,0.924421
14,Dissatisfied,"b""Just hold on, I know it's hard when you feel so desperate, I felt suicidal before, and the nights are like the darkest hour, but hold on through it, just stay on this forum and chat to people to get you through.You don't know yet how you're therapy might turn out, it could be a new leaf for you and a brighter future. I know it's hard but there is a part of you that exists within you right now that is a survivor, this part of you has hope, at the moment you are probably in your wounded self, but it's often this part of us that we want to kill off, not the part of us that will survive. If you can try to access this part of you, I know when it's really bad, when we feel our worst it becomes nearly impossible to do this, but it can be done.And one day, if you want it bad enough, your wounded part of you will become more manageable, and the survivor part of you will blossom. That might happen after therapy, so just hold on.""",0.0,0.0,0.0,0.727478,0.0,0.0,0.922932
15,Dissatisfied,"b""this is such a good quote, I think it's worth repeating!""",0.0,0.0,0.836823,0.0,0.620279,0.0,0.0
16,life2live,"b""It's everyone's fate to die no point speeding it along. Life is hard, and the down's seem to last forever. All you can do is survive those times.....somehow. You gotta believe good times follow bad times and if you stay in the game things will turn around.""",0.0,0.0,0.0,0.667001,0.0,0.0,0.782938
17,maybe.shes.a.wildflower,"b""If you ever want to speak to someone about the physical side I'm here for you  I hope the professionals can help you get well soon """,0.0,0.0,0.0,0.0,0.0,0.0,0.698904
18,Waverunner,"b""Thank you all for your replies. I'm not feeling up to writing more now but just wanted to say thanks to all. Wish I could feel hope...""",0.0,0.0,0.0,0.0,0.0,0.0,0.914329
19,Waverunner,"b""So, had what was supposed to be the final appointment for my psychotherapy assessment today. Think perhaps should not have been so honest about how I'm feeling. Anyway, still don't know the outcome as she thinks that I'm so low that the crisis team should be involved. She also feels I should be on medication (which I again refused). So, she wants some time to speak to cmht etc etc and offered me 1 more appointment after she's had those discussions. I've also had a letter from the Recovery Team with an appointment in July. I don't really have any interest in engaging with the cmht and I'm not sure if I'll be offered the therapy. So, not much left is there?""",0.0,0.0,0.0,0.0,0.0,0.0,0.886982
20,katya,"b""I'm glad that you were honest with her about how you're feeling, because at least then they can put in place some support for you if you choose to take it. I'm sorry you feel that medication wouldn't really work, and that you seem to be overwhelmed by yet more appointments with your therapist - but surely it's good that you're on their radar?""",0.0,0.0,0.0,0.650024,0.0,0.0,0.789226
21,Dissatisfied,"b""sounds like the people working with you are busy telling you what you need, no wonder you don't want to engage, how about turning it round and you telling them what you need for your recovery?there are always other groups and services on offer that aren't nhs and might provide a better more compassionate and healing environment, and it's more likely to meet social contacts who will accept you as you are in those kind of places. don't give up, although it's easier to say that than actually do if you are depressed.""",0.0,0.0,0.0,0.650368,0.0,0.0,0.792377
22,Waverunner,"b'The problem is that they think they know how to ""support"" me. They don\'t listen when I have asked for things so not sure what would be different now.'",0.0,0.0,0.0,0.559046,0.720783,0.0,0.674405
23,Dissatisfied,"b""then I go suggest what you could do, I'm just as bad as your workers.Was just trying to give you other options that's all.""",0.0,0.0,0.0,0.629646,0.0,0.0,0.867767
24,Dissatisfied,"b""Tell them, or if you can't do it face to face, send them an email or letter - these professionals aren't perfect and won't take it against you if you speak up about your needs, rather they should see it as a sign of wellness that you know what you need to get better.Everything is supposed to be person-centred now, if it isn't you can complain, and they have to take your thoughts into account - also there are independent advocates that are free, they are usually linked to places like Mind - they will listen to you, that's their job - and they will represent you, make sure your needs get heard by the medical profession.""",0.0,0.0,0.0,0.0,0.0,0.0,0.0
25,Waverunner,"b""Thanks Dissatisfied. I have previously posted about what I felt would work/ not work for me and why. I won't repeat it here other than to say I have asked for individual psychotherapy and I am yet to get an answer. That is all I want at this point. It is their anxieties driving all the rest and their anxieties are not my worry. All I'm looking for is a yes or now so I can make my own decisions.""",0.0,0.698122,0.0,0.563283,0.748143,0.659623,0.0
26,Dissatisfied,"b""I wonder if you could get a form of pschotherapy from a mental health charity whilst waiting for NHS? If not there are plenty of unqualified staff that are just as good, if not better than a lot of the qualified staff, and some might have lived experiences aswell. NHS could take donkey's years""",0.0,0.0,0.0,0.0,0.776553,0.0,0.985956
27,Waverunner,b'Was not having a go at you Dissatisfied. The difference between you and my workers is that you are making suggestions based on what you have read here and with more limited info. I do appreciate the suggestions.',0.0,0.0,0.0,0.0,0.870325,0.0,0.733641
28,Dissatisfied,"b""I didn't think you were at all, I was thinking just after I typed that, I was having a dig about staff not listening to you and telling you what you need, then I go do the same, then after that I do it again in the following post - it's really hard not to be directive sometimes, I find it a real struggle. I'm also making suggestions based on my lived experience aswell and what I know would work for me, I personally have a preference for Mind, however, I appreciate not every Mind will be as good as some.There will be something, and along the way you will meet other people who you gel with, keep on going, it's hard I know, but I'm glad that your workers know that you need support, that's a good thing.""",0.0,0.0,0.0,0.617995,0.884586,0.0,0.781178
29,Waverunner,"b""Don't think I'm expressing myself very well at the moment. Feeling pretty apprehensive about what will come out of the psychotherapy assessment and the discussions she has with the cmht. Feeling a bit scared.""",0.0,0.783163,0.0,0.0,0.896183,0.0,0.50589
30,Dissatisfied,"b""I felt petrified of the professionals on my first hospital admission, then foolishly I worked at the same hospital as support worker on one of the acute wards, for my 2nd and last admission, I wasn't as petrified - and I learnt that they are more petrified of getting it wrong then you are.Just try speak up if you can about your needs and wants, if anything they will see it as a sign of wellness, they are all supposed the ask you what you want anyway, if they aren't it might be because they aren't expecting you to express yourself, rather than thinking you aren't allowed.""",0.0,0.0,0.0,0.689296,0.712953,0.0,0.0
31,Waverunner,"b""Thanks. I don't think that anyone understands my refusal of medication and it worries me that this will be seen as me being uncooperative and that I'll be forced into it. I'm also not so good at being assertive in these situations. Guess I'll see what happens in the next few days as I wouldn't be surprised if the cmht contact me sooner rather than later.""",0.0,0.686343,0.0,0.0,0.852873,0.0,0.51835
32,Dissatisfied,"b""at least they aren't leaving you to it, and they are showing concerns.Don;t worry about getting enough confidence to speak up tmrw, it's a tall order to do that, and will come in time, it took me years to stand up for myself - that and a really good consultant who I got to know really well and really helped me - I was lucky.If they give you meds, you can always wean yourself off them safely at a later date, it might just get you through in the short term.""",0.0,0.0,0.733835,0.0,0.539008,0.0,0.0
33,Waverunner,"b""I'm not quite sure which scares me more - them leaving me alone vs not leaving me alone. It's a no win situation. """,0.0,0.777324,0.0,0.0,0.0,0.0,0.905532
34,Dissatisfied,"b""I know that feeling, but at least you're battling through it, you're still alive, and it's you that's being resilient, they haven't even offered you anything yet and you've pulled yourself through a horrendous night - you did that no one else - so whatever they do or don't do, you will rise above it.""",0.0,0.0,0.0,0.0,0.0,0.0,0.5538
35,AliceinWonderland,"b""Hi waverunner, it's nice to see you again but I'm sorry things aren't good at the moment. I identify with what you've said about medication, it's very difficult when you feel you are a lone voice against a consensus. I've been persuaded many times into medication I didn't want to take and didn't believe would help (it didn't in my case). You've a right to your opinion on what you think will help, and if that's talking treatment rather than drugs they shouldn't view this as being uncooperative (they shouldn't, but unfortunately might). They can't force medication on you unless you're sectioned and admitted ( or I suppose they could force you by refusing other help unless you take them). But I hope you can manage to keep asserting what you feel is best for you, I wish you strength to be able to do that. And you do come across as strong and resilient to me, even if you perhaps don't feel it at the moment, you are contending with one of the hardest things anyone can face, and admitting to your feelings which takes courage and strength.""",0.0,0.0,0.625303,0.539985,0.551743,0.0,0.852526
36,Waverunner,"b""Alice, thank you for your words. Have found it hard to be on here in the past few weeks as I don't really want to drag anyone down and not really felt able to support others. I also realise that I am feeling negative about things at present but that doesn't mean I don't know what will not work for me. At this point, I feel pretty numb. Just had enough and not wanting to do this anymore. I don't care if I die but I absolutely do not want to end up being sectioned or forced into something I don't want only because it alleviates the anxiety felt by professionals. Death is preferable to that.""",0.0,0.509287,0.0,0.663267,0.844746,0.0,0.949706
37,Waverunner,"b'Feeling restless and agitated. Not so sure what to do with myself. Dark thoughts, strong urges.'",0.0,0.0,0.0,0.0,0.0,0.0,0.866516
38,braveone,"b'I had a bout of that last Thursday night, no easy answers to give, I was drinking and luckily passed out. I had the same feeling again Saturday afternoon and took myself out of the house to paint a door for a property I look after ( im a self employed gardener, sometimes painter!)Can you take yourself out for a walk, just to clear your thoughts a bit ?'",0.0,0.0,0.0,0.0,0.640483,0.0,0.770435
39,katya,"b""I really, really agree with this - if your mental health professionals aren't listening to your needs, then unfortunately you need to fight your corner.So sorry you're struggling with this. It'd be so much easier if they'd listened to you in the first fucking place.""",0.0,0.0,0.0,0.570069,0.0,0.0,0.0
40,AliceinWonderland,"b""Please don't be concerned about dragging people down, your need for a place to talk and express feelings is what's important right now. People can choose to read or not read, and to an extent people know it comes with the territory that it won't be all roses the things people want to talk about here. You've as much right as everyone else to talk about difficult times and difficult feelings. Sorry you are feeling so numb and have had enough. Please keep talking. I hope the professionals hear you as well. Hugs to you """,0.0,0.0,0.687523,0.589201,0.0,0.0,0.876849
41,Waverunner,"b""Thanks again Alice. Just have trouble believing that I'm deserving... still struggling with negative thoughts and urges. Don't want to be here.""",0.0,0.0,0.0,0.0,0.530786,0.0,0.969598
42,Waverunner,b'Feel so alone ',0.0,0.0,0.0,0.74475,0.0,0.0,0.946222
43,katya,"b""Aw hun, we're here. Keep talking.""",0.0,0.569769,0.0,0.0,0.0,0.0,0.0
44,Waverunner,"b"" can't sleep""",0.0,0.0,0.0,0.0,0.0,0.0,0.0
45,AliceinWonderland,"b""Aww, you really do deserve care and support though, I know what you mean though, I know that feeling. You're not alone, people are here who understand and care """,0.0,0.0,0.0,0.542569,0.857009,0.0,0.0
46,Waverunner,"b"" wish I could say I felt it. It struck me the other day how alone I am and I don't want to be alone anymore. Not sure why I'm struggling to go on, need to let go. """,0.0,0.0,0.0,0.739086,0.0,0.0,0.924323
47,Waverunner,"b""There was a quote about friends on someone else's thread at the beginning of the week, can't remember the thread or the poster but if anyone remembers it, please can you let me know where to find it.""",0.0,0.0,0.0,0.0,0.82831,0.0,0.781925
48,MarlieeB,"b""UmmIt could be one of thesehttp://www.mentalhealthforum.net/forum/thread108839 from 2 days agohttp://www.mentalhealthforum.net/forum/thread108760from 3 days agohttp://www.mentalhealthforum.net/for...ead108735.html from 4 days agoCan't find anything else from this week at the moment.xxx""",0.0,0.0,0.0,0.0,0.0,0.0,0.884138
49,Waverunner,"b""Thanks, no it wasn't any of these. I copied the quote on Monday but there was an issue with the formatting so can't decipher it now. It was part of a long thread. I thought it was a really good quote and wanted to keep it. Thanks for looking! Appreciate it!""",0.0,0.0,0.65622,0.0,0.712975,0.0,0.764224
50,MarlieeB,"b""Now I'm on a mission lol""",0.0,0.0,0.708252,0.0,0.0,0.0,0.0
51,Waverunner,b'You made me smile which is hard to do at the mo! Thanks though! Wish I could remember but part of it is about a friend coming into your life and staying.',0.0,0.0,0.766368,0.0,0.0,0.0,0.890302
52,blueflames,b'If it was a famous quote it might be here??Friendship Quotes - BrainyQuote',0.0,0.0,0.875174,0.0,0.589295,0.0,0.716301
53,MarlieeB,"b""I don't think it is this one but maybe.http://www.mentalhealthforum.net/forum/thread50962.htmlDo you remember anyone who commented on it?""",0.0,0.0,0.0,0.0,0.743104,0.0,0.873263
54,Waverunner,"b""Wasn't that one. I though it may have been Kerome but I may also be making it up. Tried searching that but didn't find it.""",0.0,0.0,0.0,0.0,0.77494,0.0,0.976157
55,Waverunner,"b""Haven't find it in here but some of these are very good so thanks.""",0.0,0.0,0.837595,0.0,0.0,0.0,0.0
56,AliceinWonderland,"b'(((waverunner))) Thinking of you, love Alice x'",0.0,0.0,0.867835,0.0,0.762356,0.0,0.0
57,Waverunner,"b'Nothing to say, just trying to stay connected. So badly want to crawl into a hole and disappear.'",0.0,0.0,0.0,0.0,0.0,0.0,0.966403
58,catkin,"b""Hi, I feel similarly, don't think we've spoken before, just to say hi and keep trying to connect. The urge to disappear is hard to resist I know, but very hard to achieve. Be kind as you can to you xx""",0.0,0.0,0.0,0.578107,0.894378,0.0,0.893364
59,Waverunner,"b""Hi Catkin. Thank you. It is hard to resist the urge to disappear but I don't think it's impossible to achieve. The fact is, no one would miss me. I hope that you are ok.""",0.0,0.0,0.0,0.801176,0.93221,0.0,0.800886
60,catkin,"b'I know it feels as if no one would miss you, but I think we can comfort ourselves with that thought. You would be missed, I don\'t doubt that.I won\'t say too much about it but I\'ve worked with people who\'ve tried and failed to ""disappear"", die. It isn\'t easy. But living isn\'t either is it? I\'ve read some of this thread now, you are waiting to hear about therapy?Can you wait until you find out what support is offered and give that a good go first, see where you are up to then? Being at the point of having nothing to lose can feel desperate, but sometimes also liberating. Sorry if I\'ve spoken out of turn. X'",0.0,0.0,0.646738,0.654387,0.681092,0.0,0.890302
61,Waverunner,"b""You haven't spoken out of turn Catkin. I appreciate your words. I am trying to hold on to hear about the therapy. I do have a suspicion though that being offered therapy will be conditional of me engaging with the cmht which I'm not really keen on. I just wish they would say one way or another so that I know where I stand. The question is whether I can hang on or whether I want to at this point.""",0.0,0.0,0.553654,0.514044,0.944491,0.0,0.925837
62,catkin,"b""Yes, it is hard waiting to hear. I don't know, but if you do start therapy, the cmht could simply be there in the background, as you will be focussing on therapy. Do you know what the cmht want you to do in terms of engaging?If the person or people you've seen from cmht so far are affecting your reluctance to have them involved, you can ask to see someone else? X""",0.0,0.0,0.0,0.733683,0.942528,0.0,0.868535
63,maybe.shes.a.wildflower,"b'I hope you are feeling okay today WR My CC is getting me some sort of councilling talking therapy for after shes closed with me and ive not been with her long nor do I see her often.... It may be worth engaging and pkaying along just to get the therapy in place, atleast it may be faster that way. Xx'",0.0,0.0,0.0,0.0,0.0,0.0,0.981587
64,Waverunner,"b'Thanks Catkin and Wildflower. I think it may come to me ""playing the game"". However, a bit concerned because the therapist doing the psychotherapy assessment thinks I need much more involvement from them, including the crisis team which I don\'t want. She also made a throwaway comment about me considering how long I can continue to do my job. Didn\'t get a chance to discuss that further unfortunately but it was a bit of a shock as work has always been a safety net for me despite being stressful. Never taken time off for MH reasons either so not sure where this came from. Not feeling any better but decided being as honest as I was is perhaps not a good thing. My mind is all over the place though.'",0.0,0.0,0.520253,0.0,0.769461,0.0,0.0
65,catkin,"b""But if you are actively suicidal ? they can't ignore that fact, and if this is the case, then surely there is nothing to lose. Work doesn't exist if you are dead, therapy won't help then, but if you need some support to enable you to access therapy, isn't it worth seeing if you can work with services to get to the therapy that you want? It is your decision re work unless you are signed off, but it would be wrong for the assessor not to voice their concerns. X""",0.0,0.0,0.0,0.826685,0.819612,0.652764,0.0
66,maybe.shes.a.wildflower,"b""I wanted to remain working too as I found it distracted me but when I was miserable around services users I knew I couldn't give them what they needed anymore... Sometimes it is important to concentrate on yourself. You dont have to accept extra support... I only saw crisis when I needed meds, they just phoned me to check I was ok instead. Then I was handed to my care coordinator who I only saw once a week now twice so they really dont intrude that much if you seem well """,0.0,0.0,0.0,0.77796,0.819612,0.0,0.827288
67,Waverunner,"b""What you say is true. I am so used to having to do things on my own (I know it's not a great way to operate). I also haven't felt I've been supported by the cmht when I was willing to engage so I'm apprehensive on this occasion. Re work - although I haven't had time off for MH reasons, I have just gone back to work after a year off as I have cancer. And for all sorts of reasons, don't want more time off. I guess I will need to see what happens and then make a decision.""",0.0,0.0,0.0,0.0,0.664489,0.0,0.526858
68,Waverunner,"b""I agree with you about being miserable around service users and if I felt that I wasn't able to meet their needs, my decision may be different. At the moment I can separate things and function at work but I hear you. Re cmht, maybe I'm overthinking things. Won't know until the therapist communicates her thoughts further with me. I can talk myself into opposing views within a short period . I don't know, I give up.""",0.0,0.0,0.0,0.585626,0.61361,0.0,0.909175
69,Healing2015,b'Have you been talking to the Samaritans too? They help me.',0.0,0.0,0.0,0.0,0.0,0.0,0.0
70,Waverunner,"b""Hi Healing. No, haven't used the Samaritans. I have an anxiety about using the phone. I know I could email I text but can't bring myself to do that either. Also have massive issues with trust.""",0.0,0.70141,0.0,0.0,0.793256,0.0,0.859075
71,maybe.shes.a.wildflower,"b""You can email Samaritans  although its quite slow, I hate telephone talking too so emailed but found it not much help. I think as support we imagine to be cared for as we would our su's and that hasn't happened in my experience and it saddens me. I guess I need to help myself more but I'm struggling too thats why I'm under them? I duno... I look well therefore I must be ok. I'm glad you can still be strong enough to separate work and personal life  """,0.515453,0.0,0.534724,0.639453,0.648694,0.0,0.0
72,Waverunner,"b""You are so right! Don't think I would still be here if I didn't have work.""",0.0,0.0,0.0,0.713215,0.668742,0.0,0.0
73,Abbierad92,b'Thinking of you wave runner',0.0,0.0,0.0,0.0,0.882284,0.0,0.0
74,Waverunner,b'Had an appointment with psychologist today (not the same as the person doing the assessment) and this relates only to my physical health. It was a good appointment though and feeling marginally better this afternoon.',0.0,0.0,0.585447,0.0,0.811599,0.0,0.0
75,Healing2015,"b""Work helps you? How do you put these thoughts aside to work? I'm going to have to do it and so scared.I have issues with trust too. I email samaritans from my old email address with no name identifyer.""",0.0,0.846653,0.0,0.0,0.0,0.770765,0.0
