post #,username,text,Anger,Fear,Joy,Sadness,Analytical,Confident,Tentative
796,Gajolene,With me helping the boys while ill myself I found so much strength and maybe helping your mate online can give you that strength.,0.0,0.0,0.626493,0.0,0.0,0.0,0.0
796,Gajolene,No one can say for sure.,0.0,0.0,0.0,0.0,0.0,0.942582,0.0
796,Gajolene,Don't depend on anybodies approaval but your own.,0.0,0.0,0.0,0.0,0.762356,0.0,0.984352
796,Gajolene,You can do this even without mum telling you.,0.0,0.0,0.0,0.522021,0.0,0.0,0.856622
796,Gajolene,"You know she's watching over you, deep down and would love nothing more than to see you happy and doing things that make you happy.",0.0,0.0,0.929233,0.0,0.0,0.0,0.0
796,Gajolene,That doesn't have to mean being married or having a boyfriend in tow untill you are ready.,0.0,0.0,0.636517,0.0,0.506763,0.0,0.0
796,Gajolene,That's my experience and learning in my opinion.,0.0,0.0,0.0,0.0,0.842108,0.0,0.984352
796,Gajolene,"I've had a lot of duds but learned so much along the road.""",0.0,0.0,0.551019,0.0,0.0,0.0,0.0
797,Fairy Lucretia,b'i need a miracle x does anyone have one?,0.0,0.0,0.0,0.0,0.0,0.0,0.856622
797,Fairy Lucretia,x',0.0,0.0,0.0,0.0,0.0,0.0,0.0
798,Fairy Lucretia,"b'what am i going to do on monday while im waiting to hear and what to i do if its bad news ,which it will be how do i react?",0.0,0.0,0.0,0.644197,0.0,0.0,0.0
798,Fairy Lucretia,xx',0.0,0.0,0.0,0.0,0.0,0.0,0.0
802,misssadness,b'It is going to be very hard waiting to hear the results of the test.,0.0,0.0,0.0,0.519223,0.532616,0.727798,0.0
802,misssadness,I know I struggle to distract myself during such times.,0.0,0.0,0.0,0.782006,0.687768,0.0,0.0
802,misssadness,Maybe you can take Maddie for a walk to pass some time.,0.0,0.0,0.0,0.0,0.0,0.0,0.946222
802,misssadness,xx',0.0,0.0,0.0,0.0,0.0,0.0,0.0
804,misssadness,b'I am so sorry you are feeling ill.,0.0,0.0,0.0,0.575786,0.0,0.0,0.0
804,misssadness,I imagine it is due to stress.,0.0,0.736081,0.0,0.0,0.972852,0.0,0.0
804,misssadness,You have so much going on right now and it is so hard for you.,0.0,0.0,0.0,0.610832,0.0,0.0,0.0
804,misssadness,I wish I could help.,0.0,0.0,0.0,0.68242,0.0,0.0,0.968123
804,misssadness,xx',0.0,0.0,0.0,0.0,0.0,0.0,0.0
807,misssadness,b'I am really sorry your cpn did not help you.,0.0,0.0,0.0,0.588978,0.687768,0.0,0.0
807,misssadness,You are getting a support worker soon and she will help.,0.0,0.0,0.0,0.0,0.0,0.0,0.0
807,misssadness,You will not be left alone.,0.0,0.0,0.0,0.785487,0.0,0.0,0.0
807,misssadness,xx',0.0,0.0,0.0,0.0,0.0,0.0,0.0
812,Fairy Lucretia,b'do you think i should go with my aunty on monday? to find out for sure what is going on or i might get too upset should i stay at home and wait?,0.0,0.0,0.0,0.0,0.0,0.0,0.0
812,Fairy Lucretia,xxx',0.0,0.0,0.0,0.0,0.0,0.0,0.0
815,MarlieeB,b'Personally I would stay at home.,0.0,0.0,0.0,0.0,0.0,0.0,0.0
815,MarlieeB,If it is bad news your Auntie may need some space and time to get over it herself.xxx',0.0,0.0,0.0,0.0,0.0,0.0,0.839577
816,Fairy Lucretia,b'if it has spread to her lymph glands or lymph nodes does that mean she will definitely die?,0.0,0.0,0.0,0.650552,0.747994,0.0,0.0
816,Fairy Lucretia,xx',0.0,0.0,0.0,0.0,0.0,0.0,0.0
817,misssadness,b'I know it is really hard but please try not to think of these things.,0.0,0.0,0.0,0.623479,0.961593,0.0,0.0
817,misssadness,You are torturing yourself.,0.0,0.913043,0.0,0.0,0.0,0.0,0.0
817,misssadness,Just try to get through the days until Monday.,0.0,0.0,0.0,0.0,0.0,0.0,0.946222
817,misssadness,We are all here to distract you so you can talk to us.,0.0,0.0,0.0,0.0,0.0,0.775702,0.0
817,misssadness,xx',0.0,0.0,0.0,0.0,0.0,0.0,0.0
820,misssadness,b'I think people who have been cursed with mental illness are stronger then other people as just getting through the day is so tough for us.,0.0,0.0,0.0,0.799342,0.0,0.0,0.0
820,misssadness,xx',0.0,0.0,0.0,0.0,0.0,0.0,0.0
825,misssadness,b'It is going to be hard for you to get through today as I know how worried you are.,0.0,0.603655,0.0,0.503681,0.0,0.0,0.0
825,misssadness,We are all here for you.,0.0,0.0,0.0,0.0,0.0,0.942582,0.0
825,misssadness,xx',0.0,0.0,0.0,0.0,0.0,0.0,0.0
827,misssadness,b'You are not going on so please do not say sorry.,0.0,0.0,0.0,0.0,0.0,0.0,0.0
827,misssadness,You are in such a horrible position here and there is a lot going on so it is bound to make you scared.,0.0,0.950522,0.0,0.0,0.0,0.0,0.0
827,misssadness,We will just have to wait for the results and hope it can be treated.,0.0,0.0,0.0,0.0,0.61476,0.0,0.779898
827,misssadness,xx',0.0,0.0,0.0,0.0,0.0,0.0,0.0
828,blueflames,"b'Hey LuSorry you are having a bad day, it is understandable given everything.",0.0,0.0,0.0,0.711183,0.589295,0.0,0.0
828,blueflames,But please try and stay strong =( Thinking of you and will speak to you later xxx',0.0,0.0,0.0,0.0,0.0,0.0,0.0
830,blueflames,"b""Tell him it is too stressful and you have enough to deal with atm.",0.6345,0.0,0.0,0.0,0.0,0.0,0.0
830,blueflames,If his intentions are good he will understand DON'T give him your address.,0.0,0.0,0.505897,0.0,0.908301,0.0,0.0
830,blueflames,"xx""",0.0,0.0,0.0,0.0,0.0,0.0,0.0
834,misssadness,b'Are you feeling sleepy?,0.0,0.0,0.0,0.705078,0.0,0.0,0.0
834,misssadness,Maybe you could read a bit.,0.0,0.0,0.0,0.0,0.0,0.0,0.994446
834,misssadness,xx',0.0,0.0,0.0,0.0,0.0,0.0,0.0
846,blueflames,"b""I wouldn't have thought so.",0.0,0.0,0.0,0.0,0.842108,0.0,0.75152
846,blueflames,"I read that it was easy to remove so try and stay positive xx""",0.0,0.0,0.746795,0.0,0.0,0.0,0.0
848,blueflames,b'If they have found it and remove it in time then it wont.,0.0,0.0,0.0,0.0,0.874319,0.0,0.0
848,blueflames,Did they say it had spread?? xx',0.0,0.536048,0.0,0.0,0.0,0.0,0.0
850,blueflames,"b""Okay so that sounds really good  They wouldn't be so positive if the prognoses didn't look so good.",0.0,0.0,0.9384,0.0,0.901894,0.660207,0.0
850,blueflames,I think you have nothing to worry about.,0.0,0.0,0.0,0.0,0.762356,0.0,0.615352
850,blueflames,When are they gonna operate ?? quickly I am guessing ?,0.0,0.0,0.0,0.0,0.0,0.0,0.856622
850,blueflames,"xx""",0.0,0.0,0.0,0.0,0.0,0.0,0.0
851,misssadness,b'I am really sorry it is cancer but the doctors sound quite positive they can get your aunt well.,0.0,0.0,0.0,0.532249,0.0,0.0,0.0
851,misssadness,xx',0.0,0.0,0.0,0.0,0.0,0.0,0.0
859,misssadness,b'I hope you just have a bug and recover soon.,0.0,0.0,0.0,0.0,0.0,0.0,0.968123
859,misssadness,Maddie and Winston need you.,0.0,0.0,0.0,0.0,0.0,0.0,0.0
859,misssadness,xx',0.0,0.0,0.0,0.0,0.0,0.0,0.0
862,Gajolene,"b'So sorry to hear about your aunty Lu, they have a good chance to get it all if they caught it early enough.",0.0,0.0,0.0,0.0,0.541591,0.0,0.0
862,Gajolene,Will say extra prayers for her.,0.0,0.0,0.0,0.756852,0.0,0.0,0.0
862,Gajolene,',0.0,0.0,0.0,0.0,0.0,0.0,0.0
869,Gajolene,b'A giant step in bravery for you hun.,0.0,0.0,0.0,0.0,0.0,0.0,0.0
869,Gajolene,Maybe a whole new start.,0.0,0.0,0.0,0.0,0.0,0.0,0.968123
869,Gajolene,Hope he is a good one.,0.0,0.0,0.715133,0.0,0.0,0.0,0.946222
869,Gajolene,Feel good and try not to worry.',0.0,0.0,0.903788,0.0,0.0,0.0,0.91961
873,misssadness,b'I do not think anybody could have a sense of humour when they are grieving.,0.0,0.0,0.0,0.0,0.532616,0.0,0.904882
873,misssadness,Please be patient with yourself.,0.0,0.0,0.0,0.0,0.0,0.0,0.0
873,misssadness,You have lost your mother whom you were so close to.,0.0,0.0,0.0,0.747558,0.0,0.0,0.0
873,misssadness,xx',0.0,0.0,0.0,0.0,0.0,0.0,0.0
876,misssadness,b'I so badly wish I could do that for you.,0.0,0.0,0.0,0.652148,0.0,0.0,0.822231
876,misssadness,xx',0.0,0.0,0.0,0.0,0.0,0.0,0.0
878,misssadness,b'Not kill you though!,0.0,0.0,0.0,0.0,0.0,0.0,0.0
878,misssadness,I mean wave a wand.,0.0,0.0,0.0,0.0,0.882284,0.0,0.0
878,misssadness,I replied to your post before you added you wish I could kill you.,0.0,0.0,0.0,0.532825,0.0,0.0,0.681699
878,misssadness,xx',0.0,0.0,0.0,0.0,0.0,0.0,0.0
879,Fairy Lucretia,b'i know!,0.0,0.0,0.0,0.0,0.982476,0.0,0.0
879,Fairy Lucretia,xx',0.0,0.0,0.0,0.0,0.0,0.0,0.0
882,misssadness,b'I am sorry you are lonely.,0.0,0.0,0.0,0.893587,0.0,0.0,0.0
882,misssadness,I wish I could visit you.,0.0,0.0,0.0,0.646836,0.0,0.0,0.946222
882,misssadness,xx',0.0,0.0,0.0,0.0,0.0,0.0,0.0
890,Viktoria,"b""I'm so sorry things are so bad Fairy Lu...",0.0,0.0,0.0,0.568155,0.0,0.0,0.0
890,Viktoria,I wish I could say something to help.,0.0,0.0,0.0,0.628305,0.0,0.0,0.984352
890,Viktoria,Please hold on and I promise things will get better in time.,0.0,0.0,0.0,0.0,0.0,0.0,0.0
890,Viktoria,Keep posting...,0.0,0.0,0.0,0.0,0.0,0.0,0.0
890,Viktoria,"And if things are REALLY getting too much, don't be afraid to call for help or go to A&E...",0.0,0.0,0.0,0.0,0.928187,0.0,0.525007
890,Viktoria,You are such a lovely person always helping everyone and you deserve to be helped too!,0.0,0.0,0.856504,0.0,0.0,0.704642,0.0
890,Viktoria,"You've been through so much lately, I can only imagine how hard it is.",0.0,0.0,0.0,0.76944,0.0,0.0,0.0
890,Viktoria,Please don't do anything bad to yourself.,0.0,0.0,0.0,0.591677,0.0,0.0,0.91961
890,Viktoria,"You've got your whole life ahead of you and all your forum friends care about you very much!""",0.0,0.0,0.0,0.0,0.0,0.80026,0.0
891,Poppy12,"b""Hang on in there Lu - things will get better with time.",0.0,0.0,0.0,0.0,0.0,0.0,0.0
891,Poppy12,Your loss is till so fresh I'm not surprised you're really suffering still.,0.0,0.0,0.0,0.837165,0.0,0.0,0.0
891,Poppy12,"When is your support worker going to pop round or has s/he already been out to see you?I mentioned in another thread that I'm going to a mental heath daycentre run by social services that has lots of fun activities like arts, crafts, singing, baking, yoga, Zumba, guitar and keyboard lessons etc etc - I'm starting Monday - I'm wondering whether they have anything like that in your city?",0.0,0.0,0.700453,0.0,0.0,0.0,0.644304
891,Poppy12,We all need a reason to get up in the morning and it's very depressing not seeing anyone or doing anything.,0.0,0.0,0.0,0.0,0.0,0.0,0.0
891,Poppy12,"Perhaps you could ask your CPN/support worker?Sending big hugs """,0.0,0.0,0.0,0.0,0.0,0.0,0.957828
900,blueflames,b'Hi LuPopped on to check on you.,0.0,0.0,0.0,0.0,0.801827,0.0,0.0
900,blueflames,Sorry to find you so bad.,0.0,0.516134,0.0,0.614408,0.0,0.0,0.0
900,blueflames,You can still phone me if you feel down and want someone to listenLove to you xxx',0.0,0.0,0.0,0.0,0.0,0.0,0.775166
901,Poppy12,"b""Hang on in there Fairy Lu sweetheart xxx.",0.0,0.0,0.0,0.0,0.0,0.0,0.0
901,Poppy12,So sorry to hear you're still suffering so.,0.0,0.0,0.0,0.0,0.0,0.0,0.0
901,Poppy12,I wish I could make things better for you - if only.Have you met your boyfriend in real life yet?,0.0,0.0,0.0,0.0,0.599421,0.0,0.0
901,Poppy12,What did your CPN say about him?,0.0,0.0,0.0,0.542166,0.0,0.0,0.681699
901,Poppy12,Like others have said they won't stop seeing you because you have a partner.,0.0,0.0,0.518837,0.0,0.560098,0.0,0.0
901,Poppy12,I have one and still have CMHT input.,0.0,0.0,0.0,0.0,0.0,0.0,0.0
901,Poppy12,"Sending big hugs """,0.0,0.0,0.0,0.0,0.0,0.0,0.0
904,Fairy Lucretia,b'is it ok to be friends with your ex if you have a new boyfriend?,0.0,0.0,0.544378,0.0,0.532616,0.0,0.0
904,Fairy Lucretia,xx',0.0,0.0,0.0,0.0,0.0,0.0,0.0
908,misssadness,"b'Just because you have a boyfriend, does not mean you have to give up your friends.",0.0,0.0,0.573074,0.0,0.781949,0.0,0.0
908,misssadness,xx',0.0,0.0,0.0,0.0,0.0,0.0,0.0
909,Fairy Lucretia,b'im not sure i would like him being friends with his ex though x double standards much!,0.0,0.0,0.0,0.0,0.0,0.0,0.66371
909,Fairy Lucretia,xx',0.0,0.0,0.0,0.0,0.0,0.0,0.0
910,misssadness,b'I can understand that but I do not feel you owe him anything.,0.0,0.0,0.0,0.0,0.589295,0.0,0.867767
910,misssadness,You have not even met up yet and you know you have no intentions of meeting up with your ex so nothing is going to happen.,0.0,0.0,0.0,0.0,0.0,0.0,0.0
910,misssadness,xx',0.0,0.0,0.0,0.0,0.0,0.0,0.0
913,burt tomato,"b""She is still 'alive' just not in the physical world anymore.",0.0,0.0,0.0,0.0,0.0,0.0,0.75152
913,burt tomato,"Have a look at the pictures from the link on this thread:http://www.mentalhealthforum.net/for...ead122836.html""",0.0,0.0,0.0,0.0,0.967739,0.0,0.0
915,misssadness,b'I am so sorry for your pain.,0.0,0.0,0.0,0.754295,0.0,0.0,0.0
915,misssadness,You and your mothers bond was unique and nothing can replace that.,0.0,0.0,0.0,0.0,0.0,0.0,0.0
915,misssadness,xx',0.0,0.0,0.0,0.0,0.0,0.0,0.0
916,nonotme,"b'the gap left when someone we love dies is unfillable (is thta a word?) and takes a long long time to understand and then move forwards.I think its time you gave yourself some love, you are the one with us and we want you ti stay with us.it will take time, years in some cases but grief can be lived with.sorry",0.0,0.0,0.0,0.852182,0.0,0.0,0.0
916,nonotme,words struggling today.xx',0.0,0.0,0.0,0.0,0.0,0.0,0.0
918,misssadness,b'It is very hard to take care of Maddie while you are feeling so depressed.,0.0,0.0,0.0,0.935034,0.0,0.727798,0.0
918,misssadness,Is there anyway you can force yourself to take her for an extra walk each day?,0.0,0.0,0.0,0.534139,0.506763,0.0,0.0
918,misssadness,I think it will help you too as I think it is healthy to have a routine.,0.0,0.0,0.627688,0.0,0.743104,0.0,0.0
918,misssadness,I know not working makes it hard for us to have a routine at times but if we can do some things at set times it can help.,0.0,0.0,0.0,0.769917,0.606284,0.0,0.0
918,misssadness,xx',0.0,0.0,0.0,0.0,0.0,0.0,0.0
920,Poppy12,"b""You're not letting her down lovely - and she certainly would not be better off without you - she needs you and she loves you.",0.0,0.0,0.906104,0.0,0.0,0.0,0.0
920,Poppy12,As Misssadness suggests maybe forcing yourself to do another short walk a day might help you both?,0.0,0.0,0.0,0.0,0.0,0.0,0.925256
920,Poppy12,"I think you need some extra activities in your day - you won't want to do them, at least at first but too much time on your own with nothing to do won't help how you feel.",0.0,0.0,0.0,0.619084,0.0,0.0,0.0
920,Poppy12,"Sending big hugs """,0.0,0.0,0.0,0.0,0.0,0.0,0.0
921,misssadness,b'You have no energy because you are depressed.,0.0,0.0,0.0,0.980304,0.762356,0.0,0.0
921,misssadness,That does not make you useless.,0.836113,0.0,0.0,0.0,0.0,0.0,0.0
921,misssadness,Please stop being so mean to yourself.,0.0,0.0,0.0,0.0,0.0,0.0,0.0
921,misssadness,I know it is very hard to go out when you are feeling low and tired but I actually think it would be good for you and Maddie to have two walks a day and have some structure to your day.,0.0,0.0,0.0,0.639944,0.0,0.0,0.0
921,misssadness,I want you to stop thinking Maddie is better off without you.,0.0,0.0,0.0,0.0,0.620279,0.0,0.0
921,misssadness,Nobody could love her as much as you do.xx',0.0,0.0,0.55671,0.0,0.0,0.0,0.822231
922,MarlieeB,"b""It's true that we didn't know how wonderful she was.",0.0,0.0,0.912578,0.0,0.653099,0.579436,0.0
922,MarlieeB,"Only you will ever know that but from what you have written a picture about how amazing she was is in my head and I'm sure others do as well.We will do our best, we are here for you Lu.xxx""",0.0,0.0,0.830473,0.0,0.0,0.0,0.0
923,MarlieeB,"b""No you aren't letting her down.",0.0,0.0,0.0,0.0,0.0,0.0,0.0
923,MarlieeB,"Not at all.She understands, she really does understand, it's a shame that she can't speak human but she does.You do walk her, you feed her and you give her water and your love.You really aren't letting her down.",0.0,0.0,0.0,0.0,0.678929,0.0,0.0
923,MarlieeB,"xxx""",0.0,0.0,0.0,0.0,0.0,0.0,0.0
925,nonotme,b'hey Luare you getting the right support?,0.0,0.0,0.0,0.0,0.0,0.0,0.0
925,nonotme,"I know you said you walk your dog once a day, but any friends ?",0.0,0.0,0.0,0.0,0.560098,0.0,0.681699
925,nonotme,what about your sister you spoke of?have you phoned Mind or Rethink ?,0.0,0.0,0.0,0.0,0.821913,0.0,0.867767
925,nonotme,they might be able to offer some help in your area?,0.0,0.0,0.0,0.0,0.0,0.0,0.957828
925,nonotme,although I do think Rethink are pretty rubbish they do have drop in sites you could maybe visit and see what you think?',0.0,0.0,0.0,0.0,0.903207,0.0,0.899797
927,nonotme,b'Lu maybe with the right help and support you could make real life friends.,0.0,0.0,0.547723,0.0,0.0,0.0,0.808199
927,nonotme,"I know its not easy, I have in the last few weeks rejected all of my family and friends.",0.0,0.0,0.0,0.787924,0.0,0.638987,0.0
927,nonotme,But if you could make a couple of real friends then maybe you could get out one night a week?,0.0,0.0,0.0,0.0,0.0,0.0,0.88939
927,nonotme,out for a coffee somewhere?just,0.0,0.0,0.0,0.0,0.0,0.0,0.984352
927,nonotme,an idea.xx',0.0,0.0,0.64523,0.0,0.955445,0.0,0.0
932,SarahD,"b""Doubt anyone here gets fed up - most on here know how that feels.",0.0,0.0,0.0,0.528365,0.560098,0.0,0.974201
932,SarahD,"Wish you didn't have to go through this xxxx""",0.0,0.0,0.0,0.0,0.895415,0.866237,0.0
934,Unique1,"b""They don't Lu.",0.0,0.0,0.0,0.0,0.0,0.0,0.0
934,Unique1,"Like me they probably wish they could help...I know how it feels.LoveUnique xx""",0.0,0.0,0.0,0.555596,0.532616,0.0,0.968123
936,misssadness,b'Is that what you have been told or are you guessing?,0.0,0.0,0.0,0.0,0.0,0.0,0.957828
936,misssadness,xx',0.0,0.0,0.0,0.0,0.0,0.0,0.0
938,misssadness,b'Have they said if there are any other options if the anaesthetic is not suitable?,0.0,0.0,0.0,0.0,0.781949,0.0,0.647986
938,misssadness,xx',0.0,0.0,0.0,0.0,0.0,0.0,0.0
940,misssadness,b'There is every chance your aunty can have the anaesthetic.,0.0,0.0,0.0,0.0,0.0,0.0,0.0
940,misssadness,I know it is really hard but all you can do is wait until she has the appointment.,0.0,0.0,0.0,0.570553,0.793846,0.660207,0.0
940,misssadness,When is it?,0.0,0.0,0.0,0.0,0.0,0.0,0.0
940,misssadness,xx',0.0,0.0,0.0,0.0,0.0,0.0,0.0
943,misssadness,b'It does sound like it is complicated.,0.0,0.0,0.0,0.0,0.801827,0.0,0.681699
943,misssadness,This is a very stressful and worrying time for you both and I really am sorry you are gong through this.,0.0,0.0,0.0,0.553384,0.0,0.598602,0.0
943,misssadness,xx',0.0,0.0,0.0,0.0,0.0,0.0,0.0
944,Cazcat,"b""Hi Lucretia,There are different types of anesthetic, so the anethetist will be able to advise her which is most suitable and what risks versus benefits of the different types are.",0.0,0.0,0.0,0.0,0.0,0.0,0.0
944,Cazcat,"I know its easier said than done but don't pannic yet, I think its very unlikely that there isn't an option available to her.",0.0,0.0,0.0,0.0,0.620279,0.0,0.669068
944,Cazcat,"I have worked with a lot of anethetists all who have been amazingly knowlegable and clever people.""",0.0,0.0,0.0,0.0,0.0,0.0,0.0
947,nonotme,"b""hi sweetie, it should be easy really.if",0.0,0.0,0.766781,0.0,0.901894,0.0,0.0
947,nonotme,there is a will it's already done and her estate will just be split the way she wanted it to be.have you spoke with her solicitor?,0.0,0.0,0.0,0.0,0.0,0.0,0.0
947,nonotme,and who is named in the will?,0.0,0.0,0.0,0.0,0.0,0.0,0.0
947,nonotme,"also I'm not sure here but dosn't it have to go to probate over a certain amount (\xc2\xa310,000 is it)the solicitor should do 99% of the work.""",0.0,0.0,0.0,0.0,0.0,0.652608,0.0
953,Unique1,b'This is lovely  xFor you Lu.,0.0,0.0,0.821917,0.0,0.0,0.0,0.0
953,Unique1,Ximage.jpg',0.0,0.0,0.0,0.0,0.0,0.0,0.0
958,misssadness,b'If you feel you need more time to get to know him then that is okay.,0.0,0.0,0.0,0.0,0.825947,0.0,0.0
958,misssadness,You can just tell him you are not ready.,0.0,0.0,0.0,0.0,0.0,0.0,0.856622
958,misssadness,There is no pressure to meet.,0.0,0.0,0.69342,0.0,0.0,0.0,0.0
958,misssadness,xx',0.0,0.0,0.0,0.0,0.0,0.0,0.0
959,Unique1,"b""yes it's a bit nerve wracking I would imagine.You have had such a lot going on.If your not up to it lu.",0.0,0.0,0.0,0.0,0.60456,0.0,0.0
959,Unique1,"Tell him you need time and postpone it...Unique xx""",0.0,0.0,0.0,0.0,0.0,0.0,0.0
961,Mister.B,"b""Don't feel pressured into anything.",0.0,0.0,0.0,0.0,0.0,0.0,0.984352
961,Mister.B,"This may be an outdated way of looking at it, but, he's courting you.He has to make allowances for you.If you don't want to do it, or you don't want to do it just yet, he must understand that.If he doesn't he's not a gentleman.",0.0,0.0,0.0,0.0,0.0,0.0,0.0
961,Mister.B,"""",0.0,0.0,0.0,0.0,0.0,0.0,0.0
962,misssadness,b'There is no way he would want you to self harm to meet him.,0.0,0.0,0.0,0.0,0.0,0.0,0.0
962,misssadness,That is a very dangerous idea.,0.0,0.667067,0.0,0.0,0.842108,0.942582,0.0
962,misssadness,If you cannot cope then you must put your health first.,0.0,0.0,0.686303,0.0,0.788547,0.579436,0.0
962,misssadness,You cannot help letting him down.,0.0,0.0,0.0,0.0,0.0,0.0,0.0
962,misssadness,Do not let yourself down by hurting yourself.,0.0,0.0,0.0,0.842527,0.0,0.0,0.0
962,misssadness,Meeting him is not worth it.,0.0,0.0,0.69342,0.0,0.0,0.0,0.0
962,misssadness,He will understand if he is a true friend.,0.0,0.0,0.587725,0.0,0.901894,0.660207,0.0
962,misssadness,xx',0.0,0.0,0.0,0.0,0.0,0.0,0.0
964,Unique1,"b""No lu.",0.0,0.0,0.0,0.0,0.0,0.0,0.0
964,Unique1,"Understand how you feel about feeling your letting him down but if your not up to it apologise and don't go, it's really not good to be doing things your not up to right now.",0.0,0.0,0.0,0.0,0.631014,0.0,0.0
964,Unique1,"No matter how disappointed he is it's not worth your health being affected and certainly not using sh to get through it...Xxx""",0.0,0.0,0.0,0.0,0.653099,0.0,0.0
965,misssadness,b'Have you decided what you will do?,0.0,0.0,0.0,0.0,0.93884,0.92125,0.0
965,misssadness,I am very worried you are going to hurt yourself.,0.0,0.663461,0.0,0.501925,0.0,0.849827,0.0
965,misssadness,xx',0.0,0.0,0.0,0.0,0.0,0.0,0.0
967,misssadness,b'Thank you sweetheart.,0.0,0.0,0.810904,0.0,0.0,0.0,0.0
967,misssadness,You are so special and I could not bare you to hurt yourself.,0.0,0.0,0.0,0.88221,0.0,0.0,0.716301
967,misssadness,xx',0.0,0.0,0.0,0.0,0.0,0.0,0.0
968,MarlieeB,"b""Lu if you aren't ready to meet him then if he truly cares then he will understand.",0.0,0.0,0.629602,0.0,0.901894,0.660207,0.0
968,MarlieeB,"You have to put yourself first, everytime.xxx""",0.0,0.0,0.0,0.0,0.0,0.866237,0.0
971,misssadness,"b'Waking up late makes you tired, not useless.",0.0,0.0,0.0,0.0,0.0,0.0,0.0
971,misssadness,You are not pointless.,0.0,0.0,0.0,0.0,0.0,0.0,0.0
971,misssadness,You are a loving mummy to your animals and a wonderful friend to me.xx',0.0,0.0,0.893324,0.0,0.0,0.0,0.0
972,MarlieeB,b'You are certainly not useless.,0.0,0.0,0.0,0.0,0.0,0.0,0.90601
972,MarlieeB,Not one little bit xxx',0.0,0.0,0.0,0.0,0.0,0.0,0.0
975,misssadness,b'I think you have made the right decision there.,0.0,0.0,0.0,0.0,0.901894,0.0,0.0
975,misssadness,Please do not be worried about the man not liking you.,0.0,0.0,0.0,0.0,0.0,0.0,0.0
975,misssadness,He already likes you.,0.0,0.0,0.0,0.0,0.0,0.0,0.0
975,misssadness,There is no question of that.,0.0,0.0,0.0,0.0,0.955445,0.0,0.0
975,misssadness,I actually cannot imagine anybody not liking you as you are so sweet.,0.0,0.0,0.578939,0.0,0.0,0.0,0.896155
975,misssadness,xx',0.0,0.0,0.0,0.0,0.0,0.0,0.0
976,Fairy Lucretia,b'does anyone know what happens if you have cancer and you cant have an operation to cut it out-do you definitely die?,0.0,0.0,0.0,0.726647,0.653099,0.0,0.0
976,Fairy Lucretia,xx',0.0,0.0,0.0,0.0,0.0,0.0,0.0
977,misssadness,b'Your auntie could have chemotherapy or radiotherapy and this can totally get rid of it.,0.0,0.0,0.0,0.0,0.73677,0.0,0.716301
977,misssadness,My pen pals mother has breast cancer and the therapy has got rid of it all.,0.0,0.0,0.0,0.504338,0.0,0.704642,0.0
977,misssadness,',0.0,0.0,0.0,0.0,0.0,0.0,0.0
981,Gajolene,"b'Can you break your routine to distract from the worries, do something differently today, get yourself involved in something that can take all your focus and attention Fairy?",0.0,0.637769,0.0,0.0,0.560098,0.0,0.0
981,Gajolene,It will help.',0.0,0.0,0.880435,0.0,0.0,0.0,0.0
984,blueflames,"b""I hope he will be alright.",0.0,0.0,0.0,0.0,0.0,0.0,0.91961
984,blueflames,"I will come up and take him to the vets if he needs it so don't worry about that for now xxx""",0.0,0.0,0.0,0.0,0.0,0.0,0.0
988,SomersetScorpio,"b""All will be well Lu, just you wait and see.It's natural to be worried and scared having gone through such heartbreak, but Winston will be fine and there are so many options for your Aunt.",0.0,0.822882,0.0,0.0,0.0,0.0,0.0
988,SomersetScorpio,It's easier said than done but please try not to worry too much.,0.0,0.0,0.0,0.0,0.0,0.0,0.0
988,SomersetScorpio,Worrying and anxiety makes stressy hormones go all around our bodies and leaves us feeling knackered and much worse.,0.0,0.861823,0.0,0.0,0.0,0.0,0.0
988,SomersetScorpio,"Distracting yourself or having fun doesn't mean you don't care, it's just looking after yourself which I think is very important because you are a special lady.",0.0,0.0,0.621748,0.0,0.724236,0.0,0.0
988,SomersetScorpio,"x""",0.0,0.0,0.0,0.0,0.0,0.0,0.0
994,mami5,"b'Good luck to your aunt for tomorrow Lu, hope all goes well.",0.0,0.0,0.725855,0.0,0.0,0.0,0.75152
994,mami5,xxxxx',0.0,0.0,0.0,0.0,0.0,0.0,0.0
995,blueflames,b'and he probably will.,0.0,0.0,0.0,0.528908,0.0,0.0,0.984352
995,blueflames,Try not worry xx',0.0,0.0,0.0,0.0,0.0,0.0,0.88939
997,Gajolene,b'Your still getting to know him Fairylu.,0.0,0.0,0.0,0.0,0.801827,0.0,0.0
997,Gajolene,Have you met up yet?',0.0,0.0,0.522107,0.0,0.0,0.0,0.0
1003,Gajolene,"b""Oh fairy, your cat is probably empathisizing with you being ill and with your mum being gone is grieving too.",0.0,0.0,0.0,0.60416,0.0,0.0,0.0
1003,Gajolene,Yes cats and dogs both grieve for lost owners.,0.0,0.0,0.0,0.552508,0.0,0.0,0.0
1003,Gajolene,"I've known cats that live well into their 20's when properly cared for and healthy, but if your really worried take him to the vet.""",0.0,0.0,0.0,0.0,0.74948,0.0,0.0
1004,cpuusage,b'One of our cats got to 26.,0.0,0.0,0.0,0.0,0.0,0.0,0.0
