source,date,title,description
Espn.com,2019-03-06T20:53:23Z,Royals' Perez undergoes successful TJ surgery - ESPN,"Salvador Perez, who had 27 homers and drove in 80 runs while providing a solid and calming presence behind the plate for the Royals, underwent reconstructive surgery on his right elbow."
Espn.com,2019-03-06T20:39:22Z,McIlroy -- History makes Grand Slam difficult - ESPN,Rory McIlroy can complete the career Grand Slam with a win at next month's Masters Tournament.
Packers.com,2019-03-06T19:58:59Z,FB John Kuhn retires as a Packer - Packers.com,Kuhn played nine seasons in Green Bay
Sbnation.com,2019-03-06T19:56:10Z,Jill Ellis’ USWNT is still a mess heading towards the World Cup - SB Nation,The USWNT is barreling towards the World Cup with no idea what it should look like. It’s concerning ... and yet they can still win it all.
Profootballfocus.com,2019-03-06T19:44:12Z,Landon Collins is the best off-ball linebacker entering free agency | NFL Analysis - Pro Football Focus,"Senior Analyst Mike Renner takes a look at free agent safety Landon Collins, and his potential that can be tapped by his next team."
Bleedinggreennation.com,2019-03-06T19:37:43Z,Eagles cap space update: Philadelpha has freed up over $19 million so far this week - Bleeding Green Nation,It’s Howie season.
Yahoo.com,2019-03-06T19:30:00Z,"Jamie Collins, who the Patriots traded to the Browns, cut by Cleveland - Yahoo Sports","The Browns acquired linebacker Jamie Collins in a 2016 midseason trade with New England, and cut him Wednesday."
Cbssports.com,2019-03-06T19:28:00Z,Raiders deal to stay in Oakland could apparently fall apart over one 'significant' issue - CBS Sports,The Raiders might need to find another city to play in for the 2019 season
Bleacher Report,2019-03-06T19:22:12Z,Russell Westbrook to KAT: 'Get to the F--king Playoffs' Before Speaking to Me - Bleacher Report,Russell Westbrook  unsuccessfully attempted to get under the skin of Karl-Anthony Towns and Dario Saric during the Oklahoma City Thunder's 131-120 loss to the Minnesota Timberwolves on Tuesday night...
Triblive.com,2019-03-06T19:18:02Z,Rickie Fowler paying tribute to Arnold Palmer at Bay Hill - Tarentum Valley News Dispatch,"PGA Tour player Rickie Fowler once again will personally honor the late, great Arnold Palmer this week at The King’s signature event, the Arnold Palmer Invitational at Bay Hill Club and Lodge in Orlando, Fla. Fowler will team with his sponsor, Puma, and the A…"
Deadspin.com,2019-03-06T19:13:00Z,Students Protest At Tennessee Basketball Game After School's Weak Response To Blackface Photo - Deadspin,"Around 40 or 50 students from the University of Tennessee showed up Tuesday night to the Volunteers’ men’s basketball game against Mississippi State, and protested how the school handled, or didn’t handle, a recent blackface photo involving four people all be…"
Hogshaven.com,2019-03-06T18:45:41Z,2019 NFL Mock Draft: Todd McShay keeps giving the Redskins a WR - Hogs Haven,Colt McCoy to Hollywood?
Goal.com,2019-03-06T18:32:00Z,USMNT manager Gregg Berhalter: There will be an opportunity for Efrain Alvarez with the United States national team - Goal.com,
Milehighreport.com,2019-03-06T18:18:53Z,Denver Broncos need to go after Josh Rosen to solve quarterback woes - Mile High Report,"The Denver Broncos could get a steal in Josh Rosen, but for some reason they don’t like him - but maybe they would for a third round pick."
Metsmerizedonline.com,2019-03-06T18:02:23Z,MLB News: All-Star Voting Likely To Include Election Day - metsmerizedonline.com,"Jeff Passan of ESPN reports that there appears to be an increasing likelihood that there will be a change to All-Star game voting.In replace of the current system, an Election Day will be inst"
Radio.com,2019-03-06T18:01:51Z,Bryce Harper hits simulation homer for Phillies - Sports Radio 94 WIP,"Harper hit his first home run as a Phillie today, sort of."
Cbssports.com,2019-03-06T18:01:00Z,"Champions League scores, live updates: PSG vs. Manchester United and Roma vs. Porto - CBS Sports",Two more teams will join Ajax and Tottenham by the end of Wednesday in the UCL quarterfinals
Aseaofblue.com,2019-03-06T17:33:53Z,UK Wildcats Basketball: 5 more thoughts and postgame notes from Kentucky’s win at Ole Miss - A Sea Of Blue,"That was a very good win for the Cats, and now they get ready for Senior Day."
Sbnation.com,2019-03-06T17:31:20Z,4 reasons the Rockets look like the Warriors’ biggest competitors again - SB Nation,"Houston’s season started off terribly, but they’ve bounced back well. Here’s how they became relevant again."
Newschannel5.com,2019-03-06T17:07:00Z,"News NASCAR moving Cup Series Awards to Nashville Laken Bowles 11:07 AM, Mar 06, 2019 - NewsChannel5.com",NASCAR has announced plans to move its Champion’s Week and the Monster Energy Cup Series Awards to Nashville.
The New York Times,2019-03-06T16:56:31Z,FIFA Considering Oman and Kuwait to Host Some 2022 World Cup Games - The New York Times,"FIFA’s president is seeking to expand the 2022 World Cup to 48 teams, from 32, with some matches outside Qatar as part of a broader Middle Eastern event."
Post-gazette.com,2019-03-06T16:28:00Z,"Ed Bouchette: Antonio Brown talks heat up, but why Friday deadline? - Pittsburgh Post-Gazette",
Theathletic.com,2019-03-06T16:05:26Z,"Kevin Fiala had an eventful return to Nashville, but the... - The Athletic","Kevin Fiala scored twice in his return to Nashville with the Minnesota Wild on Tuesday, his first multi-goal game this season."
Nypost.com,2019-03-06T16:00:00Z,A quieter Luis Severino tries to find bright side of shutdown - New York Post ,"TAMPA — Luis Severino believes his inflamed right rotator cuff issue can improve before the end of his two-week shutdown, but that still wouldn’t allow the Yankees’ ace to be ready for …"
Libertyballers.com,2019-03-06T16:00:00Z,Stuck in the Middle with Jimmy Butler - Liberty Ballers,"Editor’s Note: Please welcome our newest contributor at Liberty Ballers, Matthew del Rio. In recent weeks—most notably since the arrival of Tobias Harris—there has been a growing concern among P..."
Theozone.net,2019-03-06T15:56:51Z,Two-Minute Drill: Ryan Day Breaks Down Spring Practice No. 1 - The Ozone,COLUMBUS — Ohio State head coach Ryan Day spoke with reporters following the Buckeyes' first spring practice Wednesday morning. He provided some personnel updates and talked about the first day of practice. Here are the highlights of what was said.
Nba.com,2019-03-06T15:42:00Z,Blogtable: How might Bogut help Warriors? - NBA.com,"* * *

What would the addition of Andrew Bogut mean for the Warriors? 

* * *

Steve Aschburner:&nbsp;&nbsp;Bogut is a solid defender and great screen-setter, always welcome in Golden State’s"
Tennis.com,2019-03-06T15:37:40Z,Andy Murray says he's pain free after hip surgery - Baseline,The Scot says there's less than 50 percent chance he'll play singles at Wimbledon.
247sports.com,2019-03-06T15:29:56Z,Big Ten win total projections for 2019 season - 247Sports,Big Ten projected win totals for every team in 2019.
985thesportshub.com,2019-03-06T15:10:59Z,Mazz: Celtics Performance Should Inspire Hope - and Some Anger - 98.5 The Sports Hub,
Mmamania.com,2019-03-06T14:55:03Z,Audio: Hear what Robbie Lawler told Herb Dean after getting screwed in Ben Askren finish at UFC 235 - MMA Mania,UFC 235 “Thrill & Agony” video: Listen to what Robbie Lawler told referee Herb Dean following the controversial Ben Askren submission finish.
Baltimorebeatdown.com,2019-03-06T14:00:00Z,Potential replacements for safety Eric Weddle - Baltimore Beatdown,"With the release of veteran safety Eric Weddle, Baltimore now find themselves in need of a new starting free safety. Free agency begins next Wednesday, March 13, and with it comes a slew of..."
Bleacher Report,2019-03-06T13:54:06Z,An Updated Look at Every Team's Cap Situation Heading into Start of Free Agency - Bleacher Report,"Hope is a beautiful thing for an  NFL  fan, and it's what the upcoming free-agency period will bring for many. Beginning March 13, teams can officially sign new players, execute trades and otherwise improve their rosters for the 2019 season..."
Bavarianfootballworks.com,2019-03-06T13:50:00Z,Bayern Munich “irritated” with the timing and manner of Joachim Low’s roster moves - Bavarian Football Works,Bayern Munich’s CEO and sporting director questioned the timing of the news that three of the club’s veteran players were cut from the German national team.
Lowkickmma.com,2019-03-06T13:39:00Z,Gruesome Details Surface Of Matt Hughes' Alleged Domestic Abuse - LowKick MMA,Harrowing details of Matt Hughes' alleged domestic violence against his wife Audra following his June 2017 automobile accident surfaced in court documents.
Sbnation.com,2019-03-06T13:03:00Z,"Jesús take the wheel: Pochettino issued two-match touchline ban, £10k fine for confrontation with Mike Dean - Cartilage Free Captain",The FA is super dumb.
Mmafighting.com,2019-03-06T13:00:00Z,Morning Report: Anthony Johnson willing to come out of retirement to fight Jon Jones - MMA Fighting,"Anthony Johnson is willing to come out of retirement for a fight with Jon Jones, but he has one stipulation."
Turnto10.com,2019-03-06T12:47:00Z,Petition asks Gillette to remove name from Patriots' stadium - Turn to 10,"More than 13,000 people have signed an online petition asking Gillette to remove its name from the stadium in Foxborough where the New England Patriots play. The petition on Care2 asks Procter and Gamble -- Gillette's parent company -- to end ties with the Pa…"
Espn.com,2019-03-06T12:25:37Z,Olney: Expect a monster year from Red Sox's Rafael Devers - ESPN,"The champs' 22-year-old third baseman, who rose to the occasion in October, could be among baseball's biggest breakout stars in 2019."
Bigblueview.com,2019-03-06T11:50:08Z,"Giants news, 3/6: Dave Gettleman being hammered for Landon Collins decision - Big Blue View",Let’s see what others are saying about the move
Triblive.com,2019-03-06T11:31:55Z,Tim Benz: Gushing over Jake Guentzel's OT goal and what it means for Penguins - Tribune-Review,"When it comes to praising the Sidney Crosby-Evgeni Malkin-era Penguins, as a fanbase — and media corps — we can get a little … What’s the word I’m looking for? Gushy? Effusive? Flowery? Fawning? Yeah. Any of those fit. Big picture, given the franchise’s accom…"
Al.com,2019-03-06T11:29:00Z,The difference between Auburn and Alabama basketball - AL.com,The final 90 seconds on Tuesday gave us everything that is different about these two basketball teams.
Freep.com,2019-03-06T11:05:00Z,Filip Zadina shows why Detroit Red Wings were so happy to draft him - Detroit Free Press,The Detroit Red Wings drafted Filip Zadina because of his ability to score. He showed off more than than in his 4th NHL game.
Planetf1.com,2019-03-06T09:24:42Z,Five drivers who could gatecrash the podium - PlanetF1,"Ferrari look the real deal when it comes to threatening the dominance of Mercedes, but what about the more unlikely 2019 challengers?"
Thestate.com,2019-03-06T08:46:00Z,It seems UNC has a different star each week. Boston College just the latest team to find out. - The State,The North Carolina Tar Heels defeated the Boston College Eagles 79-66 behind 17 and 20 from senior forward Luke Maye.
Espn.com,2019-03-06T06:26:29Z,Rocket climbers - Houston's journey up the West standings - ESPN,"Once 14th in the conference, the Rockets have regained their place among the West's most dangerous teams."
Ljworld.com,2019-03-06T05:55:00Z,Tale of the Tait | Jayhawks in no mood for excuses after somber end to incredible Big 12 title streak - Lawrence Journal-World,"Norman, Okla. — [The streak is over][1] and as the rest of the Big 12 Conference no doubt was doing a happy dance at the expense of 14-time defending champion Kansas following Tuesday’s loss at Oklahoma, one man’s name came up that had not been mentioned in a…"
Ksl.com,2019-03-06T05:08:45Z,Jazz Gaming take Ria with first pick of NBA2K draft - KSL.com,The Utah Jazz selected Spencer
Indystar.com,2019-03-06T05:04:00Z,Minnesota fan confronts Matt Haarms as Gopher students storm court after beating Purdue - Indianapolis Star,The Minnesota Gophers fan approached Matt Haarms as students stormed the court following a win over Purdue.
Sportschatplace.com,2019-03-06T04:31:48Z,"Phoenix Suns vs. New York Knicks - 3/6/19 NBA Pick, Odds, and Prediction - Sports Chat Place",The New York Knicks and the Phoenix Suns do battle at the Talking Stick Resort Arena on Wednesday night.
Latimes.com,2019-03-06T04:10:00Z,LeBron James’ playing time next topic of concern for injury-plagued Lakers - Los Angeles Times,"LeBron James played 42 minutes in the loss to the Clippers on Monday. With the team likely out of reach of the playoffs, his minutes could decrease."
247sports.com,2019-03-06T03:59:36Z,No. 5 Vols shut down Mississippi State on Senior Night - 247Sports,"Kyle Alexander grabbed the game's first rebound. Admiral Schofield scored the first points, then went on to hit his first four shots from the floor. It was Senior Night at"
Ussoccer.com,2019-03-06T03:56:44Z,WNT Closes Out 2019 SheBelieves Cup with 1-0 Victory Against Brazil - U.S. Soccer,"The U.S. Women’s National Team closed out the 2019 SheBelieves Cup and its fifth game of the year with a 1-0 win against Brazil in front of a Tampa-record crowd of 14,009 at Raymond James Stadium. The U.S. has five domestic matches remaining before the 2019 F…"
Boston.com,2019-03-06T03:41:29Z,"Bruins Krejci scores in OT, Bruins beat Hurricanes 4-3 - Boston.com",
Rivals.com,2019-03-06T02:27:41Z,A Grand Farewell: FSU rallies for OT win against Hokies on Senior Night - Rivals.com,FSU rallies from a 14-point halftime deficit to knock off Virginia Tech and clinch the No. 4 seed in ACC tourney.
Nola.com,2019-03-06T02:10:44Z,See photos: The 55th Bourbon Street Awards costume contest on Mardi Gras in New Orleans - NOLA.com,The Bourbon Street Awards in the New Orleans French Quarter on Mardi Gras day didn't disappoint.
Care2.com,2019-03-06T01:35:20Z,Why Have 20 Horses Died at this Famous California Racetrack? - Care2.com,"In just over two months, 20 horses have died at Santa Anita Park. Nineteen suffered catastrophic injuries and were euthanized, yet the track remains open."
Nydailynews.com,2019-03-06T00:45:00Z,Headaches await ESPN's Jessica Mendoza in Mets advisory role - New York Daily News,The Mets better hope Jessica Mendoza is a better adviser than she is an ESPN analyst.
Espn.com,2019-03-06T00:11:12Z,Why Real Madrid suffered their darkest night in UCL history - ESPN,"Real Madrid's shocking loss to Ajax in the Champions League was the result of arrogance and poor player form, writes Gab Marcotti."
Grandforksherald.com,2019-03-05T23:50:00Z,Three sentenced to prison in college basketball bribery scan... - Grand Forks Herald,"Three men received federal prison sentences Tuesday for their roles in a college basketball bribery scheme, ending the first of several trials brought on by the scandal.Former Adidas executive James Gatto received nine months in prison while former Adidas con…"
Yahoo.com,2019-03-05T21:59:00Z,Kyler Murray reportedly didn't impress some teams at combine - Yahoo Sports,NFL Network's Charley Casserly said many teams had some negative things to say about Kyler Murray after the combine.
Turfshowtimes.com,2019-03-05T21:58:08Z,LA Rams release ILB Mark Barron - Turf Show Times,The Rams have decided to part ways with their leading inside linebacker.
Wdrb.com,2019-03-05T18:38:00Z,BOZICH | Who's the NCAA Tournament favorite if Zion doesn't return? - WDRB,Duke has looked vulnerable in its last four games without Zion Williamson. Who's the NCAA Tournament favorite if Zion does not return?
Yardbarker.com,2019-03-05T18:15:18Z,The '(Free) agent of change' quiz - Yardbarker,"It may have taken a little over four months to seal the deal, but the Philadelphia Phillies finally got their man. On Thursday, the Phillies and superstar free-agent right fielder Bryce Harper agreed to terms on a record 13-year/$330 million contract (whi"
Youtube.com,2019-03-05T18:00:00Z,Top Broad & Vertical Jumps | 2019 NFL Scouting Combine Highlights - NFL,The best broad and vertical jumps from the top prospects at the 2019 NFL Scouting Combine. Subscribe to NFL: http://j.mp/1L0bVBu Check out our other channels...
Yardbarker.com,2019-03-05T17:59:21Z,Steve Clifford: Magic don't expect Markelle Fultz to play this season - Yardbarker,"When the Magic acquired Markelle Fultz from the Sixers at the trade deadline last month, reports indicated that the team would be patient with the former No. 1 pick, who was diagnosed with thoracic outlet syndrome and ruled out indefinitely in December. H"
Chicagobears.com,2019-03-05T17:29:11Z,Bears release veteran linebacker Sam Acho - ChicagoBears.com,"The Bears on Tuesday released outside linebacker Sam Acho. The eight-year NFL veteran spent the past four seasons with the Bears, appearing in 51 games with 25 starts."
Nevadasportsnet.com,2019-03-05T16:04:59Z,New video sheds a little more light on Jordan Caroline-Utah State situation - Nevada Sports Net,"In yesterday's Monday Mailbag, I broke down the post-game incident at Utah State to best of my knowledge after conversations with a handful of people. Then later Monday night, a new security video of the incident was released by Utah State to KSL, a televisio…"
Abc7.com,2019-03-05T08:09:15Z,LeBron's first season in Los Angeles has become a disaster - KABC-TV,The Lakers are on the verge of missing the playoffs in LeBron James' first season in Los Angeles.
Kvrr.com,2019-03-05T00:19:56Z,"President Trump Honors FCS Champion Bison, Coach Entz ""It's been a once in a lifetime trip"" - KVRR",WASHINGTON – North Dakota State football makes its historic trip to The White House. The team was honored by President Trump for its seventh national title in the last eight seasons and there were even a few surprises thrown in. The trip was tightly scheduled…
