,date,username,post content,quoted user,post mood
0,2013-12-27 23:57:00,lostgirl19,"b""So recently i've had a few people tell me that it's possible I could have a personality disorder. I'm not really sure how to feel about it. I sort of don't really want a label, it upsets me. But having a label could help as well. I don't know. I am only 19 and really in a vulnerable state so maybe it's best I don't know for sure at the moment anyway. I just don't really know how to feel about it at the moment. It doesn't feel real.""",,Sleepy
1,2013-12-28 00:31:00,MrsMcelderry,b'I totally get what u mean ive been lablled with emotionally unstable personality disorder and it upsets me but now I can get the right help that I need it may upset u but think that in the long run it will be at ur advantage :-) xx',,Paranoid
2,2013-12-28 09:48:00,BlueGlass,"b""Got to know what the issue is before you can tackle it.  Labels don't matter, you don't have to wear a tee with it on, unless you want too.""",,None
3,2013-12-28 09:58:00,Fairy Lucretia,"b'my BPD diagnosis was helpful ,I understood more why I feel and react the way I do and I can try challenge some of my thoughts now I know what is going on with me ,if you want to talk about it message me ,BPD is often misunderstood but there is hope with this diagnosis x'",,Angelic
4,2013-12-28 11:21:00,Kerome,"b""Getting a label can be an opportunity, it's a chance to look at your story and your symptoms from another direction, and maybe recognise some things that you didn't think of as symptoms. So I wouldn't dismiss it out of hand, and it can help you get access to therapy. Maybe it's worth going with it just for that.In the long run, I think it's like a coat, you have to feel comfortable wearing it. If you really don't feel it's you, you can try to get it changed, although as I understand things doctors aren't always helpful with that. Ultimately your story and what happened to you define your condition better than any label could, and there may be some comfort in that.Hugs """,,Doh
5,2013-12-28 11:37:00,lostgirl19,"b""Thank you all. I think you're right that it can helpful but the CMHT Manager/CPN yesterday said that labels aren't that significant, it's about the treatment. As long as they know what the right treatment is for me and I stick with that then a label shouldn't really matter. But at the same time as Lu said it can help you understand yourself better to why you think and act in certain ways. I guess I am young and labels like this can be scary for me and hard for me to take. I just feel a bit overwhelmed really xx""",,Sleepy
6,2013-12-28 11:50:00,lostgirl19,"b""I feel like I don't belong anywhere. Well not in this world anyway  I am guaranteed to kill myself. It will happen it's just a matter of when.""",,Sleepy
7,2013-12-28 12:45:00,voyager,"b""I had that feeling that I didn't belong anywhere and didn't know who I was, like being in the wrong body or in a parallel universe. I feel more grounded now though. Does this sound like you in a way? xoxo""",,Angelic
8,2013-12-28 12:47:00,lostgirl19,"b""Yeah that's how it feels  Apparently that's common for people with a PD :/  xxxx""",,Sleepy
9,2013-12-28 12:51:00,voyager,"b""Well that's me too! I was told that I had some sort of a personality disorder 20 years ago by my psychiatrist. I was a little concerned at the time, but it answered a few questions I suppose xx""",,Angelic
10,2013-12-28 12:57:00,lostgirl19,b'Yeah I feel the same about it too!  it sucks xxxx',,Sleepy
11,2013-12-28 13:07:00,Kerome,"b'But the first time you get a significant label attached to you is a confusing and challenging experience for anyone, regardless of age. They\'re looking at my \'diagnosis\' at the moment as well, although I\'m hearing noises of ""well you\'re definitely not a mood disorder"". Funny, and slightly discomfiting.'",,Doh
12,2013-12-28 13:10:00,voyager,"b""In time, it got better for me, but the only med that helped was clomipramine.I also take diazepam when I'm in social stressful situations, I still need lots of sleep and do feel different to people around me. As I've got older I've just thought what the heck, it doesn't matter what people think about me, that I act the fool when possible! but am too shy sometimes! I suppose I do feel a little eccentric, people don't understand, I do feel like an observer, it's finding other people who are on my wavelength and there are others out there, lol. The job I had working in an office, I couldn't stand as I felt so trapped and anxious, the job I have now suits me because I travel to people's houses as a carer and I feel more in control. I don't like people telling me what to do and feeling trapped, I enjoy that feeling of freedom!I was very suicidal in my office jobs, it was a nightmare. I hope this helps you in some way, perhaps you can relate to some of it. I think you are still finding yourself, I certainly was at your age I like your new avatar by the way, love eeyore! xox""",lostgirl19,Angelic
13,2013-12-28 13:20:00,lostgirl19,"b""Thank you both  it's good to know that there is some hope even if I can't really see that atm xx""",,Sleepy
14,2013-12-28 13:22:00,voyager,b'I nearly got myself one of these!image.jpg',,Angelic
15,2013-12-28 13:23:00,lostgirl19,"b""I want one now! Lol so cute!I might be seeing the nurse today. She's meant to be calling me within the next hour. I don't know what to say to her :/ xx""",,Sleepy
16,2013-12-28 13:27:00,voyager,"b""I think you should get one, look on line and see what there is, I think you deserve one, I do!!!How are you feeling at the moment, are you worried about anything? Just think there's no pressure, you are the one in control, it's what you feel you need sweetie?""",lostgirl19,Angelic
17,2013-12-28 15:46:00,lostgirl19,"b""I got some random nurse who just spoke to me for ages and pretty much threatened to tell my parents/hospitalise me. Sick of this. Why does it have to be so up and down with them. I can't stand this any longer :'(""",,Sleepy
18,2013-12-28 15:55:00,voyager,"b""I don't know how to put this, but it's up to you, what you feel is best for you, but at the same time she was probably very concerned for you and thought your parents needed telling to help you I would think sweetie. Xox""",lostgirl19,Angelic
19,2013-12-28 15:57:00,lostgirl19,"b""I just hate it when people promise me things and don't stick to them. I don't understand why they do this to me. Thanks I know they don't mean it in a horrible way but when they say things like that it upsets me and makes me feel like I obviously can't trust these people. xx""",,Sleepy
20,2013-12-28 16:03:00,voyager,"b'I know what you mean, they are just human beings like the rest of us, but if they make promises, they should stick to them xox'",lostgirl19,Angelic
21,2013-12-28 16:05:00,voyager,"b""Yes. Them making threats to do things, when you don't want them to, is not what you need, I can see that lovey, I'd feel the same way as you, it's the last thing you need! xox""",,Angelic
22,2013-12-28 16:15:00,MrsMcelderry,"b'Lost, i totally get what u mean the SWIDS team kept saying we will have to tell ur parents so they can support u, i cry and scream at them to tell them not to its like they want to put u in a state so they have no choice but to tell them if that makes sense... hope ur okaii sweetie? <3'",,Paranoid
23,2013-12-28 16:22:00,lostgirl19,"b'Thanks V yeah I could really do without it. My care coordinator was meant to be calling and seeing me today. That\'s why i\'m upset. They realise consistency is key with me and she said I would be seeing her every visit unless she has a day off but that she was calling me today with the probability that she would see me. And I get this other nurse (who was okay but not the same) who didn\'t even explain what was going on when she called. Not even ""I\'m sorry ... didn\'t call like she was supposed to, i\'m calling instead because..."" nothing like that.Thanks MrsMcelderry for understanding it\'s horrible isn\'t it. I\'m not in a good place at all, I didn\'t get a visit like I probably needed to but if my care coordinator had called I would have done. I just hate all this uncertainty.xx'",,Sleepy
24,2013-12-28 16:25:00,lostgirl19,"b""At the end of the call when she said about speaking to my parents and hospital, she said she would discuss our conversation with the rest of the team. I don't know what that's meant to mean or what's likely to happen. I'm in such a panic.""",,Sleepy
25,2013-12-28 16:30:00,Tiddle,"b""Hope you are feeling ok? As you are 19 and legally an adult I don't think they can just tell your parents if you request that they don't. They are not allowed to discuss your care other than with those involved. Obviously they can decide that hospital would be best but even then a cpn can't do this without a mental health assessment by someone in the position to do so. Hospital is normally the last resort first off they would offer you the home treatment team. Hope this helps with some of your fears.""",,None
26,2013-12-28 16:31:00,MrsMcelderry,"b'It is horrible it really is i know... i wish i could contact my care co-ordinator out of work hours and weekend instead i get the SWIDS team haha.Lost, Calm down sweet please, All that means is that she needs to talk to her collegues on what she should do next and what is the best support and help she can do for you coz she doesnt want to say the wrong things and upset u more, they all talk with each other and she will contact u and have a good talk with u. can i ask are u above age 18? xx'",,Paranoid
27,2013-12-28 16:33:00,lostgirl19,"b'Thanks Tiddle not feeling great at the moment I feel like i\'m back at square one again which is a shame as yesterday\'s appt was much more positive and I felt a bit calmer and relieved. I have been under home treatment for a few weeks already. And for ages people have wanted me in hospital but as my CPN from CMHT said ""I knew you would charm your way out of being sectioned when you had the mental health act assessment"" so i\'ve been very lucky but people still want me to be in hospital it seems. It just really upsets me. Yeah that\'s what I thought i\'m 19 so surely it\'s up to me if my parents know how bad i\'m feeling or not but I suppose the fact I live with them might change things a bit. I just hope that when she tells the rest of the team that nothing bad happens :/ Things like this make me feel like disengaging which I know is wrong but I just hate all this up and down constantly with them.'",,Sleepy
28,2013-12-28 16:34:00,lostgirl19,"b""Thanks Mrs M. What's SWIDS? I'm 19. I hope that's all it is xx""",,Sleepy
29,2013-12-28 16:35:00,voyager,"b'I bet you wish that this nurse had never turned upsometimes although meaning well, they can leave us feeling worse than before! xoxoxoxoxox'",lostgirl19,Angelic
30,2013-12-28 16:37:00,lostgirl19,"b""It was only on the phone V! Yeah that's partly why I struggle to trust the services cause I feel like often they can make me feel worse. She wasn't horrible she was quite nice but some of the things she said about hospital etc and the way she never even explained why my care coordinator hadn't rang to arrange a visit to see me today upset me and unsettled me too. It's like I want to protect myself from the services by disengaging :/ xxxxxxxx""",,Sleepy
31,2013-12-28 16:42:00,Tiddle,"b""Living with your parents still shouldn't make a difference. I was the same I didn't want my family to know of my involvement with mental health services and they have had to stick to that - no post sent home, no phoning house, no visits and to be fair they have respected my wishes. I think you will be ok but if you are feeling really really bad then listen to what they can offer you as it may help. If you have a good relationship with your parents why not give them a chance to support you - family can help a lot if the relationship is good. I wasn't so lucky""",,None
32,2013-12-28 16:43:00,MrsMcelderry,"b'it stands for something but not sure what its like the crisis team tbf, well as ur 19 they cant tell ur parents without ur consent and if they do they can be in serious trouble for it.. xxx'",lostgirl19,Paranoid
33,2013-12-28 16:45:00,lostgirl19,"b""They have disrespected my wishes at times that's the problem. My living situation with family is very complicated and they know that and understand that thankfully but still there have been times when they've gone against my wishes. :/""",,Sleepy
34,2013-12-28 16:48:00,voyager,"b'Sometimes they may not know you as much as they probably should about you, that\'s why continuity is important. They are dealing with sensitive issues!They should be more aware I think, just how vulnerable we can be, not everyone has felt suicidal or very depressed, even ""so called""MH professionals, have had training, but haven\'t had first hand experience! They also see many people each day, so I suppose they become a little blas\xc3\xa9 about it. I\'m sure they care however,But only you truely knows what is going on inside your head. '",,Angelic
35,2013-12-28 16:50:00,lostgirl19,"b""I agree! But one minute they promise me certain things and put a proper plan in place the next it all goes to pot, well that's how it feels anyway. Don't get it. I can't cope with all the ups and downs with them. I'm better off without them. I can't take it it just upsets me more """,,Sleepy
36,2013-12-28 19:52:00,lostgirl19,"b""Maybe i'm overreacting. I'm so stupid.""",,Sleepy
37,2013-12-28 19:54:00,MrsMcelderry,"b'Lost, u are not overreacting at all its completely understandable why ur feeling like this.. xx'",,Paranoid
38,2013-12-28 19:57:00,lostgirl19,b'To the point where I want to discharge myself? Is that reasonable? :/ xx',,Sleepy
39,2013-12-28 20:01:00,MrsMcelderry,b'yes coz ur scared which is understandable xx',,Paranoid
40,2013-12-28 20:02:00,lostgirl19,"b""I don't understand why i'm scared though xx""",,Sleepy
41,2013-12-28 20:13:00,MrsMcelderry,"b'its alsorts of things, u wont understand it all straight away, but please dont discharge urself xx'",,Paranoid
42,2013-12-28 20:14:00,BlueGlass,"b""Being scared isn't always logical. Am sure being under their care will be helping even if you can't feel the benefit right now.Hugsxxx""",,None
43,2013-12-28 20:15:00,MrsMcelderry,"b'im gunna shut up now, im not helping im making things worse sorry LostGirl.. xx'",,Paranoid
44,2013-12-28 20:15:00,lostgirl19,"b""Thank you. I just feel like they never stick to their word. They always do something to upset me or let me down or unsettle me in some way and I can never cope with it. I can't afford to feel worse than I already do """,,Sleepy
45,2013-12-28 20:16:00,lostgirl19,"b""How are you making things worse? You aren't at all! xx""",,Sleepy
46,2013-12-28 21:21:00,lostgirl19,"b""I am impossible to help. I'm useless. I obviously do have to kill myself. There's no other way.""",,Sleepy
47,2013-12-28 22:06:00,lostgirl19,"b""Discharging myself. I've had enough. Can't do this anymore. And everyone hates me. I am better off dead.""",,Sleepy
48,2013-12-29 00:38:00,lostgirl19,"b""Who cares I don't think I even care anymore just ready to die I need peace""",,Sleepy
49,2013-12-29 00:50:00,voyager,"b""I care, I think nights are you're worst time aren't they, don't let this nurse bother you with what she said today honey  xx""",lostgirl19,Angelic
50,2013-12-29 01:33:00,Gajolene,"b""lost girl theres a reason you are telling yourself these things that are not true, depression sucks us down into a deep hole and we feel like theres no way to climb out once we're in. What your doing is called negative self-talk . The reasons you are doing this and how long you've been doing this I don't know but I can tell you, you won't always feel this way, you can learn to stop believing these things, and telling yourself these things. I know because I was caught in a cycle of negative self talk myself from as early a 4 yrs old, I felt no-one would ever love me and that somehow I was bad, ugly and so on, wishing I was dead, feeling empty or crying for no reason other than I made myself sad by saying and believing these things to myself. I did this for years always wondering but not knowing why or how to fix it. Often doing it without even realizing it. I thought everyone hated me, I hid from people, and family, was scared to ask teachers for help because I thought I would get picked on and people would think I was stupid. I had no friends because I was just too scared to try. I did this well into my twenties and like you had no idea how to change it. But there is hope hun.The same way you learned to hate yourself and talk bad about yourself you can change, this may sound silly but try picturing yourself as a little girl locked away cold and alone for such a long time up inside in a dark room in the corner of your mind. Imagine yourself opening that door letting out that little girl out. Imagine hugging her and holding her and putting her beside your heart where its not dark but there is a warm red glow, safe and secure. Think of that little girl as you, then make a promise to her. Tell her she is beautiful, that she doesn't have to be afraid, that you will keep her safe. Imagine your little girl getting mad, really mad and let her scream it out in your mind all the things she wants to say, all the people she is really mad at instead of you, let her scream, let her cry out loud and the whole time tell her its OK you are there for her, you love her. Tell her she has a right to get angry and to be sad and more importantly tell her she can be happy and you will protect her. It may sound really silly but I did this and I vowed to myself that I would never put that girl back in the dark closet in my mind again, that I would carry her in my heart always showing her how beautiful, and strong, and important she was, I would tell her how brave she was to be in that dark place all those years and still be able to come out, I would tell her she was worthy of respect and value, that she never had to be scared to speak up again and I was setting her free. I realized that little girl was me.It may sound silly but believe me when I realized that little girl in my heart was me, I realized I really did deserve all those things too.. I started asking for help, I found a counsellor I could trust and I took CBT and RBT courses to learn how to change, I joined a forum like this where I could find people like me, who wouldn't judge me that I could talk to freely without fear and I learned how I could think about myself in a good way, The more I learned the stronger and prouder of myself I became, I didn't care what other people thought about me anymore and I started to become confident about myself and to let myself be happy, and to know I deserved to be happy. That I didn't have to be afraid to speak my mind.I needed pills for the first while to help me but I didn't need them forever, I eventually became strong enough to do it myself without pills.You deserve to be happy and feel strong and beautiful, don't let anyone tell you different including yourself. I hope you realize how brave you were to go into hospital and try to get help, to reach out, maybe your little girl is reaching out for you too hun. You take care of her, you promise to take good care of her so she can become the beautiful, strong, courageous young woman you are. This really did work for me, but it took me untill I was almost 30 to figure it out by myself, I had no support. You have already taken the first steps, you reached out here and you sought medical help as well. You may have a friend you can trust or a family member you can reach out to. If your scared hold you little girls hand and give the strength. Sorry this is so long but I hope you can try this and make that choice to get healthy and happy no matter how hard you have to work for it.Huge hugs for you, hope your feeling better tommorrow lost girl""",,Lurking
51,2013-12-29 17:27:00,lostgirl19,"b""Thanks so much for your messages. I've been in a real state and it was so nice to get such lovely messages through. Thank you V, I do definitely struggle a bit more at evenings. I feel so frustrated that i've had to discharge myself but I think it was for the best. I have to protect myself. I can't be made to feel worse.Thank you Gajolene I can relate to a lot of what you have said. Thanks so much. I guess i'm just very weak atm and useless. I hope I get to the place that you did someday xxxx""",,Sleepy
52,2013-12-29 17:44:00,lostgirl19,"b""This is it for me though now i've messed up big time I will be dead soon i'm certain of it""",,Sleepy
53,2013-12-29 17:52:00,BlueGlass,b'Why do you think you have messed it up? Are you regretting getting discharged? You have control over whether you die or not. So keep alive. xxxxx',,None
54,2013-12-29 17:55:00,lostgirl19,"b""Hi BlueGlass thanks for your reply, not really no I saw no other option. But it's made me feel very stuck and like I can't see my GP Tuesday and I can't see CMHT tomorrow. Thanks I know it's silly but I feel out of control.xxxx""",,Sleepy
55,2013-12-29 18:05:00,BlueGlass,b'Am sure it was the right decision as you know you best. It is not silly at all. Keep yourself safe. When can you next see someone?xxxxx',,None
56,2013-12-29 18:08:00,lostgirl19,"b""Thanks BG. Meant to see GP Tuesday which I think i'll have to cancel. And i'm meant to be going to a housing appt tomorrow with the CMHT manager but think i'll have to cancel that too. And I don't know how to keep myself safe. I have no strength left.  :'( xxxx""",,Sleepy
57,2013-12-29 18:13:00,Kerome,"b""You do have control you know lost. You're obviously still going through a difficult time, but you'll arrive at a point sometime when you realise you have options, things will steady and you'll be out the other side. I really liked Gajolenes post about negative self talk, it's worth re-reading """,,Doh
58,2013-12-29 18:14:00,BlueGlass,"b""I think you are very strong, you just don't know it. You really need to go to these apps. Yes it may be really hard but you need to force yourself as it will help you in the long term. If you don't go to the apps soon you will just be feeling very low for longer. You need to get out of your house, as you say it is a bad environment for your recovery and seeing the doc always makes you feel better. Push yourself, it will be worth a million fold in the end. xxxxx""",,None
59,2013-12-29 18:22:00,deadchick07,"b'why are you cancelling these appointments? You are merely sabotaging any positivity there may be for you in your future? You are also risking being discharged from everything if you keep proving you dont want or need the input. Please keep the appointments, they are for your benefit x'",,Tired
60,2013-12-29 18:44:00,lostgirl19,"b""thanks for all your kind words but i'm very weak at the moment I obviously don't want a life and therefore don't deserve one as for services well i may as well have never been under them""",,Sleepy
61,2013-12-29 18:55:00,Kerome,"b""If you're feeling weak, then perhaps you should look into what makes you feel stronger? You can't go on cancelling the appointments when they are your route out of a bad living situation, to more independence and help from services? Maybe I'm not understanding but I thought that was what you wanted? Building a little strength seems like a good thing to do.""",,Doh
62,2013-12-29 18:59:00,MarlieeB,"b""Ok LG. You have discharged yourself so lets try to figure out something to keep you safe yeah In regards of the housing, do you feel it will make you feel better moving? I know its differcult living with your parents, trust me i know how hard it is, upto a couple of months ago i was with mine, sucks doesn't it. If you feel you will get better and trust me you WILL you need to go to that appointment. You should in my opinion go to your GP's appointment. She's a lovely supportive GP from what you have said so please, please go there with her.If i could i would go with you and i really mean that. There are so many people on here who care for you and we all want to support you the best we can but we can only do so much (not meant to be a dig or make you feel bad)Please, please stay safe hunnySarah xxx""",,Sad
63,2013-12-29 19:30:00,voyager,"b""(((((((Lost Girl))))))) I'm still here for you lovey, I can see where you're coming from with wanting to be discharged from services, so you can stop worrying about what you need to say to them and put your energies into making life better for yourself!You are stronger than you think Lost Girl, I know you are sweetie!!oxoxoxoxo""",,Angelic
64,2013-12-29 19:53:00,MarlieeB,b'How are you feeling now hunny? Xxx',,Sad
65,2013-12-29 22:27:00,lostgirl19,"b""Thank you all. Thought i'd get an early night tonight so I went to sleep early. Not long woke up though and I just feel awful.  i'm scared. I want this all to end. Now. I just can't keep fighting anymore and no one understands me and i'm just not meant to be in this world. I have messed up yet again. Thing is I don't even regret it I feel like I had to do it but other people won't see it like that. I have nothing and no one now.""",,Sleepy
66,2013-12-29 22:39:00,lostgirl19,"b""I think I have to give in it's the only way I need my head to shut up""",,Sleepy
67,2013-12-29 23:01:00,lostgirl19,"b""I don't want to wake up tomorrow :'(""",,Sleepy
68,2013-12-29 23:46:00,lostgirl19,"b""lost cause that's all I am everyone else knows that too only way out for me is to die need proper plans that will work this time just really didn't want it to have to be this way but it does no other way""",,Sleepy
69,2013-12-29 23:52:00,BlueGlass,"b'You are not a lost cause at all, you have all these opportunities this week with moving house. So why not see how you feel when you have moved?xxx'",,None
