,date,username,post content,quoted user,post mood
654,2014-01-13 15:25:00,Reach,"b""I am really confused by you lost, i don't understand why you wont grab anything they offer you, because it is not nice feeling the way you feel, and the risk to your life. Even a small overdose could kill you and don't say that that is the point because it isn't fair for you to say things like that to us when we don'tknow you and cannot do anything but write on a forum. It stresses me everytime you say that.I'm sorry the meeting was so stressful. For me it seems the main stress for you is the GP, waiting for their answer, and the flat decision having to be made tomorrow. I hope you have rung the GP today for their final answer then you won't have to keep worrying about this. I don't understand why you haven't got your team to contact the GP practice and urge them to keep you on their books even if you move, like others on this forum said happened for them. I don't understand why you are not calling them every morning to get this sorted to make things easier for yourself.""",,Amazed
655,2014-01-13 15:30:00,tabbykitten,"b""I agree with Reach on this one. You should be using the community team to help you with this sort of stuff.Don't just say they are useless, you really haven't given them a chance have you""",,Doh
656,2014-01-13 15:44:00,lostgirl19,b'No BG about to now :/  xxxx',,Sleepy
657,2014-01-13 19:41:00,Reach,"b""Was it bad news? I'm so sorry if it was but atleast you know what the deal is now and what to tell the council about your flat, that you need one within the same area for your GP. There is nothing wrong with wanting to keep your GP.""",,Amazed
658,2014-01-14 14:39:00,voyager,b'Play On - Carrie Underwood',,Angelic
659,2014-01-14 14:40:00,lostgirl19,b'I love this song! Thank you V  xx',,Sleepy
660,2014-01-14 14:44:00,Reach,b'Was worried you had hurt yourself lost. Glad to see you are okay.',,Amazed
661,2014-01-14 14:47:00,lostgirl19,b'Thank you x',,Sleepy
662,2014-01-14 14:54:00,tabbykitten,b'Did you manage to make a decision about the flat?',,Doh
663,2014-01-14 15:45:00,lostgirl19,"b""I didn't take it x""",,Sleepy
664,2014-01-14 15:48:00,Reach,b'Are you relieved about that?',,Amazed
665,2014-01-14 15:50:00,lostgirl19,b'Yeah I am x',,Sleepy
666,2014-01-14 15:52:00,Reach,"b'Stress is not good for the brain, it always makes me suicidal/self harm too.'",,Amazed
667,2014-01-14 16:11:00,tabbykitten,b'Think you have made the right decision. Too much to cope with at the moment.Have you let your GP practice know?',,Doh
668,2014-01-14 16:23:00,Kerome,"b""Ultimately it's your decision, so that's fine, no need to feel bad about it But I'd also present the opposite view... Sometimes taking a leap into the unknown can be a really good thing, it can energise you, present new possibilities, refresh you and keep you too busy to think about other difficulties. Something to think about for the next opportunity that presents itself.""",lostgirl19,Doh
669,2014-01-14 19:04:00,lostgirl19,"b""Yeah I let the GP know, she called me back and told me they wouldn't have been able to take me she said she did try but it was the decision of other partners and the practice manager too. So that is even more reason that I made the right decision about the flat....thanks. I feel so awful I just cant take it atm""",,Sleepy
670,2014-01-14 19:09:00,Reach,"b""I'm glad she said that.Why do you feel awful? Because you lost the flat or because of the depression? It is a shame you cannot engage with your CMHT more, talk to them. On here you don't talk very much though so i can see you find it hard to be open. I don't have a problem with it unfortunately/fortunately  I'm far too open sometimes. When i was very depressed i was practically mute though so it could be your mood.""",,Amazed
671,2014-01-14 19:25:00,tabbykitten,"b""Don't feel awful. You have managed to make an important decision ( and I think it is the right one). More important at the moment that you have the support of a GP you feel safe with.If the housing people know why you have made the decision then they will be able to look at better options for you in the future. You could still do a bit of planning towards what you will buy for your flat as you will no doubt get one eventually.""",,Doh
672,2014-01-14 19:44:00,lostgirl19,"b""Thanks guys.I feel awful because of everything that's been going on. The flat is not really the thing that's bugging me now, as I know I made the right decision, although I would like to move out soon. It's just everything that went on yesterday and living in fear of getting sectioned and feeling like I can't trust anyone anymore. I just spoke to my GP and I could have been a bit more honest with her, but she said I can see her on Thursday but I feel bad as she's the duty doctor so I'd have to get an urgent appt although she did tell me to do that and said that was fine it feels wrong. I feel I need to see her but I feel ashamed that I have been struggling to engage in the last week and I am worried she will tell me I need admission too. Then I found out my friend from school died last night, and me and friends are going to put flowers down on Saturday. It's been so emotional and I can't help but feel like why her, why not me I should be the one that's dead.Sorry end of rant I probably shouldn't be posting on here anymore, I am sick of myself so other people must be too""",,Sleepy
673,2014-01-14 20:03:00,Gajolene,"b""Ohh lost so so sorry about your friend? Don't worry about only trusting one doctor, a lot of us go through that. Write out what you can't say in words for her/him for Thursday. At least you'll have friends around you it is so good to get out and not isolate yourself even if it's for a little while. I could'nt make eye contact with men or with people in authority when I was younger and in my 20's, I was an extreamly hypersensitive person. Doctors and dentists scared me really bad. I ended up with a good female doctor that could relate to me more, over time I was able to trust her to speak openly and without worry, I had her for 15 years. She has books of stuff I had to write down because I was to anxious to talk about it in the open. I miss her she moved away about 5 years ago now.""",,Lurking
674,2014-01-14 20:10:00,lostgirl19,"b""Thank you G, I may do I just find it so embarrassing and a bit scary but I do trust her more than anyone. She has told me to call in Thursday if I need her for an on the day appt as she is duty dr so she cant book any appts for that day but I feel bad doing that. Then I question do I actually need to see her, will it be a waste of her time, what can she actually do etc...so I don't know what to do about Thursday but she will be away for two weeks so that's probably another reason why I should go. I'm not sure what to say if I do go though either.Thanks me and friends are going to lay flowers on Saturday, am dreading it.I know exactly what you mean I feel like that I was like that even with GPs up until I met mine a couple of years ago but i'm still like it with psychiatrists and some other professionals who tend to be older men. I probably just need to grow up!Thank you for understanding  xx""",,Sleepy
675,2014-01-14 22:04:00,lostgirl19,"b""I don't know how to cope. Can't take all this.""",,Sleepy
676,2014-01-14 22:14:00,BlueGlass,b'Hugs and strength  You can get through this. xxx',,None
677,2014-01-14 22:31:00,voyager,b'I feel for you Lost.......oxo',,Angelic
678,2014-01-14 23:03:00,lostgirl19,"b""Thank you. Just hoping I don't get sectioned. And hoping tomorrow is a better day.  xx""",,Sleepy
679,2014-01-14 23:06:00,tabbykitten,"b'Sorry about your friend Lost. Really keep fighting petal and use any help you can, either on here or with the professionals. I would have thought that if you worked with them, there was less chance of you being sectioned'",,Doh
680,2014-01-14 23:08:00,lostgirl19,b'Thank you Tabby. Yeah I hope so. Just struggling to find any fight in me atm x',,Sleepy
681,2014-01-14 23:11:00,tabbykitten,"b""You've managed to do so much in the last couple of days though. Keep using your community support (remember you agreed to do that) and to see your GP. I'm off to bed now petal but will chat again tomorrow.""",,Doh
682,2014-01-14 23:17:00,lostgirl19,b'Thank you  I will try. Night x',,Sleepy
683,2014-01-15 12:50:00,lostgirl19,"b""Don't know what to do with myself so fed up""",,Sleepy
684,2014-01-15 12:55:00,BlueGlass,b'What about watch some comedy? ',,None
685,2014-01-15 12:57:00,lostgirl19,"b""Thanks I'm watching some Gossip Girl just cant stop thinking about stuff. I'm wondering if Monday was just all talk and threats :/ xx""",,Sleepy
686,2014-01-15 13:03:00,tabbykitten,"b'Hi Lost.Try not to get in too much of a panic about things. If your mind starts to fix on something, say a firm ""stop"" to yourself as this can sometimes help.Have you talked to your support people today?'",,Doh
687,2014-01-15 13:08:00,lostgirl19,"b""Hi tabby thanks I will try to. No I haven't they haven't got back to me. Must have been all talk on Monday so I'm quite relieved x """,,Sleepy
688,2014-01-15 13:14:00,tabbykitten,"b""Thought they were supposed to be keeping in touch as that was part of the agreement? Oh well. Don't struggle to cope without them though.Don't know if it is the weather or time of year but I am struggling a bit at the moment too. Coping with the depression/anxiety with the tablets (only St John's Wort now - yippee) but feel too tired to do anything very much.""",,Doh
689,2014-01-15 13:22:00,lostgirl19,b'Yeah they were! What a load of crap! Oh well. Makes no difference to me anyway.Sorry to hear that  I hope u are feeling better soon xx',,Sleepy
690,2014-01-15 13:46:00,Reach,"b""I understand that it may seem like they cannnot do anything, the GP, the CMHT, but it is more about having that listening ear, that bit of interaction with a professional who cares, just a chat, it keeps you going, gives you something to do, gives you an outlet and space to talk to someone. It's not about what they can do but just about being with someone so keep using it and don't feel guilty, you have just as much right to that appointment as anyone else, the other people just have ear infections and bad backs, some will be depressed too, you are struggling and have a right to that appointment even if she is on duty, especially as you have two weeks without her support.""",,Amazed
691,2014-01-15 13:48:00,lostgirl19,"b""Thanks Reach, I guess so and I guess she wouldn't tell me to do that if she didn't mean it. I am just not really sure what to say to her and I don't know how honest I can be with her as I don't particularly want her passing things onto CMHT or anyone at the moment. :/""",,Sleepy
692,2014-01-15 13:57:00,Reach,"b""I think the only things she would pass on would be if you were very suicidal or if you had harmed yourself, even sometimes they don't pass those things on. As long as she knows you are engaging with CMHT there will be no need for her to pass it on because she will believe they already know. Just sit down and talk about how you feel, and what you are struggling with.""",,Amazed
693,2014-01-15 14:02:00,lostgirl19,b'I see what you mean. So yeah I guess it is quite likely she will contact them if I see her and am honest :/',,Sleepy
694,2014-01-15 15:01:00,Reach,"b""Not necessarily, not many professionals get stressed about self harm and isn't it for you more about self harm and suicidal thoughts rather than actuall suicide. I used to admit to suicidal thoughts to the psychiatrist sometimes and he wouldn't do a thing, and the GP asked once and i told him and he said well that is your choice, and did nothing. Many professionals aren't too bothered by it as it is so common, unless your GP is prone to panic. It is only when they think there is serious risk to life that they will act, unless they are the panicking type and don't understand the difference between suicidal thoughts and self harm, and suicide itself. There is a huge difference between thoughts and actions, self harm and suicide.""",,Amazed
695,2014-01-15 15:08:00,lostgirl19,"b"" Yeah I know what you mean but I am seen as a high risk of suicide so I think that's why she would.""",,Sleepy
696,2014-01-15 15:37:00,Reach,"b""But you have been talking about suicide for a long time and are still alive. I know that that doesn't lessen your distress, and you are still deserving of help and for people to worry about you, but that stands for something, that you haven't done it yet, that means they will think you are just struggling with thoughts and not as likely to do anything. It doesn't lessen how bad you feel and how much you want to die, it just means you can handle the thoughts and have the strength to deal with them, that you obviously want to live. That is what the professionals will see, that you will probably be okay and they won't panic as much when you tell them you want to die, because you want to die alot and don't act on it because you are strong enough not to.""",,Amazed
697,2014-01-15 19:53:00,lostgirl19,"b""I guess so. They haven't made it sound like that but oh well.""",,Sleepy
698,2014-01-15 20:01:00,Reach,"b'If you are a high risk of suicide, and the GP tells the CMHT something in order to help keep you safe, there is nothing wrong with that. It is good that the CMHT know surely. If they ask you to go to hospital then that is a good thing as it is to keep you safe.'",,Amazed
699,2014-01-15 20:03:00,lostgirl19,"b""I don't care if i'm kept safe or not though and I don't trust CMHT/CRHT. I'd rather suffer on my own at the moment. They don't understand.""",,Sleepy
700,2014-01-15 20:08:00,BlueGlass,b'No one can understand how you are feeling unless you talk to them. xxx',,None
701,2014-01-15 20:09:00,lostgirl19,"b""They don't though even when I do talk to them. I'm a lost cause xx""",,Sleepy
702,2014-01-15 20:11:00,BlueGlass,b'You are not a lost cause at all.  Have you asked anyone about when you can get therapy?',,None
703,2014-01-15 20:12:00,lostgirl19,"b""Thanks  i'm not so sure...no I haven't. Not sure whether to see my doctor tomorrow or not. Not sure what the point is. But I do want to see her and see what she thinks especially as shes going to be away for a few weeks but I dont know if it would be a waste of her time xx""",,Sleepy
704,2014-01-15 20:14:00,BlueGlass,"b'It is not a waste of her time at all, you should go see her for a chat. '",,None
705,2014-01-15 20:15:00,lostgirl19,"b""I'll try just hope she doesn't contact CMHT as i'm still calming down from Monday! xx""",,Sleepy
706,2014-01-15 20:16:00,catkin,"b""Really? I think you didn't take a flat that you liked because you wanted to keep your GP? That sounds as though you do care and you do want to be taken care of and be safe? You are posting how hard things are but you are getting through somehow, there must be something that keeps you going, maybe that's what those who are supporting you see? x""",lostgirl19,Sad
707,2014-01-15 20:19:00,lostgirl19,"b""Well it was partly for that reason but partly cause I wanted to be in a certain area in town as it would be a lot easier to get around and i'd be less isolated. At the moment I have kind of given up. I guess so x""",,Sleepy
708,2014-01-15 20:22:00,Reach,b'Just wanted to say goodbye lost as i am leaving the forum now. I hope things get better for you soon.',,Amazed
709,2014-01-15 20:23:00,lostgirl19,b'Reach have I done something wrong? ',,Sleepy
710,2014-01-15 20:24:00,BlueGlass,"b""Are you leaving permanently Reach? Please don't """,Reach,None
711,2014-01-15 20:25:00,lostgirl19,"b""Please don't leave Reach. I'm sorry if I have said something that upset you I wouldn't have meant it  thank you for all you support lately it means a lot x""",,Sleepy
712,2014-01-15 20:38:00,Reach,"b""Sorry hunny it isn't you, a row broke out on another thread and it upset me. I'm going to sleep on it now so might talk again.""",,Amazed
713,2014-01-15 20:39:00,lostgirl19,b'I am sorry that it upset you  Hope you feel better tomorrow. Try not to let it get to you  xx',,Sleepy
714,2014-01-15 23:01:00,lostgirl19,"b""I feel like self harming. I'm not sure if I want to stop myself or not. I just don't know anything anymore. I'm not sure I care anymore. I don't know how to carry on stopping myself.""",,Sleepy
715,2014-01-15 23:34:00,voyager,"b'This is your worst time, I know, can you maybe get a shower and then try and get a rest or some sleep Take care sweetie xox'",,Angelic
716,2014-01-15 23:40:00,lostgirl19,"b""Thanks V. I will try to get some sleep soon, just dwelling on things and just don't know who to turn to at the moment.  xxxx""",,Sleepy
717,2014-01-16 10:25:00,lostgirl19,b'Sitting in the drs wondering what to say :/',,Sleepy
718,2014-01-16 11:16:00,tabbykitten,"b""Guess you've seen the GP by now, hope you managed to say just a bit about how rough you feel""",,Doh
719,2014-01-16 13:19:00,lostgirl19,"b""Thanks yeah I wish I hadnt now clearly can't trust anyone""",,Sleepy
720,2014-01-16 13:29:00,tabbykitten,"b""Build up your trust a little bit at a time. You must have some trust in your GP, otherwise you wouldn't have been so concerned about having to change practices""",,Doh
721,2014-01-16 13:31:00,lostgirl19,"b""I don't think I can trust her anymore. She did what I feared.""",,Sleepy
722,2014-01-16 13:39:00,tabbykitten,"b""OK, but whatever it was you feared was a result of your mental state and not the actual skill and trustworthiness of the GP. Your are scared of any decision being made on your behalf but that doesn't mean the decision is wrong.Quite hard to explain what I mean but hope it makes some sort of sense for you.""",,Doh
723,2014-01-16 14:12:00,lostgirl19,"b""Yeah I see what you mean. Im on my own now. I've got to find a way to sort my own life out without professional people involved.""",,Sleepy
724,2014-01-16 14:43:00,Gajolene,"b""What is it that she/he did that upset you? What did you hope for her too say? I have an appointment today too in an hour with my councillor, feeling pretty blah and negative about it, but I'm going anyway, hoping it goes well.""",,Lurking
725,2014-01-16 14:44:00,BlueGlass,b'Why are you on your own? Did she send you for the assessment?xxx',,None
726,2014-01-16 14:48:00,tabbykitten,"b""Don't understand that Lost. I thought the whole idea was that you had agreed to work with the community health team.""",,Doh
727,2014-01-16 15:55:00,lostgirl19,"b""She wants me in hospital. CMHT want me in hospital. Crisis Team want me in hospital. Mental Health Act Assessment today or tomorrow. FML no one understands :'(""",,Sleepy
728,2014-01-16 15:59:00,BlueGlass,"b""(((Lost))) Am sorry that it hasn't gone the way you want, but I think it is for the best as you have been feeling so low for so long and nothing you have tried up to now has helped. xxx""",,None
729,2014-01-16 16:00:00,lostgirl19,"b""Thanks BG. Am going to try and charm my way out of it somehow :/ all my trust for anyone has gone. I wish I hadn't seen my GP earlier. xxxx""",,Sleepy
730,2014-01-16 16:00:00,messymoo,"b""I'm sorry lost  xxx""",,None
731,2014-01-16 16:01:00,lostgirl19,"b""Thank you Messy. I'm scared. I really hope it doesn't happen. It will send me even more loony!  xxxx""",,Sleepy
732,2014-01-16 16:04:00,BlueGlass,b'What was wrong with it last time? Maybe it takes a bit of time to settle in and as you only stayed a few days last time you never got to the beneficial part of staying there. Hope you get what you want though. ',,None
733,2014-01-16 16:06:00,catkin,"b""I'm sorry that things haven't gone how you wanted, but sounds as though something has to change. x""",,Sad
734,2014-01-16 16:06:00,lostgirl19,"b'It was just awful. Being sectioned, restrained, having someone with me 24/7 for 3 days, the other people, some of the staff...everything. Thanks BG  xxxx'",,Sleepy
735,2014-01-16 16:07:00,lostgirl19,"b""Thanks Catkin. I guess i'm the only one who can do that. I need to figure out what needs to change and get on with my life xx""",,Sleepy
736,2014-01-16 16:08:00,BlueGlass,b'Why did they restrain you? Am sorry it was a bad experience for you. ',,None
737,2014-01-16 16:09:00,lostgirl19,"b'My section had ran out so at that point I was like ""I\'m leaving"" I managed to get through all the doors up to reception then 3 nurses came after me restrained me and put me on a further section one of the worst experiences of my life xx'",,Sleepy
738,2014-01-16 16:11:00,BlueGlass,b'That sounded distressing. ',lostgirl19,None
739,2014-01-16 16:15:00,lostgirl19,"b""Yeah it was awful I was in like a proper lock it I couldn't move I could only move my legs xxxx""",,Sleepy
740,2014-01-16 16:20:00,Kerome,"b""Well, sometimes things work for you and sometimes they work against you. Try not to take it too hard or too seriously. Ultimately one assessment isn't going to make or break your future.If you can stay relaxed, and keep the ability to see more than one side of an argument it will help with the assessment. Losing it or jumping to lots of conclusions isn't helpful.Your doctor was just doing what she thought was best, and maybe it will be for the best. You'll get a chance to prove how sane, sober and well-behaved you can be.Sending hugs and well wishes """,,Doh
741,2014-01-16 16:22:00,lostgirl19,"b""That's what i'm aiming to do Kerome - prove that i'm fine! Then I can go back to my normal crappy life. Better that than being in hospital (well for me anyway.) I'm not sure if it's happening tonight or tomorrow. Hoping it's tomorrow. Just can't believe my doctor. The one person I properly trusted. I'm so upset. I'm really alone with this now. Thank you Kerome xxxx""",,Sleepy
742,2014-01-16 16:30:00,lostgirl19,b'Praying the assessment wont be tonight ',,Sleepy
743,2014-01-16 16:56:00,tabbykitten,"b'Lost, it really does look as though you need to be in hospital right now, much as you hate the thought of it and I can understand that.If you can stay as calm as possible that might help you. BUT you also need to discuss your problems with the psych team. Refusing help is definitely not the right thing to do. Hope you get it all sorted out soon'",,Doh
744,2014-01-16 16:59:00,lostgirl19,"b""It won't help Tabby. At all. It will just make me more distressed. I'm hoping there will be a better outcome but I still don't see how I will be able to trust anyone again. Thank you. My assessment is tomorrow thank God x""",,Sleepy
745,2014-01-16 17:05:00,tabbykitten,"b""will the assessment team visit you? I'm guessing you will have no choice but will have to be seen by them. I know it is going to be hard to cope with the next few hours. You seem relieved that the assessment isn't until tomorrow.""",,Doh
746,2014-01-16 17:32:00,lostgirl19,"b""I am going to meet them at CMHT. Yeah it will be. I feel awful. I feel like there's absolutely no one I can trust now. And I feel scared about possibly being admitted again. I am relieved that it's not til tomorrow. I am dreading it so much.""",,Sleepy
747,2014-01-16 18:09:00,Gajolene,"b""Hunny if almost everyone believes you need to be in hospital right now, if you go voluntarily and request through your doctor no lockdown for the first 72 hrs maybe you doctor could arrange that you go straight to the non secure ward rather than the sucide watch obsevation room. I don't know if that can be done in britain but my boys have don't that here at times. If they know you are not suicidal and really want help they may do it for you. Then they might let you go back on medications to help your anxiety/and depression and help you get feeling better. They will only keep you long enough to make sure the medications are working and let you go home. You could arrange to have your meds doled out through a family member if they are worried about you having an OD. I really believe your in a place you can't handle functioning on your own, your depression is consuming your every waking moment and you are having such a hard time finding hope right now. I know this is similar probably what you've already been told and that you are resistant from fear of past experience, but really a week or two in hospital can't be any worse, than you struggling with sh and this severe depression all alone every day, week after week. They don't restrain you unless you really try to harm yourself, someone else,try to escape, or are violent with other patients and staff. I know it's incredibly difficult for you to see, but look at all the lovely people here willing to support you through this, surely there are some people there to support you through this too. Please please please accept the help they are offering, you are so young and your life will not always be crappy, even if you can't see it right now.""",,Lurking
748,2014-01-16 18:13:00,lostgirl19,"b""Thanks so much for your reply, and for caring. I don't think they allow that here. I don't trust any of them anymore so I can't do it. I'll be fine, I always am. Just have to concentrate on making sure they don't section me. Hopefully it won't happen. I can't deal with it.""",,Sleepy
749,2014-01-16 23:56:00,lostgirl19,"b""I feel so upset, beyond words. I know I sound pathetic, I just can't get over it. I'm more upset than anything right now. I don't understand. And I don't know where to go from here.""",,Sleepy
750,2014-01-17 08:37:00,tabbykitten,"b'get yourself to the meeting at CMHT, that is important. Accept the advice/decision they make for you. Really is the best thing in the long run.Hope you get a chance to post on here later. hugs xxxx'",,Doh
751,2014-01-17 08:44:00,BlueGlass,b'Hope the assessment goes okay. We are all behind you. xxx',,None
752,2014-01-17 08:48:00,MarlieeB,"b""I'll be there holding your hand (well you know what I mean) Hopefully both our assessments will go well No matter what we will be here for you.Take care LGxxxx""",,Sad
