,date,username,post content,quoted user,post mood
354,2014-01-08 12:25:00,Tiddle,"b""I think you feel helped and understood by your GP because it is soothing - the emotional support she offers feels nice. I've been in that position too I was still am really attached to a professional who can't actually help me with the work that needs to be done to improve my life. It really hurts and makes me feel angry because I just want her to be the one. This also meant that for a long time I couldn't / refused to engage with anyone else. I have finally got myself to a point of accepting help from other members of the team and am doing DBT which I think is starting to have a real affect on my life. Why do you see killing yourself as the only option? The easy option, yes ( I think this all the time) but from your posts you have other paths to choose from - the new flat, help from CMHT, or not taking that flat and waiting for another. I know you can't see it but there are choices for you. At the end of the day this flat might be the best thing that ever happened to you with or without your GP. Sometimes we have to say goodbye to people and that hurts like hell.""",,None
355,2014-01-08 12:26:00,lostgirl19,b'i dont know anymore i just want my life to be over',,Sleepy
356,2014-01-08 12:33:00,Tiddle,"b""And if all else fails there ain't nothing wrong with a duvet day""",,None
357,2014-01-08 13:30:00,lostgirl19,"b""Hm  I feel awful. I'm just relieved i'm not seeing my CPN today :/""",,Sleepy
358,2014-01-08 14:55:00,Reach,"b""You keep saying you want to die/kill yourself, just please let us know whether they are thoughts or that you are about to act because it stresses me i don't know about anyone else. Perhaps if you give more info each time you say that you will reduce our stress levels. We are only people on a laptop remember.Okay, i think you should, especially if you are having suicidal thoughts, not cancel appointments with your support team. You never know if they can help, but they can do nothing if you don't give them a chance. I hope the appointment with the GP tomorrow will bring good news for you.""",,Amazed
359,2014-01-08 15:13:00,messymoo,"b""I hope your safe Lost? I know it feels hopeless but don't do anything to hurt you.  xxx""",,None
360,2014-01-08 15:23:00,lostgirl19,"b""I'll PM you messy.  Thanks Reach I hope it does too although not feeling hopeful about it :/""",,Sleepy
361,2014-01-08 15:24:00,tabbykitten,"b""do you think you will manage to see your GP tomorrow? It could help you to get some answers about how the decision is made that you can stay with the practice or not.I'm starting to worry that you will feel we are all nagging you though and maybe that is making things worse""",,Doh
362,2014-01-08 15:27:00,lostgirl19,"b""I will try to. I'm just really worrying that it's going to be bad news and I won't take it well.No of course you aren't! Thank you all for being there for me xx""",,Sleepy
363,2014-01-08 15:35:00,tabbykitten,"b'You are worrying anyway, it could always be good news of course.Remember too that the only reason you might need to change GPs is if you take the flat on. If you are told that you would have to change then turn the flat down. Why not write that down for yourself and read it every so often?Have some extra hugs from me.'",,Doh
364,2014-01-08 15:38:00,lostgirl19,"b""Thanks  yeah it's just made me worry more now I know it's been handed over to the admin team I thought if it was just her decision it should be no problem :/ Yeah I guess so it would just be a real shame to lose the flat.""",,Sleepy
365,2014-01-08 16:06:00,tabbykitten,b'Would it actually help you if you knew what the answer was?Only asking as I have an awful habit of finding something else to worry about when a problem is sorted.',,Doh
366,2014-01-08 16:08:00,lostgirl19,b'I think so but I do always seem to find something else to worry about :/',,Sleepy
367,2014-01-08 16:16:00,tabbykitten,"b""I know, horrible isn't it.I even find that if things are going well, I start to worry about how long it will be before something else goes wrong""",,Doh
368,2014-01-08 16:17:00,lostgirl19,b'Thats exactly what happens to me! :/ xx',,Sleepy
369,2014-01-08 19:55:00,lostgirl19,b'I feel so hopeless ',,Sleepy
370,2014-01-08 20:07:00,Kerome,"b""Random pictures to help you feel better image.jpgimage.jpgimage.jpgimage.jpgDon't worry Lost, before you know it it will be another day and you will feel better!  By the way, has anyone told you to look into your diet for your depression? I've heard of quite a few people who found there were links, one person was wheat-intolerant, another dairy-intolerant, and so on. It's a good thing to find a nutritionist and check these things out.""",,Doh
371,2014-01-08 20:09:00,lostgirl19,"b""Thanks those pictures are so cute  I struggle with eating in general so it probably doesn't help but oh well. I hope I do feel better tomorrow :/ I'm dreading tomorrow. Thank you  xxxx""",,Sleepy
372,2014-01-08 20:17:00,MarlieeB,"b""I really hope that the GP situation works out for you. I know how it feels like to be in your shoes, that's why I haven't told my GP practice that I moved towns because I just don't want to risk losing the one I am seeing right now.Keep talking on here xxxxxxxxxxx""",,Sad
373,2014-01-08 20:19:00,lostgirl19,"b""Thanks Sarah for understanding. I shouldn't have told them! If they say no, I may just say I might not move now and just not tell them that I actually have. I'm just scared they'll find out?! Thank you  xxxx""",,Sleepy
374,2014-01-08 20:21:00,BlueGlass,"b""If they did find out all they would do is say you couldn't be under that practice, so you have got nothing to lose it doing that if it comes to it.  Good idea, never thought of it. xxxxx""",,None
375,2014-01-08 20:22:00,lostgirl19,b'Is there a way they could find out? I guess so. I just hate lying especially to my doctor xxxx',,Sleepy
376,2014-01-08 21:43:00,lostgirl19,b'Dreading tomorrow ',,Sleepy
377,2014-01-08 21:46:00,BlueGlass,"b'What are you dreading about tomorrow, seeing your doc? xxxxx'",,None
378,2014-01-08 21:55:00,lostgirl19,b'Yeah seeing the doc at 8.20am tomorrow  and facing another day  xxxx',,Sleepy
379,2014-01-08 22:00:00,BlueGlass,b'It is good that you are seeing her in the morning.  You should do something nice afterwards. ',,None
380,2014-01-08 22:02:00,lostgirl19,"b""She's going to hate me though. I don't even know what I'm going to say to her. Yeah I should I guess just don't know what xxxx""",,Sleepy
381,2014-01-08 22:03:00,BlueGlass,b'Whatever pops into my head when I get there is what I usually go for?Do you have anything specific you want to chat to her about?xxx',,None
382,2014-01-08 22:04:00,BlueGlass,b'Why do you think is she going to hate you?xxx',,None
383,2014-01-08 22:08:00,lostgirl19,"b""I suppose I should speak to her about my OD the other night and the fact that I've kinda given up with everything atm but don't want her to be annoyed with me. And I suppose I should speak to her about moving and see if she can tell me what the chances of getting to keep her. Because I am disengaging and giving up xxxx""",,Sleepy
384,2014-01-08 22:15:00,BlueGlass,"b'At least you have a lot to talk about, even if it is not good stuff that has happened. xxxxx'",,None
385,2014-01-08 22:18:00,lostgirl19,"b""Hm I suppose so :/ I'm dreading it xxxx""",,Sleepy
386,2014-01-08 22:22:00,BlueGlass,"b""Think of all the times you have been to she her before and it has always been okay and made you feel better hasn't it?xxx""",,None
387,2014-01-08 22:26:00,lostgirl19,"b""I guess so I'm just so scared to lose her. I'm also worried about her reactionto what's been going on I'm worried she will be annoyed with me I'm just hoping she doesnt lose patience with me :/ xxxx""",,Sleepy
388,2014-01-08 22:31:00,BlueGlass,b'I am sure she will support you in whatever choices you have made and just help you to work out what is best from now on. xxx',,None
389,2014-01-08 22:34:00,lostgirl19,"b""I hope so. I really hope I don't lose her xxxx""",,Sleepy
390,2014-01-08 22:39:00,BlueGlass,b'I hope you keep her too. xxx',,None
391,2014-01-08 22:42:00,lostgirl19,"b""Thanks I guess so I guess if I can't then I could choose not to move :/ xxxx""",,Sleepy
392,2014-01-08 23:11:00,tabbykitten,"b""think you keeping your GP is the most important thing at the moment. Lots of people take ages to find the right property. All sorts of factors, suitable schools if there are children, near to buses if you are elderly etc. So don't get too stressed out about this particular flat. If the practice says you can stay with them - two problems solved.Try to get some sleep tonight Lost and please please please do your very best to see your GP tomorrow. Think actually turning up will strengthen your case for remaining with them.""",,Doh
393,2014-01-08 23:25:00,lostgirl19,"b""I think I agree. It would just be a real shame to lose this flat. I wish I could go to the appointment with something positive to say and with an open mind but I can't. I feel so awful so hopeless and like i've already given up. I want to OD again. I'm genuinely scared. Thank you Tabby I will do my best xx""",,Sleepy
394,2014-01-09 09:12:00,tabbykitten,b'Lost-- hugs!!Did you make it to the GP this morning?',,Doh
395,2014-01-09 09:37:00,lostgirl19,"b""Hey  yeah I did. I told her about the OD and she's calling CMHT. She said it's unlikely they will be able to keep me if I move to this flat but they may be able to keep me temporarily :/ she said the practice managers secretary will call me hopefully today :/ xx""",,Sleepy
396,2014-01-09 10:09:00,BlueGlass,"b""That good, that you don't have to wait long and you can keep it for at least a bit, temporary is a very interpretable term and could mean for life. You think they could make the odd exception for someone like you who feels they need the same doc. Not very flexible are they. Grrrr.""",,None
397,2014-01-09 10:14:00,lostgirl19,"b""They said for a very short time! That doesn't sound like for life :/ Is it silly to not move cause you have to change GP? :/ Yeah ikr """,,Sleepy
398,2014-01-09 10:17:00,tabbykitten,"b""Lost I am so proud of you, getting to the GP and telling her about the OD. Bit of a nuisance if you can't stay with her but at least you know where you stand now.Once you have heard from the practice manager, you will be able to start making a decision about the flat. I get the feeling you might actually be able to continue and take the flat even if you do need to change GP at some point.Lots of hugs (((((((((())))))))))))""",,Doh
399,2014-01-09 10:18:00,BlueGlass,"b'Everyone has different desires for what they want when they move , yours is probably a bit unusual compared to most but it is more like moving away from a friend that a doctor. You just have to weigh up which is worse living where you are now or having a new doctor?xxxx'",,None
400,2014-01-09 10:22:00,lostgirl19,"b""Thanks Tabby  she is ringing CMHT i'm a bit scared she says there shouldn't be a need for admission if I re engage but if I don't then we are looking at admission which she says none of them want that for me. I don't want to engage though that's the problem i've kinda given up but I don't want to go back to hospital again so I guess it's about having to.Yeah I just hope they contact me soon, so at least then I know. The housing officer has called and left a message to see what's going on - cause i'm running out of time! I really think I would completely disengage and give up if I changed GP. They said they can do a smooth handover to another good GP but just don't think I could do that.I suppose so. Just continuing to see my doctor is important if I want any chance of recovery :/ xxxx""",,Sleepy
401,2014-01-09 10:28:00,tabbykitten,"b""If you could engage with CMHT though, even if you don't feel good with them, that could get you through the time of changeover with the GP. Might even be that the lack of trust you feel is because you are nervous of the whole thing being relatively new?I hate anything new, even if it something good. More hugs ((((((((((()))))))))""",,Doh
402,2014-01-09 10:33:00,lostgirl19,"b""I guess so but I haven't got anywhere near as good of a relationship with anyone else. I think it's really important I keep her otherwise I will give up. I suppose waiting around for another flat I could do but I just have to hope the right one comes along soon.""",,Sleepy
403,2014-01-09 10:37:00,tabbykitten,b'It is never going to be an easy decision.Not even sure what your present situation is with housing (not being nosy!!) as that obviously has an influence too.',,Doh
404,2014-01-09 10:41:00,lostgirl19,"b""I guess so.It's difficult but I can live with it for a bit longer I think :/""",,Sleepy
405,2014-01-09 10:51:00,tabbykitten,"b'Maybe no need to rush into a decision then. One more thought, does the housing officer know about the GP difficulty. It would be worth explaining if you could.'",,Doh
406,2014-01-09 10:52:00,lostgirl19,"b""No not really I'm a bit embarrassed to say about it x""",,Sleepy
407,2014-01-09 10:59:00,tabbykitten,"b""you needn't go into detail about the mental health problems. Just say that, because you have health issues you would be happier if you could stay with your current GP.Did you see the TV series about housing last year? Very few people actually accepted the first property they were offered.""",,Doh
408,2014-01-09 11:27:00,Tiddle,"b""Can I just throw something out there that you may want to think about? as this has happened to me in the past and it didn't even really cross my mind at the time. I don't want to sound mean or anything or upset you but what would happen if for some reason your GP has to leave and she won't be around for you any more. Worst case scenerio and this sounds really terrible but she could be hit by a bus tomorrow - nothing is set in stone. I guess what I am trying to say is that you should make a decision about the flat that is best for you and the flat might be the best thing in the long run over the short term with a GP which in all fairness could if she thought you were becoming too dependent on her (been there, got the Tshirt) just transfer you to another dr within the practise anyway and you would have given up what could be a great opportunity and you would be stuck with a GP you don't want to see. At least with a new GP surgery you could go there and take your pick which one you may find helpful and you will have the transfer time with your old GP to make the transition.Can you tell I'm quite negative? I can always see the downside of everything!""",,None
409,2014-01-09 11:40:00,tabbykitten,"b""Think you are actually being positive Tiddle. Hadn't thought of that aspect of things. It is all too easy to get over dependant on a particular person isn't it""",Tiddle,Doh
410,2014-01-09 11:50:00,Tiddle,"b""Indeed it is! attachment is my biggest issue and it absolutely rips my heart out when I become too dependent on someone who just can't return the feelings/provide the nurturing. I don't think there is any pain like it, it is very much akin to grief.""",,None
411,2014-01-09 12:23:00,lostgirl19,"b""I don't really get what you mean :/ don't worry""",,Sleepy
412,2014-01-09 12:30:00,tabbykitten,"b'Not suggesting you have an attachment problem with your GP. Attachment is a specific mental issue where someone becomes totally dependant on another person for help.In your case, what Tiddle ( I think) and I were saying is that there is a definite likelihood that your present GP might not be available for all sorts of reasons. So you would have to find a new GP anyway. This means that it might not be sensible to turn the flat down just because you will have to change GP.'",,Doh
413,2014-01-09 13:14:00,lostgirl19,"b""I don't know :/""",,Sleepy
414,2014-01-09 13:19:00,tabbykitten,"b'wait until you hear from practice manager first. Try not to panic, you have done very well today'",,Doh
415,2014-01-09 13:20:00,lostgirl19,b'Thanks Tabby :/ heard from no one so far no CMHT and no secretary :/ x',,Sleepy
416,2014-01-09 13:21:00,lostgirl19,"b""I don't get why my GP would ditch me anyway I dont get it :/""",,Sleepy
417,2014-01-09 13:24:00,BlueGlass,"b""She is not ditching you, she will most probably has no control over the decision, it will be the practice's rules. Hope they call soon. xxx""",lostgirl19,None
418,2014-01-09 13:28:00,lostgirl19,"b'Thanks just wondering what Tiddle meant by ""which in all fairness could if she thought you were becoming too dependent on her (been there, got the Tshirt) just transfer you to another dr within the practise anyway.""Yeah the practice\'s rules suck I thought it would have been her decision but it\'s not just down to her unfortunately   thanks me too xxxx'",,Sleepy
419,2014-01-09 14:16:00,Tiddle,"b""Sorry if I have confused you. What I am getting from your posts are that you have possibly formed an attachment to your GP ( needing to see her, believing she is the only one that gets you, being prepared not to move forward in your life by turning down the flat because it would mean not seeing her anymore). So what I meant is that if she is aware of this and perceives it to be not very healthy for you then she may transfer you to some one else in the practise. Not at all saying this will happen just pointing out that there is another side to think about and that is that you are assuming that the GP is going to be around for a long time when in reality anything could happen and she won't be. I think it's also important to remember she is a professional - she may be nice to you but at the end if the day there is no personal relationship- really sorry if I'm being harsh but I have missed out on so much in my life by making decisions based on my attachments and I really wouldn't want anyone else to suffer as I have for nearly 30 years. There are all levels of attachment from being not attached at all right up to the stalking type attachment issues.""",,None
420,2014-01-09 14:18:00,lostgirl19,b'Ok well thanks for explaining and for your opinion',,Sleepy
421,2014-01-09 15:28:00,lostgirl19,b'CMHT still not called :/',,Sleepy
422,2014-01-09 15:38:00,tabbykitten,"b""oh how frustrating Lost. Until you hear from them and from the practice manager with your GP, you really can't do anything more with decision making.""",,Doh
423,2014-01-09 15:39:00,lostgirl19,"b""I know, it sucks  I don't understand why CMHT haven't called though, my GP wanted them to see me today urgently shows how much they care not even bothered to call me back :/""",,Sleepy
424,2014-01-09 16:21:00,Reach,"b""They are probably just busy.Do you think you have an attachment to the GP? Or are you simply relying on her support? I wonder where the line is between the two as we are allowed to rely on people when in crisis aren't we. Maybe because you need so much support from her, she has to balance the time she gives to patients, and so you not being in her area anymore means you have to be passed onto another practice, maybe that is how it works. She is obvioulsy good at her job and thus might end up with people with mental health problems from all over the area, as well as her own area. You are lucky to have found her but as the others said, she could leave the practice next month you never know, doctors don't hang around forever, and then you would be without flat and GP. It's good that they are nice enough to offer you to stay with them for a little while once you have moved. GP's like this are rare though and you aren't likely to find another who offers that much support.""",,Amazed
425,2014-01-09 16:25:00,lostgirl19,"b""I suppose so but she wanted me to be seen urgently :/ CMHT clearly don't care.No I don't think so. I think I just feel like she understands me more than CMHT etc and I trust her more I dont see whats wrong with that and if its going to unsettle me a lot by having to change GP then its not worth it.It's not just about the GP it's about the practice and the other GP's there as well. I know she could leave at anytime but I like some of the other doctors there too and i'm comfortable with being at that practice and that's important to me right now. Yeah that's why it's so important to me she is one in a million really. I'm not sure what's going to happen with the flat now :/""",,Sleepy
426,2014-01-09 16:32:00,Reach,"b""It sounds like you have already made your decision, that you will not take it becaue it means leaving the practice and GP. Could you ask how likely it is to get one in the catchment area? I don't know how desperate your home situation is and how important it is you move. I think if you turn it down it is acceptable for you to say it needs to be in the area of your GP, there is nothing embarrassing about that.""",,Amazed
427,2014-01-09 16:34:00,lostgirl19,"b""Thanks for understanding. I'm just so vulnerable and so bad at the moment and that's the only one I really trust - much more than the services unfortunately. I would completely give up if I wasn't seeing the GP. It is quite likely it's just a case of hanging around for a bit for one which I think i'm prepared to do. I could try to focus on driving instead, that would help give me some independence in the meantime. x""",,Sleepy
428,2014-01-09 16:54:00,Gajolene,"b""I am guessing the wait list is very long through your CMHT, if they don't call back rebook with you GP and see if you can be refered to a psychiatrist directly without CMHT being involved first. I'm not sure if you can do that in England, but it would help. It is so frustrating when your desperate for help NOW!!! and they tell you it will be two or three months before you can get in to start councilling. Good luck and keep us posted, and thanks for adding me as a friend """,,Lurking
429,2014-01-09 17:01:00,lostgirl19,"b""Thanks for your reply Gajolene i'm actually already under MH services (crisis team and CMHT atm) my doctor was just particularly concerned as I am in a really bad way and OD'd the other day so she was hoping I would get seen today but that never happened. The mh services can be such a joke  Thank you  xxxx""",,Sleepy
430,2014-01-09 17:11:00,Gajolene,"b'What did you od on hun? Have the suicidal thoughts passed for the time being? Sorry so many posters here now, I hate missing important threads and am behind.'",,Lurking
431,2014-01-09 17:13:00,lostgirl19,"b""I'm not sure if I can say here :/ No they haven't """,,Sleepy
432,2014-01-09 17:15:00,Gajolene,"b""You can say. it's OK your still anonymous here. you can pm me too if your more comfortable with that as well, but people who have done the same may be able to respond with helpfull advice more if they can see it.""",,Lurking
433,2014-01-09 17:15:00,lostgirl19,"b""Shouldn't say :/""",,Sleepy
434,2014-01-09 17:18:00,Gajolene,"b'I see, do you think your meds are causing you to be more or less suicidal? Remember they are thoughts not actions and thoughts can pass and be brought under control.'",,Lurking
435,2014-01-09 17:19:00,lostgirl19,"b""I'm not on meds anymore x""",,Sleepy
436,2014-01-09 17:22:00,tabbykitten,"b""General rule on this forum is that we shouldn't go into detail about ways of ODing - thin it could be seen as giving folks ideas!!Think I am right about that""",Gajolene,Doh
437,2014-01-09 17:22:00,Gajolene,b'Is it something your considering trying again then? Or do you just want to go through with psychotherapy first with the team?',,Lurking
438,2014-01-09 17:25:00,BlueGlass,b'Have they actually said you are going to get any therapy soon? (sorry may have missed you saying it)xxxx',,None
439,2014-01-09 17:28:00,lostgirl19,"b""Sorry tabby I thought that too but wasn't sure...so ive edited it out.I'm not sure Gajolene :/ Some sort of therapy yeah.They want me to see a psychologist for an assessment soon BG but i'm not sure i'm ready.Still annoyed CMHT not called so asked my doctor to call me back cause i'm not sure what to do :/ xxxx""",,Sleepy
440,2014-01-09 17:31:00,Gajolene,"b'Thanks Tabby, usually with going into details, I will post a trigger warning label at the head of the comment. I\'ve Never had a ""details"" post removed myself on here before. So unsure if your right with that one. But then too, I was off the forum for quite a long time so rules may have changed. Sometimes getting those details out helps us in recovery, one to face them and cope with them ourselves and two so others who have experienced and survived similar can offer experience to help.'",,Lurking
441,2014-01-09 17:31:00,BlueGlass,"b""Did they say they were defo going to ring today? coz our definition of urgent may not be theirs annoyingly. I am sure they will be able to tell from the assessment if you are ready. xxxYou can't put self-harm specifics in a post, and oding is a form of sh.""",,None
442,2014-01-09 17:33:00,lostgirl19,"b""My doctor wanted them to see me today!I've rung her back and left her a message so i'm hoping that's okay, I just need to know what's going on and need her advice.Hm good point! xx""",,Sleepy
443,2014-01-09 17:35:00,tabbykitten,b'Think it could be a whole grey area. I see your point though',Gajolene,Doh
444,2014-01-09 17:37:00,tabbykitten,"b""Well done for ringing and leaving a message with the GP. Shows you are prepared to make the effort. Really isn't on that community support haven't contacted you if GP has said it was urgent.""",lostgirl19,Doh
445,2014-01-09 17:39:00,Gajolene,"b'Thanks for clarifying that for me BG, You can still talk about feelings and behaviours around an incident though, without the specifics to help work through it.'",,Lurking
446,2014-01-09 17:42:00,lostgirl19,"b""Thanks Tabby, unless my CPN wasn't around today or something like that I don't know. Oh well.""",,Sleepy
