post #,username,text,Anger,Fear,Joy,Sadness,Analytical,Confident,Tentative
2,calypso,"b""Hey MarkYou say you change moods in the twinkling of an eye, and I would argue that is very rare in bipolar.",0.0,0.0,0.0,0.525945,0.0,0.560944,0.0
2,calypso,Have you been formally diagnosed?,0.0,0.0,0.0,0.0,0.0,0.0,0.0
2,calypso,I am interested that meds don't work at all.,0.0,0.0,0.0,0.603531,0.0,0.874372,0.0
2,calypso,"Sometimes this is indicative, not of bipolar, but of borderline personality disorder.",0.0,0.0,0.0,0.52292,0.620279,0.0,0.88939
2,calypso,You could look this up on the site on here.,0.0,0.0,0.0,0.0,0.0,0.0,0.822231
2,calypso,"I am NOT diagnosing you, I cannot do that, of course, but the sudden swinging up and down as you feel is much more common in borderline.",0.0,0.0,0.0,0.0,0.0,0.0,0.0
2,calypso,"There is treatment for borderline, a specific therapy called DBT (not CBT).",0.0,0.0,0.0,0.0,0.0,0.0,0.0
2,calypso,"I know very little about it, but others know a lot.",0.0,0.0,0.0,0.0,0.862286,0.0,0.0
2,calypso,"It may be an idea to check with your psychiatrist whether you have borderline, or that maybe they could look again at your symptoms.",0.0,0.0,0.0,0.0,0.702145,0.0,0.961411
2,calypso,"All of this is just a thought, and meds do not work on people with this disorder.",0.0,0.526909,0.0,0.637425,0.0,0.0,0.0
2,calypso,There is hope honey.,0.0,0.0,0.669877,0.0,0.0,0.0,0.984352
2,calypso,"xx""",0.0,0.0,0.0,0.0,0.0,0.0,0.0
4,maxitab,b'Hi madmark.,0.0,0.0,0.0,0.0,0.0,0.0,0.0
4,maxitab,"Twenty eitght years ago doctors were not very refined in their ability to diagnose, and to be honest, I would agree with mayfair, that this sounds much more like BPD to me than just about anything else.",0.0,0.0,0.0,0.0,0.0,0.0,0.819373
4,maxitab,Have you looked at the criteria/symptoms.,0.0,0.0,0.0,0.0,0.0,0.0,0.0
4,maxitab,"Many of us who have BPD do not respond to medication, but there are now a few very effective treatment ( not meds) options.",0.0,0.0,0.0,0.0,0.636458,0.560944,0.0
4,maxitab,"If this were me I would go to my GP and ask for a proper assessment with a clinical psychologist and put down the manic depression label, since it is not, IMO true for you.",0.0,0.0,0.0,0.828837,0.620279,0.0,0.0
4,maxitab,Once you have a better idea of what is going on you will be able to access help.,0.0,0.0,0.0,0.0,0.0,0.0,0.0
4,maxitab,"It is out there, why go on suffering?'",0.0,0.0,0.0,0.726247,0.0,0.0,0.0
6,maxitab,"b""HI again mark.",0.0,0.0,0.0,0.0,0.506763,0.0,0.0
6,maxitab,"I am supposing the isolation is due to anxiety, it sounds like it.First,",0.0,0.763459,0.0,0.0,0.73677,0.0,0.716301
6,maxitab,"I do need to ask, do you want things to be different?",0.0,0.0,0.0,0.0,0.0,0.0,0.0
6,maxitab,Because anxiety is a symptom of something that is going on that is not being addressed.,0.0,0.831254,0.0,0.0,0.506763,0.0,0.615352
6,maxitab,"Also, are you in the UK because being given a phone number for counselling does not sound like the UK....There is a service called IAPT which your GP can refer you to - is this it?",0.0,0.0,0.0,0.0,0.0,0.0,0.0
6,maxitab,If you are getting no result then you need to insist!,0.0,0.0,0.0,0.0,0.905748,0.0,0.0
6,maxitab,Phone again and say you want to speak to the manager of the service and explain that you never get the promised appointment and ask who you can make a complaint with.,0.511454,0.0,0.0,0.0,0.0,0.0,0.0
6,maxitab,"It is amazing how people respond when you get a little pushy!In addition, there is some good help on line for anxiety, however, it is no good looking at it and thinkint 'that won't work for me' you have to be prepared to suspend your judgement and actually do it.",0.0,0.0,0.0,0.0,0.526316,0.0,0.0
6,maxitab,"If you want to try it,  www.anxietycoach.com",0.0,0.0,0.0,0.0,0.724236,0.0,0.5538
6,maxitab,Good luck.,0.0,0.0,0.828113,0.0,0.0,0.0,0.998976
6,maxitab,"Don't suffer in silence.""",0.0,0.0,0.0,0.0,0.0,0.0,0.0
9,maxitab,"b""Mark, did you look at any of the link I posted?What did you think of the suggestion that this may well be untreated BPD?",0.0,0.0,0.0,0.0,0.948998,0.0,0.836129
9,maxitab,"I don't want to be or appear to be unsympathetic, but if it is BPD then I do feel you need to give the new more modern and aware Mental Health Service a second chance ( because you will be giving yourself a second chance along the way).Just because they failed you in the past is not a reason for staying angry at them.",0.522171,0.0,0.0,0.0,0.566847,0.0,0.764412
9,maxitab,If you always do what you have always done - you will always get what you have always got.,0.0,0.0,0.0,0.0,0.0,0.970053,0.0
9,maxitab,Try something new.,0.0,0.0,0.58483,0.0,0.0,0.0,0.998976
9,maxitab,"Get on the website, and go and ask your GP for a proper assessment.""",0.0,0.0,0.0,0.0,0.0,0.0,0.0
11,maxitab,"b""Hi again.",0.0,0.0,0.0,0.0,0.0,0.0,0.0
11,maxitab,"The thing about the IAPT is that though they say 6 hours, they have the ability to extend it or to refer you to a different form of therapy if they think you need it, so though the 6 hours sounds silly, it could be good for what it may lead in to.I know one of the things lots of people do is to say they are OK when they are not so don't pull any punches with the therapist, say how things really are for you.I do hope you can get some ongoing help..........""",0.0,0.0,0.0,0.0,0.0,0.0,0.686593
15,maxitab,"b""Remember to keep your thoughts under control - you are in charge not them.",0.0,0.0,0.0,0.619475,0.833126,0.0,0.0
15,maxitab,"Just because you have a thought that does not mean it is necessarily:True.Something you need to act on.A reason for feeling a certain way.Untrue!Any more important then the thought 'oh look its raining'.......""",0.0,0.0,0.0,0.0,0.673299,0.0,0.525007
24,dawndeec,"b""I was diagnosed with bipolar but my moods flip in a matter of minutes not weeks or months.",0.0,0.0,0.0,0.756977,0.0,0.0,0.525007
24,dawndeec,Its not like bipolar for them to change at this rate.,0.0,0.0,0.0,0.0,0.0,0.0,0.0
24,dawndeec,I'm seeing a new psychiatrist soon for a new diagnosis were thinking its bpd.,0.0,0.0,0.0,0.0,0.560098,0.0,0.0
24,dawndeec,I also found anti depressents made me worse so I'm now on a atypical anti psychotic called seroquel xr.,0.0,0.0,0.0,0.59661,0.0,0.0,0.0
24,dawndeec,"Which is also used for bpd it hasn't done wonders but its the best meds i have tried""",0.0,0.0,0.54642,0.0,0.0,0.0,0.5538
35,TiredTina,"b""Hi madmark,Living with depression is extremely hard as I know from experience.",0.0,0.0,0.0,0.900884,0.560098,0.0,0.0
35,TiredTina,It is a constant battle which is absolutely exhausting as it takes all your energy to keep up the fight.I picked up on the bit you wrote about thinking of leaving your wife and children.,0.0,0.0,0.0,0.0,0.0,0.741964,0.0
35,TiredTina,I can see what you mean about your illness affecting them as well but what you have to keep in mind is the affect your leaving would have which Im sure would be considerably worse.I see you are waiting for an appointment and hopefully when that finally happens they will be able to offer you the support you need.I see that this thread is called 'been a battle for 28 years with no medication'.,0.0,0.0,0.0,0.654687,0.517456,0.0,0.0
35,TiredTina,Im sorry I havent had time to read from the beginning so dont know the full story.,0.0,0.0,0.0,0.0,0.0,0.0,0.0
35,TiredTina,I dont know whether the no meds situation is because you havent been prescribed them or you choose not to take them.,0.0,0.0,0.0,0.0,0.780088,0.0,0.88939
35,TiredTina,"I will try and read your whole story so that I have a better picture.If you havent done so already would you consider starting your own journal on here where you can keep a log of how you are doing?Tina""",0.0,0.0,0.0,0.545648,0.678929,0.0,0.0
46,lost!,"b""if there is any kind of pattern to mine i have noticed more often than not lately i have 2 good 2 bad and 3 trying to pick up the pieces and apologise!",0.0,0.0,0.0,0.513491,0.852648,0.0,0.786991
46,lost!,"for the complete mess i have made of things meds not changed my thoughts or feelings just slightly towards my appearance due to me sleeping but nothing to make me feel something other than the feeling that i am some how always getting things wrong no matter how hard i try i always fail like i'm just not enough and then thats it i'm gone a wreck blank on the outside and just silently crying on the inside hurting but just cant say it,would be easier just to let some one know how your feeling just by a touch my life is such a mess the blank exterior gives the false impression of not caring almost to the point that my partner always thinks i am angry i just dont know how to explain all this to him so that he can understand and he is understandably angry with me right now and is trying to support me still.He just will not give up he doesn't listen when i tell him i am a lost cause what do i do?Lost!""",0.0,0.0,0.0,0.638147,0.650285,0.0,0.629399
52,lost!,b'Mark you have to remember that no matter how you feel you have always and will always remain a very large and loved part of your families life no matter how down you get and how hard you push they are always waiting there for you when your mind returns you know what i am saying is right you tell me often enough!,0.0,0.0,0.583577,0.0,0.649361,0.704642,0.0
52,lost!,why not try to plan a surprise family get together over christmas never know bit of fesvive magic and a romantic glass in the still of the night with just you your wife and the snow may help remind you why we fight this because our loved ones are worth it they believe in us even threw the darkest of days with or without understanding or knowledge of what is the cause and more often than not wondering if it is their fault but yet past the dark and the grey you know that your wife is with you anxiously waiting for that little glint that tiniest of shimmer in your eye that lets her know that you are still there just temporarily unable to communicate that one little ray of light tells her that you love her and to her will be all she needs to help her be there to support you.xx please keep strong we seem to both be hitting our 2 down again.',0.0,0.0,0.0,0.588245,0.52045,0.0,0.507098
61,madsue40,"b""You could be describing me here!",0.0,0.0,0.0,0.0,0.0,0.0,0.91961
61,madsue40,I have a lovely family and have been married for20 years but at the moment I feel so disconnected from everything.,0.0,0.0,0.750782,0.0,0.0,0.0,0.0
61,madsue40,I push my husband to see if he is going to leave me but he doesn't - he loves me!,0.0,0.0,0.0,0.540842,0.0,0.0,0.0
61,madsue40,Don't know why?,0.0,0.0,0.0,0.0,0.955445,0.0,0.0
61,madsue40,My psychologist says I have to learn to connect with myself first then I might be able to connect with others!,0.0,0.0,0.755088,0.0,0.85365,0.0,0.0
61,madsue40,"But it's bloody difficult!!Perhaps if you get an assessment you might need to do this also?My thoughts are with you - life is so bloody difficult!""",0.0,0.0,0.0,0.572676,0.0,0.0,0.698904
64,lost!,"b""another like me and mark hi there I push to stop from hurting my partner if you read the posts between mark and myself in marks posts you may feel like you can find understanding in the strangest of places there is always a friend around even if it is a stranger sometimes they make the best of friends such as Mark he has been such a life line and always here with a note of encouragement waiting for me when i need it that is something you don't get from meeting people outside as they don't get to understand you as you don't let your random thoughts out so they are unsure of your frame of mind.you",0.0,0.0,0.0,0.510256,0.672064,0.0,0.0
64,lost!,think it is easier to push your husband away to test him but why not see if it isn't just being with him that you are scared of it is such a good feeling to get that reassurance you need with a cuddle a snuggle up on a cold night with a cup of hot chocolate and funny film watching the snow fall threw the frosted up windows Christmas magic let it in and you will feel it help bring memories back your husband loves you he isn't going antwhere 20 years is a long time ti push and he is still there with you waiting patiently for the good days that you are the woman he feel in love with the 1 that in he's eyes is the love of he's life or would have gone you have to accept that before you push yourself he loves you not for you to question why just accept as i do with my partner and realise that no matter what your faults he see's past them as you are he's life! as we believe that our partners live with our illness it is just a fault in our brains our partners have their own faults in their eyes that we do not see because above all we love them no matter what as they love us.please,0.0,0.0,0.701156,0.0,0.0,0.0,0.0
64,lost!,"remember that next time you see snow fall on a night and put the kettle on(Smile)""",0.0,0.0,0.783779,0.0,0.641954,0.0,0.0
86,wendolene26,"b""Hello madmarkI'm sorry you are having such a bad time at the moment.",0.0,0.0,0.0,0.711864,0.0,0.0,0.0
86,wendolene26,"Try not to blame yourself too much, it is the depression talking and the depression which causes these thoughts and feelings.",0.0,0.0,0.0,0.965652,0.670204,0.0,0.0
86,wendolene26,"Perhaps instead of trying to talk to your wife and it ending up in an exchange of insults, why don't you write her a note explaining how you feel.",0.566857,0.0,0.0,0.0,0.0,0.0,0.664718
86,wendolene26,She can then read this at her leisure and think about things.take,0.0,0.0,0.0,0.0,0.842108,0.0,0.0
86,wendolene26,"care,Wendolene""",0.0,0.0,0.0,0.564889,0.0,0.0,0.0
90,Apotheosis,b'May or may not help; or you may have already tried it; but have you tried looking into more spiritual angles on it all?,0.0,0.0,0.0,0.0,0.0,0.0,0.971848
90,Apotheosis,http://www.jungcircle.com/depression.html,0.0,0.0,0.0,0.0,0.0,0.0,0.0
90,Apotheosis,',0.0,0.0,0.0,0.0,0.0,0.0,0.0
92,Apotheosis,"b""That's OK Mark.",0.0,0.0,0.0,0.0,0.506763,0.0,0.0
92,Apotheosis,"I find it helps to try & get as many angles on all this as possible - multiple personal & environmental perspectives - social, spiritual, psychological, & biological.",0.0,0.0,0.0,0.0,0.0,0.0,0.0
92,Apotheosis,For me things are primarily psychological & spiritual - & that seems to make most sense.I recently read the book 'in case of spiritual emergency' by Catherine Lucas - & really enjoyed it.,0.0,0.0,0.735226,0.0,0.711887,0.0,0.534455
92,Apotheosis,Try some Google searches for 'Dark Night of the Soul' & 'Depression & Spirituality'.,0.0,0.0,0.0,0.866987,0.0,0.0,0.88939
92,Apotheosis,There is a PDF file here which is a good read as well -  http://www.mentalhealthforum.net/for...l-Explanations I'm not trying to convince you of anything.,0.0,0.0,0.618056,0.0,0.579367,0.0,0.704683
92,Apotheosis,If you have tried everything else - then what is there to lose?I do think that there is something in all this; & I do find it all a help.,0.0,0.0,0.0,0.573387,0.791857,0.0,0.0
92,Apotheosis,Anyway - just a suggestion.,0.0,0.0,0.0,0.0,0.0,0.0,0.996505
92,Apotheosis,"Glad that your getting some counselling; I think that can really help too.""",0.0,0.0,0.710579,0.0,0.821913,0.0,0.716301
95,creamcheese,b'Hey MarkI used to suffer with deression.,0.0,0.0,0.0,0.857657,0.0,0.0,0.0
95,creamcheese,It was a nine year battle for me.,0.0,0.0,0.0,0.507416,0.0,0.0,0.0
95,creamcheese,I can relate to you.You are not alone.,0.0,0.0,0.0,0.0,0.724236,0.0,0.0
95,creamcheese,Hope to see you back online soon.Take careBecky',0.0,0.0,0.0,0.0,0.0,0.0,0.856622
97,creamcheese,"b""Hi MarkNice to see you back on the forum.I can relate to you in many ways.",0.0,0.0,0.0,0.0,0.0,0.0,0.0
97,creamcheese,"I used to be on medication for my depression and like you, found it made me worse.",0.0,0.0,0.0,0.86379,0.0,0.0,0.0
97,creamcheese,"Tried counselling as well but the counsellor didn't help me.What I found help me, was writing about my feelings in a diary.",0.0,0.0,0.0,0.0,0.731735,0.0,0.0
97,creamcheese,"When I was going through my depressive moments, a lot of what was going on around me left me feeling confused.",0.0,0.0,0.0,0.872437,0.0,0.0,0.876534
97,creamcheese,"When I wrote about it, with my feelings etc. Reading through it actually made me see things differently.",0.0,0.0,0.571335,0.0,0.0,0.0,0.0
97,creamcheese,"Writing about my feelings, day events in a diary is like therapy for me.Another tool was having a strong supportive network of people around me.",0.0,0.0,0.587987,0.0,0.0,0.0,0.716301
97,creamcheese,Like family and friends.,0.0,0.0,0.695522,0.0,0.0,0.0,0.88939
97,creamcheese,Talking to someone who is non-judgemental really helped me.,0.0,0.0,0.0,0.562028,0.724236,0.0,0.856622
97,creamcheese,"Especially when I spent most of my life in a shell, not opening to anyone about my feelings.",0.0,0.0,0.0,0.0,0.0,0.0,0.856622
97,creamcheese,Everyone is different.,0.0,0.0,0.510496,0.0,0.0,0.0,0.0
97,creamcheese,Different tools help different people.,0.0,0.0,0.0,0.0,0.0,0.0,0.0
97,creamcheese,"Once you have access the right resources, recovery can take place.What do you feel helps you to control your depression?P.S It's nice to meet you Mark.Take careBecky""",0.0,0.0,0.0,0.625497,0.0,0.0,0.0
99,creamcheese,b'Good luck with your appointment on Friday.,0.0,0.0,0.76642,0.0,0.560098,0.0,0.91961
99,creamcheese,Hope the week brings you joy anf happiness.Take careBecky',0.0,0.0,0.969377,0.0,0.0,0.0,0.822231
101,madmark,b'well been for my 6 sessions and now been put on to open ended counsoling got to go again in 2 weeks and start paying for every session pmsl done all 6 meeting no review report and no real feedback realy cant see the point of carrying on with it what is it ment to do ?,0.0,0.0,0.0,0.0,0.0,0.0,0.0
101,madmark,i can talk to anybody for free so why pay to talk to a stranger lol what a complete waste of time that was so it meens i still aint going to find any awnsers realy has pissed me off is there any awnsers or is it just we ment to suffer untill we deside we realy cant keep batteling our way through day to day and decide to give in and end it all',0.685947,0.0,0.0,0.0,0.0,0.0,0.0
105,creamcheese,b'Hi MarkDid the counsellor talk to you about the terms of counselling to you before you started?,0.0,0.0,0.0,0.0,0.0,0.0,0.0
105,creamcheese,What about other types of counselling?',0.0,0.0,0.0,0.0,0.0,0.0,0.75152
106,opendoorpsychiatry,"b""Hello MadMark,I am joining this thread very late, but I can see that you have been having a very difficult time.",0.0,0.0,0.0,0.0,0.0,0.812632,0.0
106,opendoorpsychiatry,"It sounds as if that medicines haven't really helped you so far, and the counselling is coming to an end and you are still feeling awful.I would suggest going back to your GP to explain how things just aren't getting any better.",0.0,0.0,0.0,0.684136,0.711887,0.0,0.590113
106,opendoorpsychiatry,It is really important for them to know about the suicidal thoughts you have had so that they can ensure that you get the sort of help you need (by the way I don't mean being sectioned to hospital - that very rarely happens to people with depression these days).,0.0,0.0,0.0,0.954754,0.831014,0.0,0.0
106,opendoorpsychiatry,I wonder if you might benefit from having another go with a psychiatrist?,0.0,0.0,0.0,0.0,0.589295,0.0,0.933436
106,opendoorpsychiatry,They can help make the proper diagnosis and may be able to receommend treatmetns which your GP can't access.I hope things start to improve soon.,0.0,0.0,0.0,0.0,0.0,0.0,0.716301
106,opendoorpsychiatry,"Life always looks very bleak when one is depressed, but it doesn't have to be that way and most people find something which helps, though it can be a painfully slow business getting there.Best wishes,Andy""",0.0,0.0,0.0,0.648305,0.0,0.0,0.0
109,madmark,b'cbt whats that lol ?,0.0,0.0,0.579427,0.0,0.0,0.0,0.0
109,madmark,hope you ok and well thank you for getting back to me',0.0,0.0,0.0,0.0,0.0,0.0,0.75152
113,creamcheese,b'A nurse spoke to me about C.B.T.,0.0,0.0,0.0,0.0,0.0,0.0,0.5538
113,creamcheese,She told me to go to my local gp and ask to be referred to a mental health team.Might be worth having a look into.',0.0,0.0,0.0,0.0,0.687768,0.0,0.0
115,creamcheese,b'Hi MarkIs there anything else they can do for you?,0.0,0.0,0.0,0.0,0.0,0.0,0.822231
115,creamcheese,Have you asked them?',0.0,0.0,0.0,0.0,0.0,0.0,0.0
117,creamcheese,b'Look after yourself.,0.0,0.0,0.0,0.0,0.0,0.0,0.0
117,creamcheese,Try not to put any pressure on yourself.,0.0,0.533802,0.0,0.0,0.0,0.0,0.961411
117,creamcheese,Hope things work out well for you.',0.0,0.0,0.0,0.0,0.982476,0.0,0.0
120,creamcheese,b'How did your depression?,0.0,0.0,0.0,0.981673,0.0,0.0,0.0
120,creamcheese,Think about the causes?,0.0,0.0,0.0,0.0,0.995622,0.0,0.0
120,creamcheese,Might help.',0.0,0.0,0.0,0.0,0.0,0.0,0.998976
121,madmark,b'havent found out what has caused it ime realy not in a good place at the moment falling so low and cant seem to stop myself or over come my brain seems to have blocked all my emotions ?,0.0,0.0,0.0,0.609267,0.0,0.0,0.525007
121,madmark,"happy ,sad,love i just dont seem to give a f*ck about nothing i look at my children and feel nothing and that realy scares me as i love them so much y wont my brain engage any emotions been like if for about 2 weeks thank you for posting to me'",0.0,0.0,0.928181,0.0,0.0,0.0,0.808199
122,iamchello,"b""yes i also feel that before - detached.",0.0,0.0,0.0,0.0,0.0,0.0,0.615352
122,iamchello,don't worry it will wear off soon and you will find the emotions once again.,0.0,0.0,0.0,0.0,0.532616,0.0,0.0
122,iamchello,"smile (Smile)""",0.0,0.0,0.983886,0.0,0.0,0.0,0.0
123,opendoorpsychiatry,"b""Hi MadMark,I really am sorry to hear things are difficult at the moment for you.",0.0,0.0,0.0,0.606091,0.0,0.0,0.0
123,opendoorpsychiatry,It sounds as if you have quite a complicated problem from what you say of your thyroid problem and the fact that you haven't got better despite trying a number of different antidepressants.Have you had the opportunity to see a psychiatrist yet?,0.0,0.0,0.0,0.806405,0.836334,0.0,0.0
123,opendoorpsychiatry,Because you have this complicated mix of a thyroid problem associated with depression and not responding to standard treatments including counselling you should have the opportunity to see a psychiatrist.,0.0,0.0,0.0,0.820076,0.704916,0.0,0.0
123,opendoorpsychiatry,"I would hope that a psychiatrist would be to give you some specific advice about other things you could do to help treat your depression.All the best,Andy""",0.0,0.0,0.0,0.733401,0.0,0.0,0.74407
124,creamcheese,"b""That's worth a try.",0.0,0.0,0.612843,0.0,0.0,0.0,0.822231
124,creamcheese,"Good luck Mark.""",0.0,0.0,0.808282,0.0,0.620279,0.0,0.994446
126,creamcheese,b'No problem.,0.0,0.0,0.0,0.0,0.982476,0.0,0.0
126,creamcheese,Really hope you get this depression sorted.Hope you have a nice weekend.Take care Becky',0.0,0.0,0.0,0.692505,0.506763,0.0,0.88939
128,creamcheese,"b""Hi MarkWhat about trying to stay busy?",0.0,0.0,0.0,0.0,0.0,0.0,0.88939
128,creamcheese,Helps to stop thinking all the time.,0.0,0.0,0.0,0.0,0.801827,0.92125,0.0
128,creamcheese,"At least it's better then sitting down and think over things.""",0.0,0.0,0.0,0.0,0.959869,0.0,0.0
130,madmark,b'well here goes with a update on my progress its a wierd feeling like i never felt before i seem to still have no emotions not sad not happy ?,0.0,0.0,0.0,0.0,0.0,0.0,0.515711
130,madmark,since i gave up fighting with myself and putting on a show trying to let people think i was happy i just said to myself f*ck it a aint doing it no more i feel 10 times better stoped my counsoling and just not bothering with all the depression crap no more i refuse to be down and i refuse to put on a show of happy old me i am just being the real me yes i am a bit quite and withdrawn within myself but hey not depressed taking hour by hour not day by day and sleeping alot more not stressing over work or nothing else my way is what happens will happen and i sort it when it does working good so far .,0.0,0.0,0.0,0.584109,0.0,0.0,0.0
130,madmark,hope everyone is ok and well oh yer and another thing i keep in my head is i control my mind and i have a choice how i feel not my deppression i am in charge',0.0,0.0,0.0,0.0,0.0,0.0,0.0
134,SimDon,"b'Hi - I\'m new to the forum, I\'ve just finished reading this thread - and I have to admit, you and I are REALLY alike.I don\'t feel much emotion - someone can tell a joke, the room will burst into laughter - I\'ll be sitting there pretending to laugh while thinking, ""wth?""",0.0,0.0,0.550295,0.0,0.0,0.0,0.0
134,SimDon,I can understand your viewpoint on people not being able to help...,0.0,0.0,0.0,0.0,0.702145,0.0,0.0
134,SimDon,"That you\'re grateful to them, but nothing seems to work - It\'s painful, annoying and generally upsetting.I really hope you find a happy balance!Sim.'",0.556352,0.0,0.0,0.0,0.0,0.0,0.773921
143,Sooty1,"b""Hi MadmarkHey I have suffered from Bi-polar for 31 years being on lithium 26 of those years (has given me kidney damage) 5 years ago I had a choice to go on Aripiprazol and have never looked back.My life is so different now I'm in control I am stable and on a good level,I'm where everybody is.",0.0,0.0,0.0,0.665105,0.0,0.0,0.0
143,Sooty1,"It's quite new in New Zealand was tested in America and they had really good results with it.I have not gained much weight and have no side effects at all,it's my wonder drug.Looking forward to hearing from you Sooty1.""",0.0,0.0,0.728805,0.0,0.670204,0.0,0.0
146,Sooty1,"b""Oh Madmark I feel so bad for you have you tried Arapax anti-depressant.",0.0,0.0,0.0,0.732251,0.0,0.0,0.681699
146,Sooty1,It hurt me so much feeling your pain life is there for you to live and live you must.,0.0,0.0,0.0,0.803056,0.0,0.0,0.0
146,Sooty1,Do you believe in God?,0.0,0.0,0.593381,0.0,0.965509,0.0,0.0
