post #,username,text,Anger,Fear,Joy,Sadness,Analytical,Confident,Tentative
1113,jaxie40,',0.0,0.0,0.0,0.0,0.0,0.0,0.0
1114,bulbie,"b""lol kids.My moods crashed.",0.0,0.0,0.0,0.0,0.0,0.0,0.0
1114,bulbie,I feel fat and ugly.,0.0,0.0,0.0,0.0,0.0,0.0,0.822231
1114,bulbie,ffs I'm sickof this.,0.709099,0.0,0.0,0.0,0.0,0.0,0.0
1114,bulbie,"""",0.0,0.0,0.0,0.0,0.0,0.0,0.0
1116,shrew,b'we had a mrs.,0.0,0.0,0.0,0.0,0.0,0.0,0.0
1116,shrew,pratt - my first school teacher she was',0.0,0.0,0.0,0.0,0.0,0.0,0.0
1117,bulbie,b'I bawled my eyes out for a bit.,0.0,0.0,0.0,0.0,0.0,0.0,0.0
1117,bulbie,Still low though.',0.0,0.0,0.0,0.615271,0.0,0.0,0.0
1118,shrew,"b""aww do you want to talk?I'm sure tomorrow you will be better and you have something to look forward to and distract you from things a bit.",0.0,0.0,0.515878,0.0,0.0,0.0,0.0
1118,shrew,"I come over like that a bit sometimes, just for no reason at all.""",0.0,0.0,0.0,0.0,0.560098,0.0,0.845297
1121,jaxie40,"b""Hey bulbie.",0.0,0.0,0.0,0.0,0.0,0.0,0.0
1121,jaxie40,You're a wonderful person.,0.0,0.0,0.750334,0.0,0.0,0.0,0.0
1121,jaxie40,"Look at how much you're doing for L&A, despite what you're going through.",0.0,0.0,0.0,0.0,0.0,0.0,0.0
1121,jaxie40,"Hope you're feeling better today hun """,0.0,0.0,0.608485,0.0,0.0,0.0,0.946222
1122,bulbie,"b""My head kills I haven't made it to group.",0.505834,0.0,0.0,0.0,0.0,0.0,0.0
1122,bulbie,"Fail one.""",0.0,0.0,0.0,0.726376,0.0,0.0,0.0
1124,bulbie,b'Mooooooooo.,0.0,0.0,0.0,0.0,0.0,0.0,0.0
1124,bulbie,',0.0,0.0,0.0,0.0,0.0,0.0,0.0
1125,bulbie,b'Mooooooooo.,0.0,0.0,0.0,0.0,0.0,0.0,0.0
1125,bulbie,',0.0,0.0,0.0,0.0,0.0,0.0,0.0
1126,WigglyOwl,"b""Aww hun, no.",0.0,0.667727,0.0,0.0,0.0,0.0,0.0
1126,WigglyOwl,"It'll be ok it will pass, find something to distract yourself with, i'm sure there is some crap on tv that'll grab you, even if it's for train wreck reasons lol.",0.0,0.0,0.0,0.733429,0.0,0.0,0.0
1126,WigglyOwl,Laugh at the silly Americans etc.,0.0,0.0,0.0,0.0,0.0,0.0,0.0
1126,WigglyOwl,You have an excuse for the headache if your weather is anything like mine.,0.0,0.0,0.0,0.0,0.560098,0.0,0.845297
1126,WigglyOwl,Stormy and raining like a monsoon.,0.0,0.0,0.0,0.0,0.0,0.0,0.75152
1126,WigglyOwl,I swear i just saw a canoe go past.,0.0,0.0,0.0,0.0,0.0,0.0,0.856622
1126,WigglyOwl,"Group will be there next time, so don't worry about it.Here for you, just keep talking  """,0.0,0.0,0.0,0.0,0.0,0.0,0.775166
1128,WigglyOwl,"b""Well there you go, get some new knickers and bras, then you can sit and watch your programs, i knew i wasn't far off when i said train wreck lol A relative of mine was on there once i believe.",0.0,0.0,0.0,0.511098,0.0,0.0,0.0
1128,WigglyOwl,"Not pretty lol""",0.0,0.0,0.0,0.0,0.0,0.0,0.994446
1129,bulbie,"b""Aye train wreck is right, but its background noise if nothing else.",0.0,0.0,0.0,0.0,0.808152,0.0,0.0
1129,bulbie,"The shop is full of giggling girls which I'm finding quite annoying and my head feels like its going to burst.""",0.0,0.0,0.0,0.0,0.0,0.0,0.681699
1130,WigglyOwl,"b""Did you forget your stale baguette?",0.0,0.0,0.0,0.0,0.711887,0.0,0.0
1130,WigglyOwl,Have you taken anything for your head?,0.0,0.0,0.0,0.0,0.0,0.0,0.91961
1130,WigglyOwl,"If not, get yourself to boots/superdrug asap young orange.I just thought do you intend watching, in said new undies?",0.0,0.0,0.0,0.0,0.801827,0.0,0.681699
1130,WigglyOwl,That would combine the 2 perfectly lolOh Gods i just saw how that read... really i'm not thinking about that or meaning that.,0.0,0.0,0.632938,0.0,0.775384,0.0,0.63698
1130,WigglyOwl,"This hole is getting deeper isn't it?....I'm going now """,0.0,0.0,0.0,0.63738,0.0,0.0,0.0
1132,jaxie40,"b""You're sexy enough to turn me orange, my little fruity!",0.0,0.0,0.512495,0.0,0.0,0.0,0.0
1132,jaxie40,"Get yeself to Superdrug then go and put ya feet up """,0.0,0.0,0.0,0.0,0.0,0.0,0.0
1134,jaxie40,b'Are they what I call over shoulder boulder holders?,0.0,0.0,0.0,0.0,0.0,0.0,0.0
1134,jaxie40,',0.0,0.0,0.0,0.0,0.0,0.0,0.0
1136,jaxie40,"b""I need to get new ones.",0.0,0.0,0.0,0.0,0.0,0.0,0.0
1136,jaxie40,The ones I'm wearing now really dig in by the end of the day.,0.0,0.0,0.621526,0.0,0.61476,0.0,0.0
1136,jaxie40,"Can I be surgically altered so I never have to wear a bra again?""",0.0,0.0,0.0,0.0,0.0,0.839923,0.0
1137,bulbie,"b'Actually, yes.",0.0,0.0,0.511634,0.0,0.920855,0.996934,0.0
1137,bulbie,Yes you can.,0.0,0.0,0.0,0.0,0.0,0.0,0.0
1137,bulbie,They make a skin bra under th\xc3\xa9m or something and they stay perky and supported without the need for a bra.',0.0,0.0,0.0,0.0,0.0,0.0,0.769251
1138,WigglyOwl,"b""Oh my lol Good job the kids and hubby can't read this lol The kids would be all ewwww and he would be alll ohhhhhhhh pmslJaxie you could get that done but then you'd be perma perky lolWhat's that saying?",0.0,0.0,0.632792,0.0,0.0,0.0,0.0
1138,WigglyOwl,"Oranges are not the only fruit """,0.0,0.0,0.506622,0.0,0.620279,0.0,0.0
1139,jaxie40,b'Perma perky?,0.0,0.0,0.0,0.0,0.0,0.0,0.0
1139,jaxie40,Better than perma down-by-my-waist!,0.0,0.0,0.630396,0.0,0.0,0.0,0.0
1139,jaxie40,"Oh yes, Oranges are not the only fruit, hey bulbie!",0.0,0.0,0.761564,0.0,0.0,0.0,0.0
1139,jaxie40,',0.0,0.0,0.0,0.0,0.0,0.0,0.0
1143,Tatty,"b""Do you get a funny feeling when they're bouncing off the ceiling?",0.0,0.0,0.0,0.0,0.0,0.0,0.0
1143,Tatty,"Do you boobs hang low?""",0.0,0.0,0.0,0.0,0.0,0.0,0.0
1145,jaxie40,"b""Yes to all of those!",0.0,0.0,0.0,0.0,0.0,0.942582,0.0
1145,jaxie40,"And thanks, Wiggly.",0.0,0.0,0.587559,0.0,0.0,0.0,0.0
1145,jaxie40,"Yes, I read about your day.",0.0,0.0,0.641113,0.0,0.0,0.0,0.75152
1145,jaxie40,"I haven't replied as yet, been rushed of my tootsies, with son's sports day this morning, giving shit to Yodel and Matalan, dealing with my Avon delivery and doing a quick Morrisons shop.Anyone want a Belgium bun? """,0.772098,0.0,0.0,0.0,0.0,0.0,0.0
1147,jaxie40,"b""I know, I'm just Awesome!",0.0,0.0,0.933177,0.0,0.842108,0.0,0.946222
1147,jaxie40,"Gotta get bums into gear to clean the house downstairs, ready for the party tomorrow....which includes putting nice bottle of wine in the fridge for afterwards!",0.0,0.0,0.682251,0.0,0.0,0.0,0.0
1147,jaxie40,"""",0.0,0.0,0.0,0.0,0.0,0.0,0.0
1149,jaxie40,"b""Yes, a couple of Mel's schoolfriends are coming round after pre-school.",0.0,0.0,0.558774,0.0,0.0,0.0,0.0
1149,jaxie40,"It was supposed to be three, but one of them is poorly so won't be here """,0.0,0.0,0.0,0.726849,0.0,0.0,0.615352
1150,bulbie,"b""Im not four, or five, or even three, but can I take her place?",0.0,0.0,0.0,0.0,0.0,0.0,0.968123
1150,bulbie,I'm right in the mood for some jelly and ice cream.,0.0,0.0,0.592923,0.0,0.0,0.0,0.786991
1150,bulbie,"That IS what the kids eat at parties still?""",0.0,0.0,0.0,0.0,0.0,0.0,0.0
1151,shrew,"b""I'm four (...and twenty) Haven't had jelly and ice cream for years - can I come too?Don't be too hard on yourself for not going to group bulbie, you sounded like you had a bad night last night so don't fret it, there will be other chances when you're in a better frame of mind.",0.0,0.0,0.0,0.52881,0.0,0.0,0.0
1151,shrew,"I hope you are alright today """,0.0,0.0,0.0,0.0,0.0,0.0,0.946222
1152,jaxie40,"b'No jelly and ice cream tomorrow, but there will be Disnay princess fairy cakes and chocolate rolls, along with birthday cake, of course!",0.0,0.0,0.852759,0.0,0.0,0.735644,0.0
1152,jaxie40,',0.0,0.0,0.0,0.0,0.0,0.0,0.0
1153,bulbie,"b'Thank you Shrew, why do all the gentlemen live so far away?",0.0,0.0,0.0,0.0,0.788547,0.825035,0.0
1153,bulbie,Jaxie do those fairy cake have the little edible paper bits on?',0.0,0.0,0.0,0.0,0.0,0.0,0.0
1155,bulbie,"b'Keep blushing Shrew, we could all use a heat!",0.0,0.0,0.0,0.0,0.0,0.0,0.0
1155,bulbie,',0.0,0.0,0.0,0.0,0.0,0.0,0.0
1156,shrew,b'a heat?,0.0,0.0,0.0,0.0,0.579367,0.0,0.0
1156,shrew,',0.0,0.0,0.0,0.0,0.0,0.0,0.0
1158,shrew,"b'yeah, but why do we all need heat?",0.0,0.0,0.0,0.0,0.0,0.898327,0.0
1158,shrew,It is quite hot outside today ',0.0,0.0,0.0,0.0,0.0,0.0,0.75152
1163,shrew,b'why?,0.0,0.0,0.0,0.0,0.0,0.0,0.0
1163,shrew,Is yours too? hahahahh sorry ',0.0,0.0,0.0,0.0,0.0,0.0,0.0
1165,shrew,"b""mind like a sewer you, ain't ya?",0.0,0.0,0.516723,0.0,0.0,0.0,0.615352
1165,shrew,"I don't know, so childish...""",0.0,0.0,0.0,0.0,0.0,0.0,0.0
1172,jaxie40,"b""No excuses!!!! Miss Holly's just been going hell for leather on her wheel!",0.671049,0.0,0.0,0.0,0.0,0.0,0.681699
1172,jaxie40,"My daughter's really excited, because I've promised we'll take her in for show & tell next week """,0.0,0.0,0.814264,0.0,0.762356,0.0,0.0
1173,WigglyOwl,b'*Jumps up and down.,0.0,0.0,0.0,0.0,0.0,0.0,0.0
1173,WigglyOwl,Pictures pictures pictures.',0.0,0.0,0.0,0.0,0.0,0.0,0.0
1174,sadgirl,b'What one did you get? Colour?,0.0,0.0,0.0,0.0,0.0,0.0,0.0
1174,sadgirl,Name?,0.0,0.0,0.0,0.0,0.0,0.0,0.0
1174,sadgirl,Jaxie its gonna be fun in your daughters classroom If the hamster escapes can you imagine it it would be like a scene from horrid henry lol my sons got a syrian hamster he loves his food!!!!( The hamster not my son well he does too)',0.0,0.0,0.875145,0.0,0.0,0.0,0.0
1175,jaxie40,"b""Miss Holly's a Syrian hamster, absolutely gorgeous!",0.0,0.0,0.0,0.56211,0.506763,0.955584,0.0
1175,jaxie40,"She won't escape, I won't even risk opening the cage just in case!",0.0,0.0,0.0,0.0,0.702145,0.0,0.946222
1175,jaxie40,"Holly's not eaten a great deal, but we're only had her a few days, so she's still settling it, getting used to two very loud children!""",0.0,0.0,0.583234,0.0,0.0,0.509368,0.0
1178,jaxie40,"b""Miss Holly's very good and me holding her, has been since the first day.",0.0,0.0,0.0,0.722613,0.0,0.727798,0.0
1178,jaxie40,"The man in Pets at Home told me not to touch her for a few days, but I've had so many hamsters over the years and have never done that.",0.0,0.0,0.0,0.0,0.0,0.0,0.0
1178,jaxie40,"In my experience, the sooner you handle them (if you're able) the better.",0.0,0.0,0.0,0.0,0.0,0.0,0.0
1178,jaxie40,They get used to you.,0.0,0.0,0.0,0.0,0.0,0.0,0.0
1178,jaxie40,"I'm going to let the children give her a few treats over the weekend, so they can get used to her climbing on their hands, and so she gets used to them """,0.0,0.0,0.0,0.0,0.0,0.0,0.0
1180,jaxie40,"b""Hey Wise, how are you doing hun?",0.0,0.0,0.527532,0.0,0.0,0.0,0.0
1180,jaxie40,"I'm being given the evil eye as I type, because she want to come out of her cage again!""",0.0,0.0,0.0,0.0,0.793846,0.0,0.0
1183,Wiseowl,"b""I'm okay had a stressful week and it's catching up with slept till 6pm yesterday!",0.0,0.0,0.0,0.0,0.0,0.0,0.0
1183,Wiseowl,Thanks for askingHamsters can be very moody mine can be scary staring at me without blinking.,0.0,0.87309,0.0,0.0,0.0,0.704642,0.0
1183,Wiseowl,It's good she wants to be active.,0.0,0.0,0.0,0.0,0.0,0.0,0.0
1183,Wiseowl,Have you given her some carrots?,0.0,0.0,0.0,0.0,0.0,0.0,0.946222
1183,Wiseowl,I made my own hamster snacks the other day.,0.0,0.0,0.0,0.0,0.0,0.0,0.0
1183,Wiseowl,I was using a butternut squash for a recipe so I took out the seeds cleaned them and dry roasted them at 200 degrees until they began popping.,0.0,0.0,0.0,0.0,0.0,0.0,0.0
1183,Wiseowl,My hammy loves them.,0.0,0.0,0.991375,0.0,0.0,0.0,0.0
1183,Wiseowl,"""",0.0,0.0,0.0,0.0,0.0,0.0,0.0
1184,jaxie40,"b'Loads of  hunNO, I was told no fresh food for a while, but I\'m going to start her on it this weekend.",0.0,0.0,0.0,0.0,0.0,0.0,0.0
1184,jaxie40,"What else do you give yours, Wise?",0.0,0.0,0.0,0.0,0.560098,0.0,0.0
1184,jaxie40,Do I remember you giving him peas before?,0.0,0.0,0.0,0.0,0.762356,0.0,0.0
1184,jaxie40,Your hamster does sound scary!,0.0,0.918038,0.0,0.0,0.0,0.0,0.0
1184,jaxie40,Reminds me of one of my old bunnies.,0.0,0.0,0.0,0.0,0.0,0.0,0.0
1184,jaxie40,"If she was in a mood (which was often) we used to get the ""Rosie Stare"".",0.0,0.0,0.0,0.0,0.506763,0.0,0.0
1184,jaxie40,"She glare and chew at the same time Right, I\'m off to bed, so shall bid you all goodnight'",0.0,0.0,0.668483,0.0,0.0,0.6821,0.0
1186,Wiseowl,"b""peas, carrot, courgette, dried peaches, raisins, sultanas, milk drops, wilkinsons hamster biscuits, brocoli, apple, banana chips (not too many because of the added oil and sugar), seed bars, strawberries (seeds removed), grapes, fresh peach, parsnip, mango, roast chestnuts (very tiny bit at xmas due to the calories), carrot tops, cucumber (not the watery bit in the middle the edges), dried whole sweetcorn you get in pet shops, 1/4 of a weetabix and cherries to name a few.",0.0,0.0,0.0,0.0,0.560098,0.0,0.0
1186,Wiseowl,He's very spoilt.,0.0,0.0,0.0,0.862998,0.0,0.989586,0.0
1186,Wiseowl,I started giving him fresh fruit in the first week a very small amount.,0.0,0.0,0.741631,0.0,0.0,0.866237,0.0
1186,Wiseowl,"Indy does seem quite resilent he doesn't suffer from a bad stomach.My hammy glares at me if I'm on the phone he wants all the attention You'll have to share some pics let us know how she gets on""",0.0,0.0,0.0,0.0,0.608261,0.0,0.0
1189,jaxie40,"b""Spock's cute, bulbie, and a very happy birthday for yesterdday Yess, I will keep posting photo's too, Wise.",0.0,0.0,0.959471,0.0,0.0,0.638987,0.0
1189,jaxie40,"There is one on his thread, but it's not that good.",0.0,0.0,0.0,0.0,0.0,0.0,0.0
1189,jaxie40,She's been out on here wheel this morning while I was on my exercise bike.,0.0,0.0,0.677264,0.0,0.0,0.0,0.0
1189,jaxie40,"She's gone back to bed now!Did you get your new over shoulder boulder holders, bulbie?",0.0,0.0,0.0,0.0,0.0,0.0,0.0
1189,jaxie40,"""",0.0,0.0,0.0,0.0,0.0,0.0,0.0
1190,Wiseowl,b'Bulbie a belated Happy birthday!,0.0,0.0,0.939474,0.0,0.0,0.0,0.0
1190,Wiseowl,',0.0,0.0,0.0,0.0,0.0,0.0,0.0
1191,WigglyOwl,"b""EEp where did my reply go?Happy Birthday for yesterday hun.",0.0,0.0,0.873989,0.0,0.0,0.0,0.0
1191,WigglyOwl,"Did you have cake?Spock looks such a sweetie, i had dwarfs once tried to breed them, but the male kept getting the wrong end of the female pmsl.",0.0,0.0,0.0,0.516566,0.0,0.0,0.0
1191,WigglyOwl,One day she'd had enough of it in her ear all day so she tried to bite his balls off.,0.0,0.0,0.0,0.0,0.0,0.0,0.0
1191,WigglyOwl,"Had to separate them sharpish.What does today hold?""",0.0,0.0,0.0,0.0,0.0,0.833309,0.0
1192,bulbie,b'I did I got three sets!,0.0,0.0,0.0,0.0,0.0,0.0,0.0
1192,bulbie,',0.0,0.0,0.0,0.0,0.0,0.0,0.0
1194,bulbie,"b""Haha shrew I'm not sure the rest of the girls would be cool with that!",0.0,0.0,0.905916,0.0,0.0,0.0,0.0
1194,bulbie,And thank you.,0.0,0.0,0.880435,0.0,0.0,0.0,0.0
1194,bulbie,"Spock is fast asleep this morning.""",0.0,0.514212,0.0,0.0,0.0,0.0,0.0
1195,jaxie40,"b""You could always send the pics via PM, bulbie!",0.0,0.0,0.0,0.0,0.0,0.0,0.0
1195,jaxie40,"Oh, off to Hobbycraft again in about half an hour if you'd like to join me and my son """,0.0,0.0,0.0,0.0,0.0,0.0,0.525007
1197,jaxie40,"b'Wow, that was fun!",0.0,0.0,0.954437,0.0,0.0,0.0,0.0
1197,jaxie40,We have nearly every colour Hobbycraft paint now.,0.0,0.0,0.0,0.0,0.0,0.0,0.0
1197,jaxie40,"We have all the glitter paints, all the pearlised, just need the remaining ordinary paints Oh, and treated myself to another suncatcher'",0.0,0.0,0.0,0.0,0.0,0.579436,0.0
1200,bulbie,"b""I just can't get myself out of bed today.",0.0,0.0,0.543146,0.0,0.0,0.0,0.822231
1200,bulbie,"""",0.0,0.0,0.0,0.0,0.0,0.0,0.0
1201,shrew,b'how are you feeling?,0.0,0.0,0.0,0.644819,0.0,0.0,0.0
1201,shrew,Just tired or lack of motivation?,0.0,0.0,0.0,0.749125,0.955445,0.0,0.994446
1201,shrew,Hope you are ok.,0.0,0.0,0.0,0.0,0.0,0.0,0.984352
1201,shrew,Share it with us girls ',0.0,0.0,0.0,0.0,0.0,0.0,0.0
1203,shrew,"b""why are you feeling like that today?",0.0,0.0,0.0,0.580992,0.0,0.0,0.615352
1203,shrew,Has anything triggered it?,0.0,0.0,0.0,0.0,0.920855,0.0,0.984352
1203,shrew,"Maybe put some happy music on and go and see the hamster, might cheer you up a bit, or just veg out on the sofa and watch something rubbish.",0.0,0.0,0.792585,0.0,0.0,0.0,0.971243
1203,shrew,"I have days like this, a lot recently, where I just don't feel motivated to do a thing or go in.",0.0,0.0,0.0,0.0,0.0,0.0,0.946222
1203,shrew,It is good to have a bit of alone time.I'm sorry.,0.0,0.0,0.0,0.627902,0.0,0.0,0.0
1203,shrew,"I never fully consider things with you bulbie - you always seem so happy and fun on here and I forget sometimes how you're feeling the rest of the time.""",0.0,0.0,0.607367,0.0,0.0,0.0,0.0
1204,Starless,"b""It's no crime to have the odd off day love.",0.0,0.0,0.827535,0.0,0.0,0.0,0.0
1204,Starless,"""",0.0,0.0,0.0,0.0,0.0,0.0,0.0
1207,bulbie,"b""Nothings triggered it really...",0.0,0.0,0.0,0.0,0.970179,0.0,0.0
1207,bulbie,"Not that I'm aware of, anyway.",0.0,0.0,0.0,0.0,0.0,0.0,0.0
1207,bulbie,"I'll pose for you tomorrow, Shrew.",0.0,0.0,0.0,0.0,0.0,0.0,0.0
1207,bulbie,"""",0.0,0.0,0.0,0.0,0.0,0.0,0.0
1208,shrew,b'hahahaI hope you feel better soon bulbie.,0.0,0.0,0.0,0.0,0.0,0.0,0.974201
1208,shrew,"Like star said, alright to have off days, it is understandable.",0.0,0.0,0.606332,0.0,0.788547,0.0,0.0
1208,shrew,Have you played with the hamster?,0.0,0.0,0.0,0.0,0.0,0.0,0.0
1208,shrew,(that is not a euphamism by the way)',0.0,0.0,0.0,0.0,0.0,0.0,0.0
1209,bulbie,"b""Spock got out this morning.",0.0,0.0,0.0,0.0,0.0,0.0,0.0
1209,bulbie,"He's crazy fast.""",0.0,0.0,0.0,0.0,0.0,0.0,0.0
1212,shrew,"b""I take it you got him back then.",0.0,0.0,0.0,0.0,0.0,0.0,0.0
1212,shrew,"I tried to catch a rabbit and pick it up but it was skin and bones, there was nothing there on the body, same with cats.Are you thinking to give the group thing another try when it's next on?""",0.0,0.0,0.0,0.0,0.0,0.0,0.0
1213,bulbie,"b""I will be giving group another go yeah.Yup I goit him back with my dads help.",0.0,0.0,0.0,0.0,0.0,0.0,0.0
1213,bulbie,We managed to scoop him up and put him in the exercise ball.,0.0,0.0,0.0,0.0,0.0,0.0,0.0
1213,bulbie,"He's so cute, not much bigger than a gumball.""",0.0,0.0,0.0,0.0,0.0,0.0,0.0
1214,jaxie40,"b""Aww, he sounds adorable, bulbie!",0.0,0.0,0.803318,0.0,0.0,0.0,0.0
1214,jaxie40,"I've just worked out how to put the hamster ball together, now Miss Holly is running round in it, with an apple yoghurt drop in her cheeks!",0.0,0.0,0.0,0.699226,0.0,0.0,0.0
1214,jaxie40,"""",0.0,0.0,0.0,0.0,0.0,0.0,0.0
1215,bulbie,"b""I used to have a hamtard that would hide treats in his cheeks.",0.0,0.0,0.0,0.0,0.0,0.0,0.0
1215,bulbie,But once he got hold of an actual malteser.,0.0,0.0,0.0,0.0,0.0,0.874372,0.0
1215,bulbie,"He amazingly managed to stuff it in there, along with one in the other cheek.",0.0,0.0,0.0,0.0,0.0,0.0,0.0
1215,bulbie,We couldn't get them out without hurting him.,0.0,0.0,0.0,0.0,0.0,0.0,0.0
1215,bulbie,"He decided to wait until they had melted before emptyingg his cheeks all over my knee.""",0.0,0.0,0.0,0.0,0.762356,0.898327,0.0
1216,jaxie40,b'Nice! lol.,0.0,0.0,0.918888,0.0,0.0,0.0,0.0
1216,jaxie40,"I remember I used to watch one of my many hamsters fill his pouches, go into his bed and spit all the food out! '",0.0,0.0,0.0,0.0,0.0,0.543112,0.0
1218,jaxie40,"b""That's one of my demands for next Saturday morning!",0.0,0.0,0.571851,0.0,0.0,0.0,0.0
1218,jaxie40,"""",0.0,0.0,0.0,0.0,0.0,0.0,0.0
1219,bulbie,"b""I don't recall a partner ever doing that for me.",0.0,0.0,0.503029,0.0,0.653099,0.579436,0.0
1219,bulbie,"""",0.0,0.0,0.0,0.0,0.0,0.0,0.0
1220,jaxie40,"b""I only get breekie in bed on Mother's Day, and am only getting it next week because Ive told hubby he's got not choice!",0.0,0.0,0.75985,0.0,0.74948,0.0,0.0
1220,jaxie40,"He gets the full cooked brekkie on his birthday and Father's Day, so he can't complain!""",0.0,0.0,0.747657,0.0,0.0,0.0,0.0
1221,bulbie,"b""I had better teach d how to do it, for all the work I'm putting into helping him find his flat.",0.0,0.0,0.0,0.0,0.0,0.598602,0.0
1221,bulbie,"Humph.""",0.0,0.0,0.0,0.0,0.0,0.0,0.0
1223,jaxie40,b'Definitely!,0.0,0.0,0.647093,0.0,0.0,0.999744,0.0
1223,jaxie40,"It can take some doing, with occassional threats of violence!",0.0,0.764756,0.0,0.0,0.0,0.0,0.822231
1223,jaxie40,"Years of training, sadgirl!",0.0,0.0,0.595901,0.0,0.0,0.0,0.0
1223,jaxie40,',0.0,0.0,0.0,0.0,0.0,0.0,0.0
1226,jaxie40,b'The sooner the better!,0.0,0.0,0.61976,0.0,0.0,0.0,0.0
1226,jaxie40,"Gotta start early with them Getting dinner cooked for me next Saturday too, plus lush pud!'",0.0,0.0,0.56236,0.0,0.0,0.0,0.0
1227,WigglyOwl,"b""I never get brekkie in bed.",0.0,0.0,0.0,0.0,0.0,0.751512,0.0
1227,WigglyOwl,"One of my hammy's once managed to get 6 of those little milk bones in, 2 in each cheek one i've no idea and carry one in her mouth lol.""",0.0,0.0,0.0,0.516345,0.0,0.0,0.0
1228,jaxie40,"b'I\'m very lucky with my hubby, I know.",0.0,0.0,0.816548,0.0,0.724236,0.0,0.0
1228,jaxie40,"Just been talking about a Jezzer Kyle question on Facebook, ""Would you leave your partner if they gained a lot of weight?"" .",0.0,0.0,0.0,0.0,0.788547,0.0,0.786991
1228,jaxie40,"Most of the men have said, yes, they would, the women said they wouldn\'t.",0.0,0.0,0.0,0.0,0.0,0.0,0.0
1228,jaxie40,"My hubby\'s seen me put on weight when we first moved in together, he saw me lose that.",0.0,0.0,0.0,0.538195,0.620279,0.0,0.0
1228,jaxie40,"He saw me gain 4 1/2 stone during my first pregnancy, losing all but a stone of it before I fell pregnant again.",0.0,0.0,0.0,0.0,0.0,0.543112,0.0
1228,jaxie40,"When we\'d moved and settle, I lost weight again, then went over the top and developed an ED.",0.0,0.0,0.0,0.0,0.0,0.0,0.0
1228,jaxie40,"He\'s never said anything when I\'ve gained weight, but he was so worried when I lost a load.We\'ve been through a lot together, he\'s truly my best friend '",0.0,0.0,0.0,0.0,0.0,0.0,0.0
1229,WigglyOwl,"b""Aww you are so lucky Jaxie.",0.0,0.0,0.71908,0.0,0.0,0.0,0.91961
1229,WigglyOwl,"Mine thinks i am his life, which means i kind of don't get to have mine.""",0.0,0.0,0.0,0.0,0.595347,0.0,0.615352
1230,shrew,"b""jaxie, you are living the dream  Sounds brilliantI'd do breakfast in bed for a bird I reckon.",0.0,0.0,0.777235,0.0,0.0,0.0,0.5538
1230,shrew,Wouldn't be so keen on getting it though as it is never right.,0.0,0.0,0.0,0.0,0.0,0.509368,0.0
1230,shrew,My nan used to lay everything out in the morning if I stayed round her house when I was younger.,0.0,0.0,0.0,0.0,0.0,0.0,0.0
1230,shrew,The milk ends up getting a bit warm which irks me How are you feeling bulbie?,0.0,0.0,0.0,0.0,0.0,0.0,0.0
1230,shrew,"Been up to much?""",0.0,0.0,0.0,0.0,0.0,0.0,0.0
1231,bulbie,b'Am I a sad individual Shrew?,0.0,0.0,0.0,0.872424,0.0,0.0,0.0
1231,bulbie,I joined a dating site....',0.0,0.0,0.0,0.0,0.0,0.0,0.0
1233,bulbie,"b""Oh good.",0.0,0.0,0.0,0.0,0.0,0.0,0.0
1233,bulbie,"It's a distraction, if nothing else.",0.0,0.0,0.0,0.0,0.920855,0.0,0.0
1233,bulbie,"Can't hurt to make new friends and see what's out there...""",0.0,0.0,0.74419,0.0,0.0,0.0,0.0
1234,shrew,b'exactly.,0.0,0.0,0.0,0.0,0.0,0.999744,0.0
1234,shrew,Loads of people do it nowadays and there are so many stories of people meeting online and being happy ',0.0,0.0,0.746367,0.0,0.0,0.0,0.0
1236,shrew,"b""No.",0.0,0.0,0.0,0.0,0.0,0.0,0.0
1236,shrew,Was too nervous.,0.0,1.0,0.0,0.0,0.0,0.0,0.0
1236,shrew,"I'm 24 and studying full-time and working part time - it might be awkward with people sometimes, though this is probably my own hang ups.",0.0,0.0,0.0,0.667221,0.0,0.0,0.88939
1236,shrew,"I don't know, it's just me.",0.0,0.0,0.0,0.0,0.842108,0.0,0.946222
1236,shrew,"All I want out of my life is to meet someone, fall in love and be able to be together, look after one another and share experiences, stories and a future together.""",0.0,0.0,0.824837,0.0,0.0,0.0,0.0
1238,shrew,"b""I told you earlier that you seem to have a good sense of humour and your posts always make me smile.",0.0,0.0,0.887659,0.0,0.560098,0.0,0.0
1238,shrew,That is always good.,0.0,0.0,0.780432,0.0,0.0,0.97759,0.0
1238,shrew,"From what I gather just on here you have good morals and are a carng and sensitive person, which will make someone very happy.",0.0,0.0,0.825813,0.0,0.0,0.0,0.0
1238,shrew,You've just had bad luck is all.,0.0,0.798165,0.0,0.862998,0.0,0.0,0.91961
1238,shrew,Anyone who doesn't appreciate you is a fool.,0.0,0.0,0.0,0.0,0.762356,0.0,0.88939
1238,shrew,"Not anything you've done, or at least anything you can help.",0.0,0.0,0.0,0.0,0.0,0.0,0.988397
1238,shrew,"It is just the way it is sometimes.""",0.0,0.0,0.0,0.545784,0.0,0.0,0.984352
1240,shrew,"b""Doesn't always have to be that way just because it has been so far.",0.0,0.0,0.0,0.0,0.886021,0.0,0.677247
1240,shrew,"It will change.""",0.0,0.931034,0.0,0.0,0.0,0.0,0.0
1242,shrew,"b""I'm a bit behind.",0.0,0.0,0.0,0.0,0.0,0.0,0.0
1242,shrew,What did he do?,0.0,0.0,0.0,0.0,0.0,0.0,0.0
1242,shrew,"Can speak by PM if you prefer.""",0.0,0.0,0.0,0.0,0.93884,0.0,0.0
1246,jaxie40,"b""He is the lowest of the low to cheat on my bulbie You're not sad hun!",0.0,0.0,0.0,0.0,0.0,0.0,0.0
1246,jaxie40,"I think after my first husband, I would have eventually dont that had I not met hubby, bearing in mind I was 31 when I met him.",0.0,0.0,0.0,0.0,0.0,0.0,0.0
1246,jaxie40,"Bulbie, as shrew said ealier, you have a wicked sense of humour, one day you will find someone who just gets you """,0.0,0.0,0.0,0.0,0.0,0.0,0.786991
1247,bulbie,b'I got given a phone number last night.,0.0,0.0,0.0,0.0,0.0,0.0,0.0
1247,bulbie,',0.0,0.0,0.0,0.0,0.0,0.0,0.0
1248,jaxie40,"b""ANOTHER one?",0.0,0.0,0.0,0.0,0.0,0.0,0.0
1248,jaxie40,You're obviously giving out some sort of Bulbie Vibe at the moment!,0.0,0.0,0.616356,0.0,0.0,0.0,0.75152
1248,jaxie40,"""",0.0,0.0,0.0,0.0,0.0,0.0,0.0
1250,jaxie40,b'Definitely not hun!,0.0,0.0,0.0,0.0,0.0,0.989586,0.0
1250,jaxie40,',0.0,0.0,0.0,0.0,0.0,0.0,0.0
1254,Tatty,"b""What's wrong jaxie?",0.0,0.0,0.0,0.586306,0.0,0.0,0.0
1254,Tatty,"""",0.0,0.0,0.0,0.0,0.0,0.0,0.0
1256,jaxie40,"b""I don't know, just feeling really crap.",0.0,0.0,0.0,0.0,0.0,0.0,0.88939
1256,jaxie40,"Anxiety is sky high""",0.0,0.839267,0.0,0.0,0.0,0.0,0.0
1259,WigglyOwl,"b""extemely crap sorry to say  It's stupid, i can't help it.",0.627657,0.0,0.0,0.0,0.0,0.0,0.0
