post #,username,text,Anger,Fear,Joy,Sadness,Analytical,Confident,Tentative
580,Wiseowl,"b""Jaxie I think you're being an orangist someone who clearly has a problem with an animate fruit because it's orange lol.and on the subject of food that lives who the heck does a hotdog go anywhere without some drunk/stoned person eating them for a midnight snack?",0.0,0.0,0.0,0.0,0.0,0.0,0.0
580,Wiseowl,The world must be a constantly scary dangerous place for you my friend.,0.0,0.853196,0.0,0.0,0.0,0.775702,0.0
580,Wiseowl,"""",0.0,0.0,0.0,0.0,0.0,0.0,0.0
581,jaxie40,"b""I'm not orangist, not at all The world doesn't scare me, not with my teeth!",0.0,0.0,0.0,0.0,0.0,0.0,0.0
581,jaxie40,"Plus, who wants to eat a 40 year old hotdog!",0.0,0.0,0.0,0.0,0.0,0.0,0.0
581,jaxie40,"""",0.0,0.0,0.0,0.0,0.0,0.0,0.0
582,Wiseowl,"b""Sorry Jaxie of course you're not..I didn't mean to upset you.",0.0,0.0,0.0,0.0,0.0,0.898327,0.0
582,Wiseowl,Wow a 40 year old hotdog think of the bacteria!,0.0,0.0,0.0,0.0,0.955445,0.0,0.0
582,Wiseowl,"You have teeth it's hard to see in your pic do you floss?""",0.0,0.0,0.0,0.0,0.0,0.0,0.0
583,jaxie40,b'Hotdog.jpgI,0.0,0.0,0.0,0.0,0.0,0.0,0.0
583,jaxie40,"do floss, twice a day.",0.0,0.0,0.0,0.0,0.0,0.0,0.0
583,jaxie40,And I polish and sharpen my fangs regularly too',0.0,0.0,0.0,0.0,0.0,0.0,0.0
584,Wiseowl,"b""I'm scared  a vampire hotdog!What do you get if you cross a snake with a hotdog?",0.0,0.824065,0.0,0.0,0.0,0.0,0.0
584,Wiseowl,"A fangfurther.""",0.0,0.0,0.0,0.0,0.0,0.0,0.0
586,bulbie,b'Oh the joys of dyslexia - I thought you called her an organist!,0.0,0.0,0.602179,0.0,0.0,0.0,0.0
586,bulbie,',0.0,0.0,0.0,0.0,0.0,0.0,0.0
587,TiredTina,b'This thread is getting more strange by the minute!!jaxie - did you always have fangs since you became a hotdog?,0.0,0.0,0.0,0.0,0.0,0.618451,0.0
587,TiredTina,If so I need new glasses because I didnt notice before.,0.0,0.0,0.0,0.0,0.862286,0.0,0.0
587,TiredTina,"I take back what I said about not being able to take you seriously, I take a vampire hotdog very seriously!",0.0,0.0,0.0,0.0,0.0,0.751512,0.0
587,TiredTina,',0.0,0.0,0.0,0.0,0.0,0.0,0.0
591,jaxie40,"b""I think I'm gonna disappear for the rest of the day guys.",0.0,0.0,0.0,0.0,0.0,0.0,0.0
591,jaxie40,"Really struggling """,0.0,0.0,0.0,0.736265,0.982476,0.0,0.0
592,bulbie,b'Ok jaxie.,0.0,0.0,0.0,0.0,0.0,0.0,0.0
592,bulbie,love youuuuuuuuuu',0.0,0.0,0.991342,0.0,0.0,0.0,0.0
594,Starless,b' Hope you feel better soon Jaxie hun.,0.0,0.505836,0.0,0.0,0.0,0.0,0.961411
594,Starless,xx',0.0,0.0,0.0,0.0,0.0,0.0,0.0
595,jaxie40,"b'Back to pester you lot, especially you, you juicy citrus fruit!",0.0,0.0,0.548319,0.0,0.0,0.0,0.0
595,jaxie40,',0.0,0.0,0.0,0.0,0.0,0.0,0.0
597,jaxie40,b'you juicy citrus fruit!,0.0,0.0,0.0,0.0,0.0,0.0,0.0
597,jaxie40,',0.0,0.0,0.0,0.0,0.0,0.0,0.0
600,bulbie,"b'Well, we can do serious or random, your choice.",0.0,0.0,0.0,0.0,0.724236,0.0,0.946222
600,bulbie,',0.0,0.0,0.0,0.0,0.0,0.0,0.0
601,jaxie40,"b""That's part of the problem.",0.0,0.0,0.0,0.732451,0.873624,0.0,0.0
601,jaxie40,"Part of me feels really good, another feels really low.",0.0,0.0,0.0,0.0,0.896021,0.0,0.822231
601,jaxie40,"I've SH today out of frustration, so much crap going on in my head """,0.625358,0.0,0.0,0.0,0.0,0.0,0.0
603,jaxie40,"b""I'm fine on here hun.",0.0,0.0,0.643857,0.0,0.0,0.0,0.0
603,jaxie40,"Really don't know what to say, though""",0.0,0.0,0.0,0.0,0.93884,0.0,0.0
604,bulbie,"b'Its fine, if you want to say nothing, say nothing, if you want to talk rubbish talk ruibbish.",0.0,0.0,0.0,0.0,0.724236,0.0,0.0
604,bulbie,X',0.0,0.0,0.0,0.0,0.0,0.0,0.0
605,jaxie40,"b""I just had this thing about SHing today, and wasn't happy until I had.",0.0,0.0,0.504853,0.0,0.0,0.0,0.822231
605,jaxie40,I couldn't settle.,0.0,0.0,0.0,0.0,0.0,0.0,0.0
605,jaxie40,Glad I'm seeing my doctor tomorrow.,0.0,0.0,0.603927,0.0,0.0,0.0,0.0
605,jaxie40,"How's you, anyway?""",0.0,0.0,0.0,0.0,0.0,0.0,0.0
606,bulbie,"b""I'm in one of those moods for which there is no word.",0.0,0.0,0.0,0.0,0.0,0.0,0.0
606,bulbie,"I watched eraserhead and I think its done things to my brain.""",0.0,0.0,0.0,0.0,0.620279,0.0,0.0
608,cfb107,"b""So this is where you've been hiding B!!!! 61 pages...",0.0,0.0,0.0,0.0,0.0,0.0,0.0
608,cfb107,You guys have been busy!,0.0,0.0,0.0,0.504747,0.0,0.0,0.0
608,cfb107,How are you doing with the whole loneliness thing?,0.0,0.0,0.0,0.942862,0.0,0.0,0.0
608,cfb107,Any better?,0.0,0.0,0.851351,0.0,0.0,0.0,0.998976
608,cfb107,"So been there, done that...",0.0,0.0,0.0,0.0,0.0,0.0,0.0
608,cfb107,"The surprising thing is for me that being 'settled' doesn't take it away... Big hugs  (I just wrote bug hugs by accident but changed it, you can have bug hugs as well coz you're you)""",0.0,0.0,0.0,0.0,0.0,0.0,0.0
609,bulbie,b'I like bug hugs!,0.0,0.0,0.0,0.0,0.0,0.0,0.88939
609,bulbie,"And yes jaxxie, my brain is broken, so I absolutely should not be telling you it can be found on google videos...'",0.0,0.0,0.0,0.0,0.0,0.0,0.0
612,jaxie40,"b""Have you seen Lost's last post, bulbie?",0.0,0.0,0.0,0.659118,0.0,0.0,0.0
612,jaxie40,"Really worried about her""",0.0,0.849586,0.0,0.0,0.920855,0.0,0.88939
614,Lostie,b'I know what its like to feel alone.,0.0,0.0,0.0,0.694966,0.762356,0.0,0.88939
614,Lostie,If I could sum my life up in a word alone would sound pretty much accurate from where Im sitting.,0.0,0.0,0.0,0.0,0.8766,0.0,0.0
614,Lostie,"So im on the market for friends if you ever need one, I could use some.",0.0,0.0,0.0,0.0,0.0,0.0,0.798791
614,Lostie,Making friends is not my strong suit..especially since im different.,0.0,0.0,0.0,0.0,0.788547,0.0,0.0
614,Lostie,As different as any of you it would seem xx',0.0,0.0,0.0,0.0,0.0,0.0,0.968123
615,jaxie40,"b""Hey Lostie.",0.0,0.0,0.0,0.0,0.0,0.0,0.0
615,jaxie40,"Making friends isn't easy, is it?",0.0,0.0,0.544593,0.0,0.842108,0.0,0.0
615,jaxie40,"I always knew I was different somehow, and it's good to find others who are on the same wavelength.",0.0,0.0,0.586307,0.0,0.705784,0.0,0.0
615,jaxie40,"Welcome to the forum, by the way """,0.0,0.0,0.712886,0.0,0.0,0.0,0.0
616,Wiseowl,"b""Hi guys how are you?",0.0,0.0,0.0,0.0,0.0,0.0,0.0
616,Wiseowl,Having one of those days where getting up is a mammoth event my brain is saying 'go back to bed'.,0.0,0.0,0.0,0.541267,0.0,0.0,0.0
616,Wiseowl,Got art group this morning so have to get up and at it.,0.0,0.0,0.670741,0.0,0.0,0.704642,0.0
616,Wiseowl,Making friends is very difficult but it does happen and being on this forum is a good way of practicing your skills.,0.0,0.0,0.527388,0.0,0.0,0.579436,0.0
616,Wiseowl,"Hugs to all """,0.0,0.0,0.880435,0.0,0.0,0.989586,0.0
617,bulbie,"b""Morning my little hooter.Lostie I would love to be your friend.I can't get started this morning.",0.0,0.0,0.755723,0.0,0.0,0.0,0.0
617,bulbie,"Vroom vroom brain.""",0.0,0.0,0.0,0.0,0.0,0.0,0.0
620,jaxie40,"b""Not today you can't.",0.0,0.0,0.0,0.0,0.0,0.0,0.0
620,jaxie40,"Haven't got the energy, and my head's beginning to hurt""",0.0,0.503506,0.0,0.0,0.0,0.0,0.0
623,bulbie,b'Believe me I do understand.,0.0,0.0,0.0,0.0,0.882284,0.0,0.968123
623,bulbie,"So can I cheer you up instead, or use my giant ears to listen to you?'",0.0,0.0,0.519449,0.0,0.0,0.0,0.615352
624,jaxie40,"b""I just can't explain how I feel though.",0.0,0.0,0.0,0.604336,0.724236,0.0,0.946222
624,jaxie40,"I sat balling my eyes out at the doctors yesterday morning, because I couldn't explain myself properly.",0.0,0.0,0.0,0.0,0.743104,0.0,0.0
624,jaxie40,"It didn't help that I SH'd the day before, either.""",0.0,0.0,0.0,0.0,0.687768,0.0,0.0
627,bulbie,"b""Maybe its just the nature of the depression jaxie?",0.0,0.0,0.0,0.939577,0.0,0.0,0.968123
627,bulbie,"I know when I'm having a breakdown, I cry at random and such.",0.0,0.0,0.0,0.875672,0.73677,0.0,0.716301
627,bulbie,"Xx""",0.0,0.0,0.0,0.0,0.0,0.0,0.0
628,jaxie40,"b""I'm just in such a weird place.",0.0,0.0,0.0,0.0,0.0,0.0,0.88939
628,jaxie40,"i'm happy that I'm eating normally again, and feeling no guilt.",0.0,0.0,0.884897,0.0,0.0,0.0,0.0
628,jaxie40,I'm loving that i'm a happy mummy and wife.,0.0,0.0,0.959212,0.0,0.0,0.0,0.0
628,jaxie40,"I can't even describe why I'm feeling crap, though I think memories of the past have been creeping back.",0.0,0.0,0.0,0.68053,0.0,0.0,0.525007
628,jaxie40,I wish I never had to see my parents again.,0.0,0.0,0.0,0.578135,0.0,0.916773,0.0
628,jaxie40,"I know that sounds awful, but every time I see them, I'm reminded""",0.0,0.0,0.0,0.0,0.589295,0.775702,0.0
629,MacDuffH,b'I feel the same about my parents after what I\'ve been through with them.,0.0,0.0,0.0,0.0,0.0,0.0,0.647986
629,MacDuffH,Most of the time I have no idea what emotions I\'m even feeling.,0.0,0.0,0.0,0.0,0.560098,0.0,0.845297
629,MacDuffH,Yesterday I just started crying hysterically in the car.,0.0,0.0,0.0,0.829724,0.0,0.0,0.856622
629,MacDuffH,"When my boyfriend asked why all I could say was ""I don\'t know"".",0.0,0.0,0.0,0.0,0.560098,0.0,0.0
629,MacDuffH,I was just feeling down in general.,0.0,0.0,0.0,0.0,0.920855,0.0,0.946222
629,MacDuffH,I couldn\'t separate one emotion from another or figure out the reason behind them.,0.0,0.0,0.0,0.596495,0.781949,0.0,0.647986
629,MacDuffH,I hope your mood lightens soon.,0.0,0.0,0.0,0.0,0.0,0.0,0.946222
629,MacDuffH,Try to keep your chin up.',0.0,0.0,0.0,0.0,0.0,0.0,0.75152
631,jaxie40,"b""Thanks MacDuffH.",0.0,0.0,0.592297,0.0,0.0,0.0,0.0
631,jaxie40,"I hope you're ok too Well, Karma's cheered me up a bit.",0.0,0.0,0.730313,0.0,0.0,0.0,0.75152
631,jaxie40,"A mother who's tried causing a lot of problems for me down at the school (who said playground behaviour ended when you leave school, which I did some 25 years ago now!) is in trouble with the police for something.",0.0,0.0,0.0,0.526524,0.0,0.0,0.704683
631,jaxie40,"I overheard her talking in her usual loud voice earlier, saying she's due in court next week, and could go to prison.",0.0,0.0,0.0,0.647315,0.0,0.0,0.659112
631,jaxie40,"Yes, I really feel for the kids, because it's going to be them that suffer, but IMO, the kids should have been taken away by social services last year when they had to go to court.",0.0,0.0,0.0,0.718285,0.0,0.0,0.0
631,jaxie40,"The father's a junkie, who's attacked the mother, tried choking her etc, and the kids see it all.",0.0,0.0,0.0,0.0,0.0,0.0,0.0
631,jaxie40,"No wonder the son tried choking others in pre school last year, including my son!""",0.0,0.0,0.0,0.0,0.0,0.0,0.822231
634,jaxie40,"b""Unfortunately yes.",0.0,0.0,0.0,0.0,0.0,0.0,0.0
634,jaxie40,"It's my dad's birthday tomorrow, and it's Father's Day on Sunday, so we're going for a couple of hours on Sunday.",0.0,0.0,0.767653,0.0,0.0,0.0,0.0
634,jaxie40,"I got questioned as to why we weren't staying for dinner, and I just pointed out that my husband happens to be a dad too, and that he deserves to be made a fuss of too.",0.0,0.0,0.0,0.0,0.0,0.0,0.0
634,jaxie40,"Didn't go down well, but my dad has to realise that our lives don't revolve around him.",0.0,0.0,0.0,0.550551,0.506763,0.0,0.0
634,jaxie40,"Plus I don't want to be sitting there watching him down a bottle and a half of wine, and making a pratt of himself as he does.""",0.0,0.0,0.0,0.0,0.0,0.0,0.0
636,bulbie,b'Its the beeeeeeest daaaaaay eeeeeeveeeerr!,0.0,0.0,0.0,0.0,0.0,0.0,0.0
636,bulbie,How are you?',0.0,0.0,0.0,0.0,0.0,0.0,0.0
637,MacDuffH,"b""Your husband definitely deserves his own celebration as well.",0.0,0.0,0.789025,0.0,0.842108,0.874372,0.0
637,MacDuffH,"Thankfully, I get out of spending Father's Day with my family since I'm having 5 teeth removed tomorrow.",0.0,0.0,0.633032,0.0,0.0,0.0,0.0
637,MacDuffH,"I'd almost rather deal with the teeth being pulled then another family camping trip.....""",0.0,0.0,0.578546,0.0,0.0,0.0,0.681699
639,jaxie40,"b""What is it with families?",0.0,0.0,0.64439,0.0,0.0,0.0,0.0
639,jaxie40,"It's our daughter's birthday in 11 days, so we're having a family celebration.",0.0,0.0,0.844643,0.0,0.0,0.0,0.0
639,jaxie40,"It's the lesser of two evils, as my mum in law and brother in law will be here too, so I can talk to them instead.Five teeth out?",0.527669,0.0,0.0,0.0,0.0,0.0,0.0
639,jaxie40,"Ouch! Loads of  hunBulbie, what's all this happiness?",0.0,0.0,0.890502,0.0,0.0,0.898327,0.0
639,jaxie40,"You do realise it's not allowed, don't you?!""",0.0,0.0,0.0,0.64248,0.920855,0.0,0.0
641,jaxie40,"b""Hey L&A!",0.0,0.0,0.0,0.0,0.0,0.0,0.0
641,jaxie40,"I will reply to your PM, but really not sure how to reply!",0.0,0.0,0.0,0.0,0.589295,0.0,0.513787
641,jaxie40,"Feeling better as the day's gone on, maybe due to extra meds.",0.0,0.0,0.0,0.0,0.788547,0.0,0.786991
641,jaxie40,"Oh, and the bag of choccie in the fridge that I will be eating later.",0.0,0.0,0.0,0.0,0.0,0.0,0.0
641,jaxie40,"I might even share some with hubby, IF he compliments me on his dinner!",0.0,0.0,0.761492,0.0,0.560098,0.0,0.974201
641,jaxie40,"""",0.0,0.0,0.0,0.0,0.0,0.0,0.0
643,jaxie40,"b""Aww, bless you hun  Just having a 'down' timeWe have Revels.",0.0,0.0,0.728464,0.0,0.0,0.0,0.75152
643,jaxie40,"I really should share, seeing as hubby got me and him a pouch of Rolo's the other day, bless him """,0.0,0.0,0.847709,0.0,0.0,0.0,0.0
645,jaxie40,"b'All right, rub it in, you spring chicken!",0.0,0.0,0.656766,0.0,0.0,0.898327,0.0
645,jaxie40,Bom bom bom..... Ayi Aye!',0.0,0.0,0.0,0.0,0.0,0.0,0.0
647,jaxie40,"b""Well, I've got about 10 years on you, so to me, you're a spring chick!",0.0,0.0,0.0,0.0,0.0,0.0,0.0
647,jaxie40,"lol""",0.0,0.0,1.0,0.0,0.0,0.0,0.0
653,bulbie,"b""Maybe.",0.0,0.0,0.0,0.0,0.0,0.0,0.998976
653,bulbie,I have also known D ten years.,0.0,0.0,0.0,0.0,0.801827,0.0,0.0
653,bulbie,"I don't know if I'm chasing a high that will never be there?""",0.0,0.0,0.0,0.0,0.821913,0.509368,0.0
654,jaxie40,"b""Maybe you feel that comfortable that you won't get that high.",0.0,0.0,0.0,0.0,0.0,0.0,0.88939
654,jaxie40,I don't think I've ever felt like that with my husband to be honest.,0.0,0.0,0.0,0.0,0.560098,0.0,0.0
654,jaxie40,"Don't get me wrong, I love him so much, never felt for anyone else what I feel for him.",0.0,0.0,0.0,0.613988,0.0,0.0,0.727988
654,jaxie40,I've just always felt that comfortable with him.,0.0,0.0,0.0,0.0,0.0,0.0,0.615352
654,jaxie40,"It's hard to explain, but I suppose that we've never been one of these couples who's all over each other in the beginning.",0.0,0.0,0.0,0.623473,0.0,0.0,0.0
654,jaxie40,It's been consistant througout the years we've been together.,0.0,0.0,0.633282,0.0,0.0,0.0,0.0
654,jaxie40,"Our friendship gets stronger, and there's still the spark there.Sorry for rambling, I've probably made no sense at all.... """,0.0,0.0,0.511731,0.0,0.0,0.0,0.0
655,bulbie,"b""You have, don't worry about it.",0.0,0.0,0.0,0.0,0.0,0.0,0.681699
655,bulbie,"I know you're probably right but right now I seem to be thinking if there's no high it mustnt be going anywhere...""",0.0,0.0,0.0,0.0,0.653099,0.0,0.863333
656,jaxie40,b'Do you enjoy spending time with him?,0.0,0.0,0.858008,0.0,0.0,0.0,0.0
656,jaxie40,Do you have a good friendship?,0.0,0.0,0.961117,0.0,0.0,0.0,0.0
656,jaxie40,Does he make you laugh?,0.0,0.0,0.837987,0.0,0.0,0.0,0.0
656,jaxie40,Are you attracted to him?',0.0,0.0,0.0,0.0,0.0,0.0,0.0
657,bulbie,"b""Yes yes yes and yes.",0.0,0.0,0.0,0.0,0.0,0.0,0.0
657,bulbie,"I just can't stop questioning everything.""",0.0,0.0,0.0,0.0,0.955445,0.0,0.984352
659,shrew,b'hahaha spongebob hug - had to laugh at that.,0.0,0.0,0.906735,0.0,0.0,0.866237,0.0
659,shrew,"The grouphug smilies are so sweet as well, makes me smile everytime I see them It might be hard bulbie, but try not to question it all.",0.0,0.0,0.896287,0.0,0.67368,0.0,0.0
659,shrew,Just enjoy it for what it is and have a good time.,0.0,0.0,0.876634,0.0,0.0,0.0,0.75152
659,shrew,"Sometimes we think too much, I know I do, and build up things in our heads that throw out all sorts of rubbish that stop us doing things or make things difficult.",0.0,0.0,0.0,0.0,0.535726,0.0,0.0
659,shrew,"Makes me want to scream, I know that much.",0.0,0.0,0.0,0.0,0.724236,0.0,0.0
659,shrew,Hope all is well with you ps ',0.0,0.0,0.626059,0.0,0.0,0.0,0.0
660,bulbie,"b'Thanks guys, I just want my brain to shut up.",0.539118,0.0,0.0,0.0,0.0,0.0,0.822231
660,bulbie,',0.0,0.0,0.0,0.0,0.0,0.0,0.0
661,jaxie40,"b""It's no good keep over analysing these things, bulbie.",0.0,0.0,0.0,0.0,0.882284,0.0,0.0
661,jaxie40,"That's exactly what I did in the start, but soon realised it wasn't worth stressing over.Hun, just be happy with D. Maybe your subconcious is trying to protect you from hurt after the way you were treated before.""",0.0,0.0,0.0,0.587037,0.0,0.0,0.0
662,bulbie,"b""probably.but",0.0,0.0,0.0,0.528908,0.0,0.0,0.994446
662,bulbie,"I've been dying to ask you - what's the story with your new avatar?""",0.0,0.0,0.0,0.73484,0.0,0.0,0.0
665,jaxie40,"b' Random, but amusing when I saw that picture!",0.0,0.0,0.513389,0.0,0.0,0.0,0.856622
665,jaxie40,"Looks nothing like me, BTW!'",0.0,0.0,0.0,0.0,0.0,0.0,0.822231
667,jaxie40,"b'Kind of, yes.",0.0,0.0,0.0,0.0,0.620279,0.0,0.994446
667,jaxie40,',0.0,0.0,0.0,0.0,0.0,0.0,0.0
673,jaxie40,"b""Well, it brings my husband to the yard!",0.0,0.0,0.0,0.0,0.0,0.0,0.0
673,jaxie40,I remember after I'd had the children and I was a bit bigger than I am now.,0.0,0.0,0.0,0.0,0.0,0.0,0.0
673,jaxie40,They were big!,0.0,0.0,0.0,0.0,0.0,0.0,0.0
673,jaxie40,They grew within the frst few months of me falling pregnant and stayed that way until I developed another ED.,0.0,0.0,0.0,0.0,0.0,0.0,0.0
673,jaxie40,"Now they're in between!""",0.0,0.0,0.0,0.0,0.0,0.0,0.0
675,jaxie40,"b'MIne bloody hurt throughtout, so I used to threaten to grab my hubbys nads if he went near them!",0.0,0.0,0.0,0.516218,0.0,0.0,0.0
675,jaxie40,',0.0,0.0,0.0,0.0,0.0,0.0,0.0
677,jaxie40,"b""Mine hurt more than ever before, that's partly how I guessed I was pregnant in the first place.",0.0,0.0,0.0,0.515825,0.868982,0.0,0.615352
677,jaxie40,"Move on a month, and they hurt even more!""",0.0,0.0,0.0,0.823541,0.868982,0.0,0.0
678,bulbie,b'i had a massive pregnancy scare a couple of exes back.,0.0,0.819943,0.0,0.0,0.0,0.0,0.0
678,bulbie,i became with signs my boobs were changing.',0.0,0.0,0.0,0.533881,0.0,0.0,0.0
679,jaxie40,"b'Mine just really hurt, and I felt nauseous.",0.0,0.0,0.0,0.654943,0.762356,0.0,0.961411
679,jaxie40,"Lo and behold the following day, a positive pregnancy test, followed by a second.",0.0,0.0,0.516305,0.0,0.0,0.751512,0.0
679,jaxie40,And a third.,0.0,0.0,0.0,0.0,0.0,0.0,0.0
679,jaxie40,And a fourth!,0.0,0.0,0.0,0.0,0.0,0.0,0.0
679,jaxie40,',0.0,0.0,0.0,0.0,0.0,0.0,0.0
680,bulbie,b'hehehe!,0.0,0.0,0.0,0.0,0.0,0.0,0.0
680,bulbie,Needless to say mine was negative which turned out to be a good thing in the end.',0.0,0.0,0.599483,0.0,0.664451,0.0,0.0
681,jaxie40,"b""I still remember doing what I needed to do, with the lines appearing straight away.",0.0,0.0,0.0,0.684442,0.506763,0.0,0.0
681,jaxie40,"I did another test, which did the same.",0.0,0.0,0.0,0.0,0.0,0.0,0.0
681,jaxie40,"I phoned my hubby of 3 weeks at work, which I never do unless it's important.",0.0,0.0,0.551636,0.0,0.0,0.0,0.0
681,jaxie40,"AS I told him, I was laughing and crying because I just couldn't believe it!.""",0.0,0.0,0.0,0.882619,0.532616,0.0,0.904882
682,bulbie,b'i bet as soon as he hung up everyone at work knew there was something special going on.,0.0,0.0,0.0,0.0,0.0,0.0,0.856622
682,bulbie,',0.0,0.0,0.0,0.0,0.0,0.0,0.0
683,jaxie40,"b""No, he didn't tell anyone.",0.0,0.0,0.0,0.0,0.0,0.0,0.946222
683,jaxie40,It'd just been announced that one of the bosses had died.,0.0,0.0,0.0,0.710731,0.653099,0.0,0.786991
683,jaxie40,"He took the call in his office, and didn't believe it until he saw the first scan photo!",0.0,0.0,0.511823,0.0,0.0,0.0,0.5538
683,jaxie40,"Even then, he didn't say anything at work until I was halfway through the pregnancy!""",0.0,0.0,0.0,0.0,0.0,0.0,0.904882
685,jaxie40,"b"" It's amazing, watching them moving on the screen.",0.0,0.0,0.890908,0.0,0.0,0.0,0.0
685,jaxie40,"I couldn't see any movement at my first scan, because I was only about 10 weeks.",0.0,0.0,0.555832,0.0,0.664451,0.0,0.798791
685,jaxie40,He was tiny!,0.0,0.0,0.0,0.0,0.0,0.0,0.0
685,jaxie40,Amazing when you see them sucking their thumb and blowing bubbles!,0.0,0.0,0.629806,0.0,0.0,0.0,0.0
685,jaxie40,"Amazing when you feel, and you can see your stomach moving so clearly!",0.0,0.0,0.779525,0.0,0.0,0.509368,0.0
685,jaxie40,"It used to freak my husband out, but I loved watching my tummy moving, especially after our evening meal """,0.0,0.0,0.588454,0.0,0.0,0.0,0.0
686,bulbie,"b""i always wondered what that would feel like.",0.0,0.0,0.0,0.519181,0.868982,0.0,0.0
686,bulbie,"When I thought I was pregnant with my ex's baby, i used to sit on the bus patting my tummy.""",0.0,0.0,0.0,0.0,0.0,0.0,0.0
687,jaxie40,"b""It's amazing!",0.0,0.0,0.986546,0.0,0.0,0.0,0.0
687,jaxie40,I remember the first strong kick from Tommy was the day we went for the second scan.,0.0,0.0,0.0,0.0,0.538448,0.0,0.0
687,jaxie40,I used to sit there in the evening with my top pulled up so I could watch my tummy moving.,0.0,0.607833,0.0,0.0,0.0,0.0,0.0
687,jaxie40,"It hurt a fair bit when Mel decided to turn herself the right way, but that was because she was set further back than Tommy.",0.0,0.0,0.0,0.620953,0.787769,0.525926,0.0
687,jaxie40,It's not fun when they kick your ribs repeatedly though!,0.0,0.0,0.0,0.0,0.0,0.0,0.0
687,jaxie40,"""",0.0,0.0,0.0,0.0,0.0,0.0,0.0
688,bulbie,b'Did you try the maltesers trick?,0.0,0.0,0.0,0.0,0.0,0.0,0.75152
688,bulbie,',0.0,0.0,0.0,0.0,0.0,0.0,0.0
689,jaxie40,"b""Oh no, I didn't have the patience!",0.0,0.0,0.0,0.0,0.0,0.0,0.0
689,jaxie40,"If I had any chocolate, it didn't last long enough!",0.0,0.0,0.649274,0.0,0.687768,0.0,0.822231
689,jaxie40,"Actually, I had to be in the mood to eat chocolate before I was pregnant with Tommy....... """,0.0,0.0,0.0,0.0,0.0,0.870892,0.0
690,bulbie,"b""My mum haad a wicked craving for creme eggs whilst carrying my sister.",0.0,0.0,0.0,0.0,0.61476,0.0,0.0
690,bulbie,"it's how i discovered them.""",0.0,0.0,0.0,0.0,0.970179,0.0,0.0
691,jaxie40,"b""I didn't have any cravings as such.",0.0,0.0,0.0,0.0,0.974578,0.0,0.91961
691,jaxie40,"Well, except for food!",0.0,0.0,0.0,0.0,0.920855,0.0,0.0
691,jaxie40,"I ate so much and put on 4 1/2 stone with Tommy, but ate the same with Mel and only out on 1 1/2 stone.",0.0,0.0,0.0,0.0,0.0,0.0,0.0
691,jaxie40,"a lot of it was around the chest area though """,0.0,0.622268,0.0,0.0,0.0,0.0,0.928936
695,jaxie40,"b'Problem was, I sleep on my stomach.",0.0,0.627702,0.0,0.0,0.801827,0.0,0.0
695,jaxie40,Not easy with two freaking melons!,0.553934,0.0,0.0,0.0,0.0,0.0,0.0
695,jaxie40,',0.0,0.0,0.0,0.0,0.0,0.0,0.0
697,jaxie40,"b'I was a B to start with, cfb, so went up 4 during.",0.0,0.0,0.0,0.0,0.0,0.0,0.0
697,jaxie40,I stayed that size until I started with my ED',0.0,0.0,0.0,0.0,0.0,0.0,0.0
699,jaxie40,"b""I was flat chested until I was 15, at which point they grew overnight!",0.0,0.0,0.0,0.0,0.0,0.0,0.0
699,jaxie40,"I've always been conscious about mine, even more so when I look at photo's of me a couple of months after my daughter was born.",0.0,0.0,0.520513,0.0,0.852209,0.0,0.0
699,jaxie40,They're just there!,0.0,0.0,0.0,0.0,0.0,0.0,0.994446
699,jaxie40,"""",0.0,0.0,0.0,0.0,0.0,0.0,0.0
701,jaxie40,"b""Oh, I got that all the time!",0.0,0.0,0.0,0.0,0.0,0.898327,0.0
701,jaxie40,"Not as bad now, but I keep teasing my husband, saying I'm going for breast reduction surgery.",0.0,0.0,0.0,0.607668,0.0,0.0,0.0
701,jaxie40,"He tells me their his, so I'm not allowed.",0.0,0.0,0.0,0.0,0.0,0.0,0.0
701,jaxie40,"Cheeky sod! """,0.0,0.0,0.0,0.0,0.0,0.0,0.0
702,bulbie,"b""lol I'm willing to bet D would have the same reaction!",0.0,0.0,0.728072,0.0,0.0,0.0,0.75152
702,bulbie,"Mind you I can't complain about him being a boob man, they ARE nice, and I'ma boob girl! """,0.0,0.0,0.575854,0.0,0.0,0.0,0.0
703,cfb107,"b""Wow!!!!!!!! Mum was an A before and went up to a C/D.",0.0,0.0,0.721303,0.0,0.0,0.0,0.0
703,cfb107,Boobs are LOVELY!!! I'm a 32C and sneakily quite hope mine grow if I get pregnant ... Mum's have not only grown but stayed impressively perky - she's 62 now and they're great!,0.0,0.0,0.821788,0.0,0.0,0.0,0.0
703,cfb107,"(My mum is very uptight but bizarrely not shy about getting naked in front of me!!!! ) Mine always grow quite noticeably during the couple of weeks before AF (I don't have a regular cycle) and my hubby likes that a lot (me not so much as they're sore)!!!!!! """,0.0,0.0,0.713506,0.0,0.0,0.0,0.0
704,jaxie40,b'That was the only drawback.,0.0,0.0,0.0,0.0,0.687768,0.0,0.0
704,jaxie40,"I threatened husband with violence if he touched ""the Girls"" while I was pregnant because they hurt so much!'",0.0,0.0,0.0,0.0,0.0,0.0,0.0
706,bulbie,"b""Thanks for your kind words Dodo.",0.0,0.0,0.0,0.0,0.0,0.0,0.91961
706,bulbie,"Gah, feel rotten.",0.0,0.0,0.0,0.0,0.0,0.0,0.946222
706,bulbie,"Can't get started today.""",0.0,0.0,0.0,0.0,0.0,0.0,0.0
707,jaxie40,"b""What's up, my fruity fiend?",0.0,0.0,0.0,0.0,0.0,0.0,0.0
707,jaxie40,"Come and talk to me """,0.0,0.0,0.0,0.0,0.0,0.0,0.0
709,jaxie40,"b""Tell you what, the weather's knackering me out big time.",0.0,0.0,0.0,0.0,0.0,0.0,0.0
709,jaxie40,"Mind you, stress over a possibly poorly car didn't help, neither does running around like a headless chicken.""",0.0,0.0,0.0,0.596319,0.0,0.0,0.913819
711,jaxie40,b'Oh yes?,0.0,0.0,0.634962,0.0,0.0,0.0,0.0
711,jaxie40,Tell me more ',0.0,0.0,0.0,0.0,0.0,0.0,0.0
713,jaxie40,"b'Oooh, where was this hun?",0.0,0.0,0.0,0.0,0.0,0.0,0.0
713,jaxie40,I thought you already had a new man?',0.0,0.0,0.0,0.0,0.762356,0.0,0.615352
714,bulbie,"b""Well, I do, but im not ready to commit.",0.0,0.0,0.0,0.0,0.0,0.618451,0.0
714,bulbie,To ANYONE.,0.0,0.0,0.0,0.0,0.0,0.0,0.998976
714,bulbie,So if D is up tonight we'll be having a talk.,0.0,0.0,0.0,0.0,0.0,0.0,0.0
