,date,username,post content,quoted user,post mood
629,2012-06-14 14:59:00,MacDuffH,"b'I feel the same about my parents after what I\'ve been through with them. Most of the time I have no idea what emotions I\'m even feeling. Yesterday I just started crying hysterically in the car. When my boyfriend asked why all I could say was ""I don\'t know"". I was just feeling down in general. I couldn\'t separate one emotion from another or figure out the reason behind them. I hope your mood lightens soon. Try to keep your chin up.'",,Sad
630,2012-06-14 15:00:00,bulbie,b'Is there a visit to or from your parents looming?',,Chatty
631,2012-06-14 15:36:00,jaxie40,"b""Thanks MacDuffH. I hope you're ok too Well, Karma's cheered me up a bit. A mother who's tried causing a lot of problems for me down at the school (who said playground behaviour ended when you leave school, which I did some 25 years ago now!) is in trouble with the police for something. I overheard her talking in her usual loud voice earlier, saying she's due in court next week, and could go to prison. Yes, I really feel for the kids, because it's going to be them that suffer, but IMO, the kids should have been taken away by social services last year when they had to go to court. The father's a junkie, who's attacked the mother, tried choking her etc, and the kids see it all. No wonder the son tried choking others in pre school last year, including my son!""",,None
632,2012-06-14 16:05:00,LostandAlone,b'Spongebobs Here  ....  jaxieBulbie',,None
633,2012-06-14 16:20:00,bulbie,b'Hey spongebob!',,Chatty
634,2012-06-14 16:24:00,jaxie40,"b""Unfortunately yes. It's my dad's birthday tomorrow, and it's Father's Day on Sunday, so we're going for a couple of hours on Sunday. I got questioned as to why we weren't staying for dinner, and I just pointed out that my husband happens to be a dad too, and that he deserves to be made a fuss of too. Didn't go down well, but my dad has to realise that our lives don't revolve around him. Plus I don't want to be sitting there watching him down a bottle and a half of wine, and making a pratt of himself as he does.""",bulbie,None
635,2012-06-14 16:27:00,LostandAlone,b'Hey Bulbie how are you doing',bulbie,None
636,2012-06-14 16:36:00,bulbie,b'Its the beeeeeeest daaaaaay eeeeeeveeeerr! How are you?',,Chatty
637,2012-06-14 16:41:00,MacDuffH,"b""Your husband definitely deserves his own celebration as well. Thankfully, I get out of spending Father's Day with my family since I'm having 5 teeth removed tomorrow. I'd almost rather deal with the teeth being pulled then another family camping trip.....""",,Sad
638,2012-06-14 16:43:00,LostandAlone,b'hahahaha I Ripped My Pants  i doing better ',bulbie,None
639,2012-06-14 17:11:00,jaxie40,"b""What is it with families? It's our daughter's birthday in 11 days, so we're having a family celebration. It's the lesser of two evils, as my mum in law and brother in law will be here too, so I can talk to them instead.Five teeth out? Ouch! Loads of  hunBulbie, what's all this happiness? You do realise it's not allowed, don't you?!""",MacDuffH,None
640,2012-06-14 17:17:00,LostandAlone,b'Hey Jaxie ',,None
641,2012-06-14 17:22:00,jaxie40,"b""Hey L&A! I will reply to your PM, but really not sure how to reply! Feeling better as the day's gone on, maybe due to extra meds. Oh, and the bag of choccie in the fridge that I will be eating later. I might even share some with hubby, IF he compliments me on his dinner! """,LostandAlone,None
642,2012-06-14 17:25:00,LostandAlone,"b'You dont have to reply ...just making sure your holding in there  ohhh you shouldve said about the chock ,i have 2 bars of fruit and nut in the fridge ,nooooooo chockie cant be shared :P'",jaxie40,None
643,2012-06-14 17:31:00,jaxie40,"b""Aww, bless you hun  Just having a 'down' timeWe have Revels. I really should share, seeing as hubby got me and him a pouch of Rolo's the other day, bless him """,,None
644,2012-06-14 17:49:00,mckeo5514,b' i love this song it was all the rage at christmas when i was 4',jaxie40,Cool
645,2012-06-14 17:51:00,jaxie40,"b'All right, rub it in, you spring chicken! Bom bom bom..... Ayi Aye!'",,None
646,2012-06-14 17:52:00,mckeo5514,b'wish i was a spring chicken lol',jaxie40,Cool
647,2012-06-14 17:58:00,jaxie40,"b""Well, I've got about 10 years on you, so to me, you're a spring chick! lol""",,None
648,2012-06-15 01:13:00,bulbie,b'Cluck cluck!!',,Chatty
649,2012-06-18 13:33:00,bulbie,b'Feeling distinctly underwhelmed.',,Chatty
650,2012-06-18 13:51:00,jaxie40,"b'Why would that be, my strange little fruit?'",,None
651,2012-06-18 14:03:00,bulbie,b'I just got with D and I feel like I should be more excited...',,Chatty
652,2012-06-18 14:18:00,jaxie40,"b""Maybe you're mind is being cautious hun?""",,None
653,2012-06-18 14:22:00,bulbie,"b""Maybe. I have also known D ten years. I don't know if I'm chasing a high that will never be there?""",,Chatty
654,2012-06-18 14:39:00,jaxie40,"b""Maybe you feel that comfortable that you won't get that high. I don't think I've ever felt like that with my husband to be honest. Don't get me wrong, I love him so much, never felt for anyone else what I feel for him. I've just always felt that comfortable with him. It's hard to explain, but I suppose that we've never been one of these couples who's all over each other in the beginning. It's been consistant througout the years we've been together. Our friendship gets stronger, and there's still the spark there.Sorry for rambling, I've probably made no sense at all.... """,,None
655,2012-06-18 14:44:00,bulbie,"b""You have, don't worry about it. I know you're probably right but right now I seem to be thinking if there's no high it mustnt be going anywhere...""",,Chatty
656,2012-06-18 14:51:00,jaxie40,b'Do you enjoy spending time with him? Do you have a good friendship? Does he make you laugh? Are you attracted to him?',,None
657,2012-06-18 15:09:00,bulbie,"b""Yes yes yes and yes. I just can't stop questioning everything.""",,Chatty
658,2012-06-18 15:22:00,LostandAlone,b'Spongebob Hug bulbie ',bulbie,None
659,2012-06-18 15:30:00,shrew,"b'hahaha spongebob hug - had to laugh at that. The grouphug smilies are so sweet as well, makes me smile everytime I see them It might be hard bulbie, but try not to question it all. Just enjoy it for what it is and have a good time. Sometimes we think too much, I know I do, and build up things in our heads that throw out all sorts of rubbish that stop us doing things or make things difficult. Makes me want to scream, I know that much. Hope all is well with you ps '",,Stressed
660,2012-06-18 15:32:00,bulbie,"b'Thanks guys, I just want my brain to shut up. '",,Chatty
661,2012-06-18 16:58:00,jaxie40,"b""It's no good keep over analysing these things, bulbie. That's exactly what I did in the start, but soon realised it wasn't worth stressing over.Hun, just be happy with D. Maybe your subconcious is trying to protect you from hurt after the way you were treated before.""",bulbie,None
662,2012-06-18 17:01:00,bulbie,"b""probably.but I've been dying to ask you - what's the story with your new avatar?""",,Chatty
663,2012-06-18 17:10:00,jaxie40,"b""I typed in Jaxie to Google images, and that's the first pic that came up! lol""",,None
664,2012-06-18 17:21:00,bulbie,"b""you know I totally just googled that don't you?""",,Chatty
665,2012-06-18 17:24:00,jaxie40,"b' Random, but amusing when I saw that picture! Looks nothing like me, BTW!'",,None
666,2012-06-18 17:33:00,bulbie,"b""But... you are blonde... aren't you?""",,Chatty
667,2012-06-18 17:34:00,jaxie40,"b'Kind of, yes. '",,None
668,2012-06-18 17:42:00,bulbie,"b""Well then, pigtails, short skirt, pink blouse, you're Jaxie of internet fame!""",,Chatty
669,2012-06-18 17:56:00,jaxie40,"b'Except I\'ve got a little more ""oop top"" '",,None
670,2012-06-18 18:02:00,bulbie,b'Even better!! ',,Chatty
671,2012-06-18 18:06:00,jaxie40,b'.......... ',,None
672,2012-06-18 18:08:00,bulbie,b'your milkshake brings all the boys to the yard!',,Chatty
673,2012-06-18 18:10:00,jaxie40,"b""Well, it brings my husband to the yard! I remember after I'd had the children and I was a bit bigger than I am now. They were big! They grew within the frst few months of me falling pregnant and stayed that way until I developed another ED. Now they're in between!""",,None
674,2012-06-18 18:19:00,bulbie,b'D says he would be pretty pleased with mine if I ever got pregnant ',,Chatty
675,2012-06-18 18:24:00,jaxie40,"b'MIne bloody hurt throughtout, so I used to threaten to grab my hubbys nads if he went near them! '",,None
676,2012-06-18 18:34:00,bulbie,"b'Mine urt enough right no, coming off the pill.... (not to try for a baby, mind)'",,Chatty
677,2012-06-18 18:50:00,jaxie40,"b""Mine hurt more than ever before, that's partly how I guessed I was pregnant in the first place. Move on a month, and they hurt even more!""",,None
678,2012-06-18 19:01:00,bulbie,b'i had a massive pregnancy scare a couple of exes back. i became with signs my boobs were changing.',,Chatty
679,2012-06-18 19:17:00,jaxie40,"b'Mine just really hurt, and I felt nauseous. Lo and behold the following day, a positive pregnancy test, followed by a second. And a third. And a fourth! '",,None
680,2012-06-18 19:26:00,bulbie,b'hehehe! Needless to say mine was negative which turned out to be a good thing in the end.',,Chatty
681,2012-06-18 19:45:00,jaxie40,"b""I still remember doing what I needed to do, with the lines appearing straight away. I did another test, which did the same. I phoned my hubby of 3 weeks at work, which I never do unless it's important. AS I told him, I was laughing and crying because I just couldn't believe it!.""",,None
682,2012-06-18 19:50:00,bulbie,b'i bet as soon as he hung up everyone at work knew there was something special going on. ',,Chatty
683,2012-06-18 19:53:00,jaxie40,"b""No, he didn't tell anyone. It'd just been announced that one of the bosses had died. He took the call in his office, and didn't believe it until he saw the first scan photo! Even then, he didn't say anything at work until I was halfway through the pregnancy!""",,None
684,2012-06-18 19:58:00,bulbie,"b""Oh wow... i bet if i was looking at my first scan picture, I'd say something stupid like omg I'm giving birth to a baked bean!""",,Chatty
685,2012-06-18 20:10:00,jaxie40,"b"" It's amazing, watching them moving on the screen. I couldn't see any movement at my first scan, because I was only about 10 weeks. He was tiny! Amazing when you see them sucking their thumb and blowing bubbles! Amazing when you feel, and you can see your stomach moving so clearly! It used to freak my husband out, but I loved watching my tummy moving, especially after our evening meal """,,None
686,2012-06-18 20:22:00,bulbie,"b""i always wondered what that would feel like. When I thought I was pregnant with my ex's baby, i used to sit on the bus patting my tummy.""",,Chatty
687,2012-06-18 20:29:00,jaxie40,"b""It's amazing! I remember the first strong kick from Tommy was the day we went for the second scan. I used to sit there in the evening with my top pulled up so I could watch my tummy moving. It hurt a fair bit when Mel decided to turn herself the right way, but that was because she was set further back than Tommy. It's not fun when they kick your ribs repeatedly though! """,,None
688,2012-06-18 20:35:00,bulbie,b'Did you try the maltesers trick? ',,Chatty
689,2012-06-18 20:40:00,jaxie40,"b""Oh no, I didn't have the patience! If I had any chocolate, it didn't last long enough! Actually, I had to be in the mood to eat chocolate before I was pregnant with Tommy....... """,,None
690,2012-06-18 20:44:00,bulbie,"b""My mum haad a wicked craving for creme eggs whilst carrying my sister. it's how i discovered them.""",,Chatty
691,2012-06-18 20:46:00,jaxie40,"b""I didn't have any cravings as such. Well, except for food! I ate so much and put on 4 1/2 stone with Tommy, but ate the same with Mel and only out on 1 1/2 stone. a lot of it was around the chest area though """,,None
692,2012-06-18 20:52:00,bulbie,"b""They didn't return to normal size?""",,Chatty
693,2012-06-18 20:57:00,jaxie40,"b'Nope! Went to an E, stayed at an E! '",,None
694,2012-06-18 21:26:00,bulbie,b'I am actually quite jealous!',,Chatty
695,2012-06-19 06:27:00,jaxie40,"b'Problem was, I sleep on my stomach. Not easy with two freaking melons! '",,None
696,2012-06-19 11:31:00,cfb107,"b""My mum's boobs went up 2-3 cup sizes after her pregnancies """,,None
697,2012-06-19 11:50:00,jaxie40,"b'I was a B to start with, cfb, so went up 4 during. I stayed that size until I started with my ED'",,None
698,2012-06-19 12:02:00,bulbie,"b""part of me thinks I'd love bigger boobs, but then I'm self conscious about showing them off already...""",,Chatty
699,2012-06-19 12:28:00,jaxie40,"b""I was flat chested until I was 15, at which point they grew overnight! I've always been conscious about mine, even more so when I look at photo's of me a couple of months after my daughter was born. They're just there! """,,None
700,2012-06-19 12:37:00,bulbie,"b""Mine aren't small, I just don't want people to talk to my boobs """,,Chatty
701,2012-06-19 13:30:00,jaxie40,"b""Oh, I got that all the time! Not as bad now, but I keep teasing my husband, saying I'm going for breast reduction surgery. He tells me their his, so I'm not allowed. Cheeky sod! """,,None
702,2012-06-19 13:38:00,bulbie,"b""lol I'm willing to bet D would have the same reaction! Mind you I can't complain about him being a boob man, they ARE nice, and I'ma boob girl! """,,Chatty
703,2012-06-19 17:29:00,cfb107,"b""Wow!!!!!!!! Mum was an A before and went up to a C/D. Boobs are LOVELY!!! I'm a 32C and sneakily quite hope mine grow if I get pregnant ... Mum's have not only grown but stayed impressively perky - she's 62 now and they're great! (My mum is very uptight but bizarrely not shy about getting naked in front of me!!!! ) Mine always grow quite noticeably during the couple of weeks before AF (I don't have a regular cycle) and my hubby likes that a lot (me not so much as they're sore)!!!!!! """,jaxie40,None
704,2012-06-19 17:39:00,jaxie40,"b'That was the only drawback. I threatened husband with violence if he touched ""the Girls"" while I was pregnant because they hurt so much!'",,None
705,2012-06-19 18:21:00,dodo777,b'I messed my life up jumping on the first girl that came around rather than be alone now my life is in ruins because the women who had my child didnt have a maternal bone in her body and my son is in bits.I am here worrying while she is out drinking and not a care in the world.So please take care there are some nasty pieces of work out there that will take advantage of your loneliness.',,Mellow
706,2012-06-20 12:18:00,bulbie,"b""Thanks for your kind words Dodo. Gah, feel rotten. Can't get started today.""",,Chatty
707,2012-06-20 12:22:00,jaxie40,"b""What's up, my fruity fiend? Come and talk to me """,,None
708,2012-06-20 12:30:00,bulbie,b'Probably just the effects of coming off the pill... absolutely no energy today.',,Chatty
709,2012-06-20 12:36:00,jaxie40,"b""Tell you what, the weather's knackering me out big time. Mind you, stress over a possibly poorly car didn't help, neither does running around like a headless chicken.""",,None
710,2012-06-20 12:44:00,bulbie,b'I made a new friend last night.',,Chatty
711,2012-06-20 12:45:00,jaxie40,b'Oh yes? Tell me more ',,None
712,2012-06-20 12:55:00,bulbie,b'We spent most of the night flirting... ',,Chatty
713,2012-06-20 12:55:00,jaxie40,"b'Oooh, where was this hun? I thought you already had a new man?'",,None
714,2012-06-20 13:02:00,bulbie,"b""Well, I do, but im not ready to commit. To ANYONE. So if D is up tonight we'll be having a talk. He assumed we were officially together, and I just didn't correct him, so I think possibly we're both at fault.""",,Chatty
715,2012-06-20 13:04:00,jaxie40,"b""Oooh, the plot thickens! Seriously, I don't blame you, sweetie. You will know when you're ready, and so long as you're honest, there's no problem!""",,None
716,2012-06-20 13:11:00,bulbie,"b""I treat others how I would expect to be treated. Told him he can come up tonight on the proviso his migraine is gone. It's obviously harder talking in person, but it will be better in the long run.""",,Chatty
717,2012-06-20 13:40:00,cfb107,"b'Oooh exciting... So who is this new person??? Tell us more! And what are you thinking - about D, about it all?'",,None
718,2012-06-20 13:44:00,bulbie,"b""I met him on a friendship site and we swapped numbers yesterday after a while of chatting on there. The flirtingis just how it naturally progressed, but not before we both made it clear to each other its just light flirting for fun and nothing more.I know I'm not ready to commit to anyone for anything, and as for D the attraction is there, but i can't do things at his speed just to please him, if it doesn't work for me also. Men seem to be like buses for me. Go without for ages then two come along at once.I'm comfortable with D as i have known him for ten years, but S is a new and exciting person.""",,Chatty
719,2012-06-20 13:59:00,jaxie40,"b'You know, my hubby\' never been ""new and exciting"" to me, and I don\'t mean that in a bad way at all. He\'s always made me feel comfortable in his company, right from our first proper date. I acted stupid, just being myself, and he laughed. I knew he was the man for me.Have fun, bulbie! '",,None
720,2012-06-20 14:02:00,cfb107,"b""Ditto Jaxie, and there's something about our society that makes me feel bad saying that, but my hubby's steady eddy and I love him for that! So no, no 'new and exciting' for me, even though we met online, but I felt so comfortable and secure and unlike in any other relationships that I knew this was it...LOL Bulbie I thought about the bus thing for you too!!!!!!!!!!! Keep trusting your intuition and have fun! """,jaxie40,None
721,2012-06-20 14:08:00,jaxie40,"b""I feel bad saying it too, but like you, I've never been in love like I am with my hubby. He's not the most romantic, but he surprises me constantly in little ways, and he's an absolutely fab daddy too. I met my hubby through mutual friends. I still tell them I'll never forgive them! """,,None
722,2012-06-20 14:11:00,bulbie,"b'With D though I\'m not sure I have that real ""in love"" feeling.'",,Chatty
723,2012-06-20 14:19:00,jaxie40,"b'Hmmm.... see, I knew that I was in love with my hubby, told him that I was falling for him after about 7 weeks.All you can do is keep going, talk to him and see what happens'",,None
724,2012-06-20 14:21:00,bulbie,"b""Thikn time is the only answer here. He wants to rush, I really don't, that's a habit I need to change in myself; rushing.""",,Chatty
725,2012-06-20 14:29:00,jaxie40,"b""IT sounds like it doesn't feel quite right either. You're right, you need to be going at the same speed, else it will never work. I remember getting incredibly paranoid because I didn't meet my mum in law until we'd been together for 7 months. I thought I wasn't good enough etc, but he didn't want us to meet until he was sure we were going to be serious.""",,None
726,2012-06-20 14:33:00,bulbie,"b""IT's just getting him to actually listen now...""",,Chatty
727,2012-06-20 14:53:00,jaxie40,"b""Do you think he'll be upset, or is that a stupid question?""",,None
728,2012-06-20 14:55:00,cfb107,"b""Yep I knew I was in love with hubby and that this was different very early on... We said 'I love you' after only a few weeks. That doesn't mean there weren't insecurities though, I had a lot of insecurities.I can't imagine what it must be like for you B because the idea of adjusting a friendship of 10 years to a relationship must be kinda strange and scary... But great relationships can come out of long term friendships!!! So keep going and see what tonight brings... You might just need to give the relationship space to change and evolve...""",jaxie40,None
729,2012-06-20 14:55:00,bulbie,"b""I've no idea. He ays he wants what I wants but the actions don't match the words.""",,Chatty
730,2012-06-20 15:59:00,jaxie40,"b""I agree with cfb, you may just need to give things some time, and see how tonight goes Cfb, I was so insecure, but then he's my second husband. I never understood why he'd want to be with me, so I tried pushing him away, but he stayed. I gave up pushing him, because he proved he really wanted me. WE rented a place together after a year while we let my flat, I proposed after we'd been together 18 months, we bought a place together after 2 years together and we haven't looked back!""",,None
731,2012-06-20 16:09:00,bulbie,b'About an hour and a half until I hear from him.',,Chatty
732,2012-06-20 16:13:00,jaxie40,"b'If you want to chat afterwards, you know where we are hun '",,None
733,2012-06-20 16:15:00,bulbie,"b'Thanks. I care about him loads and there is a degree of attraction there, but I am just not ready to commit.'",,Chatty
734,2012-06-20 16:25:00,cfb107,"b""I say just be as totally honest (and kind) with him as you can be... Relationships are pretty scary when you've been dumped on a load of times by different people...Thinking of you.""",,None
735,2012-06-20 16:34:00,jaxie40,"b""Hell yeah! Relationships ARE scary! I'm the woman who, 10 years ago, was never, ever getting married again.""",,None
736,2012-06-20 16:41:00,cfb107,"b""Lol, I'm 26 now, but in my teens I decided I was NEVER EVER getting married as it would a) end in divorce, b) leave me, as the woman, being crapped all over, and c) leave me trapped with kids and struggling. (i.e. my mum). About 90% of relationships in my family - grandparents, parents, aunts & uncles - have ended in divorce. When I met my first serious boyfriend, as we both came from broken homes, neither marriage nor living together were ever on the cards. It scared me something chronic. In fact I think I broke up with him partly because he wanted to live together (after 2 1/2 years - the forwardness of such a suggestion, LOL)...Don't want to be intrusive with my faith but it is totally the grace of God that I am married and confident in it in any way at all!!!!!!!""",,None
737,2012-06-20 16:48:00,jaxie40,"b""It's weird, because I always wanted to get married and have children, but never found the right man. I met my first husband, and don't think I was ever really in love with him, but married him anyway because I thought no one else would ever ask me. It last just under two years, and left me widowed just after I turned 30. I knew it was a mistake before I married him, but I don't regret it, because I believe that if I hadn't married him, I wouldn't be with my wonderful hubby now, and have my children.I don't think there's any divorce in our family, though I did come close with the first husband. MY own parents have been married for 45 years now, though sometimes I wish they'd split up.""",,None
738,2012-06-20 17:00:00,cfb107,"b""Yeah I always wanted to get married and have children, really deep down in my heart, but I didn't think I could have it as coming from a broken home the statistics are against me (my dad delightfully informed me of this many times as a teenager, he's a cheerful one). I also believed the world is coming to an end (again my dad) so decided best not to have children. But all the time those decisions were denying me that which I wanted so much!So sorry you were widowed Jaxie... Totally sucks. Guess it's got a pretty happy ending though . My mum left my dad before they got married but my granny (her mum) persuaded her to go back to him. Doh!Sorry to take over your thread, B!!!""",,None
739,2012-06-20 17:12:00,bulbie,"b""It's ok. I'm just quietly worrying away...""",,Chatty
740,2012-06-20 17:14:00,cfb107,"b'Oh, me too...'",,None
741,2012-06-20 17:21:00,bulbie,"b""Haven't heard from him yet.""",,Chatty
742,2012-06-20 17:28:00,cfb107,b'When are you expecting to have heard from him by?',,None
743,2012-06-20 17:31:00,bulbie,b'Round about now I suppose.',,Chatty
744,2012-06-20 17:34:00,cfb107,b'Tum te tum te tum......',,None
745,2012-06-20 17:45:00,cfb107,"b'That was the sound of me waiting, BTW.Does D live close to you?'",,None
746,2012-06-20 17:48:00,bulbie,"b""He's on his way. I think I'll vomit when I hear the door.""",,Chatty
747,2012-06-20 18:05:00,cfb107,b'Eeeeeeeeeeeeeeeeeeeeeeeeeeeeeeeeeeeeeeeeeeeeeeeeeeeeeeeeeeeeeek!!!!!!!!!!Good luck!!!!',,None
748,2012-06-20 18:16:00,bulbie,"b""Thanks, I'll need it...""",,Chatty
749,2012-06-20 18:19:00,cfb107,"b""You'll be fine """,,None
750,2012-06-20 18:20:00,blacktulip,b' Tulip wuves wu xx',,Worried
751,2012-06-20 18:29:00,bulbie,b'Awww I wuv Tulip!!!!!!!!! xx',,Chatty
752,2012-06-20 18:32:00,jaxie40,"b""So, what did I miss while I've been traumatising the kids? """,,None
753,2012-06-20 18:35:00,blacktulip,b'Just lotsa loving  ',,Worried
754,2012-06-20 18:36:00,bulbie,b'Me feeling more and more sick waiting on D. Already been to the bathroom once.',,Chatty
755,2012-06-20 18:49:00,jaxie40,b'I missed out ',blacktulip,None
756,2012-06-20 18:51:00,blacktulip,"b""You'll be fine babe """,bulbie,Worried
757,2012-06-20 18:54:00,blacktulip,b'Heres some for you jaxie ',jaxie40,Worried
758,2012-06-20 18:55:00,jaxie40,"b'Aww thank you, blacktulip '",,None
759,2012-06-20 19:04:00,bulbie,"b'Well, hes here...'",,Chatty
760,2012-06-20 19:13:00,cfb107,b'He arrived!!!!!!!!!!!!!!!!!!!!!!! ',,None
761,2012-06-20 19:19:00,jaxie40,b'Dum dum DUUUUMMMMMMMM!!!! ',,None
762,2012-06-20 19:20:00,cfb107,b'Keeping all my fingers (and toes) crossed for you!!!!!!!!!',,None
763,2012-06-20 19:29:00,bulbie,"b""And now T is being a dick. I'm feeling fragile, sent a text saying I'm old soon to make conversation, and he texts back saying he has no sympathy for me. """,,Chatty
764,2012-06-20 19:31:00,jaxie40,"b""Who's T? """,,None
765,2012-06-20 19:45:00,bulbie,"b'Te friend I stay with down south. Seriously, do I have a sign saying kick me on my back?'",,Chatty
766,2012-06-20 19:46:00,jaxie40,"b""I don't understand the message you sent him hun """,,None
