,date,username,post content,quoted user,post mood
0,2012-05-25 21:01:00,bulbie,"b""...all of the time. It's crippling me. """,,Chatty
1,2012-05-25 21:08:00,manekineko,"b""Hi bulbie, I share your pain! That's why I like forums, they make me feel less lonely and just the kindness of having someone reply with empathy and encouragement is enough to make me feel a little better. Are you lonely because you're alone? Or do you feel lonely even when you're around others? I have social anxiety and depression which means meeting people is difficult, and I find that I don't 'play well with others' as my parents like to say. What's making you feel so lonely? x""",,None
2,2012-05-25 21:10:00,Starless,b'',,Cheerful
3,2012-05-25 21:40:00,bulbie,"b""I'm completely isolated here, that really doesn't help. Been single for over a year whn everyone seems to have someone. No one wants me. """,,Chatty
4,2012-05-25 21:46:00,Unloved,b'hiya Bulbie.. You are NOT alone in your feelings.. I Know how hard it can feel.. Admitting you feel alone is half the battle (i think).. Keep talking you can get through this x',,Tired
5,2012-05-25 21:51:00,manekineko,"b""You can talk to your friends here  AWWWWWWW, I'm sure that's not true! You are probably so down at the moment that you don't even realise when someone likes you or are showing an interest/checking you out! I know it can suck being single, especially if all your friends have someone, but take solace in the fact that I've been single for five years! Not even a date... Also, if you are single then you can take advantage of that time to do things that you want to do without the responsibility of having another to worry about. A year isn't a long time at all if you think about it, because looking for a person that is right for you is more important than being with someone to not be alone, and i'm sure once you have found a person like that, you wont regret holding out for more! x""",,None
6,2012-05-25 21:55:00,Allyke,b'Love you Bulbie  xx',,None
7,2012-05-25 22:25:00,Sugarplum,"b""You sound fantastic to me. I'd go out with you if I wasn't takenSPXx""",Allyke,Sad
8,2012-05-26 10:24:00,bulbie,"b""Thank you so much everyone.I'm hoping a visit home might pick me up, but right now its hard to see that. I've gotten a little flabby too and all that makes me think is who would want me with a body like this? """,,Chatty
9,2012-05-26 10:52:00,Unloved,"b""morning Bulbie, its nice to hear your going out visiting.. Being able to go bk to your 'roots' can be reassuring.. On your body image,, anyone worth their salt would see past that straight off!,.. judging someone on looks alone is pretty shallow, buts thats how i see it.. Really hope you get out there, and end up having a Cracking day! X""",,Tired
10,2012-05-26 11:05:00,Foxjo,"b""Morning Bulbie, ive just logged on. all the people above have given you great words of wisdom. its true, people find each other, fall in love with each other in more ways than just the physical sense. friends too, cannot always be around but on-line there is always someone to talk to. thats why i love the forum. there is always someone 'here'. try and enjoy some of the sunshine this weekend, log on later and let us know how you are?hugs Fox""",,None
11,2012-05-26 12:48:00,bulbie,"b""So I'm out at McDonalds then going to get the shopping. I feel like everyone is looking at me thinking I look a mess.""",,Chatty
12,2012-05-26 12:56:00,blacktulip,b'You could never look a mess  xx',,Worried
13,2012-05-26 13:19:00,bulbie,"b'I feel like I do, feel like my hairs a mess and I look ridiculous in this outfit, and that everyone can see my tummy. '",,Chatty
14,2012-05-26 13:30:00,jaxie40,"b""Fox is right, I met and fell in love wih my second husband when I was least expecting to. In fact, I was anti-marriage, vowed I'd never do it again after the first. Anyway, I got to know a lot about my husband through many late night chats. I fell deeply in love with that person, not what he looks like. If you saw him in the evenings and weekends, you'd mistake him for a layabout, dressed in torn old jeans and tatty t-shirts. That side of him really doesn't bother me, he's comforatble dressed like that, and that's what's important.And I bet you don't look a mess at all! Seeing some of the sights around, I bet you have nothing to worry about, Bulbie""",Foxjo,None
15,2012-05-26 19:16:00,bulbie,"b'Thanks Jaxie. I just wish I could meet someone who values me enough, who loves me enough to want to marry me.'",,Chatty
16,2012-05-26 19:22:00,Foxjo,"b'Hi Bulbiei met my husband through on-line dating, i fell in love with him over the internet. talking to him, getting to know him first then meeting up with him, i too was painfully shy at meeting people so i felt for me it was a great way of getting to know someone first before dating them in person. obivously there are some men/women on there only out for one thing and they get it. but you can usually suss that one out pretty quickly!today i went out in the sun, i too have put on a lot of weight with my change in meds, i felt like a white whale out in the sun. but i know thats just me and how im thinking about myself right now. i tried not to let it spoil my dayout but it is hard. yeah i wish i was a size ten with beautiful hair and teeth but it aint gonna happen! acceptance is what is needed- acceptance from ourselves. then once we feel beautiful to ourselves we can portray that to others.'",,None
17,2012-05-26 19:28:00,bulbie,"b""God my teeth are another issue. I'm very scared of the dentist, and am scheduled for oral surgery but its months off... I've met so many people who judge if you have less than perfect teeth even if the rest of you could be deemed perfect.I've been told i'm ugly all my life, so naturally I believe it so strongly now.""",,Chatty
18,2012-05-26 19:28:00,jaxie40,"b""Aww how lovely Fox! Very true what you say about acceptance too Bulbie, you will meet someone when you're least expecting it hun """,Foxjo,None
19,2012-05-26 19:34:00,bulbie,"b""Let's face it, I'm still in love with J, and I'm nowhere near as gorgeous as the girl he left me for...""",,Chatty
20,2012-05-26 19:35:00,Starless,b'Nowhere near as stupid either... *cough* .. Who said that? ',,Cheerful
21,2012-05-26 19:37:00,jaxie40,"b""Aww how awful Bulbie. My dad used to tell me that I was ugly and that no-one would ever want me. I grew up believing him. MY self estemm is still low, though with thanks to psychotherapy, it's better than it was.Anyone who judges on appearance is shallow, and doesn't deserve to be in a decent relationship. We think you're lovely anyway Bulbie, sod those who've called you ugly """,bulbie,None
22,2012-05-26 19:38:00,jaxie40,b'Who said what? ',Starless,None
23,2012-05-26 19:38:00,Starless,"b'Exactly Jaxie, exactly! '",jaxie40,Cheerful
24,2012-05-26 19:44:00,bulbie,"b""See, that's how i know you're my best friend! and of course I know you're right Jaxie, I'm just really struggling to see it right now. """,Starless,Chatty
25,2012-05-26 19:47:00,Starless,"b""It's what I'm here for. Besides, if it gets really dire, you could always move to Austrailia and marry a building. (No, really!)I don't think we have too much to worry about here when there's people having maritals with buildings out there.(And before I get slayed for that, I am joking!)""",,Cheerful
26,2012-05-26 19:52:00,bulbie,"b""I can't marry a building don't be silly! i'm already betrothed to the oxfam goat...""",,Chatty
27,2012-05-26 19:56:00,-Phoenix-,"b""Hi bulbie,I feel exactly the same as you do from time to time. I haven't been in a relationship for 27 years. And I'm 27 years old!  Hope you get the joke. It can get a little lonely from time to time.But I have faith that I'll meet the girl of my dreams somewhere. Maybe I already have. And there's plenty of opportunities out there. Why, just today I was offered by an ad on this very forum inviting me to engage in dating gay women. Which unfortunately wouldn't work seeing as how I'm a hetero guy. Oh well, better luck next time. But I'm sure you'll find that special someone sooner or later. Keep the faith. I'm finding a lot of the comments in this thread to be very encouraging and supportive. Therefore, it gets a five-star rating from me! """,,None
28,2012-05-26 19:57:00,jaxie40,"b'OH my word ladies! Now, if you were talking about marrying a horse, a la Jerry Springer......'",Starless,None
29,2012-05-26 19:58:00,Unloved,"b'I tried posting up a msg to you earlier Bulbie, but my phone was playing up.. I hope your shopping trip went well after, and you got round Ok..? ..i cant stand it when i feel self conscious when out, i get so panicky and nervous.. I really do like your thread as i can relate, and think you have some cracking responses from some really decent and down to earth folk..xx.'",,Tired
30,2012-05-26 20:00:00,jaxie40,"b""RP, from the posts of yours I've seen on here, you'll find someone. You come across as a kind, caring guy, who also has a good sense of humour. To me, being able to laugh with your partner is a must!""",Rising Phoenix,None
31,2012-05-26 20:10:00,bulbie,"b'RP, a welshman eh? I always did find the Welsh accent very sexy. i managed to shop, but only just. Very nearly had a panic attack and passed out. '",,Chatty
32,2012-05-26 22:38:00,-Phoenix-,"b""Hehe... I'm Welsh but my mother is English and I was born in England. So I'm a bit of both. I consider myself more Welsh than English though. I've lived most of my life in Wales and I do have a Welsh accent. """,bulbie,None
33,2012-05-26 22:40:00,jaxie40,"b'Hey RP, what part of Wales did you live in? My dad was born in Holyhead, and lived there until he was about 6 '",,None
34,2012-05-26 22:52:00,-Phoenix-,b'I still live in Wales... not too far from Swansea. I spent 6 years from age 9-15 in NW England.',,None
35,2012-05-26 22:56:00,jaxie40,"b""Oh cool! Do you know, even though my dad and Uncle were born there, I've only ever been to Wales once. I really liked what I saw though, much greener than 'darn Sarf' ! """,,None
36,2012-05-26 23:30:00,-Phoenix-,"b""Of course. Very green and very hilly and very friendly too. As the song goes:We'll keep a welcome in the hillside,We'll keep a welcome in the vales,This land you knew will still be singing,When you come home again to Wales!""",,None
37,2012-05-26 23:33:00,jaxie40,"b"" BRAVO!! Can tell you're Welsh by your great singing voice, RP! """,,None
38,2012-05-26 23:39:00,-Phoenix-,"b""Thanks. But I'd better not outstay my welcome. Last time I started singing in work I got some really weird looks... """,,None
39,2012-05-26 23:42:00,jaxie40,"b""Yes, I've just finished watching the Eurovision Song Contest and am off to bed. Night, RP. Take care """,,None
40,2012-05-26 23:50:00,-Phoenix-,b'Goodnight. ',,None
41,2012-05-27 18:02:00,bulbie,b'And suddenly my thread is no longer about me...',,Chatty
42,2012-05-27 18:10:00,jaxie40,"b'Sorry Bulbie, it was totally unintentional. How are you today hun? '",,None
43,2012-05-27 18:31:00,Jamster,"b""Sorry to hear that, i'm in the same boat, and I realised I just have nowhere to fit in in society, I come across as well spoken and intelligent, but I am poor and have not job or prospects. I would fit in with middle class/professional people if I had the money as I have the same interests/want to spend free time in the same way but can't get there. It's driven me to drink. I hope you can find a way out of it. I'm assuming for you it's about being out of work. Work and education are the main ways to meet people (church would be another good option depending)... I hope you can have better luck than me resolving this!""",,None
44,2012-05-27 18:32:00,bulbie,"b""Ha, don't worry about it. I'm just cranky because of the heat. It's unbelievable.""",,Chatty
45,2012-05-27 18:47:00,Jamster,"b""Yep, my flat was 29 degrees most of yesterday and was when I woke up this morning too. I can't study because of the heat and looking forward to the sun going away while I'm living here!""",,None
46,2012-05-27 18:47:00,Unloved,"b'hi bulbie, i know what u mean about the heat!. Ive not gone out the house again for the last 2 days.. Hopefully tmrw may be slightly cooler '",,Tired
47,2012-05-27 18:48:00,Starless,"b'You can get blinds for velux windows, B. Not sure where though. Google will know!'",,Cheerful
48,2012-05-27 18:50:00,bulbie,"b""I'll tell T to ask Siri! Unloved, I've hidden in all day, but tomorrow i have to replant my lettuce. Eek!""",,Chatty
49,2012-05-27 18:51:00,bulbie,"b""i keep trying to read case studies, i just can't do it in this heat.""",Jamster,Chatty
50,2012-05-27 18:52:00,Starless,"b""Ooh. Siri - she'll know which ones are close to you too. Haha""",,Cheerful
51,2012-05-27 19:00:00,bulbie,b'Apparently last night T told it to fuck off and it said Now now...',,Chatty
52,2012-05-27 19:14:00,jaxie40,"b""Someone else who grows their own! YAY!!! Are you growing anything else, Bulbie?I agree about this heat too. We've been indoors all day today, too hot out there""",bulbie,None
53,2012-05-27 19:18:00,bulbie,"b""Besides the lettuce, I'm growing tomatoes and bell peppers. There are literally hundreds of shoots to be replanted...""",,Chatty
54,2012-05-27 19:24:00,jaxie40,"b""Lovely! Nothing like growing your own! Are lettuce easy to grow? I've grown salad leaves every year for the past 5 years or so, but never tried lettuce. Good luck with the replanting!""",,None
55,2012-05-27 19:29:00,bulbie,"b""I'm growing little gem and they are sprouting like crazy> Mine appeared after just one week.""",,Chatty
56,2012-05-27 20:09:00,jaxie40,"b""Little gems are a nice lettuce! I've just been and inspected my veggies, and noticed a dwarf french bean just sprouting! Lots of strawberries on my plants too!""",,None
57,2012-05-27 22:54:00,mckie,b'take care.',,None
58,2012-05-28 10:23:00,bulbie,b'Oh gods I would love to be able to grow strawberries ',jaxie40,Chatty
59,2012-05-28 10:27:00,jaxie40,"b""Easy to grow in tubs, Bulbie. I've only just put them into a raised bed that my dad built last year for me. I have enough varieties so I'll get strawberries from now until October time """,,None
60,2012-05-28 10:42:00,bulbie,"b""T's mum is growing them in a strawberry grower thing, maybe I'll get some of those... I love it when they're super juicy.... """,,Chatty
61,2012-05-28 10:44:00,jaxie40,"b'Nothing like fresh grown fruit and veg! i have two different typesof hazelnut tree too, they produced fruit for the first time last year!'",,None
62,2012-05-28 10:51:00,bulbie,b'I really want a tree. Have my own ultrajuicy fruit.',,Chatty
63,2012-05-28 11:00:00,jaxie40,"b""I want a walnut tree now. The only problem I have this year is the hosepipe ban. Sweetcorn's growing rapidly in the heat, I just hope we get some rain in the next few days""",,None
64,2012-05-28 11:12:00,bulbie,"b""Aren't you allowed to use a watering can?""",,Chatty
65,2012-05-28 11:24:00,jaxie40,"b""I have been using the water from the water but. That's run out now. I can use a watering can, just trying to work out the easiest way to do it. We have a large garden, and it would take about 15 trips back and forth.""",,None
66,2012-05-28 11:31:00,bulbie,b'Good for keeping fit?',,Chatty
67,2012-05-28 11:42:00,Wiseowl,b'Hi bulbie just wanted to say I started gardening to help my mental health about two years ago. I started growing fruit and veg in pots on the patio at first. I tried to be a green gardener no pesticides this website is very good for thathttp://www.greengardener.co.uk/It really does keep you fit and it helps you get out in the sun (when we have it) so you get lots of serotonin. ',,In Love
68,2012-05-28 11:52:00,bulbie,"b""Thanks muchly for the link, it's going to come in really useful! T's mum is a horticulturalist, but I'm always too shy to ask her stuff. """,,Chatty
69,2012-05-28 12:02:00,jaxie40,"b""Having two kids is my way of keeping fit! Yes, it's lovely working out in the garden when the weather's good, though I've found it too hot over the last week. Shouldn't complain, I know!""",bulbie,None
70,2012-05-28 12:03:00,Wiseowl,"b'I just used to follow the instructions on the seed packet/plant and learn as I went. A lot of it is intuitive like looking after a pet, do they need feeding, a drink, are they too hot etc. '",,In Love
71,2012-05-28 12:05:00,jaxie40,"b""I've got a diploma in horticulture, and one in garden design, but I agree. It's great to know the theoretical side, but it mean little without practical knowledge too""",Wiseowl,None
72,2012-05-28 14:25:00,bulbie,"b""I'm just winging it, reading the seed packets really. I've had more success with this recent venture than I've had before.""",,Chatty
73,2012-05-28 14:29:00,jaxie40,"b""Having decent soil's a contributory factor. This is the first year ever that I've used a greenhouse, and it's was going fine....until my plants got burnt in there last weekend when i was ill. Still, managed to get some dwarf bean seeds out, and two of them are coming through now """,bulbie,None
74,2012-05-28 14:47:00,bulbie,"b""Eat those beans! When they're fully grown...I think my friend's avoiding me. Sigh.""",,Chatty
75,2012-05-28 14:49:00,jaxie40,"b""WE will indeed! MY dad gave me some runner bean plants last week too!Oh no hun, that's not nice. I had the same with a so-called friend, who I ended up screaming at and calling a selfish bitch. Her husband's told her she doesn't need friends besides him, and she's doing what he says. Shame her kids have been affected too!""",bulbie,None
76,2012-05-28 14:51:00,bulbie,"b""I don't know what my friend is thinking really. He was all gung ho about meeting up with me again, but now my travel date is getting closer, he's getting quieter and quieter...""",,Chatty
77,2012-05-28 14:57:00,jaxie40,"b""oh no, that's not nice """,,None
78,2012-05-28 15:03:00,bulbie,"b""His loss. I'm not going to waste time or tears on him if he won't make an effort.""",,Chatty
79,2012-05-28 15:44:00,jaxie40,"b""I've just been given evils by my ex-friends daughter. She's 8 years old and giving me filthy looks, ffs!""",,None
80,2012-05-28 15:47:00,Starless,b'His loss indeed! What a silly fruit.',bulbie,Cheerful
81,2012-05-28 16:14:00,Wiseowl,"b""I agree Starless. I hate it when you make an arrangement with someone and they don't contact you then it gets all complicated. Call me old fashioned but if I make plans with someone I stick to it unless there is a very good reason why not, in which case I let them know ASAP and rearrange it.""",,In Love
82,2012-05-28 16:16:00,jaxie40,"b""You're old fashioned, Wiseowl! Seriously, I'm exactly the same, it's the way I was brought up. To me it's only polite""",Wiseowl,None
83,2012-05-28 16:21:00,Wiseowl,"b""It's peoples' lack of thought/concern for other people that makes my fear of socialising worse. I think you're right Bulbie don't waste time it is there loss.""",,In Love
84,2012-05-28 16:26:00,jaxie40,"b""Yep, as you can see on this thread, I'v just been dumped on from a height!""",Wiseowl,None
85,2012-05-28 17:16:00,bulbie,b'Why she giving you evils? Did you get the last pack of Pikachu cards in the shop?',,Chatty
86,2012-05-28 17:41:00,jaxie40,"b'Because her mother\'s probably been trashing me for no real reason! When I confronted this woman, she said ""You\'re so controllung, always telling me I have to go here and there"". What I actually do is ask her if she\'d like to come to Tesco\'s with me when I go (she doesn\'t drive), and sometimes text to see if she\'d like to come round for a cuppa. And that\'s controlling! No doubt her husband\'s been slagging me off in front of the kids, because he\'s nice like that. Oh well, her kids won\'t have anyone to play with during the holidays.'",bulbie,None
87,2012-05-28 17:53:00,bulbie,b'Why are you friends with her? ',,Chatty
88,2012-05-28 18:01:00,jaxie40,"b""I'm not any more. She's been avoiding me for a while, so I just confronted her about it. I do feel for her, her husband's a pig, but after the way she spoke to me last Thursday, I'm not having any part of it. He's verbally aggressive and abusive to her and the kids""",,None
89,2012-05-28 18:06:00,bulbie,"b""Nah, there's no excuse for shitty behaviour like that. """,,Chatty
90,2012-05-28 18:16:00,jaxie40,"b""What really hurt was when she said she didn't care that my son had been so poorly a couple of weeks ago, he's not her son, so why should she? """,,None
91,2012-05-28 18:26:00,bulbie,b'Sounds like she was never really your friend at all.Is your son ok now?',,Chatty
92,2012-05-28 18:37:00,jaxie40,"b""He's back to full stregth now, thanks for asking. He came very close to ending up in hospital with dehydration though. He was so weak, poor thing.I honestly think she's been brainwashed, she told me when we first stated talking that her husband's told her she doesn't need friends because she has him. Still, her loss. I'm either a good friend or a bad enemy. If her daughter looks at me like that again, I will be saying something because I'm not having it. I've done nothing to deserve it""",,None
93,2012-05-28 18:42:00,bulbie,"b""No, quite right too. It does sound a bit like he's trying to make her completely dependant on him so she'll never leave. Creepy.""",,Chatty
94,2012-05-28 18:47:00,jaxie40,"b""They've been together for years, he was her first boyfriend (she was in her 20's, mum's schizophrenic, so she didn't have a particularly normal childhood or teen years), they married when she fell pregnant with the daughter.Anyway Bublbie, how're you doing today?""",,None
95,2012-05-28 18:50:00,bulbie,"b'Bubbly Bulbie is fried, tired, and paranoid. How are you?'",,Chatty
96,2012-05-28 18:57:00,jaxie40,"b""Aww hun, what are you paranoid about?I'm good thanks, looking forward to next week when the kids are off school. Can't believe they've only got 7 weeks of school left in this academic year, and that my baby will be going to full time school in September!""",,None
97,2012-05-28 19:03:00,bulbie,"b'I think everyone is avoiding me, being unpleasant o purpose. '",,Chatty
98,2012-05-28 19:10:00,sadgirl,"b""I know how you feel everytime I step outside I'm convinced that everyones starring at me with disgust and talking about me because there disgusted with who I am""",,Sad
99,2012-05-28 19:11:00,jaxie40,"b""Well I'm not hun. I think you've got a wicked sense of humour, and the fact you grow your own veg is great too! Anyone who's nasty to you just isn't worth your time. """,,None
100,2012-05-28 19:16:00,bulbie,"b""Thanks guys. Sadgirl, I'm like that every time I go out too. i hate it! None of my RL friends are talking. That always makes me paranoid. """,,Chatty
101,2012-05-28 19:19:00,jaxie40,"b""I used to get like that with friends, but I have so few now that I don't """,,None
102,2012-05-28 19:25:00,bulbie,"b""I've never had many to start with. No one wants be friends with the crazy lady who smells of wee.""",,Chatty
103,2012-05-28 19:32:00,jaxie40,"b'I do I was the outcast at school, never fitted in because I refused to be one of the herd, liking the latest fashion, music etc.'",,None
104,2012-05-28 19:34:00,bulbie,b'Exactly the same here.I need a friend tonight. I feel unsettled.',,Chatty
105,2012-05-28 19:40:00,jaxie40,"b""I'm here if I can be of any use hun. We'll be opening a box of Thornton's chocolates soon if you'd like to help us eat them?""",,None
106,2012-05-28 19:41:00,bulbie,"b""*climbs on to couch*I'm there.""",,Chatty
107,2012-05-28 19:45:00,jaxie40,b'Welcome Bulbie! Can I get you a drink? Tea? Coffee? Cold drink? ',,None
108,2012-05-28 19:49:00,bulbie,b'Cider......... anything to drown out le voices...',,Chatty
109,2012-05-28 19:54:00,jaxie40,b'Chilled cider it is Help yourself to chocolates!',,None
110,2012-05-28 19:55:00,bulbie,"b'uuuuuuuuuuuuurpThaaaaanks.Feck I hate mods like this, I really do.'",,Chatty
111,2012-05-28 19:59:00,Allyke,b'Did I hear...cider?',,None
112,2012-05-28 19:59:00,jaxie40,b' Is there anything I can do to help hun?Yes you did Allyke. ',,None
113,2012-05-28 20:03:00,bulbie,"b""I'm worried about my dad and some other things... """,,Chatty
114,2012-05-28 20:05:00,jaxie40,"b""I'm here to listen if you want to talk about it Bulbie""",,None
115,2012-05-28 20:08:00,Wiseowl,b'I like you to BulbieYey to all orange fruit people ',,In Love
116,2012-05-28 20:13:00,bulbie,"b""Im proper freaked out tonight, an overwhelming feeling of no one is talking to me because they don't love me anymore. """,,Chatty
117,2012-05-28 20:15:00,jaxie40,b'We do bulbie ',,None
118,2012-05-28 20:19:00,Wiseowl,b'Bulbie I hate that feeling. I hope it goes away As Jaxie said we do ',,In Love
119,2012-05-28 20:24:00,bulbie,"b""Thank you...I've had quite a knock the last few days, the bad news about my dad, my ex texting then going cold on me yet again, and something tonight which I'm not comfortable mentioning publicly...""",,Chatty
120,2012-05-28 20:30:00,Starless,"b""You are loved, B.  Things will be OK - we're here for you.""",,Cheerful
121,2012-05-28 20:34:00,bulbie,"b""Waaaaaaah I'm just in meltdown mode!""",,Chatty
122,2012-05-28 20:48:00,jaxie40,"b'can you distaract yourself somehow, or does that not work ?'",,None
123,2012-05-28 21:01:00,bulbie,"b""Its not tonight for some reason. And my mind is on cake but the voices won't let me eat.""",,Chatty
124,2012-05-28 21:04:00,jaxie40,"b""Voices talking to bulbie, Let her have some cake else you'll have me to deal with! I'm off to bed in a minute hun, but you take care, ok?I'll be around plenty tomorrow, unless I decide to give my new strimmer a go! Loads of Just remember, we care about you a lot bulbie """,,None
125,2012-05-28 21:12:00,bulbie,b'Thank you for tonight Jaxie. ',,Chatty
126,2012-05-28 21:50:00,Allyke,"b""Sorry you're struggling at the moment, Bulbie. I care about you too, I think you're awesome. I wish I could stay and talk to you through this, but I have to go and have a shower and go to bed. PM me though if there's anything you want to get off your chest? Love xx""",,None
