,date,username,post content,quoted user,post mood
1148,2012-06-28 15:51:00,bulbie,b'Another party?!',,Chatty
1149,2012-06-28 15:58:00,jaxie40,"b""Yes, a couple of Mel's schoolfriends are coming round after pre-school. It was supposed to be three, but one of them is poorly so won't be here """,,None
1150,2012-06-28 16:03:00,bulbie,"b""Im not four, or five, or even three, but can I take her place? I'm right in the mood for some jelly and ice cream. That IS what the kids eat at parties still?""",,Chatty
1151,2012-06-28 16:24:00,shrew,"b""I'm four (...and twenty) Haven't had jelly and ice cream for years - can I come too?Don't be too hard on yourself for not going to group bulbie, you sounded like you had a bad night last night so don't fret it, there will be other chances when you're in a better frame of mind. I hope you are alright today """,,Stressed
1152,2012-06-28 16:26:00,jaxie40,"b'No jelly and ice cream tomorrow, but there will be Disnay princess fairy cakes and chocolate rolls, along with birthday cake, of course! '",,None
1153,2012-06-28 16:41:00,bulbie,"b'Thank you Shrew, why do all the gentlemen live so far away? Jaxie do those fairy cake have the little edible paper bits on?'",,Chatty
1154,2012-06-28 17:15:00,shrew,"b""Couldn't hack those poxy paper things on cakes - it's immoral eating paper, doesn't seem right.Gentleman? """,bulbie,Stressed
1155,2012-06-28 17:30:00,bulbie,"b'Keep blushing Shrew, we could all use a heat! '",,Chatty
1156,2012-06-28 17:34:00,shrew,b'a heat? ',,Stressed
1157,2012-06-28 17:46:00,bulbie,"b'Yeah, cos your face heat up when you blush...?'",,Chatty
1158,2012-06-28 17:48:00,shrew,"b'yeah, but why do we all need heat? It is quite hot outside today '",,Stressed
1159,2012-06-28 17:49:00,jaxie40,"b'No, thry have pink sprinkles on '",bulbie,None
1160,2012-06-28 17:52:00,bulbie,"b""Not where I'm at!""",,Chatty
1161,2012-06-28 17:56:00,shrew,b'It is here - keeps sticking to the inside of my leg today.',bulbie,Stressed
1162,2012-06-28 18:07:00,bulbie,b'We need to get a shower up in here!',,Chatty
1163,2012-06-28 18:08:00,shrew,b'why? Is yours too? hahahahh sorry ',bulbie,Stressed
1164,2012-06-28 18:12:00,bulbie,"b""ewwwwwwww I'm all stickyyy""",,Chatty
1165,2012-06-28 18:16:00,shrew,"b""mind like a sewer you, ain't ya?  I don't know, so childish...""",bulbie,Stressed
1166,2012-06-28 18:17:00,jaxie40,b'',,None
1167,2012-06-28 18:35:00,bulbie,"b""Aww that's naaaaaaaaaaaaasty.""",,Chatty
1168,2012-06-28 20:00:00,jaxie40,b'Sorry ',,None
1169,2012-06-28 20:24:00,bulbie,b'The hamster has arrived!!',,Chatty
1170,2012-06-28 20:37:00,jaxie40,"b""YAYYYYYYYY!!!!! Pictures please, or it didn't happen """,,None
1171,2012-06-28 20:43:00,bulbie,"b""He's soooooooo fast though!""",,Chatty
1172,2012-06-28 20:46:00,jaxie40,"b""No excuses!!!! Miss Holly's just been going hell for leather on her wheel! My daughter's really excited, because I've promised we'll take her in for show & tell next week """,,None
1173,2012-06-28 20:47:00,WigglyOwl,b'*Jumps up and down. Pictures pictures pictures.',,Stressed
1174,2012-06-28 21:07:00,sadgirl,b'What one did you get? Colour? Name? Jaxie its gonna be fun in your daughters classroom If the hamster escapes can you imagine it it would be like a scene from horrid henry lol my sons got a syrian hamster he loves his food!!!!( The hamster not my son well he does too)',,Sad
1175,2012-06-28 21:16:00,jaxie40,"b""Miss Holly's a Syrian hamster, absolutely gorgeous! She won't escape, I won't even risk opening the cage just in case! Holly's not eaten a great deal, but we're only had her a few days, so she's still settling it, getting used to two very loud children!""",sadgirl,None
1176,2012-06-28 21:24:00,bulbie,b'Gah the internets slooooooow.',,Chatty
1177,2012-06-28 21:28:00,sadgirl,"b""Awe she sounds lovley we've got hammy the hamster he's 2yrs old now cream and beigey brown he spends more time out of his cage than in loves tro be handled he loves the rabbit and vice versa they aren't supposed to get on according to the vet but hey we will be different hope your daughters show and tell goes well""",,Sad
1178,2012-06-28 21:34:00,jaxie40,"b""Miss Holly's very good and me holding her, has been since the first day. The man in Pets at Home told me not to touch her for a few days, but I've had so many hamsters over the years and have never done that. In my experience, the sooner you handle them (if you're able) the better. They get used to you. I'm going to let the children give her a few treats over the weekend, so they can get used to her climbing on their hands, and so she gets used to them """,,None
1179,2012-06-28 21:42:00,Wiseowl,"b""awww she sounds lovely JaxieI'm glad you got another pet""",,In Love
1180,2012-06-28 21:54:00,jaxie40,"b""Hey Wise, how are you doing hun? I'm being given the evil eye as I type, because she want to come out of her cage again!""",,None
1181,2012-06-28 21:59:00,bulbie,"b""Uploading isn't working....""",,Chatty
1182,2012-06-28 22:02:00,jaxie40,"b""Umm..... that link's not doing anything for me hun""",,None
1183,2012-06-28 22:02:00,Wiseowl,"b""I'm okay had a stressful week and it's catching up with slept till 6pm yesterday! Thanks for askingHamsters can be very moody mine can be scary staring at me without blinking. It's good she wants to be active. Have you given her some carrots? I made my own hamster snacks the other day. I was using a butternut squash for a recipe so I took out the seeds cleaned them and dry roasted them at 200 degrees until they began popping. My hammy loves them. """,,In Love
1184,2012-06-28 22:05:00,jaxie40,"b'Loads of  hunNO, I was told no fresh food for a while, but I\'m going to start her on it this weekend. What else do you give yours, Wise? Do I remember you giving him peas before? Your hamster does sound scary! Reminds me of one of my old bunnies. If she was in a mood (which was often) we used to get the ""Rosie Stare"". She glare and chew at the same time Right, I\'m off to bed, so shall bid you all goodnight'",,None
1185,2012-06-28 22:11:00,bulbie,b'',,Chatty
1186,2012-06-28 22:16:00,Wiseowl,"b""peas, carrot, courgette, dried peaches, raisins, sultanas, milk drops, wilkinsons hamster biscuits, brocoli, apple, banana chips (not too many because of the added oil and sugar), seed bars, strawberries (seeds removed), grapes, fresh peach, parsnip, mango, roast chestnuts (very tiny bit at xmas due to the calories), carrot tops, cucumber (not the watery bit in the middle the edges), dried whole sweetcorn you get in pet shops, 1/4 of a weetabix and cherries to name a few. He's very spoilt. I started giving him fresh fruit in the first week a very small amount. Indy does seem quite resilent he doesn't suffer from a bad stomach.My hammy glares at me if I'm on the phone he wants all the attention You'll have to share some pics let us know how she gets on""",,In Love
1187,2012-06-28 22:17:00,Wiseowl,b'Love the pic Bulbie',,In Love
1188,2012-06-28 22:21:00,bulbie,b'i will take a picture of Spock every day and make a time lapse video of his growth I think.',,Chatty
1189,2012-06-29 06:37:00,jaxie40,"b""Spock's cute, bulbie, and a very happy birthday for yesterdday Yess, I will keep posting photo's too, Wise. There is one on his thread, but it's not that good. She's been out on here wheel this morning while I was on my exercise bike. She's gone back to bed now!Did you get your new over shoulder boulder holders, bulbie? """,,None
1190,2012-06-29 08:48:00,Wiseowl,b'Bulbie a belated Happy birthday! ',,In Love
1191,2012-06-29 10:26:00,WigglyOwl,"b""EEp where did my reply go?Happy Birthday for yesterday hun. Did you have cake?Spock looks such a sweetie, i had dwarfs once tried to breed them, but the male kept getting the wrong end of the female pmsl. One day she'd had enough of it in her ear all day so she tried to bite his balls off. Had to separate them sharpish.What does today hold?""",,Stressed
1192,2012-06-29 11:11:00,bulbie,b'I did I got three sets! ',,Chatty
1193,2012-06-29 11:14:00,shrew,"b""pics or it didn't happen  Happy birthday for yesterday bulbie - I was on and didn't realise :doh: I hope you had a good day.""",bulbie,Stressed
1194,2012-06-29 11:22:00,bulbie,"b""Haha shrew I'm not sure the rest of the girls would be cool with that! And thank you. Spock is fast asleep this morning.""",,Chatty
1195,2012-06-29 14:54:00,jaxie40,"b""You could always send the pics via PM, bulbie! Oh, off to Hobbycraft again in about half an hour if you'd like to join me and my son """,bulbie,None
1196,2012-06-29 15:04:00,bulbie,"b""Oh you know I'm coming with you!""",,Chatty
1197,2012-06-29 16:32:00,jaxie40,"b'Wow, that was fun! We have nearly every colour Hobbycraft paint now. We have all the glitter paints, all the pearlised, just need the remaining ordinary paints Oh, and treated myself to another suncatcher'",bulbie,None
1198,2012-06-29 17:09:00,bulbie,"b'Meanwhile, I have been comatose.'",,Chatty
1199,2012-06-29 17:29:00,jaxie40,"b"" What's up, me old fruit?""",,None
1200,2012-06-29 17:34:00,bulbie,"b""I just can't get myself out of bed today. """,,Chatty
1201,2012-06-29 17:40:00,shrew,b'how are you feeling? Just tired or lack of motivation? Hope you are ok. Share it with us girls ',,Stressed
1202,2012-06-29 17:42:00,bulbie,b'Tired and a lack of motivation.',,Chatty
1203,2012-06-29 17:48:00,shrew,"b""why are you feeling like that today? Has anything triggered it? Maybe put some happy music on and go and see the hamster, might cheer you up a bit, or just veg out on the sofa and watch something rubbish. I have days like this, a lot recently, where I just don't feel motivated to do a thing or go in. It is good to have a bit of alone time.I'm sorry. I never fully consider things with you bulbie - you always seem so happy and fun on here and I forget sometimes how you're feeling the rest of the time.""",,Stressed
1204,2012-06-29 17:57:00,Starless,"b""It's no crime to have the odd off day love. """,,Cheerful
1205,2012-06-29 18:00:00,bulbie,b'I must concede defeat to the point that those who seem happiest are often the saddest inside.',,Chatty
1206,2012-06-29 18:03:00,shrew,b'tears of a clown - i can relate Did anything trigger this today?',,Stressed
1207,2012-06-29 18:12:00,bulbie,"b""Nothings triggered it really... Not that I'm aware of, anyway. I'll pose for you tomorrow, Shrew. """,,Chatty
1208,2012-06-29 18:24:00,shrew,"b'hahahaI hope you feel better soon bulbie. Like star said, alright to have off days, it is understandable. Have you played with the hamster? (that is not a euphamism by the way)'",,Stressed
1209,2012-06-29 18:33:00,bulbie,"b""Spock got out this morning. He's crazy fast.""",,Chatty
1210,2012-06-29 18:40:00,shrew,"b""Escaped himself?I like little animals like that but always seem so delicate when I've handled them.""",,Stressed
1211,2012-06-29 18:47:00,bulbie,"b""Nah I picked him up and he made a bid for freedom and shot off underneath my bedroom door.He is so incredibly delicate though I'm almost afraid to touch him.""",,Chatty
1212,2012-06-29 18:50:00,shrew,"b""I take it you got him back then. I tried to catch a rabbit and pick it up but it was skin and bones, there was nothing there on the body, same with cats.Are you thinking to give the group thing another try when it's next on?""",,Stressed
1213,2012-06-29 18:57:00,bulbie,"b""I will be giving group another go yeah.Yup I goit him back with my dads help. We managed to scoop him up and put him in the exercise ball. He's so cute, not much bigger than a gumball.""",,Chatty
1214,2012-06-29 20:35:00,jaxie40,"b""Aww, he sounds adorable, bulbie! I've just worked out how to put the hamster ball together, now Miss Holly is running round in it, with an apple yoghurt drop in her cheeks! """,,None
1215,2012-06-29 20:45:00,bulbie,"b""I used to have a hamtard that would hide treats in his cheeks. But once he got hold of an actual malteser. He amazingly managed to stuff it in there, along with one in the other cheek. We couldn't get them out without hurting him. He decided to wait until they had melted before emptyingg his cheeks all over my knee.""",,Chatty
1216,2012-06-29 20:47:00,jaxie40,"b'Nice! lol. I remember I used to watch one of my many hamsters fill his pouches, go into his bed and spit all the food out! '",,None
1217,2012-06-29 20:52:00,bulbie,"b""Well who doesn't love breakfast in bed?""",,Chatty
1218,2012-06-29 21:01:00,jaxie40,"b""That's one of my demands for next Saturday morning! """,,None
1219,2012-06-29 21:12:00,bulbie,"b""I don't recall a partner ever doing that for me. """,,Chatty
1220,2012-06-29 21:16:00,jaxie40,"b""I only get breekie in bed on Mother's Day, and am only getting it next week because Ive told hubby he's got not choice! He gets the full cooked brekkie on his birthday and Father's Day, so he can't complain!""",,None
1221,2012-06-29 21:23:00,bulbie,"b""I had better teach d how to do it, for all the work I'm putting into helping him find his flat. Humph.""",,Chatty
1222,2012-06-29 21:26:00,sadgirl,"b""You've got a rare one there jaxie40 bulbile I agree I've never had breakfast in bed done for me the closest I've got is my son making me a cup of tea with cold water lol""",,Sad
1223,2012-06-29 21:26:00,jaxie40,"b'Definitely! It can take some doing, with occassional threats of violence! Years of training, sadgirl! '",,None
1224,2012-06-29 21:34:00,bulbie,b'sigh..........',,Chatty
1225,2012-06-29 21:36:00,sadgirl,b'Better start now then!',,Sad
1226,2012-06-29 21:59:00,jaxie40,"b'The sooner the better! Gotta start early with them Getting dinner cooked for me next Saturday too, plus lush pud!'",sadgirl,None
1227,2012-06-29 22:24:00,WigglyOwl,"b""I never get brekkie in bed. One of my hammy's once managed to get 6 of those little milk bones in, 2 in each cheek one i've no idea and carry one in her mouth lol.""",,Stressed
1228,2012-06-29 22:31:00,jaxie40,"b'I\'m very lucky with my hubby, I know. Just been talking about a Jezzer Kyle question on Facebook, ""Would you leave your partner if they gained a lot of weight?"" . Most of the men have said, yes, they would, the women said they wouldn\'t. My hubby\'s seen me put on weight when we first moved in together, he saw me lose that. He saw me gain 4 1/2 stone during my first pregnancy, losing all but a stone of it before I fell pregnant again. When we\'d moved and settle, I lost weight again, then went over the top and developed an ED. He\'s never said anything when I\'ve gained weight, but he was so worried when I lost a load.We\'ve been through a lot together, he\'s truly my best friend '",,None
1229,2012-06-29 22:51:00,WigglyOwl,"b""Aww you are so lucky Jaxie. Mine thinks i am his life, which means i kind of don't get to have mine.""",,Stressed
1230,2012-06-30 00:12:00,shrew,"b""jaxie, you are living the dream  Sounds brilliantI'd do breakfast in bed for a bird I reckon. Wouldn't be so keen on getting it though as it is never right. My nan used to lay everything out in the morning if I stayed round her house when I was younger. The milk ends up getting a bit warm which irks me How are you feeling bulbie? Been up to much?""",,Stressed
1231,2012-06-30 00:22:00,bulbie,b'Am I a sad individual Shrew? I joined a dating site....',,Chatty
1232,2012-06-30 00:45:00,shrew,b'not at all bulbie - I was thinking about doing it not long ago myself to be honest',,Stressed
1233,2012-06-30 00:48:00,bulbie,"b""Oh good. It's a distraction, if nothing else. Can't hurt to make new friends and see what's out there...""",,Chatty
1234,2012-06-30 00:54:00,shrew,b'exactly. Loads of people do it nowadays and there are so many stories of people meeting online and being happy ',,Stressed
1235,2012-06-30 01:15:00,bulbie,b'Did you ever join one?',,Chatty
1236,2012-06-30 01:21:00,shrew,"b""No. Was too nervous. I'm 24 and studying full-time and working part time - it might be awkward with people sometimes, though this is probably my own hang ups. I don't know, it's just me. All I want out of my life is to meet someone, fall in love and be able to be together, look after one another and share experiences, stories and a future together.""",,Stressed
1237,2012-06-30 01:24:00,bulbie,"b'Pretty much what I want too, but the bag eggs seem to follow me like a bad smell.'",,Chatty
1238,2012-06-30 01:30:00,shrew,"b""I told you earlier that you seem to have a good sense of humour and your posts always make me smile. That is always good. From what I gather just on here you have good morals and are a carng and sensitive person, which will make someone very happy. You've just had bad luck is all. Anyone who doesn't appreciate you is a fool. Not anything you've done, or at least anything you can help. It is just the way it is sometimes.""",,Stressed
1239,2012-06-30 01:57:00,bulbie,b'I attract bad luck ',,Chatty
1240,2012-06-30 02:00:00,shrew,"b""Doesn't always have to be that way just because it has been so far. It will change.""",,Stressed
1241,2012-06-30 02:01:00,bulbie,"b""I'm still hopeful, which is a feat considering my ex.""",,Chatty
1242,2012-06-30 02:04:00,shrew,"b""I'm a bit behind. What did he do? Can speak by PM if you prefer.""",,Stressed
1243,2012-06-30 02:11:00,bulbie,b'Cheated on me with three others.',,Chatty
1244,2012-06-30 02:12:00,shrew,b'what a bellend',,Stressed
1245,2012-06-30 02:23:00,bulbie,"b'Amen to that, brother.'",,Chatty
1246,2012-06-30 11:02:00,jaxie40,"b""He is the lowest of the low to cheat on my bulbie You're not sad hun! I think after my first husband, I would have eventually dont that had I not met hubby, bearing in mind I was 31 when I met him. Bulbie, as shrew said ealier, you have a wicked sense of humour, one day you will find someone who just gets you """,,None
1247,2012-06-30 13:50:00,bulbie,b'I got given a phone number last night. ',,Chatty
1248,2012-06-30 14:30:00,jaxie40,"b""ANOTHER one? You're obviously giving out some sort of Bulbie Vibe at the moment! """,,None
1249,2012-06-30 14:46:00,bulbie,"b""Well I don't suppose it hurts to keep my options open at this stage... """,,Chatty
1250,2012-06-30 15:01:00,jaxie40,b'Definitely not hun! ',,None
1251,2012-06-30 15:16:00,bulbie,b'S is going increasingly quiet on me anyway.',,Chatty
1252,2012-06-30 17:40:00,WigglyOwl,"b'I joined a dating site and met hubby, nothing to be ashamed of '",,Stressed
1253,2012-06-30 18:14:00,jaxie40,b'I keep crying to my husband today ',,None
1254,2012-06-30 18:20:00,Tatty,"b""What's wrong jaxie? """,,None
1255,2012-06-30 19:16:00,bulbie,"b""What's wrong my jaxie?""",,Chatty
1256,2012-06-30 20:36:00,jaxie40,"b""I don't know, just feeling really crap. Anxiety is sky high""",,None
1257,2012-06-30 20:43:00,WigglyOwl,b' To everyone.',,Stressed
1258,2012-06-30 21:02:00,jaxie40,"b'Right back at you, Wiggly How are you today?'",,None
1259,2012-06-30 21:23:00,WigglyOwl,"b""extemely crap sorry to say  It's stupid, i can't help it. sorry everyone""",,Stressed
1260,2012-06-30 21:33:00,bulbie,"b'Please, there is no need to apologise. '",,Chatty
1261,2012-06-30 21:40:00,jaxie40,"b""Mrs WigglyOwl, do not apologise. Just gimme a  instead.In fact, let's all """,,None
1262,2012-06-30 21:52:00,bulbie,b'',,Chatty
1263,2012-07-01 16:19:00,WigglyOwl,"b'282337_362907187111337_602512448_n.jpg531396_362907583777964_398075109_n.jpg561051_362922913776431_1728180172_n.jpgCake for everyone, take one and pass them around xx'",,Stressed
1264,2012-07-01 16:22:00,bulbie,b'They look incredible!',,Chatty
1265,2012-07-01 16:28:00,jaxie40,b'I second that! Yummy!Anyone for a cuppa to go with the cake? ',bulbie,None
1266,2012-07-01 16:32:00,bulbie,b'Please. I have a distinct case of The Hots.',,Chatty
1267,2012-07-01 16:42:00,jaxie40,"b'Here ya go, bulbie.I have a distinct case of crappieitus again today.Oh, and I now loathe Hobbycraft too '",,None
1268,2012-07-01 16:48:00,sadgirl,"b""They look great I can't do the icing even following the instructions! Mine always end up in a watery puddle I'm soooooooooooooo jelous""",,Sad
1269,2012-07-01 16:52:00,jaxie40,"b'Watery puddle? Oooh, you need to try making my chocolate butter icing. Tiz verr, verr good '",,None
1270,2012-07-01 16:54:00,bulbie,"b""What's up my jaxie?""",,Chatty
1271,2012-07-01 16:57:00,jaxie40,"b""I really wish I knew hun. Just suddenly crashed these past few days. My mood has really dropped. I feel like I should just disappear, everyone would be better off without me. Irrational, I know. My hubby's given me lots of cuddles for reassurance, which has helped. Hoping that finally remembering to take my afternoon meds mega early helps!""",,None
1272,2012-07-01 17:03:00,bulbie,b'Have some more hugs. ',,Chatty
1273,2012-07-01 17:03:00,sadgirl,b'Sending you hugs aswellxx',,Sad
1274,2012-07-01 17:07:00,sadgirl,b'Stop your making me hungry and very jelous. Chocolate yummy excuse me whilst I do my homer simpson impression urrrrrrrrrrrgh chocolate............ Excuse the dribble lol',,Sad
1275,2012-07-01 17:14:00,bulbie,b'Chocolate cake...drool',,Chatty
1276,2012-07-01 17:16:00,sadgirl,"b""I know I want some I'm so hungery""",,Sad
1277,2012-07-01 17:22:00,bulbie,"b""If you're hungary you'd better czech the fridge.""",,Chatty
1278,2012-07-01 17:22:00,jaxie40,b'Just about to have a go at making teriyaki sauce to go with chicken....... Wish me luck!',,None
1279,2012-07-01 17:58:00,shrew,b'sending you a spongebob hug jaxie - at the moment they are the most powerful of hugsspongebob hug hope you are alright bulbie ',,Stressed
1280,2012-07-01 18:31:00,bulbie,b'Oh shrew I have so little energy.',,Chatty
1281,2012-07-01 19:07:00,jaxie40,"b""Spongebob hug received gratefully shrew. Hope you're ok, hun How's you today, bulbie? """,,None
1282,2012-07-01 20:12:00,bulbie,b'So tired jaxie. So tired.',,Chatty
1283,2012-07-01 20:14:00,jaxie40,"b'What you been up tp, or just not sleeping well hun? '",,None
1284,2012-07-01 20:44:00,bulbie,"b""I haven't been getting tired til about 5am lately. Its really doing my head in.""",,Chatty
1285,2012-07-01 20:55:00,jaxie40,"b""I can imagine it is! That would drive me crazy!I've made myself have my evening meds today and will hopefully keep remembering to take them. I don't want to keep on being a blubbering wreck """,,None
1286,2012-07-01 21:24:00,jaxie40,"b""I think we've frightened shrew off. Have you been flashing your new underwear at him again, bulbie? Right, I'm off to bed. My eyes hurt, feel really sore and heavy. Probably from all the crying earlier.Night all """,,None
1287,2012-07-01 21:31:00,bulbie,b'Aw honey. Sleep well. Xxx',,Chatty
1288,2012-07-01 21:33:00,jaxie40,"b""Ah, I'll be alright. Just hope I can remember which Spawn needs to be where this week!Hope you sleep a bit better too, bulbie """,,None
1289,2012-07-01 22:54:00,WigglyOwl,"b'Hugs everyone. I admit to cheating with the buttercream to save energy. I bought it ready made  I could guarantee it happened that way. I hope you all like them they were scrummy. I had one without the gold bears on top. Love cake, love gold bears but not in the same bite lol'",,Stressed
1290,2012-07-01 23:08:00,bulbie,b'Gold bear cake... interesting...',,Chatty
1291,2012-07-02 09:18:00,shrew,"b""I hope you are feeling a bit better today bulbie. It is amazing how much stress and just thinking about other things can tire you out. Last few months I have felt the same, like I cannot be bothered to do anything, but no matter how much sleep or whatever else I do I just felt drained. I can only recommend trying to get an early night, cup of cocoa and watch telly in bed and get up early and keep busy. Hopefully as well having something to look forward to and get you out of the house always helps a bit, so if you are trying the group thing again then that might be just the thing. Often it isn't tiredness but motivation that there is something to do in the day, if you get what I'm saying.  Hope you are feeling better today I had to work and not yet """,bulbie,Stressed
1292,2012-07-02 09:34:00,jaxie40,"b""What's this 'work' you speak of, shrew? How are you today, anyway? :shrew:Yes, I too hope you're feeling better today, bulbieMy day started off well, until husband put his raincoat on and found his office key to be missing. One of the kids has taken it, obviously, but guess who it's down to to find? Second time this has happened this year. The last time, he didn't empty hus pockets before playing in the snow. Guess who had to find it that time too! Time to buy a keysafe, methinks!""",shrew,None
1293,2012-07-02 10:39:00,shrew,"b""My nan is like that with keys - only has to walk a few metres to the shed from the house with the key and it still manages to go missing. She had one of those massive keyfobs but she lost that too, the dippy old bint I am fine jaxie - are you alright? I have no idea what this work is to be honest - the bar I turn up and pour a few drinks and that's it. The university work, well, you tell me what that is - what a joke.""",,Stressed
1294,2012-07-02 12:11:00,jaxie40,"b""I text my hubby to get ideas of where the key may be, having gone through wardrobes, drawers, beds...basically everywhere. He replied an hour later and said last time it happened, the kids had put it with all of our other keys. I wish he'd told me that before, it would have saved me soooo much time and stress! Yes, I'm ok thanks, though suffering from lack of sleep. Venlafaxine and sleep do not mix! Univeristy work. Ah yes, that was me some 16 years ago. I was an older student, who spent much of the time between lectures either standing on the uni steps smoking with the lecturers, or over the pub having informative chats with lecturers! """,,None
1295,2012-07-02 13:48:00,bulbie,b'Hola chicas!!',,Chatty
1296,2012-07-02 14:03:00,shrew,b'hi bulbie - how are you feeling today? ',,Stressed
1297,2012-07-02 14:04:00,jaxie40,b'Yo! Wasssssuuuuuuuup! ',bulbie,None
1298,2012-07-02 14:15:00,bulbie,"b""I am so freakin' excited!""",,Chatty
1299,2012-07-02 14:19:00,shrew,"b""why's that?""",,Stressed
1300,2012-07-02 14:23:00,jaxie40,"b'Yes, do tell! '",shrew,None
