,date,username,post content,quoted user,post mood
1457,2014-12-16 12:44:00,RainbowHeartz,b'feeel like ive achieved alot but dont understand why i should be proud what ive done isnt rocket science or nothing',,None
1458,2014-12-16 12:48:00,*autumn*,b' (judazz)',,Fine
1459,2014-12-16 12:51:00,*autumn*,b'hugs monroe ',,Fine
1460,2014-12-16 12:52:00,RainbowHeartz,b'thanks teddy your ace too ',T.e.d.d.y,None
1461,2014-12-16 12:52:00,RainbowHeartz,b'thanks xxxxxxxx ',autumnalsprinkles,None
1462,2014-12-16 13:26:00,*autumn*,"b""I'm sorry you're not feeling so great topcat. Best wishes x""",,Fine
1463,2014-12-16 13:39:00,RainbowHeartz,b'shaken up i am i had to ring about P.I.P',,None
1464,2014-12-16 13:42:00,FallenAngel2,b'Cor I am trying warm me limbs up after that trek. The wind chill was around -2! Feels good though to have a dry crisp day. Maisie has the vets tonight so hopefully all will be right with the world.Got to keep my mind ticking over. Tick tock tick tock.',,None
1465,2014-12-16 16:44:00,Helena1,b'i feel like me at the moment. the happy me. ',,Cheerful
1466,2014-12-16 16:49:00,RainbowHeartz,b'',Helena1,None
1467,2014-12-16 16:55:00,RainbowHeartz,b'feeling anxious about everything ',,None
1468,2014-12-16 19:58:00,Helena1,b'ive got a headache from thinking too much.',,Cheerful
1469,2014-12-16 20:07:00,burt tomato,b'feeling depressed - been in bed all day',,Amazed
1470,2014-12-16 20:35:00,mami5,"b""feel like I'm crawling around in a deep dark hole""",,Crappy
1471,2014-12-16 20:48:00,RainbowHeartz,b'sad ',,None
1472,2014-12-16 20:56:00,ScaredCat,b'Tired. All this running to try not let bad thoughts catch me',,None
1473,2014-12-16 21:21:00,RainbowHeartz,b'hopeless i feel',,None
1474,2014-12-16 21:43:00,Mister.B,"b""I know you've been through the wringer. I hope you find time to be kind to yourself and recuperate.""",Judazz,Inspired
1475,2014-12-16 22:02:00,RainbowHeartz,b'Alone and scared',,None
1476,2014-12-16 22:03:00,RainbowHeartz,b'Thank you xxx',Mister.B,None
1477,2014-12-16 22:12:00,AliceinWonderland,"b'Afraid, sad.'",,None
1478,2014-12-16 22:21:00,ScaredCat,b'Hope you get a good sleep',T.e.d.d.y,None
1479,2014-12-16 22:25:00,mami5,b'Have had enough for today. Goodnight.',,Crappy
1480,2014-12-16 22:43:00,burt tomato,b'sad...',,Amazed
1481,2014-12-16 22:46:00,SomersetScorpio,"b'Tired, wobbly and a bit fed up with physical health problems going on.'",,Blah
1482,2014-12-16 22:47:00,ScaredCat,b'So sorry you have had such a horrible day',brat tomato,None
1483,2014-12-17 01:29:00,burt tomato,b'Thanks ScaredCat for being my friend.struggling with inner turmoil - its my own fault.',ScaredCat,Amazed
1484,2014-12-17 01:32:00,*autumn*,"b'not ""fault"", please try not blame.. '",,Fine
1485,2014-12-17 01:45:00,burt tomato,"b""can't help but blame myself.""",autumnalsprinkles,Amazed
1486,2014-12-17 01:59:00,rubyrose,b'Fat and disgusting ',,None
1487,2014-12-17 02:20:00,*autumn*,b'Conscious as opposed to overwhelmed with emotion',,Fine
1488,2014-12-17 08:14:00,ScaredCat,b'Woke up with feeling of dread',,None
1489,2014-12-17 08:50:00,dubblemonkey,"b""...I don't feel like explaining myself, I cannot justify anything that I do without feeling bad about it.""",,Angelic
1490,2014-12-17 09:07:00,Fallen Phoenix,b'Mentally and physically done in.',,Crappy
1491,2014-12-17 09:51:00,FallenAngel2,b'Very tired and like the weight of me thoughts are causing me to keel over. Not good.',,None
1492,2014-12-17 10:01:00,RainbowHeartz,b'Whats the point in a shit life i dont get it',,None
1493,2014-12-17 12:52:00,RainbowHeartz,b'fuck the policegrrrrrrrrrrrrrrrrrrrrrrrrrrrrrrrrrrrrrrsoooooooooooo pissed off they are not questioning stepdad til after new year now at this rate this shit is going to go on for a couple of years when i was a kid it took over a year with my real dad before it went to courtim sooooooooooooooo angry and annoyed ive a fucking temper problem now for fuck sakeAHHHHHHHHHHHHHHHHHHHHHHHHHHHHHHHHHHHHHHHHHHHHHHHHHHHHHHHHHHHHHHHHHHHHHHHHHHHHHHHHHHHHHHHHHHHHHHHHHHHHHHHHHHHHHHHHHHHfuck everything fuck it all',,None
1494,2014-12-17 13:04:00,RainbowHeartz,b'dittoits great innit',T.e.d.d.y,None
1495,2014-12-17 13:13:00,RainbowHeartz,b'awww bless ya xxxxxxxxxxxxi got baileyswould drink apple juice too if i had some ',T.e.d.d.y,None
1496,2014-12-17 13:14:00,Mister.B,b'I feel full of cold. ',,Inspired
1497,2014-12-17 13:24:00,RainbowHeartz,"b'had enough in real world people telling me what to do, just back the fuck off if it was that simple dont you think i would be doing it'",,None
1498,2014-12-17 14:46:00,ScaredCat,b'Very upset. Bawling',,None
1499,2014-12-17 14:50:00,Mister.B,"b""If you need to talk, just inbox me, I'll try my best.""",ScaredCat,Inspired
1500,2014-12-17 16:51:00,ScaredCat,b'Emotional pain',,None
1501,2014-12-17 16:57:00,Gajolene,"b'Good that I made it to the therapist, but frustrated I have another huge disability package of papers to get and fill out. She booked me an hour and a half on christmas eve. I told her she should be home with her kids. She assured me she was working that day anyway.'",,Lurking
1502,2014-12-17 17:01:00,ScaredCat,b'Wish my counsellor was working next week too. I so selfish',,None
1503,2014-12-17 17:03:00,Helena1,b'you not selfish. i am glad i got nearly 3 weeks off from my therapist. all i say is idk for 50 mins. so excruciating. i think she hates me.',ScaredCat,Cheerful
1504,2014-12-17 17:09:00,Gajolene,"b""Take that time away from your therapists to write out all the things you think are the biggest problems, and area's you think you need help with the most. It really helps to write it out ahead of the appointment. Anxiety can give us those mental blocks and make us shut down in the appointments. That's when those check lists come in the most helpfull.""",,Lurking
1505,2014-12-17 17:23:00,ScaredCat,b'RFeally dont think she hates you. When i first started seeing my counsellor i said that loads too and she was fine with it.',Helena1,None
1506,2014-12-17 17:24:00,RainbowHeartz,b'pissed off',,None
1507,2014-12-17 18:10:00,Gajolene,"b""My ex girl friend keeps e mailing me saying she hates me and all I stand for, but can't live without me. She can't understand her self destuctive behavior tears my heart out, and I can't watch her do that to herself. She won't except help, or understand her life won't change unless she changes her behavior.I would email her telling her that you can not help her, you are moving on with your life, to get professional help and inform her that you are blocking her future emails/social media. She will keep doing this and won't stop. Don't keep letting her do this, it's selfish of her, insensitive to you. You don't need to go back into isolation. Just stop this one person from harassing you.""",,Lurking
1508,2014-12-17 19:49:00,*autumn*,"b'Pretty content. Did a bit of exercise, did some official stuff, now eating the rest of my curry with *three papadums* yums'",,Fine
1509,2014-12-17 20:15:00,Mister.B,b'Sick of this cold. ',,Inspired
1510,2014-12-17 20:51:00,BillFish,"b""Happy and chillaxed, have been for a few weeks, relaxed in my middle age, and don't seem to give a damn what people think when I'm out and about. Just walk around with a contented smile or nonchalant whistle.Perhaps 10 years of strong medication has finally fried my pre- frontal cortex """,,Breezy
1511,2014-12-17 20:53:00,katya,"b""Can't fucking wait for the Christmas break. The feeling of fatigue is too damn high.""",,Crappy
1512,2014-12-17 21:24:00,ScaredCat,b'A mess.....',,None
1513,2014-12-17 22:09:00,RainbowHeartz,b'i feel like life isnt worth it at all im always abused bullied or recovering from it.... ive had enough',,None
1514,2014-12-17 22:16:00,mami5,b'sick and tired. Goodnight ',,Crappy
1515,2014-12-17 22:55:00,rasselas.redux,b'I am the ascended being',,None
1516,2014-12-18 00:37:00,lovagemuffin,b'I feel paranoid...................................but know tomorrow I will be better',,Mellow
1517,2014-12-18 01:37:00,*autumn*,b'In love with the universe and vibrating with oneness and consciousness.',,Fine
1518,2014-12-18 02:00:00,SomersetScorpio,"b""Feeling worried because i'm seeing my care co-ordinator tomorrow, but when I phoned to make the appointment last week she sounded like she couldn't be arsed to see me and didn't even ask me how I was...""",,Blah
1519,2014-12-18 02:42:00,Tomtom,b'Worried and anxious about Drs appointment tomorrow. Also a little sun burnt',,None
1520,2014-12-18 02:53:00,*autumn*,b'I hope it all goes well for you xx ',SomersetScorpio,Fine
1521,2014-12-18 06:49:00,FallenAngel2,"b""Don't know where that night went, but I am totally shattered.Need a bit of a magic lift off this morning. Something to shake me out of this stupor.The closer Christmas gets the more I feel anxious.""",,None
1522,2014-12-18 10:52:00,RainbowHeartz,b'i feel like crap tbh not going to pretend anymore',,None
1523,2014-12-18 11:26:00,*autumn*,b'Better',,Fine
1524,2014-12-18 14:26:00,RainbowHeartz,b'wow well jelly ',T.e.d.d.y,None
1525,2014-12-18 14:30:00,RainbowHeartz,b'totally enjoy it innit have a good xmas teddy xxx',T.e.d.d.y,None
1526,2014-12-18 14:36:00,RainbowHeartz,b'thanks and your welcome xxxxxxx  to teddy and  to teddys mum and dad',T.e.d.d.y,None
1527,2014-12-18 15:46:00,Kerome,"b'Feeling snottery as I have a cold... Going to make more lemon drink, hope it goes away soon.'",,Doh
1528,2014-12-18 15:52:00,FallenAngel2,"b""Really tired. And that's without the medication.My eyes are like little puddles of glue. Can't keep them open.....""",,None
1529,2014-12-18 15:53:00,RainbowHeartz,b'panicky ',,None
1530,2014-12-18 15:57:00,maybe.shes.a.wildflower,"b""Went to deliver cards to old services users, feel good as they were pleased to see me  on even had some Thornton's for me!  then I come home and my bf winds me straight up, at least I'm out of here for a Christmas party soon, im going as an elf  excited for Christmas now!""",,Lurking
1531,2014-12-18 16:03:00,RainbowHeartz,b'mum will be home soon i cant deal with it  i love her to pieces though',,None
1532,2014-12-18 16:09:00,mami5,b'fucked up!',,Crappy
1533,2014-12-18 16:26:00,RainbowHeartz,b'',mami5,None
1534,2014-12-18 16:54:00,SomersetScorpio,"b""You're not a burden to the NHS. You're not a burden to anybody.If anybody has made you feel that way, it's because they're bloody useless and are putting the blame on you instead.""",T.e.d.d.y,Blah
1535,2014-12-18 17:14:00,fair&square75,"b'Teddy don\'t think yourself as a burden,if it wasn\'t for us that pdoc wouldn\'t have a.job  and that\'s what NHS is there for...i think its wrong for them.to shout at us.as if the.other way around its percieved differently...just say in ur head if ya can ""f*** em"" x'",,None
1536,2014-12-18 18:38:00,Helena1,b'i feel okay but i am never ever going out round here again. i went out 2 times and seen person i know both times and had to say hi once. was awful.',,Cheerful
1537,2014-12-18 18:46:00,Gajolene,"b""Little disappointed in our Salvation army this year. Instead of making up food hampers they gave out your choice of turkey or ham and a 25 dollar gift card for the grocery store farthest to walk to. Not complaining it's still charity. But I miss the unexpected goodies they gave out in previous years you don't normally buy when you shop on a poverty budget.""",,Lurking
1538,2014-12-18 19:12:00,Gajolene,b' Funny I was just thinking the exact same thing topcat. I think it may be just a christmas thing for me but I suspect not. ',,Lurking
1539,2014-12-18 19:13:00,MarlieeB,"b""*Runs into forum, baywatch style * who put that random pole there, ouch.I'm hereeeeeeeeeeeeeeeeeeeeeBut not for long lol""",T.e.d.d.y,Sad
1540,2014-12-18 19:15:00,Bianca222,b'Sending lots of love to you guys ',,None
1541,2014-12-18 19:16:00,*autumn*,b'I feel really good.',,Fine
1542,2014-12-18 19:27:00,Gajolene,"b""For me I'm trying to be happy for everyone else, but the negatives in our life just want to drag me back down. Been flashbacking a lot the last few days too. Maybe a good day to journal and get it out of my head. Sometimes it helps, sometimes it makes it worse. Don't do anything dangerous silly.  Hope I feel better after I get out and get this last appointment over with. Off to get me coat (literally) See you all later.""",,Lurking
1543,2014-12-18 19:31:00,SarahD,"b""Tired and lost. I was just talking to someone close to me and really wanted to tell them some stuff, but they were excited and had a lot to say and I didn't want to ruin things, so I kept quiet.""",,None
1544,2014-12-18 19:49:00,FallenAngel2,b'Feeling cleaner after a bath. That kip earlier helped.Shaved me head and face and feel all dynamic and fresh.All I need to do is learn to fly and I am ready to go ',,None
1545,2014-12-18 20:16:00,RainbowHeartz,b'feeling more positive',,None
1546,2014-12-19 06:57:00,ScaredCat,b'Feel like i dragging myself through mud which is up to my neck and for what - there is no point',,None
1547,2014-12-19 08:26:00,rubyrose,"b""Like I've forgotten what it's like to be happy. Like I don't deserve to get that feeling back. Unworthy of good things.""",,None
1548,2014-12-19 08:34:00,FallenAngel2,"b""Quite sullen and broody. Not helped by the whipping winds and pouring rain.Sort of torn between doing something or amusing myself with media. I can't decide. I'll let the coffee decide. This time next week it'll all be over.""",,None
1549,2014-12-19 08:44:00,MarlieeB,"b'Tired but feeling pretty good, cuddling up to my Hot Water Bottle '",,Sad
1550,2014-12-19 09:16:00,burt tomato,"b""I don't feel anything. haha""",,Amazed
1551,2014-12-19 16:58:00,cherish,"b""Sienna rose I think if i ever felt truly happy my head would EXPLODE with shockyou ARE worthy of good things sienna rose but it does seem like all the good things happen to bad people ( justin bieber for one )In all seriousness though when we don't like ourselves we think other people don't like us too, which isn't true , i like you a lot and wish you ALL the good things and feelings you have ever wanted keep-calm-because-you-re-worth-it-7.jpg""",Sienna Rose,Bashful
1552,2014-12-19 17:36:00,Aquarius,b'Worrying because I just broke a tooth.',,Amused
1553,2014-12-19 20:34:00,RainbowHeartz,b'i dunno tbh',,None
1554,2014-12-19 21:25:00,mami5,b'anxioustiredscaredsickmessed up',,Crappy
1555,2014-12-19 21:27:00,mami5,b'anxioustiredscaredsickmessed up',,Crappy
1556,2014-12-19 21:30:00,Mister.B,b'I feel ill. ',,Inspired
1557,2014-12-19 21:37:00,RainbowHeartz,b'i feel afraid to say my feelings tbh',,None
1558,2014-12-19 22:17:00,FallenAngel2,b'I am feeling the cold tonight. Even the end of me nose feels like ice.Must be the snowwoman I have been snogging ',,None
1559,2014-12-19 22:31:00,Quickduck,b' xxxx',T.e.d.d.y,None
1560,2014-12-20 01:59:00,Darkred,"b""Bored and annoyed. Not sure why I'm annoyed though.. maybe because I'm bored. """,,None
1561,2014-12-20 02:59:00,Gajolene,b'silly with whiskey',,Lurking
1562,2014-12-20 03:05:00,Fallen Phoenix,"b'Snap!, same here.'",,Crappy
1563,2014-12-20 08:12:00,FallenAngel2,b'Bunged the hell up because someone put the heating on in the night ',,None
1564,2014-12-20 08:24:00,Unloved,"b'tired, Wired, worn-out with too much on my plate, no help and NOT Knowing where to begin.'",,Tired
1565,2014-12-20 08:30:00,MarlieeB,"b""Very tired but can't sleep till my washing is done or I will be working naked tonight and no one wants to see that!""",,Sad
1566,2014-12-20 08:59:00,Quickduck,"b'I think sales might increase. I bet Tesco are willing to try anything to increase sales right now, might become company policy. '",MarlieeBee,None
1567,2014-12-20 09:06:00,Quickduck,"b'Christmas can be difficult, thinking of you T.e.d.d, y.  x'",T.e.d.d.y,None
1568,2014-12-20 09:14:00,MarlieeB,"b'Trust me they would go downhill, we might only make one billion profit *gasps*'",Quickduck,Sad
1569,2014-12-20 09:22:00,Quickduck,"b""Thanks T.e.d.d.y.You look after yourself over crimbo my lovely friend.  xWe'll have loads of fun in the new year. """,T.e.d.d.y,None
1570,2014-12-20 12:27:00,Mister.B,"b'I feel like a pig, eating with this cold.'",,Inspired
1571,2014-12-20 14:17:00,AliceinWonderland,b'Tired and ill.',,None
1572,2014-12-20 15:40:00,ScaredCat,b'Scared of myself',,None
1573,2014-12-20 16:02:00,RainbowHeartz,b'like im faking it',,None
1574,2014-12-20 16:33:00,Quickduck,b'Feeling very BaAaar Humbug!',,None
1575,2014-12-20 16:35:00,Quickduck,b'Christmas spirit? Me too. ',Judazz,None
1576,2014-12-20 16:36:00,Gajolene,"b'Having a peacefull quiet morning, made up some poached eggs and dollar fries for breakfast and having my tea with no sugar this morning. The boys and the cats are still sleeping and I get some time on the fast computer, mine is just about dead now. Lucky to make 4 comments in half an hour on that one, soooo slow and am down to half a screen because of dead pixels. Will enjoy this one while I can today.'",,Lurking
1577,2014-12-20 16:46:00,Quickduck,"b""That's the kind Christmas spirit I need right now, but we've none in. """,T.e.d.d.y,None
1578,2014-12-20 17:00:00,Gajolene,b'who me?',,Lurking
1579,2014-12-20 17:27:00,Gajolene,"b""I frequently have to take breaks if my anxiety is high, and pull back from commenting, or take a couple days away, you have to do what is best for your health Teddy. If you do want some support you have lots of lovely friends here who will help when you do need us. Maybe stick to the chill outs for a while and stay away from the two pence worth section, where controversial topics are discussed and get upsetting because of strong opinions. I help when I can but somedays I just feel like anything I post is going to sound like crap. I doubt myself a lot so I just lurk or post light and easy stuff. It's sad sometimes people get so caught up in topics that they seem to forget that this forum is for infomation and for support. """,,Lurking
1580,2014-12-20 17:33:00,ScaredCat,b'Really sorry you are so upset Teddy',,None
1581,2014-12-20 17:40:00,Quickduck,"b""What happened? Hope you ok T.e.d.d.y. Please don't go; you're a valued member here.  xx""",T.e.d.d.y,None
1582,2014-12-20 17:45:00,TiredTina,"b'As you will see, this thread has been heavily moderated. Please - no more discussion on moderation decisions, these are not appropriate on the open forum. If you have any concerns then please either report or pm a member of mods/admin. Thank you'",,Tired
1583,2014-12-20 20:24:00,Gajolene,"b'Feel like I could get used to this quick, two monitors one computer, one monitor for my shows and one for the forum. JS says if he gets his PS4 I can have his computer '",,Lurking
1584,2014-12-20 20:32:00,RainbowHeartz,b'i feel like i cant be honest on here anymore on how im feeling i stick to my p j for that',,None
1585,2014-12-20 20:43:00,BlueBerry,"b""I hope I'll be a lighter and more cheerful person after the new year. I'd love to be posting on here with a better more light-hearted attitude than I have now. I feel like I'm such a downer nowadays. I want a dancing banana. """,,Scared
1586,2014-12-20 21:20:00,Helena1,b'me too blueberry.',,Cheerful
1587,2014-12-20 21:39:00,FallenAngel2,"b'I am feeling content. Low lights, blankie, animals, hot chocolate.These 20 minutes will be enjoyed despite their temporary status.'",,None
1588,2014-12-20 21:57:00,maybe.shes.a.wildflower,"b""I hate my life and quite frankly I'm tired of living it anymore  feel like a twat cause there's people much worse then me but I just dont w\xc3\xa0nt to carry on, theres no fuckin point to being here anyway.""",,Lurking
1589,2014-12-20 22:27:00,SomersetScorpio,"b'I feel really grotty - drained, scared, physically unwell, anxious, regretful..'",,Blah
1590,2014-12-21 04:34:00,Darkred,"b'I feel lonely, anxious scared and slightly upset trying to remain positive through the negative and trying even harder to avoid self pity.'",,None
1591,2014-12-21 05:25:00,Desna,b'I admire your strength. All will be well ',Darkred,Breezy
1592,2014-12-21 07:26:00,burt tomato,b'I feel okay. I feel more optimistic about the short term all of a sudden.',,Amazed
1593,2014-12-21 09:45:00,rubyrose,"b'I hope you feel better soon, Topcat. I truly do. '",Topcat,None
1594,2014-12-21 09:50:00,Helena1,b'i am swinging between rage and sadness.',,Cheerful
1595,2014-12-21 11:51:00,BlueBerry,"b""Going back home today for Christmas. Can't wait to see my mum, my sister and my two lovely cats again. I'm so fed up of my university. Keep bumping in to people who seem to hate me. Glad to get away for a few weeks.""",,Scared
1596,2014-12-21 12:23:00,maybe.shes.a.wildflower,"b""Waiting for Christmas, can't wait to see the look on my little mans face when he opens all his presents  Hopeing my bf will be offered redundancy soon so we can plan our escape, been waiting forever for any news """,,Lurking
1597,2014-12-21 12:39:00,Mister.B,"b""I still feel ill. Got that thing were loads of gas builds up in your stomach/bowels now, 'cos I drink too much fizzy pop. It's really uncomfortable.""",,Inspired
1598,2014-12-21 12:40:00,Mister.B,"b'Also, I too, am waiting for Christmas.I keep going over to the tree and looking at all the presents like ""Soon....""'",,Inspired
1599,2014-12-21 13:20:00,maybe.shes.a.wildflower,b'Recently I experienced what I believe was trapped gas and I feel for you  i found lots of burping helped and stuffing my face with food.',,Lurking
1600,2014-12-21 14:48:00,MarlieeB,"b'So, so tired zzzzzI should be able to take my bed to work'",,Sad
1601,2014-12-21 14:52:00,Mister.B,"b'I might start doing that. Take a rucksack with a blanket in and then just sit on the bus wrapped up, and then get there and put it back in the rucksack and occasionally go out back and have a little nap. '",MarlieeBee,Inspired
1602,2014-12-21 14:57:00,MarlieeB,b'Haha if only beds could move',,Sad
1603,2014-12-21 15:04:00,MarlieeB,b'Time too get up. Be back later.',,Sad
1604,2014-12-21 17:23:00,Gajolene,"b""Good day everyone, just lunch here and logged in late today. Don't know if it's winter coming on or what the hell it is, but wracked with pain the last couple days, can barely walk for cramping and joint pain. My iron levels and B12 levels are back to normal so it can't be the anemia.  Don't know what the hell it is, but sure is keeping me from getting things done, hope it passes soon. Don't want to be munching pain killers every day.All kinds of fears back as to whats causing it. Probably an inflamation thing I'm guessing.""",,Lurking
1605,2014-12-21 20:21:00,FallenAngel2,"b""I feel like fuck fuck and fuck.Went to Wakehurst Park and my gosh what a stunningly beautiful place. Not a tree or bird out of place. Lovely waterfall features and it was amazing. Peace and tranquility everywhere. It's nature being allowed to be nature. I was looking at all the brilliant trees and wishing I could build tree houses. It was \xc2\xa312.50 well spent.I feel so disappointed I can't still be there. """,,None
1606,2014-12-21 20:25:00,mami5,b'Not so good and dangerously calm',,Crappy
1607,2014-12-21 20:28:00,SomersetScorpio,"b""I'm feeling really weary and a bit thick-headed.""",,Blah
1608,2014-12-21 21:15:00,*autumn*,b'Loved and supported',,Fine
1609,2014-12-21 21:18:00,shaky,"b""You know, they glue those birds to the trees each morning so they don't move out of their allotted places""",FallenAngel2,Worried
1610,2014-12-21 21:24:00,shaky,"b""I feel tired - AGAIN.I have been ill.Today is the first day since Tuesday I have spent more time out of bed than in it.I was getting pretty sick of that place.It's the flu, you know.My mum said it was 48 hour flu, but I've had it for 6 days now.It's the baddest, longest physical illness I've had for ages.I've cancelled my holiday away at Christmas because I haven't had any company since Tuesday.I've also missed out on so many things. Parties, games, crosswords, banquets The only times I've turned on the computer have been to tell people I can't come to things But today I have been functioning.Today I even played my guitar.But I am tired now and it's not even nine thirty.I would so like a LONG sleep instead of waking up at 2:15 am or something.""",,Worried
1611,2014-12-21 21:55:00,MarlieeB,b'Just got home from work. Not in till 8 pm tomorrow ',,Sad
1612,2014-12-21 22:09:00,NervyTwo,"b""I want to be able to look forward to Christmas, but I know something bad will happen to ruin it or overshadow it.Although I always say I'm going to look forward to Christmas in the end I always end up wishing it would be over...""",,Worried
1613,2014-12-22 06:39:00,ScaredCat,b'Just gone really scared',,None
1614,2014-12-22 08:39:00,FallenAngel2,"b""Not feeling the love I should be. Got the Bichon hugging my leg, the Westie snuggled into my torso and the cat is cuddling my arm. It's like Animal Farm or something and quite overbearing.""",,None
1615,2014-12-22 09:33:00,*autumn*,b'Exhausted and overwhelmed.',,Fine
1616,2014-12-22 10:40:00,RainbowHeartz,"b'feeling too warm, at mums is boiling'",,None
1617,2014-12-22 15:21:00,RainbowHeartz,b'now im freezing ',,None
1618,2014-12-22 16:07:00,burt tomato,b'feel okay',,Amazed
1619,2014-12-22 17:04:00,shaky,"b""I had a bad night last night.Couldn't sleepI had watched Men In Black 3 and my mind was going over and over time travel stuff and aliensAnd I was coughingAnd trying to think of calming things - but aliens kept jumping out.And coughingAnd I took the time device and left it in 2024 so no-one could use itBut some fool went and brought it backAnd coughingAnd I was lying there thinking 'I am stuck in a time loop to repeat the same thoughts again and again - and the same cough cough coughs again and again.'Horrible.""",,Worried
1620,2014-12-22 18:14:00,ScaredCat,b'Tired.',,None
