,date,username,post content,quoted user,post mood
925,2014-11-25 13:11:00,FallenAngel2,b'I feel like Charlie friggin Brown.Fuck. Where did all that rain come from?? Go away!',,None
926,2014-11-25 13:26:00,SomersetScorpio,"b""Feel really tired, which is not surprising given the time I got to sleep last night... still, am determined to stay awake so that I hopefully tonight i'll sleep better.""",,Blah
927,2014-11-25 17:16:00,monopod,"b'Night, Bagpuss. Catch you tomorrow '",,Lonely
928,2014-11-25 18:21:00,Quickduck,"b""Sorry you've got a poorly head BAGGPUSS; hope it's gone by morning...Not your head...I mean; oh you know I mean. Hope you're feeling better really soon. """,BAGGPUSS,None
929,2014-11-25 19:35:00,ScaredCat,b'Alone.....',,None
930,2014-11-25 19:58:00,mami5,b'Ready to go',,Crappy
931,2014-11-25 20:42:00,ScaredCat,b'Getting cross now',,None
932,2014-11-25 23:44:00,Mister.B,"b""Feel like I'm ready to explode.So much inside my head.""",,Inspired
933,2014-11-26 07:26:00,Darkred,b'Feeling warm and fuzzy but have a headache.',,None
934,2014-11-26 07:50:00,mumdownunder,b'Broken and sick of mh stigma.',,None
935,2014-11-26 09:40:00,FallenAngel2,"b'On the fence at the moment. One or two things will ultimately decide if I get down or feel good for the day.Please, please let it be the latter.'",,None
936,2014-11-26 10:11:00,BillFish,"b'Jeez this thread reads like an obituary, am I the only one here stupid enough to feel happy and contented with my lot in life '",,Breezy
937,2014-11-26 10:15:00,Darkred,b'Hey I said I felt warm and fuzzy!',,None
938,2014-11-26 15:47:00,Fairy Lucretia,b'unwanted and lost',,Angelic
939,2014-11-26 16:04:00,Quickduck,"b""You're wanted here fairy Lu.""",fairy Lu,None
940,2014-11-26 16:07:00,Quickduck,"b""Hope you're ok BAGGPUSS. Hope to see you back very, very, very, very, very, very, very, very, very, very, very, very, very, very, very, very, very, very, very soon. """,BAGGPUSS,None
941,2014-11-26 18:33:00,supergreysmoke,"b""Runaway anxiety. Stress from ATOS. They are messing with my head. Not only them, they are a reminder of the crisis in the system...don't overate them, a trigger for what is stored within here in the Sellafield of mind.""",,Sad
942,2014-11-26 18:38:00,Mister.B,b'Scared. I had to go out in the dark.',,Inspired
943,2014-11-26 20:11:00,White Dragon,b'Tired and stressed at the same time.',,Crappy
944,2014-11-26 20:14:00,Quickduck,"b'I find early morning the best; quiet, just a few dog walkers, joggers, no rowdy yobs. '",Topcat,None
945,2014-11-26 20:14:00,Quickduck,"b""Hope you're feeling better soon. """,Topcat,None
946,2014-11-26 20:16:00,burt tomato,b'Hi Noetic.Thought you had left?',Quickduck,Amazed
947,2014-11-26 20:18:00,Quickduck,b'I find being stressed can made you tired; all the worry can wear us out. Hope you get some sleep tonight and are feeling less stressed tomorrow. ',White Dragon,None
948,2014-11-26 20:21:00,Quickduck,"b""I did.PMed a few people to let them know I was back; including a mod. Thought it would get round sooner or later.Hope you're doing ok brat tomato.""",brat tomato,None
949,2014-11-26 20:25:00,Helena1,b'everyone is like that.',Topcat,Cheerful
950,2014-11-26 20:32:00,White Dragon,"b'Thank you very much. I just have so much on my mind. Like you said, it can be exhausting.'",Quickduck,Crappy
951,2014-11-26 20:47:00,mami5,"b""I'm a lost cause, ready to die.""",,Crappy
952,2014-11-26 21:30:00,Mister.B,"b""I'm seething.""",,Inspired
953,2014-11-26 21:40:00,SomersetScorpio,"b'Suppose it\'s a bit daft to say ""I hope you\'re ok"", but what I mean is, I hope it\'s nothing too terrible and that you feel better soon. x'",Mister.B,Blah
954,2014-11-26 21:45:00,Mister.B,"b""It's just all these memories. Why is no one nice to me blah blah bitch bitch.""",SomersetScorpio,Inspired
955,2014-11-26 21:54:00,*autumn*,b'A bit sick. Might be coming down with a cold in my bones too.',,Fine
956,2014-11-26 22:29:00,boondoggle,"b""Right now, I can't pick just one thing. I feel idiotic, regretful, and anxious.""",,Sad
957,2014-11-27 01:46:00,SomersetScorpio,"b""Triggered, headache, want to kill someone.. don't know whether to try to sleep or distract myself with something light-hearted before going to bed.""",,Blah
958,2014-11-27 02:23:00,Mister.B,b'Restless and lonely.',,Inspired
959,2014-11-27 03:40:00,monopod,b'Awake. ',,Lonely
960,2014-11-27 11:22:00,FallenAngel2,b'I am sitting in silence in a dark room with all the curtains drawn.I am feeling nasty and aggressive like I want to go on a shooting spree. Mr Violence has shown up again.I am scared to peek through the curtains in case I see the people and the world ',,None
961,2014-11-27 11:33:00,Rowan,b'I feel cold and shivery.',,Angelic
962,2014-11-27 11:35:00,Darkred,b'Just feeling very bored as always!  ...',,None
963,2014-11-27 11:51:00,Rowan,b'I feel a bit better now I have a hot water bottle on my lap.',,Angelic
964,2014-11-27 13:31:00,Quickduck,b'Tired and depressed; disillusioned and disinterested.',,None
965,2014-11-27 13:40:00,Darkred,b'Feeling sick and tired but must stay up to see doctor! ugh!',,None
966,2014-11-27 14:43:00,SomersetScorpio,b'Feel really wiped out after a difficult night last night and talking to my counsellor today about some really fucked-up things.',,Blah
967,2014-11-27 14:54:00,NervyTwo,b'Feeling quite tired after waking at ten to four this morning and not being able to sleep since.',,Worried
968,2014-11-27 14:55:00,voyager,b'Feeling guilty as only got up about half an hour ago.....',,Angelic
969,2014-11-27 16:45:00,White Dragon,"b""Not feeling that great to be honest. I'm lonely even though I got out today. I talked about my feelings though so that has made me feel a bit better.""",,Crappy
970,2014-11-27 16:45:00,Mister.B,b'I could never forget you! ',Topcat,Inspired
971,2014-11-27 16:57:00,Helena1,b'i feel too anxious to go out to get my book that i need and it is the last day i can get it. i need it for therapy so i dont know what to do. i dont suppose it matters.',,Cheerful
972,2014-11-27 17:07:00,Darkred,"b""Feeling way to tired to wait for doctor anymore. Waited all day now its 5pm so screw it. She will come as I'm taking my clothes off to get in bed lets be honest its always the way """,,None
973,2014-11-27 17:47:00,Purple Chaos,b'I feel like a whirlwind in a field of nettles. Go figure ',,Mellow
974,2014-11-27 17:59:00,Mister.B,"b""I feel drained again. Like I'm simply surviving and getting through the day.Not living.""",,Inspired
975,2014-11-27 18:42:00,BillFish,"b'Great, and full of fish and chips, going to have a nice soke in a hot bath in a minute, did some jobs around the house and went for a drive................you should try the cheesy peas life style theory......brilliant!'",,Breezy
976,2014-11-27 18:45:00,Helena1,b'fuming.',,Cheerful
977,2014-11-27 19:06:00,burt tomato,b'why dont you just get your book.',Helena1,Amazed
978,2014-11-27 19:08:00,Helena1,b'am too scared to go to town.',brat tomato,Cheerful
979,2014-11-27 19:10:00,burt tomato,"b'its dark now, and you can hide in the shadows.'",Helena1,Amazed
980,2014-11-27 19:17:00,Helena1,b'thanks for the suggestion.',brat tomato,Cheerful
981,2014-11-27 20:30:00,mami5,b'ready to turn the switch off on me.',,Crappy
982,2014-11-27 21:43:00,SomersetScorpio,"b'Ouch, achey muscles and headache.. early night tonight for me, I think.'",,Blah
983,2014-11-27 22:31:00,Quickduck,"b'Nighty-night. Sleep well, hope you feel better in the morning. '",SomersetScorpio,None
984,2014-11-28 01:03:00,Mister.B,b'I feel like I dunno if I want to fight or f*ck. ',,Inspired
985,2014-11-28 01:06:00,volnash,"b'I wanna fight then cosy a bit, and snugging followed thereafter im just in that mood has to be the new meds im on.'",,None
986,2014-11-28 01:09:00,Mister.B,"b'If I had a girlfriend I would start a petty arguement with her, and then have ""I love you, don\'t ever leave me"" sex with her. I\'m sure that would satisfy my cravings right now. Although, that would probably make me an arsehole...'",,Inspired
987,2014-11-28 01:14:00,volnash,"b'Then we are both arseholes, maybe ill say that her feet are in the way and wake her up by tickling only to reveal that im not happy about our relationship, even though I secretely am, maybe ill suggest a threesome to save our affairs. I really wanna tickle her feet, but id rather not leap into a minefield with my feet first.\xe2\x98\xba'",,None
988,2014-11-28 01:18:00,Mister.B,"b""I should get drunk and turn up at an ex's house.That'd work too. Alas, no money. """,,Inspired
989,2014-11-28 01:38:00,Darkred,"b""Woke up at the awkward time of 1:30am but feeling really good! Didn't see doctor so get to wait 3 weeks """,,None
990,2014-11-28 03:13:00,monopod,b'Awake... again ',,Lonely
991,2014-11-28 07:57:00,Quickduck,"b""You've got a proper case of insomnia there matey. """,monopod,None
992,2014-11-28 07:58:00,Quickduck,b'Feeling less paranoid today. ',,None
993,2014-11-28 07:59:00,monopod,"b'You know, I think you may be on to something there '",Quickduck,Lonely
994,2014-11-28 08:12:00,Quickduck,"b""I'm quick like that. """,monopod,None
995,2014-11-28 08:26:00,Rowan,b'Gleeful. Is that a word?',,Angelic
996,2014-11-28 08:27:00,monopod,"b""You'll be happified to know that it is!""",Rowan,Lonely
997,2014-11-28 08:49:00,Rowan,b'Embiggens is a perfectly cromulent word. Do you remember that from The Simpsons?',monopod,Angelic
998,2014-11-28 08:54:00,monopod,"b""I don't, but I like it! """,Rowan,Lonely
999,2014-11-28 09:03:00,monopod,b'',toast,Lonely
1000,2014-11-28 09:17:00,Darkred,b'Feeling tired alwaaaaays feeling tired. ',,None
1001,2014-11-28 12:09:00,monopod,b'... like leaving this b***** forum.',,Lonely
1002,2014-11-28 12:18:00,SomersetScorpio,"b""Oh no, what's up?What have I missed?""",monopod,Blah
1003,2014-11-28 12:23:00,volnash,b'Dont you eeverlleave you are partially reason i stayed man.',monopod,None
1004,2014-11-28 12:31:00,BlueBerry,"b""Oh Gawd, f**k this cold I've had all week. It's getting worse. """,,Scared
1005,2014-11-28 12:44:00,Darkred,"b""Have a horrible sinking feeling which isn't nice.  BLAH crack open a redbull me thinks cba with feeling sorry myself doesn't achieve anything. Chin up darkred chin up. """,,None
1006,2014-11-28 12:49:00,monopod,"b""I'm sick of having perfectly civil and reasonable posts/threads removed just because ###### throws a tantrum. I could do without the personal abuse as well.Anyway, sorry for the drama. I'm not going to close my account, so if anyone wants to get in touch they can pm me. I might come back at some point in any case.""",SomersetScorpio,Lonely
1007,2014-11-28 12:59:00,Helena1,b'i feel quite good today. ',,Cheerful
1008,2014-11-28 14:16:00,Quickduck,"b""I've never been very big on retribution, devine or otherwise. Glad you're having a good day though.""",Nikita,None
1009,2014-11-28 14:18:00,Quickduck,"b""I'm feeling more in control than I have of late. """,,None
1010,2014-11-28 14:31:00,supergreysmoke,"b""Eye for a eye and tooth for tooth mood. Introspective on the great get even. Not gonna do anything with it. Been this way many times. Good thing I've not got a red button....""",,Sad
1011,2014-11-28 14:32:00,SomersetScorpio,"b""Tired and slightly dreading the busy weekend i've got planned, but nevermind.. i'm looking forward to seeing my dogs later. """,,Blah
1012,2014-11-28 15:01:00,underdog4,"b""I feel hopeless,empty and depressed most of the time. I'm turning 19 next year i'm still in high school because i've stopped going to school because of bullying and depression. Now i don't know what to do.""",,None
1013,2014-11-28 15:07:00,Mister.B,b'Undesirable.',,Inspired
1014,2014-11-28 15:09:00,volnash,"b'Easily impressionable, irritated and anxious about life and the future.'",,None
1015,2014-11-28 16:11:00,mami5,"b""cold, think it's time to switch the heating on """,,Crappy
1016,2014-11-28 19:34:00,RainbowHeartz,b'like a vulnerable kid',,None
1017,2014-11-28 19:40:00,supergreysmoke,"b""I feel like I could castrate a priest...won't do that, how I feel.""",,Sad
1018,2014-11-29 00:53:00,Mister.B,b'I have too much energy! ',,Inspired
1019,2014-11-29 00:57:00,stella,b'I feel ugly',,Sad
1020,2014-11-29 00:59:00,Mister.B,"b""I'm sure you're not. I'm sure you're pretty as a button. """,stella,Inspired
1021,2014-11-29 01:55:00,Mister.B,b'Here comes the crushing low now. ',,Inspired
1022,2014-11-29 01:59:00,Darkred,b'Just woke up so feeling a bit tired and just meh',,None
1023,2014-11-29 02:03:00,*autumn*,"b""Like i wanna get on with my life, don't know how to go about it, holding on to a lot, very sad and mixed up.""",,Fine
1024,2014-11-29 02:07:00,NervyTwo,"b""I feel much the same way. I want to get out, make friends, get a job etc, but I just don't know where to start...""",autumnalsprinkles,Worried
1025,2014-11-29 02:45:00,rubyrose,"b""Same here. I hope you find clarity and contentment. Keep holding on to hope. I'm here for you if you need someone to talk to. I want you to know that I care.Hugs """,autumnalsprinkles,None
1026,2014-11-29 02:51:00,*autumn*,"b""I thank you. You're very kind and write lovely posts. I'm so f**king selfish but really I'm just so scared.  I hate myself. Rrr God I'm so sorry""",Sienna Rose,Fine
1027,2014-11-29 03:23:00,rubyrose,"b""I'm sorry you feel that way...but I don't hate you. I find you very likeable and sweet. Please try to be kind to yourself. Hope your spirits are lifted soon """,autumnalsprinkles,None
1028,2014-11-29 03:34:00,Purple Chaos,"b""You're not selfish at all. You always support people on here and appear calm, kind and caring. I'm sorry you're going through such a crappy time. Please don't hate yourself. I hope that things start looking up for you very soon.""",autumnalsprinkles,Mellow
1029,2014-11-29 03:42:00,*autumn*,"b""Thank you purplechaos and thank you siennarose.  I'm having an affair with aunt flow, she seems to like me at the moment.""",,Fine
1030,2014-11-29 03:47:00,Purple Chaos,"b"" Lol. Oh dear, hormones have a lot to answer for! Hopefully you'll be feeling brighter soon.""",,Mellow
1031,2014-11-29 03:50:00,*autumn*,"b'Thanks, really resonate with your avatar. Me in a nutshell.'",,Fine
1032,2014-11-29 08:36:00,monopod,b'unloved',,Lonely
1033,2014-11-29 10:35:00,mumdownunder,"b'Rejected,unloved, always bottom of the heap or second best. I\'m ""welling up"" at the moment.i tried to reach out to someone and used an online chat service but i think I was talking to a robot. I asked if they were male or female because of sensitive things I wanted to discuss and apparently that\'s too personal!!! It doesn\'t matter that if I call the helpline it\'s blatantly obvious!!!!'",,None
1034,2014-11-29 10:35:00,mumdownunder,b'Sorry that was more than a sentence!',,None
1035,2014-11-29 10:39:00,Quickduck,b'We love ya monopod. *gives monopod a manly hug*',monopod,None
1036,2014-11-29 10:46:00,Quickduck,"b""Tis ok, I'm dyslexic, don't notice full stops. Sorry you're feeling bad mumdownunder and that when you reached out you didn't get the help you needed. """,mumdownunder,None
1037,2014-11-29 11:29:00,Rowan,"b""I'm feeling hungry.""",,Angelic
1038,2014-11-29 11:33:00,maybe.shes.a.wildflower,b'A kinda heavy chest feeling and bummed outness',,Lurking
1039,2014-11-29 13:02:00,monopod,"b'A bit silly over my tantrum, yesterday. '",,Lonely
1040,2014-11-29 13:09:00,Mister.B,"b""Don't feel silly. We all have tantrums sometimes.It's just part of being in a collective, ya dig?""",,Inspired
1041,2014-11-29 13:11:00,monopod,"b""... wordEDIT: Was thet even appropriate usage? You can tell how 'down with the kids' I am... """,,Lonely
1042,2014-11-29 13:19:00,monopod,"b""A little peeved that more people didn't beg me to stay as well, if I'm honest (You can't get rid of me that easily though )""",,Lonely
1043,2014-11-29 13:26:00,monopod,b'',,Lonely
1044,2014-11-29 13:39:00,Helena1,b'i feel okay just really nervous.',,Cheerful
1045,2014-11-29 13:45:00,Jonwal,b'Miserable',,Pensive
1046,2014-11-29 14:32:00,Darkred,"b""Beyond angry. Don't give a fuck about anything anymore im not sitting in this hospital pretending to be fucking happy when im here for nothing. completley let down by family today for the most pathetic of reasons. a parent should go out of their way for the children especially those stuck alone 24/7 in hospital. but no not mine. excuses. anyway totally wrong thread for this. pissed off is how im feeling. gonna escape tonight.""",,None
1047,2014-11-29 16:00:00,BillFish,"b""Escape night is it? Tunnel, or over the wall? Remember to say danke and not thank you when you get on the bus. I'll send a wire to the underground in Paris, we'll get you in a safe house and back to blighty and bashing the bosh in a jiffy.""",Darkred,Breezy
1048,2014-11-29 16:31:00,Mister.B,"b""In a dream.I cant cope with work, but I've gotta, they have given me 3 sick days in a row.""",,Inspired
1049,2014-11-29 17:21:00,BlueBerry,b'Cold has gotten much worse. Feel dreadful. Just want to curl up in bed and die quietly. ',,Scared
1050,2014-11-29 18:02:00,Mister.B,b'Pissed off.They havent paid me for the days I was off despite it being at their request.',,Inspired
1051,2014-11-29 22:35:00,Mister.B,"b""This is still going on because now I've ran out of fags and I have NO MONEY whatsoever. All I want is a packet of b*stard cigarettes. """,Mister.B,Inspired
1052,2014-11-29 23:08:00,mami5,b' rather tipsy and tired.',,Crappy
1053,2014-11-29 23:14:00,Purple Chaos,b'Like I am transcending the brightest of stars and spreading love throughout the universe!',,Mellow
1054,2014-11-29 23:48:00,Mister.B,b'For those of you still following the saga...I got cigs now.Had to dip into my swiss bank account. ',,Inspired
1055,2014-11-30 07:30:00,ScaredCat,b'Glad you managed to get them',Mister.B,None
1056,2014-11-30 07:31:00,ScaredCat,b'Scared of falling. So tired of this',,None
1057,2014-11-30 07:40:00,Quickduck,"b""Don't be scared. I'm sure you won't fall; but if by change you do we're here to catch you. """,no-one,None
1058,2014-11-30 07:43:00,Quickduck,"b'Tired and worn out physically, but emotionally not too bad.'",,None
1059,2014-11-30 09:20:00,ScaredCat,b'Hope u get some rest today',Quickduck,None
1060,2014-11-30 09:21:00,ScaredCat,b'Alone and sad. Just hoping it doesnt last',,None
1061,2014-11-30 09:53:00,Quickduck,"b""You're not alone my friend...you got us. I know it's not the same as a real life hug, but here ya go.Hope you're not sad for long. """,no-one,None
1062,2014-11-30 10:35:00,Quickduck,"b""It's a mistake anyone can make at any age, relationships can be tricky. What I've learnt is never marry somebody expecting to make them happy.""",Topcat,None
1063,2014-11-30 11:31:00,Quickduck,"b""Sorry, what I meant to say was if someone isn't happy with you before you marry, if you can never do anything right etc. they won't be happy with you after you wed. Sorry brought my own issues to my response. Sorry. """,Quickduck,None
1064,2014-11-30 11:33:00,Quickduck,"b""Sorry hope it wasn't anything I said. """,Topcat,None
1065,2014-11-30 11:48:00,Quickduck,"b""I'm the same, also get paranoid; I shouldn't comment on these sorts of things either. Hope you're feeling happier soon TC. """,Topcat,None
1066,2014-11-30 12:39:00,BlueBerry,"b""Grandparents are coming to visit tomorrow. Got to make sure my room is clean and presentable enough or they'll nag at me. Need to buy some tea and chocolate biscuits too.""",,Scared
1067,2014-11-30 14:07:00,Quickduck,b'Hang in there TC. ',Topcat,None
1068,2014-11-30 17:25:00,Darkred,b'Feeling tired but merry.',,None
1069,2014-11-30 17:44:00,Helena1,b'i feel the same. ',Darkred,Cheerful
1070,2014-11-30 18:26:00,SomersetScorpio,"b'A bit tired and am over-thinking, but happy to be cosy in my flat.'",,Blah
1071,2014-11-30 18:58:00,Gajolene,b'Stressing over no money and how to do christmas this year with next to nothing in decorations or presents.',,Lurking
1072,2014-11-30 19:04:00,Mister.B,"b'Tired.Also, welcome back Gajolene.I missed you. '",,Inspired
1073,2014-11-30 19:09:00,Gajolene,"b'Glad to be back, missed you too, see people have come and gone and some come back again with new names. Feels a lot longer than only a week and a half with no internet.'",,Lurking
1074,2014-11-30 19:14:00,BlueBerry,b'Welcome back sweetie! ',Gajolene,Scared
1075,2014-11-30 19:15:00,Helena1,b'dont you have decoration from last year or before then?',Gajolene,Cheerful
1076,2014-11-30 19:25:00,Gajolene,"b""Unfortunatly not, the last divorce, and having to move 4 times and living on basic government services, in the past 5 years, I lost most of my belongings and we had to start all over again from scratch. Including all my major oven cookware. There is simply no money to replace these things even from the thrift stores. My monthly money was gone in one day this month. The boys used their money to catch up on bills and reconnect our phone, internet and cable. We are trying to help JD recover from payday loans as well, they took a huge payment direct from his account. Sooo it's frustrating trying to figure it out.""",,Lurking
1077,2014-11-30 19:35:00,SomersetScorpio,"b""Paper chains are always really pretty and can make a room feel nice. A bit of coloured paper shouldn't cost too much. Just an idea, Gajolene. Also pleased to see you back online, by the way. """,,Blah
1078,2014-11-30 20:02:00,White Dragon,"b""I'm still not feeling great. On top of that I think I have developed a bit of an unhealthy obsession. """,,Crappy
1079,2014-11-30 21:23:00,ScaredCat,b'So alone',,None
1080,2014-11-30 21:27:00,Darkred,b'Not drunk enough XD',,None
1081,2014-11-30 21:29:00,mami5,b'Better than I have of late ',,Crappy
1082,2014-11-30 21:36:00,Purple Chaos,"b""I know it might feel like it but you're not alone. You have us """,no-one,Mellow
1083,2014-11-30 22:07:00,Darkred,b'in the moment where drunk to much and feel like shit. no self pity did it to myself. doesnt make it easier though. dont wanna do anything silly. ugh.',,None
1084,2014-11-30 22:12:00,ScaredCat,b'Hope you will be ok',Darkred,None
1085,2014-11-30 22:24:00,BillFish,"b""Having a drink seems to be a major drama on here, can't any of you just get pissed, play some loud music,have a dance in your living room, cold call your psychiatrist's office telling them too fuck off, watch a film, get the munchies and raid the fridge, then wake up the next day with a hangover from hell?""",Darkred,Breezy
1086,2014-11-30 22:41:00,ScaredCat,b'Whatever',,None
1087,2014-11-30 22:48:00,Quickduck,b'',no-one,None
1088,2014-11-30 23:01:00,burt tomato,b'a bit ill.',,Amazed
1089,2014-11-30 23:59:00,BlueBerry,"b""I'm very weird and very strange. I think I'm okay with that.""",,Scared
1090,2014-12-01 00:04:00,Purple Chaos,b'I feel the same. I think weird and strange are an excellent combination ',BlueBerry,Mellow
1091,2014-12-01 00:09:00,Quickduck,b'Tired and sleepy. Night all. ',,None
1092,2014-12-01 00:10:00,Mister.B,"b'Night, QuickDuck.'",Quickduck,Inspired
1093,2014-12-01 00:18:00,Purple Chaos,b'Goodnight Quickduck. Sleep well ',Quickduck,Mellow
1094,2014-12-01 01:36:00,Visionary,"b""I can't sleep yet, cause I feel like I want to have done something useful tonight before I go to bed.""",,Lonely
1095,2014-12-01 01:39:00,SarahD,"b""Feel very edgy and uncomfortable, don't know if I will sleep.""",,None
1096,2014-12-01 01:50:00,NervyTwo,b'Slightly drunk... ',,Worried
1097,2014-12-01 04:44:00,Mister.B,"b""Cold. Sat here in an undershirt though, that's probably why.""",,Inspired
1098,2014-12-01 09:28:00,clyde,b'I feel great and happy because I overcome my addiction and I have my family back.',,None
1099,2014-12-01 11:04:00,MarlieeB,"b'Feel triggered, unimportant, like no one would miss me, like no one cares, a total failure, rejected, hurt, angry, sad, ugly, fat, dumbThe list goes on'",,Sad
1100,2014-12-01 11:19:00,BillFish,"b""I'M all those as you describe, but I'm also thick as a brick, so am still very happy""",MarlieeBee,Breezy
1101,2014-12-01 11:34:00,MarlieeB,"b'Thick as a brick, I forgot to add that part'",BillFish,Sad
1102,2014-12-01 12:09:00,Davey Blueeyes,"b'Hey Marliee,You are none of those things sweetie. You are a lovely little bee, buzzing around us bring happiness.Davey x'",MarlieeBee,Lonely
1103,2014-12-01 12:14:00,MarlieeB,"b""Thanks but I'm not x""",Davey Blueeyes,Sad
1104,2014-12-01 12:18:00,BlueBerry,"b""This describes me pretty well, except that I'm unattractively skinny. I'm trying my best to let go off all those crappy feelings and maybe one day I'll be happy with my imperfect awkward dorky self. I hope you'll be able to put it behind you some day sweetie, I know its hard. """,MarlieeBee,Scared
1105,2014-12-01 12:20:00,MarlieeB,"b""I'll swap the fatness for your skinnyness. I'll be ugly anyway but at least I won't waddle everywhere.""",,Sad
1106,2014-12-01 14:17:00,FallenAngel2,"b""Just like what the fuck...Flipping between living and the notion of dying. When someone I know does die, like they did last week I think shit that's nothing you can come back from!Maybe vanishing like Hollow Man would be much better for me!""",,None
1107,2014-12-01 14:33:00,volnash,"b'Like floating, doc has decided to reduce abilify and keep seroquel at the same dose, with an increase not impossible, but abilify is for now going down.Other then that i feel like flying, i feel light and deserving of some caps and hats that say i am mental, something i can wear with pride, so that people wont judge or pun at me.'",,None
1108,2014-12-01 14:44:00,voyager,b'Overwhelmed by the thought of Christmas!!!',,Angelic
1109,2014-12-01 15:12:00,SomersetScorpio,b'I have a headache - probably due to the fact I slept so much last night but I did need the sleep. ',,Blah
1110,2014-12-01 19:15:00,ScaredCat,b'Soooo bad',,None
1111,2014-12-01 19:43:00,ScaredCat,b'Need to calm down',,None
