,date,username,post content,quoted user
180,2014-10-26 16:51:00,apple,"b"" I seem to have lost my way. Feel overwhelmed and in a fog with the home. I'm not sure what's going on. I recently saw a relative and spoke to a sibling. Both triggered feelings. """,
181,2014-10-26 17:06:00,bagpuss,b'  ',
182,2014-10-26 18:37:00,Noetic,b'  ',
183,2014-10-26 18:56:00,bagpuss,"b' The Needle on my Bordem Meter just went bazzerk and snapped off.  I might go in the bathroom and count how many tiles are on the wall.  I hate living alone its like groundhog day and no escape from ths flat.  , Dear Farther Christmas please bring me an extra strong depot injection and some smiling tablets . '",
184,2014-10-26 19:19:00,hellokittymad,b' i feel anxious and tired ',
185,2014-10-26 19:32:00,sightseer,b' I cant leave a pea or one bean on a plate.coz all its mates have been eaten so even if im full i feel its cruel to the pea to leave it so i dont and i eat it so that it can be with its friends again... Think im abit of a werdo.. ',
186,2014-10-26 19:36:00,bagpuss,b' at least all the peas are together then x    although they would be mushy peas and a better class of peas. ',sightseer
187,2014-10-26 19:48:00,bagpuss,"b' Ow come on Forum whats happened, its like a ghost town on here tonight.  if your happy and you know it clap your hands  if you happy and you know it and you really want to show it clap your hands .  I might go for a walk up and down my hall way all 3 Meters of it. Bored shitless '",
188,2014-10-26 20:39:00,Helena1,b' dirty and itchy as i havent had a shower for like a week and brushed my teeth since wednesday. ',
189,2014-10-26 20:48:00,Noetic,"b"" Showers can be dangerous; I saw a film once...didn't like having a shower for ages afterward.   """,Helena1
190,2014-10-27 10:24:00,RainbowHeartz,b' i feel grrrrrrrrrrrrrrrrrrrrrrate  ',
191,2014-10-27 14:10:00,Helena1,b' pissed off and upset. ',
192,2014-10-27 14:17:00,Noetic,"b' Ohhh, feeling the urge to hug.  '",Helena1
193,2014-10-27 14:19:00,Noetic,"b"" And again, one didn't seem enough.  """,Helena1
194,2014-10-27 14:19:00,Helena1,b' me too.  ',Noetic
195,2014-10-27 14:24:00,MarlieeB,b' (((((((((((((((The number one Helena & The number one Noetic)))))))))))) ',
196,2014-10-27 14:28:00,Helena1,b'  ',MarlieeBee
197,2014-10-27 14:31:00,RainbowHeartz,b' feeling slightly annoyed ',
198,2014-10-27 15:19:00,mumdownunder,b' Completely and utterly fucked up- alarm going off on four hours and not slept yet!!! ',
199,2014-10-27 15:42:00,Fairy Lucretia,b' i feel hopeless x ',
200,2014-10-27 15:45:00,Fairy Lucretia,b' i feel like i dont belong ',
201,2014-10-27 15:49:00,Fairy Lucretia,b' i feel like everybody hates me ',
202,2014-10-27 15:51:00,Helena1,b' that is not true.  ',fairy Lu
203,2014-10-27 15:56:00,BlackAdam,b' I am actually quite tired.  From all that fighting with Captain Marvel has left me feeling a bit weak.  Need to recover as I shall go after that old coot Shazam and fix him for good! ',
204,2014-10-27 18:04:00,burt tomato,b' just want to sleep forever or go somewhere ethereal. sick of this. ',
205,2014-10-27 18:32:00,cherish,"b"" I'm not very good with word's so  """,fairy Lu
206,2014-10-27 20:36:00,RainbowHeartz,b' i feel stoned  also i love fairys too xxxxxxxx ',
