,date,username,post content,quoted user
0,2014-10-19 03:00:00,mumdownunder,"Hi all, I have closed the original thread in the chill out cafe and created two ""describe how you feel with a sentence"" threads. A new one in the chillout cafe and another in experiences.The aim of the chill out cafe has always been for some time out from mental health struggles and a bit of light hearted ""banter"" so is therefore not the right place to express mental health struggles/ emotional distress. Everyone needs and deserves support so if you don't want to start your own thread or just need a short vent then this thread can be that place.",
1,2014-10-19 03:14:00,prairiechick,"At this present moment I feel grateful and blessed, and cared for by my therapist.",
2,2014-10-19 03:24:00,burt tomato,"I feel okay. Like John Nash, I accept that my hallucinations are not real. They are not real people. So I can let them disappear in the distance.",
3,2014-10-19 04:23:00,Mark_01,"Did you see this documentary,  John Nash, A Beautiful Mind?",brat tomato
4,2014-10-19 04:43:00,burt tomato,Hi thanks for the link Mark.,Mark_01
5,2014-10-19 14:39:00,BlueBerry,Feeling very intense cravings for chocolate right now...,
6,2014-10-19 15:08:00,shaky,"I feel inspired today - Getting things done - except my mind is a bit flighty, finding it hard to settle on what is the most important thing that I should be getting done.",
7,2014-10-19 15:13:00,Noetic,Me too. Here have one of mine. Quick! Won't last long at the rate I'm scoffing em. lol,BlueBerry
8,2014-10-19 15:39:00,ScaredCat,"Very, very tired. Just cant sleep",
9,2014-10-19 15:59:00,volnash,Aware.,
10,2014-10-19 16:03:00,Helena1,hopeless about the situation i am in and the future.,
11,2014-10-19 16:07:00,Sparklypurplepaws,Alone in a house full of people and a desire to not be here anymore,
12,2014-10-19 16:08:00,ScaredCat,I liked this thread better when it was all together,
13,2014-10-19 16:37:00,MarlieeB,"If this has to happen at least give it a different name like,How do you feel mentally right now?Or something along those lines so the two are shown to be different threads and people won't mistakenly post in the wrong one and then think they have done something wrong it's moved into the right thread.Also I feel it should be stickied as well as the emotion one amathus just posted.",
14,2014-10-19 16:40:00,apple,"I feel achy, tired, stressed and depressed. I wanted to do something today, but then I got caught up with an application for funding towards a course which took a lot longer than expected and which was tiring, and now it's already four thirty five. I have stomach ache and I think its because I ate either cottage cheese or too many olives.",
15,2014-10-20 08:47:00,Helena1,disappointed but relived as the doc who i saw on fri who was very nice and i wanted to see again is not available for weeks. he said to see him in a week. oh well.,
16,2014-10-20 10:21:00,Rowan,"I feel so tired and the talk about chocolate has made me crave some, lucky I have some choc gold coins in the biscuit tin.",
17,2014-10-20 10:35:00,Darkred,Just feeling a bit tired and lonely.,
18,2014-10-20 18:12:00,shaky,Don't spend them all at once ,Rowan
19,2014-10-20 18:50:00,Helena1,i feel even more hopeless today. ,Helena1
20,2014-10-20 18:52:00,MarlieeB,Special Honey Covered 'sxxxxx,
21,2014-10-20 19:07:00,hellokittymad,i feel really nervous,
22,2014-10-20 20:47:00,RainbowHeartz,i feel hungry,
23,2014-10-20 20:49:00,bagpuss,Grab ya coat were off to the chippy for pudding n chips ! heya hope you ok ,Judazz
24,2014-10-20 20:50:00,mami5,Anxious,
25,2014-10-20 20:51:00,bagpuss,"Hey Helena big hugz, one day at a time.I rekon you will be a rich happy girl pretty soon. I can see it in my tea leaves.",Helena1
26,2014-10-20 21:18:00,Helena1,how soon is pretty soon? can i sue you if you and your tea leaves are wrong. then i will be rich and a third there. ,GhostChild2
27,2014-10-20 21:23:00,bagpuss,Well they are PG Tips Tea Leaves and they have never let me down yet Helena.But if you end up sueing me then is it ok if we set up a Payment Plan for £1 a month as I am pretty boracic lint (Skint) I am just an old lady tea leaf reader with very little revenue!,Helena1
28,2014-10-20 21:46:00,ScaredCat,"Tired, falling, sad, hopeless",
29,2014-10-20 21:48:00,sightseer,(((((((((((((no one))))))))))))))))sorry you feel so sad.best wishes sightseer..,
30,2014-10-20 21:49:00,bagpuss,Hugs Some-one xx ,no-one
31,2014-10-20 21:53:00,sightseer,In pain my teeth are fxcking hurting big time...:-(,
32,2014-10-20 21:54:00,bagpuss,Try taking them out and giving them a scrub with some denture wash lol ,sightseer
33,2014-10-20 23:56:00,hellokittymad,i feel like i was brave i feel stressed though too,
34,2014-10-21 00:35:00,Princess Pea,"I feel pent up, scared, sad and happy-ish...all at the same time.",
35,2014-10-21 02:32:00,mumdownunder,Exhausted - am so drained. I thought I slept well last night,
36,2014-10-21 02:50:00,Darkred,"Just a bit empty, realizing I have no reason to get out of bed. ",
37,2014-10-21 03:42:00,Lincoln1990,"How do I feel? I feel horrible, I feel like I'm pregnant but it's a cruel thing. I'm not pregnant. I should be huge pregnant and almost meeting my child. If I didn't know better, I would think I'm pregnant. But I'm not. I can't be.",
38,2014-10-21 04:05:00,Electric,"I feel very strange. The person that I like so much, came to visit me tonight and we sat down and talked. The strange part is, dat I didn't feel that much butterflies as I used to. I wonder why not.",
39,2014-10-21 05:24:00,Gajolene,"Hey Lincoln was just wondering if you've had grief counselling to help you deal with your loss' at all?. I know people think miscarriages are not that big a deal, the grief can be the same as losing anyone else close to you that you love. Glad to here you are going to ask your mum for help with the doctors.",
40,2014-10-21 05:42:00,rubyrose,Not great...but that's nothing new.,
41,2014-10-21 12:10:00,hellokittymad,I feel calm for a change,
42,2014-10-21 13:07:00,burt tomato,I feel okay. As I walked back from the p-doc appt. I could hear some voices. But now it is much quieter. Hoping it will get better.,
43,2014-10-21 14:03:00,aneverson11,"Will pray for you for it to get better, don't know if he listens to me at the moment though. I feel flat, but stable.",
44,2014-10-21 14:16:00,hellokittymad,He always listens (: I feel upset because I don't feel believed in,aneverson11
45,2014-10-21 15:30:00,Helena1,low. life is impossible.,
46,2014-10-21 15:42:00,Darkred,"I feel okay I guess, been avoiding thing's I know will annoy me and doing thing's instead of procrastinating but I'am almost ready for bed. (loving the weather)",
47,2014-10-21 21:31:00,ScaredCat,Feeling better now i been on here for a bit,
48,2014-10-21 21:45:00,mami5,Me too!,no-one
49,2014-10-21 21:47:00,ScaredCat,I really glad,mami5
50,2014-10-21 21:53:00,Electric,Relieved...,
51,2014-10-21 21:56:00,hellokittymad,i feel like i'm worthless,
52,2014-10-21 22:11:00,mami5,I'm sorry you're feeling this way Sending (((((((((((((((HUGS))))))))))))))) your wayxxxxxxxxxxxxxxxxxxxxxxxxxxxxxxxxxxxxxxxxxx,hellokittymad
53,2014-10-21 22:14:00,ScaredCat,No you are not,hellokittymad
54,2014-10-22 05:02:00,AliceinWonderland,Welcome to the forum Princess Pea  Sorry you've got such a mix of feelings going on.,Princess Pea
55,2014-10-22 05:34:00,RainbowHeartz,i feel naked.......... o_O,
56,2014-10-22 11:54:00,Darkred,went from feeling okay and energetic to just bluguhguhguhgugh cant be fucked with anything now just staring at the bloody laptop screen and forum for no reason.,
57,2014-10-22 12:47:00,RainbowHeartz,i feel cozy under the duvet,
58,2014-10-22 21:12:00,ScaredCat,Stupid and embarrassed,
59,2014-10-22 21:21:00,Mister.B,"On edge. Reading more scary shit on the net because ""Hey, it's nearly halloween!""",
60,2014-10-22 22:13:00,BlueBerry,"Wondering if I'm actually a psychopath. I can't possibly be because I feel tons of empathy, fear, anxiety and I have devastatingly low self-esteem which all contradict the profile of psychopathy. But still... I feel very cruel, evil and bloodthirsty. ",
61,2014-10-22 22:16:00,Mister.B,Suspicious.,
62,2014-10-22 22:26:00,Toasted Crumpet,"You no psychopath But if you were, join me, and we shall conquer the universe ",BlueBerry
63,2014-10-22 22:46:00,stella,"I feel sad, angry, and wondering if I'm a horrible person",
64,2014-10-22 22:50:00,Fairy Lucretia,like im a monster,
65,2014-10-22 22:50:00,hellokittymad,sick and hyper and nervous,
66,2014-10-22 22:51:00,Mister.B,Why???,fairy Lu
67,2014-10-22 23:03:00,shaky,"Sort of calm, sort of 'at a distance' like my emotions have gone somewhere else for a while.",
68,2014-10-22 23:44:00,BillFish,"Happy and contented, slightly tired.Driven 75 miles today to keep the family at work. After pacing around at the clinic and going into one, I went to tescos, ikea, sainburys, and b&q to find something to photograph then finally felt like a middle aged man again and not a disability case, looks like good old ebay is the way to go again for the items I need.",
69,2014-10-23 01:31:00,apple,"It's 1.30am and I feel alert and I don't feel right. I've been doing more the past few weeks, plus have been thinking lots.",
70,2014-10-23 01:42:00,Darkred,I just woke up at 1:30am and it took me forever to get out of bed cause really cold and lacking motivation ,
71,2014-10-23 01:54:00,Electric,"Darkred, for what do you need motivation at 1:30 am?! Cleaning the house, doing the laundry? Or is it lack on motivation to stay in bed? Here it is almost 9 pm and I have planned to be in bed early. I feel kind of empty... I miss some one, that really sucks.",
72,2014-10-23 02:03:00,Darkred,I thought that while typing it  I've already cleaned the place the other day I guess I just mean having to use my brain for thing's like making food and trying to entertain myself with no one to speak to and nothing to do  Good old ground hog day in hospital,
73,2014-10-23 03:29:00,Lincoln1990,I feel like I'm in  a lot  of pain. I can't rely on anybody. I've ruined so many things. I should ruin myself.,
74,2014-10-23 08:31:00,Darkred,I'm in the middle of reading all my posts I made on a different forum for mental health 5 years ago and it's left me feeling a bit weird and nostalgic as it was just before I ended up in hospital. I find it so strange how I was able to write masssssive posts replying to people and to be sooo helpful and understanding compared to how I am now... It's also left me feeling slightly sad as I was struggling with alcohol at the time so I don't remember writing half of what I did but now reading it I can see how much I struggled.Sorry not one sentence but I'm feeling quite a few things.,
75,2014-10-23 10:28:00,RainbowHeartz,i feel sleepy and ashamed,
76,2014-10-23 10:31:00,bagpuss,why you ashamed judazz ? Xx,Judazz
77,2014-10-23 10:34:00,RainbowHeartz,im too ashamed to type it on here  but i am okay,GhostChild2
78,2014-10-23 10:35:00,bagpuss,skype ?,Judazz
79,2014-10-23 10:51:00,BlueBerry,"Have to go into Uni for a seminar, but I'm feeling scared and anxious to go, since it'll be crowded at this time.",
80,2014-10-23 11:02:00,BillFish,"Amused, just been to the shop to get croissants and bacon for my wife, a pay till went down, but when the girl rushed over she farted, it was like trying to hold a conversation in a gas filled room, but I remained a gentlemen throughout ",
81,2014-10-23 11:45:00,ScaredCat,Like cutting myself off,
82,2014-10-23 12:08:00,aneverson11,"Tired, fed-up, and very flat, and don't want to get up out of bed.",
83,2014-10-23 12:50:00,shaky,I feel strangely calm and disconnected.I wasn't enjoying doing the crosswordFor the first times in years I feel like meditating - so that's what I'm going to do,
84,2014-10-23 12:59:00,Darkred,A bit better then I did earlier.,
85,2014-10-23 14:47:00,Helena1,feel anxious waiting.,
86,2014-10-23 16:52:00,keepsafe,Fell like a broken bit off something....,
87,2014-10-23 16:52:00,keepsafe,Feel like a broken bit off something....,
88,2014-10-23 16:59:00,burt tomato,"I feel stupid and guilty for my past behavior in real life. I was having severe symptoms, but still feel bad about it. This was about 2-3 years ago.",
89,2014-10-23 17:11:00,Darkred,pass out in bed ,
90,2014-10-23 17:22:00,sightseer,Ild like to be off my tits and escape my stupid dark mind.but i aint got no money and eating slugs just make yer mouth slimey and nothing else.:-(,
91,2014-10-23 18:37:00,hellokittymad,you have no reason to be sorry *hugs*,Nicola398
92,2014-10-23 18:47:00,Gajolene,"Your definately not alone here Nicola, Huge huge hugs.",
93,2014-10-23 20:07:00,mami5,suicidal,
94,2014-10-23 20:11:00,hellokittymad,I feel alone and like i need to hurt myself,
95,2014-10-23 20:11:00,bagpuss,......,
96,2014-10-23 20:15:00,hellokittymad,,GhostChild2
97,2014-10-23 20:16:00,ScaredCat,I hate myself,
98,2014-10-23 20:59:00,Jonwal,Can't stop feeling stressed even though I feel relatively safe I still keep feeling like I could relax but am choosing to feel stressed because partly my upbringing didn't help me condition to deal w life and when I was in supported housing one housemate shouted and screamed all night and there was frequent threats of violence now I can't unwind and I've become fat because of my response to relaxation and perhaps loans alpine  thx,
99,2014-10-24 00:49:00,shaky,I shouldn't be up at this time of the night / morningI should be in bedBut I want something to HAPPENI am tired of being nobody - I need to be SEENBut that isn't going to happen in my living room with a vest on.I want to be loved,
100,2014-10-24 00:59:00,stella,Im a very bad person. The worst person ever,
101,2014-10-24 02:30:00,Electric,Too tired to typeToo sad to laughToo worried to breathHow can I fix myself?,
102,2014-10-24 03:05:00,RainbowHeartz,i feel as though this is going to be an all nighter again im wide awake and feel fat and gross and want it all gone from my body its disgusting,
103,2014-10-24 03:15:00,Lincoln1990,"I feel as though I shouldn't be on here anymore and nobody would care if I stopped coming on here, which I'm  highly  considering.",
104,2014-10-24 03:21:00,RainbowHeartz,"hi lincoln i think you should stay, your very likeable ",Lincoln1990
105,2014-10-24 03:31:00,Lincoln1990,I feel as though I regret  everything  in my life. I should die.,
106,2014-10-24 03:35:00,Lincoln1990,"I feel as though everyone hates me, that's why I dont get replies.",
